Authors,Author Affiliations,Publication Year,Funding Information,Author Keywords,IEEE Terms
P. He; X. Jiang; T. Sun; H. Li,"School of Electronic Information and Electrical Engineering, Shanghai Jiao Tong University, Shanghai, China; School of Electronic Information and Electrical Engineering, Shanghai Jiao Tong University, Shanghai, China; School of Electronic Information and Electrical Engineering, Shanghai Jiao Tong University, Shanghai, China; School of Electrical and Electronic Engineering, Nanyang Technological University, Singapore",2018,"National Natural Science Foundation of China(grant numbers:61572320,61572321); ",Computer-graphics (CGs);convolutional neural network (CNN);recurrent neural network (RNN),Image color analysis;Feature extraction;Convolution;Rendering (computer graphics);Forensics;Training
F. He; X. Huang; Y. Liu; M. Yan,"Institute of Image Processing and Pattern Recognition, and the MOE Key Laboratory of System Control and Information Processing, Shanghai Jiao Tong University, Shanghai, China; Institute of Image Processing and Pattern Recognition, and the MOE Key Laboratory of System Control and Information Processing, Shanghai Jiao Tong University, Shanghai, China; School of Information and Communication Engineering, University of Electronic Science and Technology of China, Chengdu, China; Department of Computational Mathematics, Science and Engineering, Michigan State University, East Lansing, USA",2018,"National Natural Science Foundation of China(grant numbers:61603248,61602091); NSF(grant numbers:DMS-1621798); ",Alternating direction method of multipliers (ADMM);compressive sensing;linear loss;nonconvex penalty;saturation,Loss measurement;Sensors;Signal processing algorithms;Compressed sensing;Noise measurement;Fasteners;Robustness
M. Meng; X. Zhan,"Department of Computer Science, Guangdong University of Technology, Guangzhou, China; Department of Computer Science, Guangdong University of Technology, Guangzhou, China",2018,"National Natural Science Foundation of China(grant numbers:61702114,61672171); Foundation for Young Innovative Talents in Higher Education of Guangdong, China(grant numbers:2016KQNCX040); ",Affinity matrix;low-rank representation (LRR);manifold regularization;zero-shot learning (ZSL),Manifolds;Semantics;Sparse matrices;Visualization;Laplace equations;Optimization;Encoding
P. Zhang; P. Yan; J. Wu; J. Liu; F. Shen,"School of Optoelectronic Science and Engineering, University of Electronic Science and Technology of China, Chengdu, China; School of Optoelectronic Science and Engineering, University of Electronic Science and Technology of China, Chengdu, China; School of Optoelectronic Science and Engineering, University of Electronic Science and Technology of China, Chengdu, China; School of Optoelectronic Science and Engineering, University of Electronic Science and Technology of China, Chengdu, China; School of Optoelectronic Science and Engineering, University of Electronic Science and Technology of China, Chengdu, China",2018,"Science and Technology Planning Project of Sichuan Province, China(grant numbers:2018GZ0166); National Natural Science Foundation of China(grant numbers:61308102); ",Appearance;depth;graphical model;motion;multiscale;saliency detection;segmentation,Image color analysis;Graphical models;Saliency detection;Three-dimensional displays;Motion segmentation;Feature extraction;Robustness
I. Almeida; J. Xavier,"Institute for Systems and Robotics, Laboratory for Robotics and Engineering Systems, Lisbon, Portugal; Institute for Systems and Robotics, Laboratory for Robotics and Engineering Systems, Lisbon, Portugal",2018,"Fundação para a Ciência e Tecnologia, Portugal(grant numbers:UID/EEA/50009/2013,PD/BD/135012/2017); ",Collaborative work;distributed algorithms;distributed computing;optimization,Signal processing algorithms;Convergence;Radio frequency;Jacobian matrices;Optimization;Distributed algorithms;Nickel
L. Stanković; E. Sejdić; M. Daković,"University of Montenegro, Podgorica, Montenegro; University of Pittsburgh, Pittsburg, USA; University of Montenegro, Podgorica, Montenegro",2018,,Energy distributions;graph-signal processing;time–frequency analysis;vertex-frequency analysis,Kernel;Interference;Spectrogram;Time-frequency analysis;Matrix decomposition;Eigenvalues and eigenfunctions
T. Wimalajeewa; P. K. Varshney,"Department of Electrical Engineering and Computer Science, Syracuse University, Syracuse, NY, USA; Department of Electrical Engineering and Computer Science, Syracuse University, Syracuse, NY, USA",2018,Air Force Research Laboratory(grant numbers:FA8650-17-C-1154); ,Bhattacharya distance;classification;compressive sensing;correlated data,Correlation;Degradation;Signal reconstruction;Compressed sensing;Measurement;Reliability;Principal component analysis
J. Chen; J. Hou; L. -P. Chau,"School of Electrical & Electronic Engineering, Nanyang Technological University, Singapore; Department of Computer Science, City University of Hong Kong, Kowloon Tong, Hong Kong; School of Electrical & Electronic Engineering, Nanyang Technological University, Singapore",2018,ST Engineering-NTU Corporate Lab through the NRF Corporate Laboratory@University scheme; Hong Kong RGC Early Career Scheme Funds(grant numbers:9048123 CityU 21211518); ,Anisotropic parallax feature;convolutional neural networks (CNN);denoising;light field (LF),Noise measurement;Noise reduction;Low-frequency noise;Feature extraction;Training;Cameras
N. Ahmed,"Ann and H. J. Smead Aerospace Engineering Sciences, University of Colorado, Boulder, USA",2018,,Classification algorithms;estimation;hybrid probabilistic models;neural networks;pattern recognition;probabilistic logic;supervised learning,Mathematical model;Training data;Probabilistic logic;Computational modeling;Data models;Parameter estimation;Estimation
Y. Miao; H. Sun; J. Qi,"School of Information Science and Engineering, Xiamen University, Xiamen, China; School of Information Science and Engineering, Xiamen University, Xiamen, China; College of Electronic Science and Technology, Xiamen University, Xiamen, China",2018,"National Natural Science Foundation of China(grant numbers:61471309,61671394); Fundamental Research Funds for the Central Universities(grant numbers:20720170044); Science and Technology Program of Shenzhen, China(grant numbers:JSGG20170414090428464); ",Instantaneous rotating operator (IRO);self-tuning demodulated operator (SDO);synchro-compensating chirplet transform (SCCT);time-frequency representation (TFR),Chirp;Transforms;Time-frequency analysis;Demodulation
X. Wang; G. Li; P. K. Varshney,"Department of Electronic Engineering, Tsinghua University, Beijing, China; Department of Electronic Engineering, Tsinghua University, Beijing, China; Department of Electrical Engineering and Computer Science, Syracuse University, Syracuse, NY, USA",2018,National Natural Science Foundation of China(grant numbers:61790551); National Science Foundation(grant numbers:ENG 60064237); ,Bernoulli–Gaussian (BG) distribution;detection theory;locally most powerful tests (LMPTs);sensor networks;sparse signals,Detectors;Testing;Signal detection;Stochastic processes;Signal reconstruction;Probability density function;Complexity theory
M. Kuribayashi,"Graduate School of Natural Science and Technology, Okayama University, Okayama, Japan",2018,JSPS KAKENHI(grant numbers:JP16K00185); ,Erasure;fingerprinting code;optimal tracing algorithm,Signal processing algorithms;Watermarking;Fingerprint recognition;Distortion;Robustness;Probability
M. Barni; H. Santoyo-García; B. Tondi,"Department of Information Engineering and Mathematical Sciences, University of Siena, Siena, Italy; Postgraduate Section, Mechanical Electrical Engineering School, National Polytechnic Institute of Mexico, Mexico, Mexico; Department of Information Engineering and Mathematical Sciences, University of Siena, Siena, Italy",2018,Defense Advanced Research Projects Agency; Air Force Research Laboratory(grant numbers:FA8750-16-2-0173); National Council of Science and Technology of Mexico; Prof. M. Nakano-Miyatake; ,Adversarial signal processing;camera fingerprint;forensics and counterforensics;sensor-based camera identification;triangle test,Cameras;Correlation;Forgery;Reliability;Probability;Indexes;Signal processing
M. Chen; X. He; J. Yang; H. Zhang,"School of Information Science and Engineering, Central South University, Changsha, China; School of Information Science and Engineering, Central South University, Changsha, China; School of Information Science and Engineering, Central South University, Changsha, China; School of Information Science and Engineering, Central South University, Changsha, China",2018,,Attention mechanism;convolutional recurrent neural networks (CRNN);speech emotion recognition (SER),Feature extraction;Convolution;Recurrent neural networks;Speech recognition;Emotion recognition;Solid modeling;Task analysis
X. Wang; R. Hu; Z. Wang; J. Xiao,"Hubei Key Laboratory of Multimedia and Network Communication Engineering, Wuhan University, Wuhan, China; Hubei Key Laboratory of Multimedia and Network Communication Engineering, Wuhan University, Wuhan, China; Collaborative Innovation Center of Geospatial Technology, Wuhan, China; Collaborative Innovation Center of Geospatial Technology, Wuhan, China",2018,"National Natural Science Foundation of China(grant numbers:91738302,61671336,61671332); Open Research Fund of State Key Laboratory of Information Engineering in Surveying, Mapping and Remote Sensing; Wuhan University(grant numbers:17E03); ",Background reference;long-term redundancy;video coding;video satellite,Satellites;Encoding;Google;Earth;Image color analysis;Redundancy;Video coding
S. P. Talebi; S. Werner; D. P. Mandic,"Department of Signal Processing and Acoustics, Aalto University, Espoo, Finland; Department of Electronic Systems, Norwegian University of Science and Technology, Trondheim, Norway; Department of Electrical and Electronic Engineering, Imperial College London, London, U.K.",2018,Academy of Finland(grant numbers:296849); , $\alpha$ -stable random signals;consensus fusion;distributed adaptive filtering;fractional differential;sensor networks,Random processes;Signal processing algorithms;Adaptive systems;Noise measurement;Approximation algorithms;Convergence;Mathematical model
L. C. Perotti; D. Vrinceanu; D. Bessis,"Department of Physics, Texas Southern University, Houston, TX, USA; Department of Physics, Texas Southern University, Houston, TX, USA; Department of Physics, Texas Southern University, Houston, TX, USA",2018,NSF; ,Data analysis;delayed signals; ${U}$ -transform;Padé approximant,Delays;Oscillators;Poles and zeros;Transient analysis;Time-frequency analysis;Taylor series;Indexes
E. Nitzan; T. Routtenberg; J. Tabrikian,"Department of Electrical and Computer Engineering, Ben-Gurion University of the Negev, Beer-Sheva, Israel; Department of Electrical and Computer Engineering, Ben-Gurion University of the Negev, Beer-Sheva, Israel; Department of Electrical and Computer Engineering, Ben-Gurion University of the Negev, Beer-Sheva, Israel",2018,"Israel Science Foundation(grant numbers:1160/15,1173/16); ",Bobrovsky–Zakai bound (BZB);mean-cyclic error;mean-squared error;periodic stochastic filtering;target tracking,Estimation;Probability density function;Bayes methods;Indexes;Stochastic processes;Filtering;Performance analysis
A. Assa; K. N. Plataniotis,"Department of Electrical and Computer Engineering, University of Toronto, Toronto, Canada; Department of Electrical and Computer Engineering, University of Toronto, Toronto, Canada",2018,Natural Sciences and Engineering Research Council of Canada(grant numbers:PDF-487746-2016); ,Gaussian mixture (GM);Gaussian mixture reduction (GMR);probabilistic distance approximation;Wasserstein distance (WD),Shape;Probability density function;Probabilistic logic;Approximation algorithms;Clustering algorithms;Silicon;Signal processing
U. Elahi; Z. Khalid; R. A. Kennedy; J. D. McEwen,"Research School of Engineering, College of Engineering and Computer Science, The Australian National University, Canberra, Australia; Department of Electrical Engineering, Lahore University of Management Sciences, Lahore, Pakistan; Research School of Engineering, College of Engineering and Computer Science, The Australian National University, Canberra, Australia; Mullard Space Science Laboratory, University College London, Surrey, U.K.",2018,"Australian Research Council's Discovery Projects(grant numbers:DP170101897); Pakistan HEC 2016-17 NRPU(grant numbers:5925); Leverhulme Trust and the Engineering and Physical Sciences Research Council(grant numbers:EP/M011852/1,EP/M011089/1); ",Harmonic analysis;sampling;sphere;spherical harmonics;spin- $s$  functions,Harmonic analysis;Transforms;Computational modeling;Numerical models;Frequency modulation;Indexes;Pins
D. -H. Pham; S. Meignen; N. Dia; J. Fontecave-Jallon; B. Rivet,"Jean Kuntzmann Laboratory, Université Grenoble Alpes, Saint-Martin-d’Hères, France; Jean Kuntzmann Laboratory, Université Grenoble Alpes, Saint-Martin-d’Hères, France; TIMC-IMAG Laboratory, Université Grenoble Alpes, La Tronche, France; TIMC-IMAG Laboratory, Université Grenoble Alpes, La Tronche, France; GIPSA-Lab Laboratory, UMR 5216, Saint-Martin-d’Hères, France",2018,LabEx PERSYVAL-Lab(grant numbers:ANR-11-LABX-0025-01); French program Investissements d’avenir; ,"Electrocardiogram (ECG);multimodality, nonnegative matrix factorization (NMF);phonocardiogram (PCG);time-frequency analysis",Phonocardiography;Spectrogram;Electrocardiography;Noise reduction;Noise measurement;Databases;Heart
E. Öztürk; E. Basar; H. A. Çırpan,"Faculty of Electrical and Electronics Engineering, Istanbul Technical University, Istanbul, Turkey; Communications Research and Innovation Laboratory (CORELAB), Koç University, Istanbul, Turkey; Faculty of Electrical and Electronics Engineering, Istanbul Technical University, Istanbul, Turkey",2018,Turkish Academy of Sciences (TUBA) GEBIP Programme; ,Fifth generation (5G) wireless networks;generalized frequency division multiplexing (GFDM);index modulation (IM);multicarrier modulation;physical (PHY) layer design,Indexes;Receivers;Detectors;Quadrature amplitude modulation;Computational complexity;Wireless networks
S. Khanna; C. R. Murthy,"Department of Electrical Communication Engineering, Indian Institute of Science, Bangalore, India; Department of Electrical Communication Engineering, Indian Institute of Science, Bangalore, India",2018,"Young Faculty Research Fellowship; Ministry of Electronics and Information Technology, Government of India; ",Compressive sensing;covariance matching;exponentiated gradient (EG) updates;joint sparsity;multiple measurement vectors;sparse recovery;Von Neumann divergence,Signal processing algorithms;Covariance matrices;Sparse matrices;Symmetric matrices;Noise measurement;Size measurement;Sensors
L. Hu; J. Zhang; X. Wang; S. Wang; E. Zhang,"College of Electronic Science, National University of Defense Technology, Changsha, China; Department of Electrical and Computer Engineering, Missouri University of Science and Technology, Rolla, MO, USA; Department of Electrical Engineering, Columbia University, New York, NY, USA; College of Electronic Science, National University of Defense Technology, Changsha, China; College of Electronic Science, National University of Defense Technology, Changsha, China",2018,China Scholarship Council(grant numbers:201703170270); ,Decentralized detection;generalized Rao (G-Rao) test;noncooperative moving target;truncated one-sided sequential (TOS) test,Sensors;Frequency selective surfaces;Probability;Wireless sensor networks;Quantization (signal);Computational complexity;Delays
A. López-Cifuentes; M. Escudero-Viñolo; J. Bescós,"Video Processing and Understanding Lab, Universidad Autónoma de Madrid, Madrid, Spain; Video Processing and Understanding Lab, Universidad Autónoma de Madrid, Madrid, Spain; Video Processing and Understanding Lab, Universidad Autónoma de Madrid, Madrid, Spain",2018,Spanish Government(grant numbers:TEC2014-53176-R); ,Area of interest (AoI);multiple moving cameras (MMCs);pan–tilt–zoom (PTZ);scene parsing;semantic segmentation;video surveillance,Cameras;Semantics;Video surveillance;Task analysis;Roads;Machine learning;Shape
S. -W. Wu; C. -Y. Chen,"Department of Engineering Science, National Cheng Kung University, Tainan, Taiwan, R.O.C.; Department of Engineering Science, National Cheng Kung University, Tainan, Taiwan, R.O.C.",2018,"Ministry of Science and Technology, Taiwan(grant numbers:106–2221–E–006–022,MOST 107–2221–E–006–065–MY2); ",Complete complementary code (CCC);Golay complementary set (GCS);peak-to-average power ratio (PAPR);Z-complementary sequence (ZCS);zero correlation zone (ZCZ),Zero current switching;Peak to average power ratio;Correlation;Boolean functions;Upper bound;Multiaccess communication;Indexes
S. Locubiche-Serra; G. Seco-Granados; J. A. López-Salcedo,"Department of Telecommunications and Systems Engineering, IEEC-CERES, Universitat Autònoma de Barcelona, Barcelona, Spain; Department of Telecommunications and Systems Engineering, IEEC-CERES, Universitat Autònoma de Barcelona, Barcelona, Spain; Department of Telecommunications and Systems Engineering, IEEC-CERES, Universitat Autònoma de Barcelona, Barcelona, Spain",2018,Spanish Ministry of Economy and Competitiveness(grant numbers:TEC2017-89925-R); ,Bayesian filtering;convergence time;Cramér–Rao bounds;Kalman filters;steady state,Kalman filters;Convergence;Manganese;Mathematical model;Noise measurement;Bayes methods;Steady-state
Z. -Q. He; X. Yuan,"University of Electronic Science and Technology of China, Chengdu, CN; University of Electronic Science and Technology of China, Chengdu, CN",2018,National Natural Science Foundation of China(grant numbers:61801084); ,Block majorization–minimization;graph clustering;outliers;symmetric nonnegative matrix factorization (SNMF),Convergence;Signal processing algorithms;Robustness;Symmetric matrices;Matrix decomposition;Clustering algorithms;Optimization
Y. Hifny,"University of Helwan, Cairo, Egypt",2018,,Arabic syntactic diacritics restoration;deep learning;long short-term memory (LSTM) networks,Syntactics;Tagging;Feature extraction;Logic gates;Hidden Markov models;Computer aided software engineering;Recurrent neural networks
B. Tu; W. Kuang; G. Zhao; H. Fei,"School of Information Science and Engineering, Hunan Institute of Science and Technology, Yueyang, China; School of Information Science and Engineering, Hunan Institute of Science and Technology, Yueyang, China; College of Electrical and Information Engineering, Beijing University of Civil Engineering and Architecture, Beijing, China; School of Information Science and Engineering, Hunan Institute of Science and Technology, Yueyang, China",2018,"National Natural Science Foundation of China(grant numbers:51704115,61462089); Key Laboratory Open Fund Project of Hunan Province University(grant numbers:17K040); Science and Technology Program of Hunan Province(grant numbers:2016TP1021); ",Hyperspectral image (HSI);joint sparse representation (JSR);superpixel segmentation;spectral information divergence (SID),Training;Measurement;Image segmentation;Entropy;Erbium;Hyperspectral imaging;Shape
X. Shen; Z. Song; H. Fan; Q. Fu,"ATR Key Laboratory, National University of Defense Technology, Changsha, China; ATR Key Laboratory, National University of Defense Technology, Changsha, China; ATR Key Laboratory, National University of Defense Technology, Changsha, China; ATR Key Laboratory, National University of Defense Technology, Changsha, China",2018,National Natural Science Foundation of China(grant numbers:61401475); ,Bernoulli filter;clutter process;finite set statistics (FISST);measurement process,Clutter;Sea measurements;Radar tracking;Simulation;Current measurement;Probability density function;Information filtering
Z. Wang; X. Zhang; Z. Yin,"Shanghai Institute for Advanced Communication and Data Science, Shanghai University, Shanghai, China; Shanghai Institute for Advanced Communication and Data Science, Shanghai University, Shanghai, China; Key Laboratory of Intelligent Computing and Signal Processing, Anhui University, Anhui, China",2018,"National Natural Science Foundation of China(grant numbers:U1636206,61525203,61502009,61472235); Natural Science Foundation of Shanghai(grant numbers:18ZR1427500); Shanghai Excellent Academic Leader Plan(grant numbers:16XD1401200); ",Cover-selection;distortion;payload-allocation;steganography,Distortion;Payloads;Optimization;Mathematical model;Optical fibers;Security;Communication channels
L. F. C. Amaral; M. V. Lopes; A. K. Barros,"Department of Electrical Engineering, Universidade Federal do Maranhão, São Luís, Brazil; Department of Electrical Engineering, Universidade Federal do Maranhão, São Luís, Brazil; Department of Electrical Engineering, Universidade Federal do Maranhão, São Luís, Brazil",2018,,Extended recursive least-squares (EX-RLS) algorithm;nonquadratic function;recursive filter adaptive;tracking performance,Signal processing algorithms;Mathematical model;Rayleigh channels;Stochastic processes;Kernel;Prediction algorithms;Autoregressive processes
A. Pizzo; A. Zappone; L. Sanguinetti,"Dipartimento di Ingegneria dell’Informazione, University of Pisa, Pisa, Italy; Large Systems and Networks Group, CentraleSupélec, Université Paris-Saclay, Gif-sur-Yvette, France; Dipartimento di Ingegneria dell’Informazione, University of Pisa, Pisa, Italy",2018,European Commission(grant numbers:749336); ,Energy efficiency (EE) maximization;fractional polynomial problems;polynomial optimization theory,Optimization;Signal to noise ratio;Signal processing algorithms;Programming;Computational complexity;Approximation algorithms
C. Xie; A. Bijral; J. L. Ferres,"School of Computer Science and Engineering, University of Washington, Seattle, USA; Microsoft, Redmond, USA; Microsoft, Redmond, USA",2018,,Nonstationary time series;online learning,Time series analysis;Global Positioning System;Market research;Predictive models;Prediction algorithms;Signal processing algorithms;Autoregressive processes
M. R. Thirumalaisamy; P. J. Ansell,"Department of Aerospace Engineering, University of Illinois at Urbana-Champaign, Urbana, USA; Department of Aerospace Engineering, University of Illinois at Urbana-Champaign, Urbana, USA",2018,Army Research Office(grant numbers:W911NF-12-R-0012-030); ,Empirical mode decomposition (EMD);FA-EMD;modal analysis;multidimensional EMD;multivariate signal,Signal processing algorithms;Microsoft Windows;Interpolation;Empirical mode decomposition;Standards;Splines (mathematics);Tools
S. Ghosh; P. Nair; K. N. Chaudhury,"Department of Electrical Engineering, Indian Institute of Science, Bangalore, India; Department of Electrical Engineering, Indian Institute of Science, Bangalore, India; Department of Electrical Engineering, Indian Institute of Science, Bangalore, India",2018,"EMR(grant numbers:SERB/F/6047/2016-2017); Department of Science and Technology, Government of India; ",Bilateral filter;fast approximation;Fourier basis,Kernel;Optimization;Standards;Fourier series;Approximation error;Approximation algorithms;Matlab
R. N. Ipanov; A. I. Baskakov; N. Olyunin; M. -H. Ka,"Moscow Power Engineering Institute (National Research University), Moscow, Russia; Moscow Power Engineering Institute (National Research University), Moscow, Russia; School of Integrated Technology, Yonsei University, Incheon, South Korea; School of Integrated Technology, Yonsei University, Incheon, South Korea",2018,"Russian Science Foundation(grant numbers:17-19-01616); Ministry of Science, ICT and Future Planning, Korea(grant numbers:IITP-2017-2017-0-01015); Civil Military Technology Cooperation Program; IITP; Korean government(grant numbers:2017-0-00678); ",Ambiguity function;autocorrelation function (ACF);complementary sequences;detection threshold;fast Fourier transform (FFT);Hadamard matrix;matched filter;pulse train;radial velocity;sidelobes;Walsh function,Correlation;Phase shift keying;Doppler effect;Radar;Signal resolution;Signal processing algorithms;Frequency modulation
R. Wen; K. Fu; H. Sun; X. Sun; L. Wang,"School of Electronic, Electrical and Communication Engineering, University of Chinese Academy of Sciences, Beijing, China; School of Electronic, Electrical and Communication Engineering, University of Chinese Academy of Sciences, Beijing, China; Key Laboratory of Technology in Geo-Spatial Information Processing and Application System, Institute of Electronics, Chinese Academy of Sciences, Beijing, China; Key Laboratory of Technology in Geo-Spatial Information Processing and Application System, Institute of Electronics, Chinese Academy of Sciences, Beijing, China; Key Laboratory of Technology in Geo-Spatial Information Processing and Application System, Institute of Electronics, Chinese Academy of Sciences, Beijing, China",2018,"National Natural Science Foundation of China(grant numbers:41501485,41701508,61725105); ",Convolutional neural networks (CNN);densely connected residual networks (DRNet);dense skip connection;image superresolution;residual learning,Training;Image reconstruction;Convolution;Image resolution;Signal resolution;Feature extraction;Dictionaries
