Authors,Author Affiliations,Publication Year,Funding Information,Author Keywords,IEEE Terms
J. Zhang; A. Sheng; K. Hirakawa,"Kangni Mechanical and Electrical Institute, Nanjing Institute of Technology, Nanjing, China; Department of Automation, Nanjing University of Science and Technology, Nanjing, China; Department of Electrical and Computer Engineering, University of Dayton, Dayton, USA",2018,National Natural Science Foundation of China(grant numbers:61702265); Natural Science Foundation of Jiangsu Province(grant numbers:BK20170856); CCF-Tencent Open Research Fund (PI: Xiangbo Shu); ,Demosaicking;Gaussian scale mixture (GSM),Image color analysis;Wavelet transforms;Image reconstruction;GSM;Color;Wavelet analysis
V. Mishuhina; X. Jiang,"School of Electrical and Electronic Engineering, Nanyang Technological University, Singapore; School of Electrical and Electronic Engineering, Nanyang Technological University, Singapore",2018,,Brain–computer interface (BCI);common spatial patterns (CSP);electroencephalography (EEG);motor imagery (MI),Eigenvalues and eigenfunctions;Feature extraction;Electroencephalography;Covariance matrices;Training;Linear programming;Probabilistic logic
H. Fan; P. C. Cosman; Y. Hou; B. Li,"School of Mechanical Engineering, Southwest Jiaotong University, Chengdu, China; Department of Electrical and Computer Engineering, University of California, San Diego, CA, USA; School of Mechanical Engineering, Southwest Jiaotong University, Chengdu, China; School of Mechanical Engineering, Southwest Jiaotong University, Chengdu, China",2018,National Natural Science Foundation of China(grant numbers:51275431); Sichuan Province Science and Technology Support Program Projec(grant numbers:2016GZ0194); ,Image classification;local binary pattern (LBP);railway fasteners;railway maintenance;visual inspection,Fasteners;Rail transportation;Feature extraction;Lighting;Rails;Gray-scale;Fans
M. Doostmohammadian; H. R. Rabiee; U. A. Khan,"Sharif University of Technology, Tehran, Tehran, IR; Sharif University of Technology, Tehran, Tehran, IR; Tufts University, Medford, MA, US",2018,,Combinatorics;cost optimization;distributed estimation;structural observability;system digraph,Observability;Optimization;Estimation;Sensors;DH-HEMTs;Monitoring;Signal processing algorithms
F. Van Eeghem; L. De Lathauwer,"Katholieke Universiteit Leuven, Leuven, Flanders, BE; Katholieke Universiteit Leuven, Leuven, Flanders, BE",2018,"Research Council KU Leuven: C1 project(grant numbers:c16/15/059-nD); FWO: projects(grant numbers:G.0830.14N,G.0881.14N); European Research Council; European Union's Seventh Framework Programme(grant numbers:FP7/2007-2013,339804); Aspirant Grant from the Research Foundation Flanders (FWO); ",Block-circulant;circulant;canonical polyadic decomposition (CPD);tensors;uniqueness;Wiener–Hammerstein,Tensile stress;Signal processing algorithms;Matrix decomposition;Discrete Fourier transforms;Eigenvalues and eigenfunctions;Independent component analysis;Manganese
M. S. Alam; G. Kaddoum; B. L. Agba,"Electrical Engineering Department, ETS, University of Quebec, Montreal, QC H3C, Canada; Electrical Engineering Department, ETS, University of Quebec, Montreal, QC H3C, Canada; Hydro-Qubec Research Institute, Varennes, QC, Canada",2018,Fonds de Recherche du Quebec - Nature et Technologies(grant numbers:Student award); ,Distributed wireless sensor network (WSN);MMSE optimal Bayesian estimation (OBE);Middleton class-A impulsive noise;Rayleigh fading,Estimation;Wireless sensor networks;Rayleigh channels;Bayes methods;Noise measurement;Performance analysis
B. Yoo; Y. Kwak; Y. Kim; C. Choi; J. Kim,"Software Solution Laboratory, Samsung Advanced Institute of Technology, Suwon-si, South Korea; Software Solution Laboratory, Samsung Advanced Institute of Technology, Suwon-si, South Korea; Software Solution Laboratory, Samsung Advanced Institute of Technology, Suwon-si, South Korea; Software Solution Laboratory, Samsung Advanced Institute of Technology, Suwon-si, South Korea; School of Electrical Engineering, Korea Advanced Institute of Science and Technology, Daejeon, South Korea",2018,,Age estimation;conditional multitask (CMT) learning;deep network;gender recognition;label expansion,Estimation;Training;Task analysis;Machine learning;Face;Feature extraction;Face recognition
R. Chandrasekharan; M. Sasikumar,"Department of Electronics, Marian Engineering College, Trivandrum, India; Department Electronics, Marian Engineering College, Kerala, India",2018,,Contrast enhancement;fuzzy transform (FT);nonuniform illumination,Signal processing algorithms;Lighting;Image color analysis;Transforms;Histograms;Brightness;Image quality
C. Kang; G. Kim,"Department of Electronic Engineering, Sogang University, Mapo-gu, Seoul, Republic of Korea; Department of Electronic Engineering, Sogang University, Mapo-gu, Seoul, Republic of Korea",2018,,Conditional random fields (CRF);dehazing;haze density estimation;refining;single image haze removal,Estimation;Training;Atmospheric modeling;Image color analysis;Message passing;Indexes;Optical attenuators
B. Appina; S. S. Channappayya,"Indian Institute of Technology Hyderabad, Hyderabad, Telangana, IN; Indian Institute of Technology Hyderabad, Hyderabad, Telangana, IN",2018,,Coherence;depth;motion;stereo video,Three-dimensional displays;Coherence;Quality assessment;Signal processing algorithms;Distortion measurement;Video recording
J. Wang; G. Li; L. Rencker; W. Wang; Y. Gu,"Tsinghua University, Beijing, Beijing, CN; Tsinghua University, Beijing, Beijing, CN; University of Surrey, Guildford, Surrey, GB; University of Surrey, Guildford, Surrey, GB; Tsinghua University, Beijing, Beijing, CN",2018,"National Natural Science Foundation of China(grant numbers:61531166005,61571263); National Basic Research Program of China (973 Program)(grant numbers:2016YFE0201900,2017YFC0403600); Tsinghua University Initiative Scientific Research Program(grant numbers:2014Z01005); European Unions H2020 Framework Program(grant numbers:H2020-MSCA-ITN-2014,642685); ",Compressed sensing;covariance-assisted matching pursuit (CAMP);restricted isometry property (RIP);sparse recovery,Matching pursuit algorithms;Noise measurement;Indexes;Estimation;Eigenvalues and eigenfunctions;Upper bound;Gaussian noise
Z. Zhu; S. Kay; R. S. Raghavan,"Department of Electrical, Computer, and Biomedical Engineering, University of Rhode Island, Kingston, RI, USA; Department of Electrical, Computer, and Biomedical Engineering, University of Rhode Island, Kingston, RI, USA; Air Force Research Laboratory, Wright-Patterson Air Force Base, Dayton, OH, USA",2018,Sensors Directorate of the Air Force Research Laboratory(grant numbers:FA8650-12-D-1376 0004); ,Doubly spread;kullback–leibler divergence;signal waveform design,Detectors;Doppler effect;Correlation;Radar detection;Indexes;Signal to noise ratio
M. Guo; Y. D. Zhang; T. Chen,"College of Information and Communication Engineering, Harbin Engineering University, Harbin, China; Department of Electrical and Computer Engineering, Temple University, Philadelphia, PA, USA; College of Information and Communication Engineering, Harbin Engineering University, Harbin, China",2018,China Scholarship Council; National Science Foundation(grant numbers:AST-1547420); National Natural Science Foundation of China(grant numbers:61571146); Fundamental Research Funds for the Central Universities(grant numbers:HEUCFP201769); ,Cramér-Rao bound (CRB);coprime frequencies;direction of arrival (DOA) estimation;performance analysis,Sensor arrays;Direction-of-arrival estimation;Estimation;Covariance matrices;Frequency estimation;Performance analysis
Z. Zhu; L. Jin; E. Song; C. -C. Hung,"School of Computer Science and Technology, Huazhong University of Science and Technology, Wuhan, China; School of Computer Science and Technology, Huazhong University of Science and Technology, Wuhan, China; School of Computer Science and Technology, Huazhong University of Science and Technology, Wuhan, China; Center for Machine Vision and Security Research, Kennesaw State University, Marietta, GA, USA",2018,"National Natural Science Foundation of China(grant numbers:61370181,61370179); ",Color images;impulse noise;local reachability density (LRD);quaternion;vector median filter (VMF),Image color analysis;Colored noise;Quaternions;Color;Brightness;Noise measurement;Switches
Y. Liu; Z. Lu; J. Li; T. Yang; C. Yao,"School of Telecommunications Engineering, Xidian University, Xi’an, China; School of Telecommunications Engineering, Xidian University, Xi’an, China; School of Telecommunications Engineering, Xidian University, Xi’an, China; SAIIP, School of Computer Science, Northwestern Polytechnical University, Xi’an, China; School of Automation, Northwestern Polytechnical University, Xi’an, China",2018,"China Postdoctoral Science Foundation funded project(grant numbers:2016M602858); Fundamental Research Funds for the Central Universities(grant numbers:3102016ZY022); National Natural Science Foundation of China(grant numbers:61272288,61502364,61672429); ",Convolutional neural networks (CNN);deep learning;global temporal information;infrared action recognition,Optical imaging;Feature extraction;Streaming media;Machine learning;Optical signal processing;Computer architecture;Trajectory
J. Hu; Z. Chen; M. Yang; R. Zhang; Y. Cui,"College of Computer Science and Technology, Taiyuan University of Science and Technology, Taiyuan, China; School of Information Science and Technology, Beijing Forestry University, Beijing, China; School of Information Science and Technology, Beijing Forestry University, Beijing, China; College of Computer Science and Technology, Taiyuan University of Science and Technology, Taiyuan, China; International School, Beijing University of Posts and Telecommunications, Beijing, China",2018,National Natural Science Foundation of China(grant numbers:61402038); ,Multiscale convolutional neural network (MSCNN);multiscale feature;plant leaf recognition,Training;Machine learning;Convolutional neural networks;Support vector machines;Shape;Testing;Feature extraction
T. Liu; Z. Shi; Y. Liu,"Shenyang Institute of Automation, Chinese Academy of Sciences, Shenyang, China; Shenyang Institute of Automation, Chinese Academy of Sciences, Shenyang, China; Shenyang Institute of Automation, Chinese Academy of Sciences, Shenyang, China",2018,Composite Information Processing Technology(grant numbers:Y6K4250401); ,Dimensionality reduction;image-set recognition;Grassmann manifold;Grassmannian optimization,Manifolds;Measurement;Dimensionality reduction;Geometry;Optimization;Kernel;Visualization
D. Neumann; M. Joham; W. Utschick,"Methods of Signal Processing, Technische Universität München, Munich, Germany; Methods of Signal Processing, Technische Universität München, Munich, Germany; Methods of Signal Processing, Technische Universität München, Munich, Germany",2018,Agence Nationale de la Recherche(grant numbers:ANR-16-CE23-0014 (FBIMATRIX)); ,Covariance matrix estimation;massive MIMO;pilot-contamination;pilot allocation,Covariance matrices;Coherence;Channel estimation;Resource management;Maximum likelihood estimation;Training
W. Sun; Y. Chen; L. Huang; H. C. So,"College of Information Engineering, Shenzhen University, Shenzhen, Guangdong, China; Department of Communication Engineering, University of Science and Technology Beijing, Beijing, China; College of Information Engineering, Shenzhen University, Shenzhen, Guangdong, China; Department of Electronic Engineering, City University of Hong Kong, Kowloon Tong, Hong Kong, China",2018,"National Natural Science Foundation of China(grant numbers:61501300,61701021,U1713217,U1501253); Natural Science foundation of Guangdong Province(grant numbers:2015A030311030); Foundation of Shenzhen University(grant numbers:201557); ",General unfolding;generalized tensor tubal rank;tensor completion;tensor SVD;tensor tubal rank,Tensors;Matrix decomposition;Matrices;Minimization;Optimization
S. Bartoletti; A. Conti; W. Dai; M. Z. Win,"Department of Engineering and CNIT, University of Ferrara, Ferrara, Italy; Department of Engineering and CNIT, University of Ferrara, Ferrara, Italy; Laboratory for Information and Decision Systems, Massachusetts Institute of Technology, Cambridge, MA, USA; Laboratory for Information and Decision Systems, Massachusetts Institute of Technology, Cambridge, MA, USA",2018,"European Union's Horizon 2020 research and innovation programme; Marie Skłodowska-Curie(grant numbers:703893); Office of Naval Research(grant numbers:N62909-18-1-2017,N00014-16-1-2141); Copernicus Fellowship; ",Energy detection;threshold profiling;time-of-arrival estimation;wideband ranging,Distance measurement;Wireless communication;Wideband;Probability;Indexes;Detectors;Receivers
C. Dinesh; I. V. Bajić; G. Cheung,"School of Engineering Science, Simon Fraser University, Burnaby, BC, Canada; School of Engineering Science, Simon Fraser University, Burnaby, BC, Canada; National Institute of Informatics, Tokyo, Japan",2018,,Three-dimensional (3-D) geometry inpainting;3-D point cloud;hole filling;nonrigid transformation (NRT);point cloud alignment,Three-dimensional displays;Geometry;Signal processing algorithms;Telepresence;Surface treatment;Octrees;Electronic mail
S. Zozor; C. Ren; A. Renaux,"Image and Signal Processing Department, GIPSA-Lab, Saint-Martin-d’Hres, France; SONDRA, CentraleSupélec, Gif-sur-Yvette, France; LSS Université Paris-Sud, Gif-sur-Yvette, France",2018,ANR ASTRID(grant numbers:ANR-17-ASTR-0015); ,Elliptically symmetric distribution;high signal-to-noise ratio (SNR) regime;maximum likelihood estimator (MLE) statistics,Maximum likelihood estimation;Signal to noise ratio;Generators;Noise level;Probability density function;Symmetric matrices
R. Mochaourab; T. J. Oechtering,"RISE Acreo, Research Institutes of Sweden, 164 25 Kista, Stockholm, Sweden; Department of Information Science and Engineering, KTH Royal Institute of Technology, Stockholm, Sweden",2018,Swedish Government through the ICT-TNG Strategic Research Area and within the PITA project; ,Hidden Markov models;privacy;dynamic programming;greedy algorithm,Privacy;Receivers;Hidden Markov models;Monitoring;Optimization;Databases;Data privacy
K. Nomura; D. Sugimura; T. Hamamoto,"Graduate School of Engineering, Tokyo University of Science, Tokyo, Japan; Department of Computer Science, Tsuda University, Tokyo, Japan; Graduate School of Engineering, Tokyo University of Science, Tokyo, Japan",2018,,Color correction;exposure bracketing imaging;underwater image,Image color analysis;Imaging;Distortion;Estimation;Data mining;Channel estimation;Image fusion
S. -C. Pei; Y. -C. Lai; K. -W. Chang,"National Taiwan University, Department of Electrical Engineering, Taipei, Taiwan; National Taiwan University, Taipei, Taiwan; National Taiwan University, Department of Electrical Engineering, Taipei, Taiwan",2018,,Fractional delay;Gabor uncertainty principle;Hermite–Gaussian functions;signal expansion,Delays;Hafnium;Symmetric matrices;Uncertainty;Signal processing;Eigenvalues and eigenfunctions;Fourier transforms
H. Chen; M. Zehni; Z. Zhao,"Department of Electrical and Computer Engineering, University of Illinois at Urbana-Champaign, Urbana, IL, USA; Department of Electrical and Computer Engineering, University of Illinois at Urbana-Champaign, Urbana, IL, USA; Department of Electrical and Computer Engineering, University of Illinois at Urbana-Champaign, Urbana, IL, USA",2018,UIUC COE SRI grant; ,,Eigenvalues and eigenfunctions;Signal processing algorithms;Noise measurement;Estimation;Discrete Fourier transforms;Robustness;Computational complexity
C. Ren; X. He; Y. Pu,"College of Electronics and Information Engineering, Sichuan University, Chengdu, China; College of Electronics and Information Engineering, Sichuan University, Chengdu, China; College of Computer Science, Sichuan University, Chengdu, China",2018,National Postdoctoral Program for Innovative Talents of China(grant numbers:BX201700163); Post-Doctoral Research and Development Foundation of Sichuan University(grant numbers:2017SCU12003); ,Gradient prior (GP);group similarity reliability (GSR);nonlocal similarity;super resolution,Image resolution;Reliability;Nickel;Convolution;Image reconstruction;Feature extraction;Signal resolution
A. R. Heravi; G. A. Hodtani,"Electrical Engineering Deptartment, Ferdowsi University of Mashhad, Mashhad, Iran; Electrical Engineering Deptartment, Ferdowsi University of Mashhad, Mashhad, Iran",2018,Ferdowsi University of Mashhad; ,Correntropy;entropy;information theoretic learning;machine learning;mean square error;minimum error entropy,Entropy;Kernel;Mathematical model;Signal processing;Mean square error methods;Minimization;Probability density function
F. Wang; J. Cheng; W. Liu; H. Liu,"Department of Information and Communication Engineering, University of Electronic Science and Technology of China, Chengdu, China; Department of Information and Communication Engineering, University of Electronic Science and Technology of China, Chengdu, China; College of Computing, Georgia Institute of Technology, Atlanta, GA, USA; Department of Information and Communication Engineering, University of Electronic Science and Technology of China, Chengdu, China",2018,"National Natural Science Foundation of China(grant numbers:61671125,61201271,61301269); State Key Laboratory of Synthetical Automation for Process Industries(grant numbers:PAL-N201401); ",Deep learning;face verification;metric learning,Additives;Face;Measurement;Visualization;Annealing;Task analysis;Training
S. Lee; D. Kim; C. Kim,"School of Electrical Engineering, Korea Advanced Institute of Science and Technology, Daejeon, South Korea; School of Electrical Engineering, Korea Advanced Institute of Science and Technology, Daejeon, South Korea; School of Electrical Engineering, Korea Advanced Institute of Science and Technology, Daejeon, South Korea",2018,,Contrast enhancement;high-dynamic-range image;infrared image;image enhancement;image sharpening,Histograms;Image edge detection;Indexes;Image enhancement;Dynamic range;Standards
S. Emura; S. Araki; T. Nakatani; N. Harada,"Media Intelligence Laboratories, Musashino, NTT, Japan; Communication Science Laboratories, Kyoto, NTT, Japan; Communication Science Laboratories, Kyoto, NTT, Japan; Media Intelligence Laboratories, Musashino, NTT, Japan",2018,,Beamformer; $\ell _1$  norm;minimum power distortionless response (MPDR);source separation,Interference;Array signal processing;Signal to noise ratio;Acoustic distortion;Microphone arrays;Sensitivity
J. Chen; Y. Liu,"School of Physics, Beijing Institute of Technology, Beijing, China; School of Physics, Beijing Institute of Technology, Beijing, China",2018,National Natural Science Foundation of China(grant numbers:61301188); ,Corrupted sensing;data-time tradeoffs;projected gradient descent (PGD),Convergence;Pollution measurement;Sensors;Complexity theory;Signal processing algorithms;Size measurement;Linear matrix inequalities
J. Chu; J. Zhang; W. Lu; X. Huang,"School of Electrical and Information Engineering, Tianjin University, Tianjin, China; School of Electrical and Information Engineering, Tianjin University, Tianjin, China; School of Electrical and Information Engineering, Tianjin University, Tianjin, China; School of Electrical and Information Engineering, Tianjin University, Tianjin, China",2018,,Aggregate features;convolutional neural networks (CNNs);multiconnected block;super-resolution,Feature extraction;Convolution;Task analysis;Image resolution;Loss measurement;Signal resolution;Stacking
A. Yadav; O. A. Dobre; H. V. Poor,"Faculty of Engineering and Applied Science, Memorial University, St. John's, Canada; Faculty of Engineering and Applied Science, Memorial University, St. John's, Canada; Department of Electrical Engineering, Princeton University, Princeton, USA",2018,"Natural Sciences and Engineering Research Council of Canada; National Science Foundation(grant numbers:CNS-1702808,ECCS-1647198); ",Full-duplex communications;radio resource management;self-interference;self-energy harvesting;small cells,Switches;Downlink;Radio frequency;Energy harvesting;Signal to noise ratio
Z. Sheng; H. D. Tuan; T. Q. Duong; H. V. Poor,"School of Electrical and Data Engineering, University of Technology Sydney, Broadway, NSW, Australia; School of Electrical and Data Engineering, University of Technology Sydney, Broadway, NSW, Australia; Queen's University Belfast, Belfast, U.K.; Department of Electrical Engineering, Princeton University, Princeton, NJ, USA",2018,"U.S. National Science Foundation(grant numbers:CNS-1702808,ECCS-1647198); ",Energy-efficient communication;interference networks;outage-aware beamforming;path-following algorithms;secure communication,Array signal processing;Transmitters;Optimization;Nonlinear equations;Quality of service;Signal processing algorithms;Channel estimation
M. I. Florea; A. Basarab; D. Kouamé; S. A. Vorobyov,"Department of Signal Processing and Acoustics, Aalto University, Aalto, Finland; IRIT, CNRS UMR 5505, University of Toulouse, Toulouse, France; IRIT, CNRS UMR 5505, University of Toulouse, Toulouse, France; Department of Signal Processing and Acoustics, Aalto University, Aalto, Finland",2018,"Academy of Finland(grant numbers:299243); CIMI Labex, Toulouse, France(grant numbers:ANR-11-LABX-0040-CIMI,ANR-11-IDEX-0002-02); ",Axially varying;deconvolution;forward model;kernel;matrix-free;point-spread function;ultrasound,Convolution;Kernel;Computational modeling;Ultrasonic imaging;Deconvolution;Imaging;Image reconstruction
C. -P. Li; K. -J. Chang; H. -H. Chang; Y. -M. Chen,"Institute of Communications Engineering and the Department of Electrical Engineering, National Sun Yat-Sen University, Kaohsiung, Taiwan; Civil Engineering Department, National Taipei University of Technology, Taipei, Taiwan; Communication Engineering Department, I-SHOU University, Kaohsiung, Taiwan; Institute of Communications Engineering, National Sun Yat-Sen University, Kaohsiung, Taiwan",2018,,Cyclic group;finite field;perfect sequence (PS);periodic autocorrelation function (PACF),Correlation;Systematics;Solids;Synchronization;Indexes;Spread spectrum communication;Channel estimation
A. R. Adhikary; S. Majhi; Z. Liu; Y. L. Guan,"Department of Mathematics, Indian Institute of Technology Patna, Bihar, India; Department of Electrical Engineering, Indian Institute of Technology Patna, Bihar, India; Institute for Communication Systems, 5G Innovation Centre, University of Surrey, Guildford, U.K.; School of Electrical and Electronic Engineering, Nanyang Technological University, Singapore",2018,"DST(grant numbers:2014/292); Visvesvaraya Ph.D. scheme for Electronics and IT, Ministry of Electronics and Information Technology, Government of India; Digital India Corporation; NRF-NSFC(grant numbers:NRF2016NRF-NSFC001-089); National Natural Science Foundation of China(grant numbers:61750110527); ",Even-length binary aperiodic Z-Complementary Pairs (EB-ZCPs);Golay complementary pair (GCP);zero correlation zone (ZCZ);Z-Complementary pair (ZCP),Systematics;Correlation;Channel estimation;Kernel;Indexes;Spectroscopy;Doppler effect
A. E. Feitosa; V. H. Nascimento; C. G. Lopes,"Department of Electronic Systems Engineering, University of São Paulo, Sao Paulo, Brazil; Department of Electronic Systems Engineering, University of São Paulo, Sao Paulo, Brazil; Department of Electronic Systems Engineering, University of São Paulo, Sao Paulo, Brazil",2018,"FAPESP and EMBRAER(grant numbers:2016/06529-1,GDT0109-15); ",Adaptive networks;distributed detection;exponential decay rate;maximum likelihood (ML) detector,Detectors;Error probability;Maximum likelihood estimation;Transient analysis;Mathematical model;Maximum likelihood detection
L. Lu; H. Zhao; B. Champagne,"College of Electronics and Information Engineering, Sichuan University, Chengdu, China; School of Electrical Engineering, Southwest Jiaotong University, Chengdu, China; Department of Electrical and Computer Engineering, McGill University, Montreal, Canada",2018,"National Science Foundation of P.R. China(grant numbers:61571374,61271340,61433011); ",Distributed nonlinear network;interpolation;sparse filter; $\alpha$ -stable noise;Volterra filter,Kernel;Signal processing algorithms;Memory management;Complexity theory;Interpolation;Noise measurement
Z. Wang; J. Lin; Z. Wang,"School of Electronic Science and Engineering, Nanjing University, Nanjing, China; School of Electronic Science and Engineering, Nanjing University, Nanjing, China; School of Electronic Science and Engineering, Nanjing University, Nanjing, China",2018,"National Natural Science Foundation of China(grant numbers:61774082,61604068); Fundamental Research Funds for the Central Universities(grant numbers:021014380065); ",Deep learning;long short-term memory (LSTM);network compression;recurrent neural networks (RNNs),Computational modeling;Quantization (signal);Computational complexity;Hardware;Sparse matrices;Logic gates;Training
E. Bostan; U. S. Kamilov; L. Waller,"Department of Electrical Engineering & Computer Sciences, University of California, Berkeley, CA, USA; Departments of Computer Science & Engineering and Electrical & Systems Engineering, Washington University in St. Louis, St. Louis, MO, USA; Department of Electrical Engineering & Computer Sciences, University of California, Berkeley, CA, USA",2018,Schweizerischer Nationalfonds zur Förderung der Wissenschaftlichen Forschung(grant numbers:P2ELP2_172278); ,Image reconstruction;inverse problems;iterative shrinkage;learning;statistical modeling,TV;Image reconstruction;Signal processing algorithms;Training;Transforms;Computational modeling;Analytical models
