Authors,Author Affiliations,Publication Year,Funding Information,Author Keywords,IEEE Terms
F. Yang; W. Yang; R. Gao; Q. Liao,"Shenzhen Key Laboratory of Information Sci& Tech/Shenzhen Engineering Laboratory of IS&DCP, Department of Electronic Engineering/Graduate School at Shenzhen, Tsinghua University, Shenzhen, China; Shenzhen Key Laboratory of Information Sci& Tech/Shenzhen Engineering Laboratory of IS&DCP, Department of Electronic Engineering/Graduate School at Shenzhen, Tsinghua University, Shenzhen, China; Shenzhen Key Laboratory of Information Sci& Tech/Shenzhen Engineering Laboratory of IS&DCP, Department of Electronic Engineering/Graduate School at Shenzhen, Tsinghua University, Shenzhen, China; Shenzhen Key Laboratory of Information Sci& Tech/Shenzhen Engineering Laboratory of IS&DCP, Department of Electronic Engineering/Graduate School at Shenzhen, Tsinghua University, Shenzhen, China",2018,"National Natural Science Foundation of China(grant numbers:61471216); National Basic Research Program of China (973 Program)(grant numbers:2016YFB0101001,2017YFC0112500); Special Foundation for the Development of Strategic Emerging Industries of Shenzhen(grant numbers:JCYJ20170307153940960,JCYJ20150831192224146); ",Coupled mapping;face recognition;low resolution;multidimensional scaling (MDS),Image resolution;Face;Linear programming;Signal resolution;Face recognition;Training;Probes
H. Ha; T. -H. Oh; I. S. Kweon,"School of Electrical Engineering, Korea Advanced Institute of Science and Technology, Daejeon, South Korea; School of Electrical Engineering, Korea Advanced Institute of Science and Technology, Daejeon, South Korea; School of Electrical Engineering, Korea Advanced Institute of Science and Technology, Daejeon, South Korea",2018,National Research Foundation of Korea; Korea Government (MSIP)(grant numbers:2010-0028680); ,Relative pose problem;rotation estimation;structure from small motion (SfSM);two-point minimal solution,Cameras;Estimation;Pipelines;Three-dimensional displays;Signal processing algorithms;Robustness;Convergence
X. Meng; S. Wu; J. Zhu,"Huawei Technologies, Co. Ltd., Shanghai, China; Tsinghua Space Center, Tsinghua University, Beijing, China; Ocean College, Zhejiang University, Zhoushan, China",2018,Zhejiang Province Natural Science Foundation of China(grant numbers:LQ18F010001); ,Approximate message passing (AMP);compressed sensing (CS);generalized linear models (GLM);sparse Bayesian learning (SBL);vector approximate message passing (VAMP),Inference algorithms;Bayes methods;Signal processing algorithms;Message passing;Approximation algorithms;Compressed sensing;Sea measurements
Y. Jia; S. Kwong; J. Hou,"Department of Computer Science, City University of Hong Kong, Kowloon, Hong Kong; City University of Hong Kong, Shenzhen Research Institute, Shenzhen, China; Department of Computer Science, City University of Hong Kong, Kowloon, Hong Kong",2018,Natural Science Foundation of China(grant numbers:61672443); ,Convex optimization;spectral clustering (SC);semi-supervised,Optimization;Clustering algorithms;Clustering methods;Signal processing algorithms;Convergence;Mutual information;Eigenvalues and eigenfunctions
F. Tronarp; Á. F. García-Fernández; S. Särkkä,"Department of Electrical Engineering and Automation, Aalto University, Espoo, Finland; Department of Electrical Engineering and Electronics, University of Liverpool, Liverpool, U.K.; Department of Electrical Engineering and Automation, Aalto University, Espoo, Finland",2018,"Academy of Finland(grant numbers:#295080,#266940); ",Iterative methods;nonlinear/non-Gaussian systems;state estimation;statistical linear regression (SLR),Smoothing methods;Kalman filters;Signal processing algorithms;Approximation algorithms;Random variables;Estimation;Computational modeling
D. K. Yadav; G. Kuldeep; S. D. Joshi,"SAG, Delhi, India; SAG, Delhi, India; Department of Electrical Engineering, Indian Institute of Technology Delhi, New Delhi, India",2018,,Discrete fourier transform;edge detection;noise level estimation;Ramanujan sums (RS),Image edge detection;Estimation;Noise level;Kernel;Signal processing;Presses
Z. Zheng; J. Huo; B. Li; H. Yuan,"State Key Laboratory of Integrated Services Networks, Xidian University, Xian, China; State Key Laboratory of Integrated Services Networks, Xidian University, Xian, China; State Key Laboratory of Integrated Services Networks, Xidian University, Xian, China; School of Information Science and Engineering, Shandong University, Jinan, China",2018,NSF of China(grant numbers:61571274); 111 Project(grant numbers:B08038); Shandong Natural Science Funds for Distinguished Young Scholar(grant numbers:JQ201614); Young Scholars Program of Shandong University(grant numbers:2015WLJH39); ,Multiview video plus depth (MVD);rate-distortion optimization (RDO);three dimensional high efficiency video coding (3D-HEVC);3-D video (3DV);virtual view distortion (VVD),Distortion;Image analysis;Encoding;Estimation;Three-dimensional displays;Color;Image color analysis
S. Imani; M. M. Nayebi; S. A. Ghorashi,"Department of Electrical Engineering, Sharif University, Tehran, Iran; Department of Electrical Engineering, Sharif University, Tehran, Iran; Department of Electrical Engineering, Shahid Beheshti University, Tehran, Iran",2018,,Filter design;multiple-input multiple-output radar (MIMO);pulse compression;waveform design,Interference;Signal to noise ratio;MIMO radar;Radar antennas;Antenna arrays;Optimization
Y. Zhang; B. Luo; L. Zhang,"State Key Laboratory of Information Engineering in Surveying, Mapping and Remote Sensing, Wuhan University, Wuhan, China; State Key Laboratory of Information Engineering in Surveying, Mapping and Remote Sensing, Wuhan University, Wuhan, China; State Key Laboratory of Information Engineering in Surveying, Mapping and Remote Sensing, Wuhan University, Wuhan, China",2018,"National Natural Science Foundation Project(grant numbers:61261130587,61571332); ",Motion segmentation;permutation preference;sampling and clustering,Motion segmentation;Computer vision;Couplings;Shape;Tracking;Image color analysis;Clustering algorithms
S. Kim; S. Choi,"Department of Computer Science and Engineering, Pohang University of Science and Technology, Pohang, South Korea; Department of Computer Science and Engineering, Pohang University of Science and Technology, Pohang, South Korea",2018,NAVER; ,Binary embedding (BE);circulant matrix;locality-sensitive hashing;random projection;sparse embedding,Hamming distance;Sparse matrices;Binary codes;Time complexity;Convergence;Quantization (signal)
I. Trots; A. Nowicki; M. Postema,"Institute of Fundamental Technological Research of the Polish Academy of Sciences, Warsaw, Poland; Institute of Fundamental Technological Research of the Polish Academy of Sciences, Warsaw, Poland; LE STUDIUM Loire Valley Institute for Advanced Studies, Orléans, France",2018,,Coded excitation;Golay sequences;synthetic aperture method;transducer bandwidth;ultrasound imaging,Bandwidth;Transducers;Ultrasonic imaging;Correlation;Matched filters;Image coding;Image resolution
S. Huang; C. Mao; J. Tao; Z. Ye,"National Engineering Laboratory for Speech and Language Information Processing, Hefei, Anhui, China; National Engineering Laboratory for Speech and Language Information Processing, Hefei, Anhui, China; National Engineering Laboratory for Speech and Language Information Processing, Hefei, Anhui, China; National Engineering Laboratory for Speech and Language Information Processing, Hefei, Anhui, China",2018,Fundamental Research Funds for the Central Universities(grant numbers:WK2350000002); ,Efficient;keyframe centered clip (KCC);key information;sequence-to-sequence;sign language recognition (SLR),Assistive technology;Gesture recognition;Hidden Markov models;Feature extraction;Trajectory;Task analysis;Adaptation models
I. Djurović,"University of Montenegro, Podgorica, Montenegro",2018,,Instantaneous frequency (IF);quasi maximum likelihood (QML);random samples consensus (RANSAC);short-time Fourier transform (STFT),Signal processing algorithms;Frequency modulation;Signal to noise ratio;Maximum likelihood estimation;Frequency estimation;Time-frequency analysis
M. Chen; X. Mao; X. Long; L. Xin,"School of Electronics and Information Engineering, Harbin Institute of Technology, Harbin, China; School of Electronics and Information Engineering, Harbin Institute of Technology, Harbin, China; Science and Technology on Electronic Information Control Laboratory, Chengdu, China; School of Electronics and Information Engineering, Harbin Institute of Technology, Harbin, China",2018,National Natural Science Foundation of China(grant numbers:61171180); ,Direct processing;passive localization;spatio-temporal processing;underdetermined scenario,Signal processing algorithms;Sensors;Signal to noise ratio;Bandwidth;Indexing;Time difference of arrival
S. S. Qureshi; S. Ali; S. A. Hassan,"School of Electrical Engineering and Computer Science, National University of Sciences & Technology, Islamabad, Pakistan; School of Electrical Engineering and Computer Science, National University of Sciences & Technology, Islamabad, Pakistan; School of Electrical Engineering and Computer Science, National University of Sciences & Technology, Islamabad, Pakistan",2018,,Dual-polarized antennas;multiple antennas;polarization diversity;quaternion algebra;space-time codes,Quaternions;Transmitting antennas;Diversity methods;Decoding;Receivers;Block codes
V. Abolghasemi; M. Chen; A. Alameer; S. Ferdowsi; J. Chambers; K. Nazarpour,"Faculty of Electrical Engineering and Robotics, Shahrood University of Technology, Shahrood, Iran; Department of Electronic Engineering, University of Surrey, Guildford, U.K.; School of Engineering, Newcastle University, Newcastle upon Tyne, U.K.; Faculty of Electrical Engineering and Robotics, Shahrood University of Technology, Shahrood, Iran; College of Automation, Harbin Engineering University, Harbin, China; School of Engineering, Newcastle University, Newcastle upon Tyne, U.K.",2018,"Higher Committee for Education Development, Iraq(grant numbers:(HCED, D1201017)); Engineering and Physical Sciences Research Council, U.K.(grant numbers:(EP/M025594/1)); ",Chinese numbers;classification;incoherent dictionary pair learning,Dictionaries;Signal processing algorithms;Machine learning;Licenses;Databases;Algorithm design and analysis;Silicon
Z. Gong; C. Li; F. Jiang,"Faculty of Engineering and Applied Science, Memorial University of Newfoundland, St. John's, NL, Canada; Faculty of Engineering and Applied Science, Memorial University of Newfoundland, St. John's, NL, Canada; Faculty of Engineering and Applied Science, Memorial University of Newfoundland, St. John's, NL, Canada",2018,Natural Sciences and Engineering Research Council of Canada(grant numbers:Discovery Grant #293264-12); Research and Development Corporation of Newfoundland and Labrador(grant numbers:SensorTECH Project 5404-2061-101); ,Autonomous underwater vehicle (AUV) aided localization;Cramér–Rao lower bound (CRLB);time of arrival (ToA);time synchronization;underwater sensor networks,Synchronization;Signal processing algorithms;Clocks;Nonlinear equations;Trajectory;Wireless sensor networks
T. Choudhary; L. N. Sharma; M. K. Bhuyan,"Department of Electronics and Electrical Engineering, Indian Institute of Technology Guwahati, Guwahati, India; Department of Electronics and Electrical Engineering, Indian Institute of Technology Guwahati, Guwahati, India; Department of Electronics and Electrical Engineering, Indian Institute of Technology Guwahati, Guwahati, India",2018,,Discrete wavelet transform (DWT);heart sound (HS);phonocardiogram;seismocardiogram,Heart;Phonocardiography;Electrocardiography;Feature extraction;Discrete wavelet transforms;Signal resolution
C. Foley; A. Quinn,"Biostatistics Department, Harvard T.H. Chan School of Public Health, Harvard University, Boston, MA, USA; Department of Electronic and Electrical Engineering, Trinity College Dublin, University of Dublin, Dublin, Ireland",2018,"Fulbright Commission, and of GAČR grants (Czech Republic)(grant numbers:GA16-09848S,GA18-15970S); ",Fully probabilistic design (FPD);Kalman filter (KF);knowledge transfer;Kullback–Leibler divergence (KLD);measurement vector fusion (MVF);predictor;transfer learning,Bayes methods;Kalman filters;Knowledge transfer;Probabilistic logic;Stochastic processes;Computational modeling;Predictive models
L. Tang; H. Li; Q. Wu; K. N. Ngan,"School of Eletronic Engineering, University of Electronic Science and Technology of China, Chengdu, China; Department of Electronic Engineering, University of Electronic Science and Technology of China, Chengdu, China; School of Electronic Engineering, University of Electronic Science and Technology of China, Chengdu, China; Department of Electronic Engineering, The Chinese University of Hong Kong, Hong Kong",2018,"National Natural Science Foundation of China(grant numbers:61525102,61601102); ",Convex optimization;edge preserving smoothing;saliency detection,Optimization;Linear programming;Convex functions;Object detection;Signal processing algorithms;Smoothing methods;Cascading style sheets
M. B. Mashhadi; S. Gazor; N. Rahnavard; F. Marvasti,"ECE Department, Queens’ University, Kingston, Canada; ECE Department, Queens’ University, Kingston, Canada; ECE Department, University of Central Florida, Orlando, FL, USA; Advanced Communications Research Institute, Sharif University of Technology, Tehran, Iran",2018,Sharif University of Technology; Iran National Science Foundation; ,1-Bit compressive sensing (CS);binary-sparse error correction;level comparison (LC) sign measurements;sparse signal acquisition,Signal processing algorithms;Error correction;Receivers;Estimation;Prediction algorithms;Measurement uncertainty;Compressed sensing
W. Minmin; S. Shengli; L. Yejin,"Shanghai Institute of Technical Physics of the Chinese Academy of Science, Shanghai, China; Shanghai Institute of Technical Physics of the Chinese Academy of Science, Shanghai, China; Shanghai Institute of Technical Physics of the Chinese Academy of Science, Shanghai, China",2018,The National High Technology Research and Development Program of China 863 Program(grant numbers:2015AA7015091); ,Compressive sensing (CS);cosine similarity;Gaussian differential graph;visual tracking,Feature extraction;Signal processing algorithms;Target tracking;Computational efficiency;Image coding;Robustness
X. Wang; Z. Lei; S. Liao; X. Guo; Y. Yang; S. Z. Li,"CBSR&NLPR, Institute of Automation, Chinese Academy of Sciences, Beijing, China; CBSR&NLPR, Institute of Automation, Chinese Academy of Sciences, Beijing, China; CBSR&NLPR, Institute of Automation, Chinese Academy of Sciences, Beijing, China; School of Computer Software, Tianjin University, Tianjin, China; CBSR&NLPR, Institute of Automation, Chinese Academy of Sciences, Beijing, China; CBSR&NLPR, Institute of Automation, Chinese Academy of Sciences, Beijing, China",2018,"National Key Research and Development Plan(grant numbers:2016YFC0801002); Chinese National Natural Science Foundation(grant numbers:61473291,61572501,61502491,61572536,61672521); AuthenMetric R&D Funds; ",Feature coding;Person re-identification,Dictionaries;Encoding;Feature extraction;Kernel;Task analysis;Signal processing algorithms;Algorithm design and analysis
P. P. Markopoulos; D. G. Chachlakis; E. E. Papalexakis,"Department of Electrical and Microelectronic Engineering, Rochester Institute of Technology, Rochester, NY, USA; Department of Electrical and Microelectronic Engineering, Rochester Institute of Technology, Rochester, NY, USA; Department of Computer Science and Engineering, University of California Riverside, Riverside, CA, USA",2018,,Data analysis;L1-norm;outliers;robust;tensors;TUCKER decomposition,Optimized production technology;Signal processing algorithms;Tensile stress;Approximation algorithms;Principal component analysis;Algorithm design and analysis;Matrix decomposition
D. G. Silva; R. Attux,"Department of Electrical Engineering, University of Braslia, Braslia, DF, Brazil; School of Electrical and Computer Engineering, University of Campinas, Campinas, SP, Brazil",2018,Conselho Nacional de Desenvolvimento Científico e Tecnológico; ,Combinatorial optimization;finite fields;Independent Component Analysis (ICA),Entropy;Signal processing algorithms;Cost function;Algorithm design and analysis;Simulated annealing;Correlation
A. -K. Seghouane; N. Shokouhi,"Department of Electrical and Electronic Engineering, University of Melbourne, Melbourne, VIC, Australia; Department of Electrical and Electronic Engineering, University of Melbourne, Melbourne, VIC, Australia",2018,Australian Research Council(grant numbers:FT 130101394); ,Principal component analysis;row/column-covariance;two-dimensional (2-D) whitening;unsupervised preprocessing,Covariance matrices;Transforms;Face;Symmetric matrices;Face recognition;Gaussian distribution;Matrix decomposition
Z. Lu; X. Jiang; A. Kot,"School of Electrical and Electronic Engineering, Nanyang Technological University, Singapore, 639798; School of Electrical and Electronic Engineering, Nanyang Technological University, Singapore, 639798; School of Electrical and Electronic Engineering, Nanyang Technological University, Singapore, 639798",2018,"Rapid-Rich Object Search Laboratory, Nanyang Technological University, Singapore; Infocomm Media Development Authority, Singapore; Singapore Ministry of Education Academic Research Fund(grant numbers:RG 123/15); ",Convolutional neural network (CNN);coupled mappings (CMs);feature extraction,Image resolution;Face;Feature extraction;Probes;Training;Convolution;Robustness
S. Tomic; M. Beko,"COPELABS, Universidade Lusófona de Humanidades e Tecnologias, Lisboa, Portugal; COPELABS, Universidade Lusófona de Humanidades e Tecnologias, Lisboa, Portugal",2018,"Fundação para a Ciência e a Tecnologia(grant numbers:PEst-OE/EEI/UI0066/2014,UID/EEA/50009/2013); Program Investigador Fundação para a Ciência e Tecnologia(grant numbers:IF/00325/2015); ",Clock imperfections;generalized trust region subproblem (GTRS);robust localization;two-way time of arrival (TW-ToA),Robustness;Clocks;Maximum likelihood estimation;Cascading style sheets;Computational complexity;Programming
M. Raitoharju; L. Svensson; Á. F. García-Fernández; R. Piché,"Laboratory of Automation and Hydraulic Engineering, Tampere University of Technology, Tampere FI-33101, Finland and Department of Electrical Engineering and Automation, Aalto University, Espoo, Finland; department of Signals and Systems, Chalmers University of Technology, Gothenburg, Sweden; Department of Electrical Engineering and Electronics, University of Liverpool,, U.K.; Laboratory of Automation and Hydraulic Engineering, Tampere University of Technology, Tampere, Finland",2018,COST Action(grant numbers:TU1302); Academy of Finland(grant numbers:287792); ,Bayesian state estimation;estimation;kalman filters;nonlinear,Signal processing algorithms;Kalman filters;Noise measurement;Computational modeling;Cost function;Convergence
R. Huang; X. Jiang,"Rapid-Rich Object Search (ROSE) Lab, Nanyang Technological University, Singapore; School of Electrical and Electronic Engineering, Nanyang Technological University, Singapore",2018,"Rapid-Rich Object Search (ROSE) Lab; Nanyang Technological University, Singapore; Fundamental Research Funds for the Central Universities(grant numbers:SWU115062); Singapore Ministry of Education Academic Research Fund(grant numbers:1 RG27/14 RG 123/15); ",Face recognition;metric learning;off-feature information;pose and expression estimation,Face;Measurement;Feature extraction;Signal processing algorithms;Face recognition;Data mining;Training
K. Upadhya; S. A. Vorobyov,"Department of Signal Processing and Acoustics, Aalto University, Espoo, Finland; Department of Signal Processing and Acoustics, Aalto University, Espoo, Finland",2018,Academy of Finland Research(grant numbers:299243); ,Covariance estimation;massive multiple-input multiple-output (MIMO);pilot contamination;staggered pilots,Covariance matrices;Channel estimation;MIMO communication;Coherence;Estimation;Partial transmit sequences;Contamination
X. Han; J. Lu; C. Zhao; S. You; H. Li,"School of Computer Science and Engineering, Nanjing University of Science and Technology, Nanjing, Jiangsu, China; School of Computer Science and Engineering, Nanjing University of Science and Technology, Nanjing, Jiangsu, China; School of Computer Science and Engineering, Nanjing University of Science and Technology, Nanjing, Jiangsu, China; College of Engineering and Computer Science, Australian National University, Canberra, ACT, Australia; College of Engineering and Computer Science, Australian National University, Canberra, ACT, Australia",2018,,Generative adversarial networks;road detection;semi-supervised learning,Roads;Training;Shape;Generators;Gallium nitride;Image segmentation;Network architecture
F. Luo; S. Wang; Y. Gong; X. Jing; L. Zhang,"School of Information and Communication Engineering, Beijing University of Posts and Communications (BUPT), Beijing, China; School of Information and Communication Engineering, Beijing University of Posts and Communications (BUPT), Beijing, China; School of Information and Communication Engineering, Beijing University of Posts and Communications (BUPT), Beijing, China; School of Information and Communication Engineering, Beijing University of Posts and Communications (BUPT), Beijing, China; School of Information and Communication Engineering, Beijing University of Posts and Communications (BUPT), Beijing, China",2018,National Natural Science Foundation of China(grant numbers:61601048); ,Approximate message passing;cooperative localizer;geographical;NLOS;VANET,Global navigation satellite system;Buildings;Current measurement;Sampling methods;Estimation;Vehicular ad hoc networks;Position measurement
X. Meng; Z. Zhang; Z. Geng; M. Zhang,"State Key Laboratory of Management and Control for Complex Systems, Institute of Automation, Chinese Academy of Sciences, Beijing, China; State Key Laboratory of Management and Control for Complex Systems, Institute of Automation, Chinese Academy of Sciences, Beijing, China; State Key Laboratory of Management and Control for Complex Systems, Institute of Automation, Chinese Academy of Sciences, Beijing, China; State Key Laboratory of Management and Control for Complex Systems, Institute of Automation, Chinese Academy of Sciences, Beijing, China",2018,National High-tech R&D Program (863 Program) of China(grant numbers:2015AA015905); National Natural Science Foundation of China(grant numbers:61605240); ,Confidence evaluation;disparity upsampling;markov random field (MRF);noise;three-dimensional (3-D) reconstruction,Noise measurement;Color;Three-dimensional displays;Mathematical model;Image color analysis;Reliability;Graphics processing units
J. J. Pérez-Solano; M. Cobos; J. Segura; S. Felici-Castell,"Departament d’Informàtica, Universitat de València, Burjassot, Spain; Departament d’Informàtica, Universitat de València, Burjassot, Spain; Departament d’Informàtica, Universitat de València, Burjassot, Spain; Departament d’Informàtica, Universitat de València, Burjassot, Spain",2018,Spanish Government(grant numbers:BIA2016-76957-C3-1-R); ,Audio ranging;chirp;localization;wireless acoustic sensor networks,Chirp;Probes;Acoustics;Distance measurement;Correlation;Bandwidth;Frequency modulation
X. Deng,"Electrical and Electronic Engineering department, Imperial College London, London, U.K.",2018,Imperial CSC scholarship; ,Image quality;single image super-resolution (SISR);style transfer,Image resolution;Image quality;Image reconstruction;Signal resolution;Signal processing algorithms;Image restoration;Neural networks
X. -L. Li,"resides in San Jose, CA, USA",2018,,Cosine modulation;discrete Fourier transform (DFT) modulation;filter bank,Discrete Fourier transforms;Modulation;Indexes;Filter banks;Prototypes;Time-domain analysis;Optimization
N. Fu; G. Huang; L. Zheng; X. Wang,"Department of Automatic Test and Control, Harbin Institute of Technology, Harbin, China; Department of Automatic Test and Control, Harbin Institute of Technology, Harbin, China; Department of Electrical Engineering, Columbia University, New York, NY, USA; Department of Electrical Engineering, Columbia University, New York, NY, USA",2018,"National Natural Science Foundation of China(grant numbers:61671177,61102148); ",Feedback;multiple sinusoids;Prony's method;sub-Nyquist sampling;time staggered,Frequency estimation;Time-frequency analysis;Frequency modulation;Estimation;Signal resolution;Simulation;Indexes
A. Haqiqatnejad; F. Kayhan; B. Ottersten,"Interdisciplinary Centre for Security, Reliability and Trust, University of Luxembourg, Luxembourg, Luxembourg; Interdisciplinary Centre for Security, Reliability and Trust, University of Luxembourg, Luxembourg, Luxembourg; Interdisciplinary Centre for Security, Reliability and Trust, University of Luxembourg, Luxembourg, Luxembourg",2018,Luxembourg National Research Fund under CORE Junior(grant numbers:C16/IS/11332341); ,Constructive interference (CI);multiuser multiple-input single-output (MISO);symbol-level precoding (SLP);Voronoi regions,Signal to noise ratio;Interference;Minimization;Precoding;Optimization;MISO communication;Transmitting antennas
S. -H. Hsieh; C. -S. Lu; S. -C. Pei,"Institute of Information Science, Academia Sinica, Taipei, Taiwan; Institute of Information Science, Academia Sinica, Taipei, Taiwan, ROC; Graduate Institute of Communication Engineering, National Taiwan University, Taipei, Taiwan, ROC",2018,,Compressive sensing (CS);sensing matrix;sparse fast Fourier transform (sFFT);sparsity,Sensors;Sparse matrices;Decoding;Dictionaries;Frequency-domain analysis;Encoding;Hardware
