Authors,Author Affiliations,Publication Year,Funding Information,Author Keywords,IEEE Terms
S. Zhang; E. Soubies; C. Févotte,"IRIT, Université de Toulouse, CNRS, Toulouse, France; IRIT, Université de Toulouse, CNRS, Toulouse, France; IRIT, Université de Toulouse, CNRS, Toulouse, France",2020,European Research Council(grant numbers:FACTORY-CoG-6681839); ,NMF;transform learning;identifiability;source separation;joint diagonalization,Source separation;Manganese;Discrete cosine transforms;Adaptation models;Linear programming;Signal processing algorithms
H. Wang; Y. Zou; D. Chong; W. Wang,"School of Electronic, Computer Engineering, Peking University, Shenzhen, China; School of Electronic, Computer Engineering, Peking University, Shenzhen, China; School of Electronic, Computer Engineering, Peking University, Shenzhen, China; Signal Processing, Centre for Vision, Speech, University of Surrey, Surrey, U.K.",2020,"Shenzhen Science and Technology Fundamental Research Programs(grant numbers:JCYJ20170817160058246,JCYJ20180507182908274); Collaboration Research Project; PKU-HKUST ShenZhen-HongKong Institution; ",Audio tagging;label dependencies;graph convolutional network;representation learning,Tagging;Acoustics;Spectrogram;Training;Convolution;Symmetric matrices;Probability
M. Han; O. Özdenizci; Y. Wang; T. Koike-Akino; D. Erdoğmuş,"Department of Electrical and Computer Engineering, Cognitive Systems Laboratory, Northeastern University, Boston, USA; Department of Electrical and Computer Engineering, Cognitive Systems Laboratory, Northeastern University, Boston, USA; Mitsubishi Electric Research Laboratories (MERL), Cambridge, USA; Mitsubishi Electric Research Laboratories (MERL), Cambridge, USA; Department of Electrical and Computer Engineering, Cognitive Systems Laboratory, Northeastern University, Boston, USA",2020,"Mitsubishi Electric Research Laboratories; Ozan Özdenizci and Deniz Erdoğmuş(grant numbers:IIS-1149570,CNS-1544895,IIS-1715858); DHHS(grant numbers:90RE5017-02-01); NIH(grant numbers:R01DC009834); ",Adversarial deep learning;stress assessment,Feature extraction;Task analysis;Decoding;Stress;Training;Physiology;Biomedical monitoring
A. Varsi; J. Taylor; L. Kekempanos; E. Pyzer Knapp; S. Maskell,"Department of Electrical Engineering and Electronics, University of Liverpool, Liverpool, U.K.; Hartree Centre, Science and Technology Facilities Council (STFC), Sci-Tech Daresbury, Warrington, U.K.; BT Applied Research, Orion Building, Adastral Park, Ipswich, U.K.; IBM Research U.K., Sci-Tech Daresbury, Warrington, U.K.; Department of Electrical Engineering and Electronics, University of Liverpool, Liverpool, U.K.",2020,"U.K. EPSRC Doctoral Training Award; U.K. EPSRC Big Hypothesis Award; STFC Hartree Centre's Innovation; Department for Business, Energy and Industrial Strategy; ",Parallel particle filters;shared memory architectures;OpenMP;resampling;redistribute,Time complexity;Particle filters;Graphics processing units;Indexes;Atmospheric measurements;Particle measurements;Proposals
A. C. Türkmen; G. Çapan; A. T. Cemgil,"Amazon Research, Berlin, Germany; Department of Computer Engineering, Boğaziçi University, Istanbul, Turkey; Department of Computer Engineering, Boğaziçi University, Istanbul, Turkey",2020,,Hawkes processes;temporal point processes;clustering,Clustering algorithms;Numerical stability;Machine learning algorithms;Signal processing algorithms;Computer networks;Computational modeling;Data models
L. Peng; M. C. Tsakiris,"School of Information Science, and Technology, ShanghaiTech University, Shanghai, China; School of Information Science, and Technology, ShanghaiTech University, Shanghai, China",2020,ShanghaiTech start-up(grant numbers:2017F0203-000-16); ,Linear regression without correspondences;unlabeled sensing;homomorphic sensing;concave minimization;branch-and-bound;linear assignment problem,Minimization;Upper bound;Signal processing algorithms;Linear regression;Linear programming;Sensors;Estimation
L. Huang; K. Song; A. Gong; C. Liu; Y. Yan,"School of Mechanical Engineering and Automation, Northeastern University, Shenyang, China; School of Mechanical Engineering and Automation, Northeastern University, Shenyang, China; School of Mechanical Engineering and Automation, Northeastern University, Shenyang, China; School of Mechanical Engineering, Shijiazhuang Tiedao University, Shijiazhuang, China; School of Mechanical Engineering and Automation, Northeastern University, Shenyang, China",2020,National Natural Science Foundation of China(grant numbers:51805078); National Basic Research Program of China (973 Program)(grant numbers:2017YFB0304200); ,Saliency detection;affinity matrix;RGB-T image fusions;low-rank tensor;collaborative ranking,Saliency detection;Tensile stress;Feature extraction;Signal processing algorithms;Collaboration;Matrix decomposition;Lighting
X. Zhang; F. Chen; C. Wang; M. Tao; G. -P. Jiang,"College of Automation and College of Artifificial Intelligence, Nanjing University of Posts and Telecommunications, Nanjing, China; School of Computer Science, Nanjing University of Posts and Telecommunications, Nanjing, China; College of Automation and College of Artifificial Intelligence, Nanjing University of Posts and Telecommunications, Nanjing, China; College of Automation and College of Artifificial Intelligence, Nanjing University of Posts and Telecommunications, Nanjing, China; College of Automation and College of Artifificial Intelligence, Nanjing University of Posts and Telecommunications, Nanjing, China",2020,National Natural Science Foundation of China(grant numbers:61871445); Nanjing University(grant numbers:NY22057); ,Two-stage GAN;Adaptive filling convolution;Siamese adversarial mechanism;Image outpainting,Convolution;Generators;Decoding;Task analysis;Filling;Extrapolation;Training
S. A. R. Kazemi; R. Amiri; F. Behnia,"Department of Electrical Engineering, Sharif University of Technology, Tehran, Iran; Department of Electrical Engineering, Sharif University of Technology, Tehran, Iran; Department of Electrical Engineering, Sharif University of Technology, Tehran, Iran",2020,,Target localization;multiple-input multiple-output (MIMO) radar;time delay (TD);Doppler shift (DS);maximum likelihood (ML) estimation;Cramer-Rao bound (CRB),Maximum likelihood estimation;Task analysis;Mathematical model;Position measurement;Velocity measurement;Noise measurement
Y. Zhou; F. Ding,"Key Laboratory of Advanced Process Control for Light Industry (Ministry of Education), School of Internet of Things Engineering, Jiangnan University, Wuxi, China; Key Laboratory of Advanced Process Control for Light Industry (Ministry of Education), School of Internet of Things Engineering, Jiangnan University, Wuxi, China",2020,National Natural Science Foundation of China(grant numbers:61873111); ,Nonlinear combined model;parameter estimation;separated idea;interactive estimation;data saturation,Signal processing algorithms;Parameter estimation;Technological innovation;Mathematical model;Computational modeling;Estimation;Optimization
J. Zhang; P. Yang; W. Wang; Y. Hong; L. Zhang,"Department of Computer Science and Engineering, MOE Key Lab of Artificial Intelligence, Shanghai Jiao Tong University, Shanghai, China; Department of Computer Science and Engineering, MOE Key Lab of Artificial Intelligence, Shanghai Jiao Tong University, Shanghai, China; Department of Computer Science and Engineering, MOE Key Lab of Artificial Intelligence, Shanghai Jiao Tong University, Shanghai, China; Department of Computer Science and Engineering, MOE Key Lab of Artificial Intelligence, Shanghai Jiao Tong University, Shanghai, China; Department of Computer Science and Engineering, MOE Key Lab of Artificial Intelligence, Shanghai Jiao Tong University, Shanghai, China",2020,National Key R&D Program of China(grant numbers:2018AAA0100704); ,Image generation;inpainting;image completion;image segmentation,Image segmentation;Image edge detection;Image color analysis;Task analysis;Convolution;Head;Signal processing algorithms
K. Zhou; D. Li; Y. Su; T. Liu,"School of Electronic Science and Technology, National University of Defense Technology (NUDT), Changsha, China; School of Electronic Science and Technology, National University of Defense Technology (NUDT), Changsha, China; School of Electronic Science and Technology, National University of Defense Technology (NUDT), Changsha, China; School of Electronic Science and Technology, National University of Defense Technology (NUDT), Changsha, China",2020,National Natural Science Foundation of China(grant numbers:61771478); ,Waveform design;mismatch filter;interrupted sampling repeater jamming (ISRJ),Interference;Radar;Peak to average power ratio;Jamming;Convergence;Repeaters;Simulation
Y. Tian; Y. Wang; L. Yang; Z. Qi,"School of Economics and Management, University of Chinese Academy of Sciences, Beijing, China; School of Computer Science and Technology, Chinese Academy of Sciences, Research Center on Fictitious Economy and Data Science, Chinese Academy of Sciences, and Key Laboratory of Big Data Mining and Knowledge management, University of Chinese Academy of Sciences, Beijing, China; Sino-Danish College, University of Chinese Academy of Sciences, Beijing, China; School of Economics and Management, University of Chinese Academy of Sciences, Beijing, China",2020,"Chinese Academy of Sciences(grant numbers:KFJ-STS-ZDTP-060); National Natural Science Foundation of China(grant numbers:71731009,61472390); ",Image compression artifacts reduction;image denoisin;concatenation;feature selection;attention mechanism,Task analysis;Image coding;Image restoration;Feature extraction;Image denoising;Convolution;Neural networks
C. Liu; W. Zhou; Y. Chen; J. Lei,"School of Information and Electronic Engineering, Zhejiang University of Science and Technology, Hangzhou, China; School of Information and Electronic Engineering, Zhejiang University of Science and Technology, Hangzhou, China; School of Information and Electronic Engineering, Zhejiang University of Science and Technology, Hangzhou, China; School of Information and Electronic Engineering, Zhejiang University of Science and Technology, Hangzhou, China",2020,"National Natural Science Foundation of China(grant numbers:61502429,61972357); Zhejiang Provincial Natural Science Foundation of China(grant numbers:LY18F020012); ",RGB-D;asymmetric deeply fused network;salient object detection;adaptive attention transformer module,Feature extraction;Decoding;Convolution;Adaptation models;Fuses;Visualization;Object detection
T. Chen; L. Shi; L. Guo,"College of Information and Communication Engineering, Harbin Engineering University, Harbin, China; College of Information and Communication Engineering, Harbin Engineering University, Harbin, China; College of Information and Communication Engineering, Harbin Engineering University, Harbin, China",2020,National Natural Science Foundation of China(grant numbers:62071137); Fundamental Research Funds for the Central Universities; ,Gridless direction of arrival;sparse linear array;atomic norm minimization;matrix completion,Direction-of-arrival estimation;Arrays;Estimation;Signal processing algorithms;Covariance matrices;Optimization;Array signal processing
S. Emura; H. Sawada; S. Araki; N. Harada,"Media Intelligence Laboratories, NTT, Musashino-shi, Japan; NTT Communication Science Laboratories, Kyoto, Japan; NTT Communication Science Laboratories, Kyoto, Japan; NTT Communication Science Laboratories, Kyoto, Japan",2020,,Frequency-domain blind source separation;residual crosstalk;post-filtering;sparse;ADMM,Crosstalk;Frequency-domain analysis;Microphones;Optimization;Time-domain analysis;Reverberation;Blind source separation
T. Wu; W. Li; S. Jia; Y. Dong; T. Zeng,"School of Science, Nanjing University of Posts and Telecommunications, Nanjing, China; School of Science, Nanjing University of Posts and Telecommunications, Nanjing, China; School of Computer Science, Nanjing University of Posts and Telecommunications, Nanjing, China; Department of Applied Mathematics and Computer Science, Technical University of Denmark, Kgs. Lyngby, Denmark; Department of Mathematics, The Chinese University of Hong Kong, Shatin, Hong Kong",2020,"National Natural Science Foundation of China(grant numbers:61971234,11671002,11701388); Nanjing University of Posts and Telecommunications; Colleges and Universities of Jiangsu Province; STITP(grant numbers:XZD2020122); CUHK Start-Up; CUHK DAG(grant numbers:4053342,4053405,RGC 14300219,RGC 14302920); NSFC/RGC(grant numbers:N_CUHK415/19); ",Cauchy noise;forward-backward splitting;image deblurring;mwcnn denoiser,Image restoration;Discrete wavelet transforms;Computational modeling;Image denoising;Gaussian noise;Mathematical model;Noise level
F. Lv; H. Liu; Y. Wang; J. Zhao; G. Yang,"Center of Statistical Research & School of Statistics, Southwestern University of Finance and Economics, Chengdu, China; School of Computer Science and Engineering, University of Electronic Science and Technology of China, Chengdu, China; School of Computer Science and Engineering, University of Electronic Science and Technology of China, Chengdu, China; Center of Statistical Research & School of Statistics, Southwestern University of Finance and Economics, Chengdu, China; School of Computer Science and Engineering, University of Electronic Science and Technology of China, Chengdu, China",2020,"National Natural Science Foundation of China(grant numbers:11829101,11931014); Fundamental Research Funds for the Central Universities(grant numbers:JBK1806002); ",Semantic segmentation;transductive learning;zero-shot learning,Semantics;Image segmentation;Neural networks;Visualization;Training;Predictive models;Machine learning
L. Tian; C. Xu; Y. Li,"School of Information Science, and Engineering, Yanshan University, Qinhuangdao, China; School of Information Science, and Engineering, Yanshan University, Qinhuangdao, China; School of Information Science, and Engineering, Yanshan University, Qinhuangdao, China",2020,National Natural Science Foundation of China(grant numbers:61671402); Natural Science Foundation of Hebei Province(grant numbers:F2020203043); ,Cognitive radio/radar;good correlation;spe-ctrally-constrained sequence (SCS);spectrally-null-constrained sequence (SNCS),Correlation;Peak to average power ratio;Radar applications;Multiaccess communication;Frequency-domain analysis;Signal processing
S. Mahmoudpour; P. Schelkens,"Vrije Universiteit Brussel (VUB), Brussels, Belgium; Vrije Universiteit Brussel (VUB), Brussels, Belgium",2020,IMEC ICON ILLUMINATE(grant numbers:HBC.2018.0201); ,Depth image-based rendering;image quality;feature matching;superpixel segmentation;view synthesis,Feature extraction;Distortion;Three-dimensional displays;Image segmentation;Measurement;Quality assessment;Rendering (computer graphics)
S. Zhang; S. Cui; Z. Ding,"Department of Electrical, and Computer Engineering, University of California at Davis, Davis, CA, USA; Shenzhen Research Institute of Big Data, and Future Network of Intelligence Institute (FNii), the Chinese University of Hong Kong, Shenzhen, China; Department of Electrical, and Computer Engineering, University of California at Davis, Davis, CA, USA",2020,National Science Foundation(grant numbers:1824553); ,Hypergraph;point cloud;segmentation;signal processing;spectral clustering,Three-dimensional displays;Tensile stress;Frequency estimation;Estimation;Covariance matrices;Laplace equations
I. Viola; P. Cesar,"Irene Viola is with Centrum Wiskunde & Informatica (CWI), Amsterdam, The Netherlands; Pablo Cesar is with Centrum Wiskunde & Informatica (CWI), Amsterdam, The Netherlands",2020,European Commission(grant numbers:762111); ,Compression;objective quality metric;point cloud;reduced reference metric,Three-dimensional displays;Distortion;Visualization;Distortion measurement;Feature extraction;Geometry
X. Zhu; J. Qian; H. Wang; P. Liu,"Shanghai Jiao Tong University, Shanghai, China; Shanghai Jiao Tong University, Shanghai, China; Shanghai Jiao Tong University, Shanghai, China; Shanghai Jiao Tong University, Shanghai, China",2020,National Natural Science Foundation of China(grant numbers:61903246); ,Person re-identification supervised attention curriculum learning,Training;Feature extraction;Convolution;Detectors;Correlation;Machine learning;Complexity theory
B. -H. Chen; Y. -S. Tseng; J. -L. Yin,"Department of Computer Science and Engineering, Yuan Ze University and the Innovation Center for Big Data and Digital Convergence, Yuan Ze University, Taoyuan, Taiwan; Department of Computer Science and Engineering, Yuan Ze University and the Innovation Center for Big Data and Digital Convergence, Yuan Ze University, Taoyuan, Taiwan; Department of Computer Science and Engineering, Yuan Ze University and the Innovation Center for Big Data and Digital Convergence, Yuan Ze University, Taoyuan, Taiwan",2020,"Ministry of Science and Technology, Taiwan(grant numbers:MOST 108-2221-E-155-034-MY3,MOST 107-2221-E-155-052-MY2); ",Bilateral filter;gaussian range kernel;gaussian spatial kernel;image smoothing,Kernel;Image edge detection;Smoothing methods;Filtering;Histograms;Convolution;Noise measurement
Y. Kim; D. Cho; S. Hong,"Department of Electrical Engineering, Yale University, New Haven, CT, USA; Department of Electronics Engineering, Chungnam National University, Daejeon, South Korea; Department of Information and Communication Engineering, Inha University, Incheon, South Korea",2020,National Research Foundation of Korea; Korea government(grant numbers:2020R1F1A1065573); Inha University; ,Domain adaptation;pre-trained model;self-learning;pseudo labels;class prototypes,Prototypes;Reliability;Adaptation models;Feature extraction;Data models;Data privacy;Training
S. Chen; Z. Li; Z. Tang,"Guangxi Key Lab of Multi-Source Information Mining and Security, Guangxi Normal University, Guilin, China; Guangxi Key Lab of Multi-Source Information Mining and Security, Guangxi Normal University, Guilin, China; Guangxi Key Lab of Multi-Source Information Mining and Security, Guangxi Normal University, Guilin, China",2020,"National Natural Science Foundation of China(grant numbers:61966004,61663004,61866004,61962008); Natural Science Foundation of Guangxi Province(grant numbers:2019GXNSFDA245018,2018GXNSFDA281009,2017GXNSFAA198365); Guangxi Graduate Education(grant numbers:YCSW2020111); ",Object detection;relation information;semantic relation;spatial relation,Semantics;Object detection;Proposals;Automobiles;Detectors;Visualization;Feature extraction
X. Gong; W. Chen; J. Chen; B. Ai,"State Key Laboratory of Rail Traffic Control, and Safety, Beijing Jiaotong University, Beijing, China; State Key Laboratory of Rail Traffic Control, and Safety, Beijing Jiaotong University, Beijing, China; School of Marine Science and Technology, Northwestern Polytechnical University, Xi’an, China; State Key Laboratory of Rail Traffic Control, and Safety, Beijing Jiaotong University, Beijing, China",2020,"National Key R&D Program of China(grant numbers:2018YFE0207600); National Natural Science Foundation of China(grant numbers:61671046,61911530216,61671382,6196113039,U1834210); Fundamental Research Funds for the Central Universities(grant numbers:2020JBZD005); Natural Science Foundation of Beijing Municipality(grant numbers:4182050); NSFC Outstanding Youth Foundation(grant numbers:61725101); Royal Society Newton Advanced Fellowship(grant numbers:NA191006); ",Denoising;low rank;tensor decomposition,Tensile stress;Noise reduction;Matrix decomposition;Indexes;Signal processing;Machine learning;Singular value decomposition
Z. Li; B. Li; J. Gao; L. Li; W. Hu,"National Laboratory of Pattern Recognition, Institute of Automation, Chinese Academy of Sciences, Beijing, China; National Laboratory of Pattern Recognition, Institute of Automation, Chinese Academy of Sciences, Beijing, China; National Laboratory of Pattern Recognition, Institute of Automation, Chinese Academy of Sciences, Beijing, China; Brain Science Center, Beijing Institute of Basic Medical Sciences, Beijing, China; CAS Center for Excellence in Brain Science and Intelligence Technology, National Laboratory of Pattern Recognition, Institute of Automation, Chinese Academy of Sciences, Beijing, China",2020,"National Key R&D Program of China(grant numbers:2018AAA0102802,2018AAA0102803,2018AAA0102800); National Natural Science Foundation of China(grant numbers:U1636218); National Natural Science Foundation of China(grant numbers:61751212,61721004,61772225,61972394); CAS(grant numbers:QYZDJ-SSW-JSC040); National Natural Science Foundation of Guangdong(grant numbers:2018B030311046); ",Model adaptation;siamese networks;visual tracking,Adaptation models;Target tracking;Task analysis;Visualization;Feature extraction;Object tracking;Training
S. Gautam; T. K. Gandhi; B. K. Panigrahi,"Department of Electrical Engineering, IIT Delhi, Delhi, India; Department of Electrical Engineering, IIT Delhi, Delhi, India; Department of Electrical Engineering, IIT Delhi, Delhi, India",2020,,Air-light estimation;dehazing,Estimation;Image color analysis;Atmospheric modeling;Indexes;Brightness;Computational modeling;Channel estimation
H. Phan; I. V. McLoughlin; L. Pham; O. Y. Chén; P. Koch; M. De Vos; A. Mertins,"Queen Mary University of London, London, U.K.; Singapore Institute of Technology, Singapore; University of Kent, Canterbury, U.K.; University of Oxford, Oxford, OX1, U.K.; University of Lübeck, Lübeck, Germany; KU Leven, Leuven, Belgium; University of Lübeck, Lübeck, Germany",2020,Vlaamse regering; ,Speech enhancement;generative adversarial networks;SEGAN;ISEGAN;DSEGAN,Generators;Noise measurement;Speech enhancement;Gallium nitride;Convolution;Decoding;Task analysis
M. Z. Zaheer; A. Mahmood; H. Shin; S. -I. Lee,"Electronics and Telecommunications Research Institute (ETRI), University of Science and Technology, Daejeon, South Korea; Department of Computer Science, Information Technology University, Lahore, Pakistan; Electronics and Telecommunications Research Institute (ETRI), University of Science and Technology, Daejeon, South Korea; Electronics and Telecommunications Research Institute (ETRI), University of Science and Technology, Daejeon, South Korea",2020,ICT R&D Program of MSIP/IITP(grant numbers:2017-0-00306); ,Anomalous events detection;self reasoning framework;video understanding;weakly supervised learning,Videos;Training;Feature extraction;Anomaly detection;Event detection;Noise measurement;Surveillance
D. Gaglione; G. Soldi; P. Braca; G. De Magistris; F. Meyer; F. Hlawatsch,"Research Department, NATO Centre for Maritime Research and Experimentation (CMRE), La Spezia, Italy; Research Department, NATO Centre for Maritime Research and Experimentation (CMRE), La Spezia, Italy; Research Department, NATO Centre for Maritime Research and Experimentation (CMRE), La Spezia, Italy; Research Department, NATO Centre for Maritime Research and Experimentation (CMRE), La Spezia, Italy; Scripps Institution of Oceanography and the Electrical and Computer Engineering Department, University of California San Diego, La Jolla, CA, USA; Institute of Telecommunications, TU Wien, Vienna, Austria",2020,"NATO Allied Command Transformation; Austrian Science Fund(grant numbers:J 3886-N31,P 32055-N31); ",Classification;factor graph;multitarget tracking;probabilistic data association;sum-product algorithm,Sensors;Probability density function;Target tracking;Manganese;Sum product algorithm;Indexes;Sea measurements
Z. Tu; J. Lin; Y. Wang; B. Adsumilli; A. C. Bovik,"Department of Electrical and Computer Engineering, The University of Texas at Austin, Austin, TX, USA; Google Inc., Mountain View, CA, USA; Google Inc., Mountain View, CA, USA; Google Inc., Mountain View, CA, USA; Department of Electrical and Computer Engineering, The University of Texas at Austin, Austin, TX, USA",2020,,Debanding;false contour;compression artifact;dithering;post-processing,Quantization (signal);Streaming media;Smoothing methods;Image edge detection;Image reconstruction;Visualization;Image color analysis
Z. Peng; Y. Jia; J. Hou,"Department of Computer Science, City University of Hong Kong, Kowloon, Hong Kong; Department of Computer Science, City University of Hong Kong, Kowloon, Hong Kong; Department of Computer Science, City University of Hong Kong, Kowloon, Hong Kong",2020,"Hong Kong Research Grants Council(grant numbers:9042820,CityU 11219019); ",Transfer learning;inter-domain distribution;negative transfer,Correlation;Optimization;Knowledge transfer;Task analysis;Learning systems;Signal processing algorithms;Kernel
B. Li; N. Wu,"School of Information and Electronics, Beijing Institute of Technology, Beijing, China; School of Information and Electronics, Beijing Institute of Technology, Beijing, China",2020,Beijing Institute of Technology Research(grant numbers:3050012222019); National Natural Science Foundation of China(grant numbers:61971041); ,Convergence analysis;distributed inference;Gaussian belief propagation;Gaussian SPAWN,Convergence;Graphical models;Computational complexity;Mathematical model;Peer-to-peer computing;Belief propagation;Gaussian distribution
S. Yang; Y. Wang; L. Xie,"School of Computer Science, and Engineering, Northwestern Polytechnical University, Xi’an, China; Bytedance AI Lab, ByteDance, Mountain View, CA, USA; School of Computer Science, and Engineering, Northwestern Polytechnical University, Xi’an, China",2020,National Key Research and Development Program of China(grant numbers:2017YFB1002102); ,Adversarial training;found data;sequence to sequence;speech synthesis,Noise measurement;Decoding;Speech synthesis;Speech recognition;Training;Speech enhancement;Acoustics
