Authors,Author Affiliations,Publication Year,Funding Information,Author Keywords,IEEE Terms
G. Zucatelli; R. Coelho,"Laboratory of Acoustic Signal Processing (lasp.ime.eb.br), Military Institute of Engineering (IME), Rio de Janeiro, Brazil; Laboratory of Acoustic Signal Processing (lasp.ime.eb.br), Military Institute of Engineering (IME), Rio de Janeiro, Brazil",2020,National Council for Scientific and Technological Development(grant numbers:307866); Fundação de Amparo Pesquisa do Estado do Rio de Janeiro(grant numbers:203075); Coordenação de Aperfeiçoamento de Pessoal de Nível Superior(grant numbers:001); ,Reverberation;absorption;non-stationarity;intelligibility,Absorption;Reverberation;Noise measurement;Distortion measurement;Acoustic distortion;Acoustic measurements
S. S. Moghadasian; S. Gazor,"Department of Electrical Engineering, Behbahan Khatam Alanbia University of Technology, Behbahan, Iran; Department of Electrical and Computer Engineering, Queens University, Canada",2020,Natural Sciences and Engineering Research Council of Canada; ,Ambiguity;localization;sparsity;chirp,Time-frequency analysis;Market research;Signal resolution;Fourier transforms;Simulation
M. N. Akbar; M. Saquib,"Northeastern University, Boston, MA, USA; Department of Electrical Engineering, The University of Texas at Dallas, Richardson, TX, USA",2020,,Real-only equalizer (ROE);widely linear equal-izer (WLE);adaptive equalization;computational complexity,Equalizers;Correlation;Complexity theory;Receivers;Impedance matching;Quadrature amplitude modulation;Bit error rate
Y. Li; Q. He; R. S. Blum,"University of Electronic Science and Technology of China, Chengdu, China; University of Electronic Science and Technology of China, Chengdu, China; Lehigh University, Bethlehem, PA, USA",2020,"National Natural Science Foundation of China(grant numbers:61571091,61371184); Huo Yingdong Education Foundation(grant numbers:161097); National Science Foundation(grant numbers:ECCS-1744129,CNS-1702555); ",Product of correlated complex Gaussian random variables;joint probability density function;non-zero means and arbitrary variances,Random variables;Probability density function;Finite wordlength effects;Covariance matrices;Communication systems;Radar applications
L. Sun; Y. Wang,"Department of Information and Communications Engineering, Xi’an Jiaotong University, Xi’an, China; Department of Information and Communications Engineering, Xi’an Jiaotong University, Xi’an, China",2020,National Natural Science Foundation of China(grant numbers:61671369); Key Research and Development Program of Shaanxi Province(grant numbers:2018KW-019); ,Sequence detection;deep-learning;recurrent neural networks;molecular communications,Artificial neural networks;Detectors;Computer architecture;Communication systems;Recurrent neural networks;Chemicals;Signal detection
S. -W. Fu; C. -F. Liao; Y. Tsao,"Department of Computer Science and Information Engineering, National Taiwan University, Taipei, Taiwan; College of Electrical Engineering and Computer Science, National Taiwan University, Taipei, Taiwan; Research Center for Information Technology Innovation, Academia Sinica, Taipei, Taiwan",2020,,Perception optimization;PESQ;speech enhancement;speech quality assessment,Speech enhancement;Training;Spectrogram;Linear programming;Data models;Training data;Signal to noise ratio
Y. Song; Z. Ou,"Department of Electronic Engineering, Tsinghua University, Beijing, China; Department of Electronic Engineering, Tsinghua University, Beijing, China",2020,National Natural Science Foundation of China(grant numbers:61976122); ,Semi-supervised learning;seq2seq;semantic parsing;joint stochastic approximation;variational auto-encoder,Semantics;Task analysis;Decoding;Natural language processing;Training;Semisupervised learning
J. Lim; H. -S. Kim; H. -M. Park,"Department of Electrical Engineering and Computer Science, University of Michigan, Ann Arbor, MI, USA; Department of Electrical Engineering and Computer Science, University of Michigan, Ann Arbor, MI, USA; Department of Electronic Engineering, Sogang University, Seoul, South Korea",2020,"National Research Foundation of Korea; Ministry of Education(grant numbers:NRF-2016R1D1A1A09918304,NRF-2019R1I1A1A01058976); ",IMM-EKF;minimax;particle filtering;maneuvering;multiple-constant-turns (MCT) model;Markovian switching structure,Computational modeling;Atmospheric measurements;Particle measurements;Noise measurement;Weight measurement;Signal processing algorithms;Filtering
J. Xu; Q. Li; J. Wang,"College of Internet of Things Engineering, Hohai University, Changzhou, China; College of Internet of Things Engineering, Hohai University, Changzhou, China; College of Internet of Things Engineering, Hohai University, Changzhou, China",2020,National Key Research and Development Program of China Stem Cell and Translational Research(grant numbers:2018YFC0406903); National Natural Science Foundation of China(grant numbers:U1830105); ,Non-blind deblurring;multiple norms;non-negativity constraint;artifacts processing;Markov chain Monte Carlo,Uncertainty;Kernel;Approximation algorithms;Image restoration;Closed-form solutions;Signal processing algorithms;Image reconstruction
Y. El-Laham; M. F. Bugallo,"Department of Electrical & Computer Engineering, Stony Brook University, Stony Brook, NY, USA; Department of Electrical & Computer Engineering, Stony Brook University, Stony Brook, NY, USA",2020,National Science Foundation(grant numbers:CCF-1617986); Research Computing and Cyberinfrastructure; Stony Brook University; NSF(grant numbers:OAC-1531492); ,,Proposals;Monte Carlo methods;Sociology;Standards;Artificial intelligence;Optimization
H. Li; K. Yang; R. Duan,"School of Marine Science and Technology, Northwestern Polytechnical University, Xi'an, China; School of Marine Science and Technology, Northwestern Polytechnical University, Xi'an, China; School of Marine Science and Technology, Northwestern Polytechnical University, Xi'an, China",2020,National Natural Science Foundation of China(grant numbers:61901383); Natural Science Foundation of Shaanxi Province(grant numbers:2019JQ633); ,Cross-correlation function;delay-and-sum;multipath time-delay,Sonar equipment;Estimation;Signal processing algorithms;Correlation;Noise measurement;Acoustics;Delays
V. Chavali; K. E. Wage,"Department of Electrical and Computer Engineering, George Mason University, Fairfax, VA, USA; Department of Electrical and Computer Engineering, George Mason University, Fairfax, VA, USA",2020,"Office of Naval Research(grant numbers:N00014-17-1-2734,N00014-18-1-2669); ",Multiplicative processors;sparse arrays;spatial spectrum estimation;distribution of sum of products of independent complex Gaussian random variables,Program processors;Gratings;Probability density function;Random variables;Sensor arrays;Geometry
W. Mack; E. A. P. Habets,"International Audio Laboratories Erlangen (a joint institution of the Friedrich-Alexander-Universität Erlangen-Nürnberg and Fraunhofer IIS), Erlangen, Germany; International Audio Laboratories Erlangen (a joint institution of the Friedrich-Alexander-Universität Erlangen-Nürnberg and Fraunhofer IIS), Erlangen, Germany",2020,,Signal extraction;signal enhancement;time-frequency masking,Time-frequency analysis;Interference;Customer relationship management;Image reconstruction;Estimation;Training;Neural networks
Y. Huang; Z. Tang; D. Chen; K. Su; C. Chen,"Institute of Physics and Information Engineering, Fuzhou University, Fuzhou, China; Institute of Physics and Information Engineering, Fuzhou University, Fuzhou, China; Institute of Physics and Information Engineering, Fuzhou University, Fuzhou, China; Institute of Physics and Information Engineering, Fuzhou University, Fuzhou, China; Institute of Physics and Information Engineering, Fuzhou University, Fuzhou, China",2020,National Science Foundation for Young Scientists of China(grant numbers:61902071); ,Deep neural networks;IoU loss function;mini-batch;semantic segmentation,Training;Integrated circuits;Semantics;Measurement;Image segmentation;Predictive models;Data models
Z. Wang; X. Zhang; Z. Qian,"Shanghai Institute for Advanced Communication and Data Science, Key laboratory of Specialty Fiber Optics and Optical Access Networks, Joint International Research Laboratory of Specialty Fiber Optics and Advanced Communication, Shanghai University, Shanghai, China; Shanghai Institute for Advanced Communication and Data Science, Key Laboratory of Specialty Fiber Optics and Optical Access Networks, Joint International Research Laboratory of Specialty Fiber Optics and Advanced Communication, Shanghai University, Shanghai, China; School of Computer Science, Fudan University, Shanghai, China",2020,"National Natural Science Foundation of China(grant numbers:U1636206,U1736213,U1536108,61525203); Natural Science Foundation of Shanghai(grant numbers:18ZR1427500); ",Cover selection;steganography;distortion,Distortion;Distortion measurement;Feature extraction;Wiener filters;Electronics packaging;Visualization;Mathematical model
E. Brugnoli; E. Toscano; C. Vetro,"National Research Council—Institute for Complex Systems, 00185 Rome, Italy; University of Palermo, 90123 Palermo, Italy; University of Palermo, 90123 Palermo, Italy",2020,,Graph theory;signal processing algorithms;signal reconstruction;spectral analysis,Convergence;Eigenvalues and eigenfunctions;Signal processing algorithms;Laplace equations;Optimized production technology;Iterative algorithms
P. De Handschutter; N. Gillis; A. Vandaele; X. Siebert,"Department of Mathematics and Operational Research, Faculté Polytechnique, Université de Mons, Mons, Belgium; Department of Mathematics and Operational Research, Faculté Polytechnique, Université de Mons, Mons, Belgium; Department of Mathematics and Operational Research, Faculté Polytechnique, Université de Mons, Mons, Belgium; Department of Mathematics and Operational Research, Faculté Polytechnique, Université de Mons, Mons, Belgium",2020,European Research Council(grant numbers:679515); Fonds De La Recherche Scientifique - FNRS; Fonds Wetenschappelijk Onderzoek(grant numbers:O005318F-RG47); ,Archetypal analysis (AA);hyperspectral imaging;nonnegative matrix factorization (NMF);optimization,Signal processing algorithms;Optimization;Standards;Tuning;Hyperspectral imaging;Data models;Dimensionality reduction
S. Xiang; B. Tang,"Department of Electrical and Computer Engineering, Mississippi State University, Mississippi State, MS, USA; Department of Electrical and Computer Engineering, Mississippi State University, Mississippi State, MS, USA",2020,,Abrupt change detection;edge preserving;bilateral filter;event detection,Kernel;Microsoft Windows;Image edge detection;Euclidean distance;Signal processing algorithms;Probability distribution;Change detection algorithms
Y. Yang; F. Gao; C. Qian; G. Liao,"Institute for Artificial Intelligence Tsinghua University, State Key Lab of Intelligent Technologies and Systems, Beijing National Research Center for Information Science and Technology, Department of Automation, Tsinghua University, Beijing, China; Institute for Artificial Intelligence Tsinghua University, State Key Lab of Intelligent Technologies and Systems, Beijing National Research Center for Information Science and Technology, Department of Automation, Tsinghua University, Beijing, China; Department of Electrical and Computer Engineering, University of Virginia, Charlottesville, VA, USA; National Laboratory of Radar Signal Processing, Collaborative Innovation Center of Information Sensing and Understanding, Xidian University, Xi’an, China",2020,"National Natural Science Foundation of China(grant numbers:61831013,61771274,61531011); Natural Science Foundation of Beijing Municipality(grant numbers:4182030,L182042); ",Source number detection;deep neural network;model-driven;non-coherent sources;coherent sources,Eigenvalues and eigenfunctions;Covariance matrices;Signal to noise ratio;Training;Neural networks;Testing;Degradation
X. Ke; Y. Wang; L. Huang,"College of Electronics and Information Engineering, Shenzhen University, Shenzhen, China; College of Electronics and Information Engineering, Shenzhen University, Shenzhen, China; College of Electronics and Information Engineering, Shenzhen University, Shenzhen, China",2020,"National Natural Science Foundation of China(grant numbers:U1713217,61925108); ",Rigid body localization;Cramer-Rao lower bound;clock offsets;semi-definite relaxation,Clocks;Sensors;Noise measurement;Wireless sensor networks;Three-dimensional displays;Pollution measurement;Synchronization
H. Zamani; S. Razavikia; H. Otroshi-Shahreza; A. Amini,"Advanced Communication Research Institute and the Department of Electrical Engineering, Sharif University of Technology, Tehran, Iran; Advanced Communication Research Institute and the Department of Electrical Engineering, Sharif University of Technology, Tehran, Iran; Advanced Communication Research Institute and the Department of Electrical Engineering, Sharif University of Technology, Tehran, Iran; Advanced Communication Research Institute and the Department of Electrical Engineering, Sharif University of Technology, Tehran, Iran",2020,Iran National Science Foundation; ,,Training;Taylor series;Recurrent neural networks;Brain modeling;Blind source separation;Blindness
M. H. Shah; X. Dang,"College of Electronics and Information Engineering, Nanjing University of Aeronautics and Astronautics, Nanjing, China; College of Electronics and Information Engineering, Nanjing University of Aeronautics and Astronautics, Nanjing, China",2020,"Natural Science Foundation of China(grant numbers:61571224,61971221,61971220); Six Talent Peaks Project in Jiangsu, China; ",Modulation classification;Bhattacharyya distance;feature selection;deep learning;RBFN;CNN,Modulation;Feature extraction;Training;Neural networks;Probability distribution;Signal processing algorithms;Complexity theory
A. R. Sadri; M. E. Celebi; N. Rahnavard; S. E. Viswanath,"Department of Biomedical Engineering, Case Western Reserve University, Cleveland, OH, USA; School of Computer Science, University of Central Arkansas, Conway, AR, USA; School of Electrical Engineering and Computer Science, University of Central Florida, Orlando, FL, USA; Department of Biomedical Engineering, Case Western Reserve University, Cleveland, OH, USA",2020,,Wavelet network;sparse representation;non-convex regularization;system identification,Signal processing algorithms;Training;Linear regression;Wavelet transforms;Computational modeling;Mathematical model;Optimization
Y. Quan; H. Teng; T. Liu; Y. Huang,"School of Computer Science and Engineering, South China University of Technology, Guangzhou, China; School of Computer Science and Engineering, South China University of Technology, Guangzhou, China; School of Computer Science and Engineering, South China University of Technology, Guangzhou, China; School of Computer Science and Engineering, South China University of Technology, Guangzhou, China",2020,"National Natural Science Foundation of China(grant numbers:61872151,61602184,61902130,61672241,U1611461); Natural Science Foundation of Guangdong Province(grant numbers:2017A030313376,2016A030308013); Fundamental Research Funds for the Central Universities(grant numbers:x2js-D2181690,x2js-D2190650); China Postdoctoral Science Foundation(grant numbers:2019M652896); ",Texture segmentation;sparse coding;weakly-supervised learning;geometric constraints,Image segmentation;Encoding;Task analysis;Feature extraction;Deep learning;Magnetic resonance imaging
I. Santos; J. J. Murillo-Fuentes; E. Arias-de-Reyna,"Departamento de Teoría de la Señal y Comunicaciones, Universidad de Sevilla, 41092 Seville, Spain; Departamento de Teoría de la Señal y Comunicaciones, Universidad de Sevilla, 41092 Seville, Spain; Departamento de Teoría de la Señal y Comunicaciones, Universidad de Sevilla, 41092 Seville, Spain",2020,Spanish Government(grant numbers:TEC2016-78434-C3-2-R); European Union (FEDER); ,Expectation propagation (EP);MMSE;low-complexity;turbo equalization;ISI;Wiener;Kalman,Equalizers;Decoding;Gaussian approximation;Approximation algorithms;Computational complexity;Proposals;Kalman filters
H. Lim; Y. Kim; J. Goo; H. Kim,"School of Electrical Engineering, Korea Advanced Institute of Science and Technology, Daejeon, South Korea; Artificial Intelligence Laboratory, LG Electronics, Seoul, South Korea; School of Electrical Engineering, Korea Advanced Institute of Science and Technology, Daejeon, South Korea; School of Electrical Engineering, Korea Advanced Institute of Science and Technology, Daejeon, South Korea",2020,"Ministry of Trade, Industry and Energy (MOTIE, South Korea); Industrial Technology Innovation(grant numbers:10063424); ",Interlayer selective attention network (ISAN);acoustic word embedding,Acoustics;Encoding;Noise measurement;Task analysis;Robustness;Google;Training data
Y. Lee; J. Min; D. K. Han; H. Ko,"School of Electrical Engineering, Korea University, Seoul, South Korea; School of Electrical Engineering, Korea University, Seoul, South Korea; Information Science Division, US Army Research Laboratory, Adelphi, MD, USA; School of Electrical Engineering, Korea University, Seoul, South Korea",2020,Korea Environment Industry & Technology Institute; Korea Ministry of Environment(grant numbers:2017000210001); U.S. Army Research Laboratory; ,Deep neural networks;attention mechanism;voice activity detection;speech activity detection;speech detection,Noise measurement;Voice activity detection;Signal to noise ratio;Training;Acoustics;Feature extraction;Learning systems
G. Wang; A. R. Adhikary; Z. Zhou; Y. Yang,"School of Mathematics, Southwest Jiaotong University, Chengdu, China; School of Information Science and Technology, Southwest Jiaotong University, Chengdu, China; School of Mathematics, Southwest Jiaotong University, Chengdu, China; School of Mathematics, Southwest Jiaotong University, Chengdu, China",2020,"National Natural Science Foundation of China(grant numbers:61661146003,61672028,61771016); Application Fundamental Research Plan Project of Sichuan Province(grant numbers:2018JY0046); Higher Education Discipline Innovation Project(grant numbers:111-2-14); ",Complementary sets (CSs);Golay complemen-tary pair (GCP),Sequences;OFDM modulation;Boolean functions
K. J. Chung; R. Souza; R. Frayne,"Departments of Radiology and Clinical Neuroscience, Hotchkiss Brain Institute, University of Calgary, Calgary, AB, Canada; Departments of Radiology and Clinical Neuroscience, Hotchkiss Brain Institute, University of Calgary, Calgary, AB, Canada; Departments of Radiology and Clinical Neuroscience, Hotchkiss Brain Institute, University of Calgary, Calgary, AB, Canada",2020,Natural Science and Engineering Research Council; AWS Cloud Credits for Research program; NSERC CREATE I3T Award; ,Convolutional neural network (CNN);image reconstruction;JPEG decompression;teleradiography,Discrete cosine transforms;Transform coding;Image coding;Image restoration;Biological neural networks;Quantization (signal);Training
A. R. Adhikary; P. Sarkar; S. Majhi,"School of Information Science and Technology, Southwest Jiaotong University, Chengdu, China; Department of Mathematics, Indian Institute of Technology Patna, Patna, India; Department of Electrical Engineering, Indian Institute of Technology Patna, Patna, India",2020,"Visvesvaraya Young Faculty Research Fellowship, Ministry of Electronics and Information Technology, Government of India; ",Even-length binary Z-complementary pairs (EB-ZCPs);Generalized Boolean functions (GBFs);Golay complementary pair (GCP);Zero correlation zone (ZCZ);Z-complementary pair (ZCP),Boolean functions;Zero correlation zone;Fans;Interference;Indexes;Correlation
P. Tang; Y. -L. Wang; W. Liu; Q. Du; C. Wu; W. Chen,"School of Electronic Information, Wuhan University, Wuhan, China; Wuhan Electronic Information Institute, Wuhan, China; Wuhan Electronic Information Institute, Wuhan, China; Wuhan Electronic Information Institute, Wuhan, China; Wuhan Electronic Information Institute, Wuhan, China; School of Electronic Information, Wuhan University, Wuhan, China",2020,Natural Science Foundation of Hubei Province(grant numbers:2017CFB589); National Natural Science Foundation of China; Civil Aviation Administration of China(grant numbers:U1733116); ,Tunable detector;signal mismatch;distributed target;multichannel signal detection,Detectors;Radar;Covariance matrices;Computational modeling;Data models;Object detection;Light rail systems
S. Hong; J. Ryu,"T-Brain, AI Center, SK Telecom, Seoul, South Korea; Department of Computer Science, Hanyang University, Seoul, South Korea",2020,National Research Foundation of Korea; Ministry of Education(grant numbers:NRF-2017R1A6A3A11031193); ,Low-resolution face recognition;image-to-image translation;domain adaptation;attention;face augmentation,Probes;Face recognition;Face;Feature extraction;Generators;Spatial resolution
H. Ma; Z. Lin; S. T. Acton,"Charles L. Brown Department of Electrical and Computer Engineering, University of Virginia, Charlottesville, VA, USA; Charles L. Brown Department of Electrical and Computer Engineering, University of Virginia, Charlottesville, VA, USA; Charles L. Brown Department of Electrical and Computer Engineering, University of Virginia, Charlottesville, VA, USA",2020,Army Research Office(grant numbers:W911NF-15-1-0275); ,Average peak-to-correlation energy;correlation filter;principle component analysis;scale estimation;visual object tracking,Estimation;Correlation;Standards;Target tracking;Robustness;Benchmark testing;Proposals
L. Zhou; G. Feng; L. Shen; X. Zhang,"School of Communication and Information Engineering, Shanghai University, Shanghai, China; School of Communication and Information Engineering, Shanghai University, Shanghai, China; School of Communication and Information Engineering, Shanghai University, Shanghai, China; School of Communication and Information Engineering, Shanghai University, Shanghai, China",2020,"Natural Science Foundation of Shanghai, China(grant numbers:19ZR1419000); National Natural Science Foundation of China(grant numbers:U1536109,61931022,U1936214,U1636206,61525203); ",Steganography;adversarial attacks;GAN;security,Security;Generative adversarial networks;Training;Distortion;Generators;Deep learning;Neural networks
K. Slavakis; S. Banerjee,"Department of Electrical Engineering, University at Buffalo, The State University of New York, Buffalo, NY, USA; Department of Electrical Engineering, University at Buffalo, The State University of New York, Buffalo, NY, USA",2020,NSF(grant numbers:CIF 1718796); ,RLS;robust;outliers;sparsity,Task analysis;Convergence;Data models;Computational modeling;Correlation;Numerical models;Zinc
S. Gu; J. Hou; H. Zeng; H. Yuan,"City University of Hong Kong Shenzhen Research Institute, Shenzhen, China; Department of Computer Science, City University of Hong Kong, Kowloon, Hong Kong; School of Information Science and Engineering, Huaqiao University, Xiamen, China; School of Information Science and Engineering, Shandong University, Qingdao, China",2020,National Natural Science Foundation of China(grant numbers:61871342); ,3D point cloud;compression;prediction;graph structure,Three-dimensional displays;Geometry;Transforms;Encoding;Image color analysis;Color;Redundancy
H. Wang; S. Wang; T. Li; H. Yin; L. Yu,"College of Electronic Information and Communications, Huazhong University of Science and Technology, Wuhan, China; College of Electronic Information and Communications, Huazhong University of Science and Technology, Wuhan, China; College of Electronic Information and Communications, Huazhong University of Science and Technology, Wuhan, China; School of Communication Engineering Hangzhou Dianzi University, Hangzhou, China; College of Electronic Information and Communications, Huazhong University of Science and Technology, Wuhan, China",2020,"National Natural Science Foundation of China(grant numbers:61871437,61572449); Natural Science Foundation of Hubei Province of China(grant numbers:2019CFA022); National Key Research and Development Project(grant numbers:2018YFC0830106); ",JND estimation;perceptual surprise;masking,Visualization;Estimation;Entropy;Neurons;Visual perception;Neuroscience;Brain modeling
M. Cotescu; T. Drugman; G. Huybrechts; J. Lorenzo-Trueba; A. Moinet,"TTS Research, Amazon.com Inc, Cambridge, U.K.; TTS Research, Amazon.com Inc, Cambridge, U.K.; TTS Research, Amazon.com Inc, Cambridge, U.K.; TTS Research, Amazon.com Inc, Cambridge, U.K.; TTS Research, Amazon.com Inc, Cambridge, U.K.",2020,,Whispered speech conversion;voice conversion (VC);whispered text to speech (TTS),Feature extraction;Training;Computational modeling;Mel frequency cepstral coefficient;Speech synthesis
Y. Niu; B. Tondi; Y. Zhao; M. Barni,"Institute of Information Science, Beijing Jiaotong University, Beijing, China; Department of Information Engineering and Mathematical Sciences, University of Siena, Siena SI, Italy; Institute of Information Science, Beijing Jiaotong University, Beijing, China; Department of Information Engineering and Mathematical Sciences, University of Siena, Siena SI, Italy",2020,"DARPA; Air Force Research Laboratory(grant numbers:FA8750-16-2-0173); National Key Research and Development of China(grant numbers:2016YFB0800404); National Science Foundation of China(grant numbers:U1936212,61532005); China Scholarship Council; ",Digital image forensics;deep learning for forensics;double JPEG compression;quantization matrix estimation,Quantization (signal);Estimation;Image coding;Transform coding;Training;Image forensics;Testing
