Authors,Author Affiliations,Publication Year,Funding Information,Author Keywords,IEEE Terms
Z. Zheng; Y. Huang; W. -Q. Wang; H. C. So,"School of Information and Communication Engineering, University of Electronic Science and Technology of China, Chengdu, China; School of Information and Communication Engineering, University of Electronic Science and Technology of China, Chengdu, China; School of Information and Communication Engineering, University of Electronic Science and Technology of China, Chengdu, China; Department of Electrical Engineering, City University of Hong Kong, Hong Kong",2020,National Natural Science Foundation of China(grant numbers:61701081); Sichuan Science and Technology Program(grant numbers:2019YJ0191); Fundamental Research Funds for the Central Universities of China(grant numbers:2672018ZYGX2018J003); ,Direction-of-arrival (DOA) estimation;coherent signals;coprime array;interpolated ULA;Toeplitz matrix,Covariance matrices;Direction-of-arrival estimation;Signal processing algorithms;Interpolation;Sensor arrays;Estimation
S. Spagnol,"Aalborg University, Copenhagen, Denmark",2020,European Union's Horizon 2020 research and innovation programme(grant numbers:797850); ,Anthropometry;auditory model;HRTF;ITD;sound localization,Predictive models;Azimuth;Databases;Computational modeling;Acoustic measurements;Market research
X. Du; A. Aubry; A. De Maio; G. Cui,"University of Electronic Science and Technology of China, Chengdu, China; University of Naples “Federico II,”, Naples, Italy; University of Naples “Federico II,”, Naples, Italy; School of Information and Communication Engineering, University of Electronic Science and Technology of China, Chengdu, China",2020,"National Natural Science Foundation of China(grant numbers:61801415,61771109); 111 Project(grant numbers:B17008); Shandong Provincial Natural Science Foundation, China(grant numbers:ZR2016FB22); ",Radar signal processing;covariance matrix estimation;projection;Toeplitz structure,Covariance matrices;Estimation;Radar;Jamming;Interference;Optimization;Linear matrix inequalities
M. Tagliasacchi; B. Gfeller; F. d. C. Quitry; D. Roblek,"Google Research, Zurich, Switzerland; Google Research, Zurich, Switzerland; Google Research, Zurich, Switzerland; Google Research, Zurich, Switzerland",2020,,Self-supervised learning;audio processing,Task analysis;Decoding;Training;Computer architecture;Spectrogram;Predictive models;Time-frequency analysis
X. Lin; J. Zhu; D. Chen,"School of Information Science and Engineering, Huaqiao University, Xiamen, China; School of Engineering, Huaqiao University, Quanzhou, China; School of Information Science and Engineering, Huaqiao University, Xiamen, China",2020,NSFC(grant numbers:61976098); Huaqiao university; ,Cell-phone recognition;convolutional neural networks;frequency subbands;attention mechanism,Microphones;Training;Spectrogram;Audio recording;Task analysis;Fingerprint recognition;Noise measurement
R. G. Gavaskar; K. N. Chaudhury,"Dept. of Electrical Engineering, Indian Institute of Science, Bengaluru, India; Dept. of Electrical Engineering, Indian Institute of Science, Bengaluru, India",2020,SERB(grant numbers:SB/S3/EECE/281/2016); ,Plug-and-play;ISTA;kernel denoiser;nonlocal means;convergence,Convergence;Noise reduction;Kernel;Standards;Eigenvalues and eigenfunctions;Signal processing algorithms
H. Hezave; M. Javadzadeh; M. H. Kahaei,"Electrical Engineering Department, Iran University of Science and Technology, Tehran, Iran; Electrical Engineering Department, Iran University of Science and Technology, Tehran, Iran; Electrical Engineering Department, Iran University of Science and Technology, Tehran, Iran",2020,,Atomic norm;blind super-resolution;prolate spheroidal wave functions;lifting;joint spectral sparsity,Frequency modulation;Signal resolution;Deconvolution;Image resolution;Wave functions;Compressed sensing;Monte Carlo methods
M. A. Colominas; S. Meignen; D. -H. Pham,"Institute for Research and Development in Bioengineering and Bioinformatics (IBB), CONICET, Entre Ríos, Argentina; Jean Kuntzmann Laboratory, University of Grenoble-Alpes and CNRS UMR 5224, Grenoble, France; IRIT Laboratory, CNRS UMR 5505, Toulouse, France",2020,Agence Nationale de la Recherche(grant numbers:ANR-19-CE48-0001-01); Universidad Nacional de Entre Rios(grant numbers:PID 6171); Consejo Nacional de Investigaciones Cientficas y Tcnicas(grant numbers:PIO 14620140100014CO); ,Time-frequency;short-time Fourier transform;synchrosqueezing;instantaneous frequency;ridge detection,Frequency modulation;Time-frequency analysis;Bandwidth;Estimation;Frequency estimation;Fourier transforms
K. Dedecius; R. Žemlička,"Czech Academy of Sciences, Institute of Information Theory and Automation, Prague 8, Czech Republic; Faculty of Information Technology, Czech Technical University in Prague, Prague 6, Czech Republic",2020,VýLet’ of the Faculty of Information Technology of the Czech Technical University in Prague; ,Diffusion;distributed estimation;collaborative estimation;Poisson regression,Estimation;Bayes methods;Gaussian distribution;Random variables;Inference algorithms;Predictive models;Probability density function
M. Tagliasacchi; F. d. C. Quitry; D. Roblek,"Google Research, Zurich, Switzerland; Google Research, Zurich, Switzerland; Google Research, Zurich, Switzerland",2020,,Multi-task leaning;audio recognition,Task analysis;Adaptation models;Computational modeling;Computer architecture;Training;Resource management;Tuning
Y. Préaux; A. -O. Boudraa,"Ecole Navale/Arts & Metiers Institute of Technology, IRENav, Brest, France; Ecole Navale/Arts & Metiers Institute of Technology, IRENav, Brest, France",2020,,Teager-Kaiser energy operator;white Gaussian noise;signal detection;coefficient of variation;statistical moments,Noise measurement;Probability density function;Oscillators;Gaussian noise;Standards;Gaussian distribution;Signal to noise ratio
S. Park; M. Elhilali; D. K. Han; H. Ko,"Department of Electrical and Computer Engineering, Johns Hopkins University, Baltimore, MD, USA; Department of Electrical and Computer Engineering, Johns Hopkins University, Baltimore, MD, USA; U.S. Army Research Laboratory, Adelphi, MD, USA; School of Electrical Engineering, Korea University, Seoul, Republic of Korea",2020,Korea Environment Industry & Technology Institute; Public Technology Program based on Environmental Policy; Korea Ministry of Environment(grant numbers:2017000210001); U.S. Army Research Laboratory; ,Generative model;adversarial networks;Wasserstein distance;audio stream generation,Generators;Gallium nitride;Training;Linear programming;Convolution;Streaming media;Generative adversarial networks
J. Chen; J. Chen; Z. Wang; C. Liang; C. -W. Lin,"National Engineering Research Center for Multimedia Software, School of Computer, Wuhan University, Wuhan, China; National Engineering Research Center for Multimedia Software, School of Computer, Wuhan University, Wuhan, China; Digital Content and Media Sciences Research Division, National Institute of Informatics, Tokyo, Japan; National Engineering Research Center for Multimedia Software, School of Computer, Wuhan University, Wuhan, China; Department of Electrical Engineering, National Tsinghua University, Hsinchu, Taiwan",2020,"National Key R&D Program of China(grant numbers:2017YFC0803700); National Nature Science Foundation of China(grant numbers:61876135); Nature Science Foundation of Hubei Province(grant numbers:2019CFB472); Hubei Province Technological Innovation Major Project(grant numbers:2018AAA062,2018CFA024); ",Low-resolution face recognition;face super-resolution;identity-aware learning;magnitude loss,Face;Feature extraction;Image resolution;Face recognition;Measurement;Image reconstruction;Training
X. Liu; Z. Xu; W. Dong; L. Wang; X. Li,"Information Research Center of Military Science, Academy of Military Science, Beijing, China; National University of Defense Technology, Changsha, China; National University of Defense Technology, Changsha, China; National University of Defense Technology, Changsha, China; Information Research Center of Military Science, Academy of Military Science, Beijing, China",2020,National Natural Science Foundation of China(grant numbers:61471372); ,Cognitive resource allocation;conic programming;radar networks;target tracking,Resource management;Radar tracking;Radar cross-sections;Target tracking
H. Lai; W. Xu,"Department of Automatic Control, School of Automation, Guangdong University of Technology, Guangzhou, China; Department of Automatic Control, School of Automation, Guangdong University of Technology, Guangzhou, China",2020,"National Natural Science Foundation of China(grant numbers:61771148,71771059,61975248,61875041); ",Kendall's tau (KT);contaminated Gaussian model (CGM);random signal detection;receiver operating characteristic (ROC) curve,Signal detection;Correlation;Mathematical model;Robustness;Receivers;Random variables
N. Alpaslan; K. Hanbay,"Department of Computer Engineering, Bingöl University, Bingöl, Turkey; Department of Computer Engineering, Bingöl University, Bingöl, Turkey",2020,,Feature representation;local binary pattern;shape index;texture descriptors,Shape;Indexes;Feature extraction;Kernel;Lighting;Windows;Histograms
Z. Lu; B. Long; S. Yang,"System Security and New Technology, State Key Laboratory of Power Transmission Equipment, Chongqing University, Chongqing, China; General hospital, Department of Radiology, University of Chinese Academy of Sciences, Chongqing, China; Chongqing Institute of Meteorological Science, Chongqing, China",2020,"Municipal Health and Family Planning Commission(grant numbers:2016MSXM065,ZY201702043); Science and Technology Committee of YuZhong district, Chongqing, China(grant numbers:20180107); Open Research Funding of Chongqing Meteorological Service; ",Dehazing;dark channel prior;image restoration;saturation,Mathematical model;Brightness;Image color analysis;Atmospheric modeling;Iterative methods;Image restoration;Estimation
C. Soares; F. Valdeira; J. Gomes,"Instituto Superior Técnico, Institute for Systems and Robotics, Universidade de Lisboa, Lisbon, Portugal; University of Milan, Milan, Italy; Instituto Superior Técnico, Institute for Systems and Robotics, Universidade de Lisboa, Lisbon, Portugal",2020,European Unions Horizon 2020; Marie Sklodowska-Curie(grant numbers:812912); FCT with the LARSyS-FCT Plurianual(grant numbers:HARMONY PTDC/EEI-AUT/31411/2017); ,Convex relaxation;maximum likelihood estimation;network localization;range and angle network localization,Noise measurement;Maximum likelihood estimation;Optimization;Position measurement;Signal processing algorithms;Current measurement;Wireless communication
A. Dudhane; P. Hambarde; P. Patil; S. Murala,"Electrical Engineering Department, CVPR Lab, IIT Ropar, Rupnagar, India; Electrical Engineering Department, CVPR Lab, IIT Ropar, Rupnagar, India; Electrical Engineering Department, CVPR Lab, IIT Ropar, Rupnagar, India; Electrical Engineering Department, CVPR Lab, IIT Ropar, Rupnagar, India",2020,DST-SERB(grant numbers:ECR/2018/001538); ,Deep learning;image restoration;light scattering;underwater haze,Image restoration;Image color analysis;Image enhancement;Distortion;Feature extraction;Image databases;Task analysis
X. P. Li; Q. Liu; H. C. So,"Department of Electrical Engineering, City University of Hong Kong, Kowloon Tong, Hong Kong; Department of Electrical and Computer Engineering, National University of Singapore, Singapore, Singapore; Department of Electrical Engineering, City University of Hong Kong, Kowloon Tong, Hong Kong",2020,,Image inpainting;low-rank matrix completion;outlier-robustness; $\ell _p$ -minimization;matching pursuit,Matrix converters;Robustness;Minimization;Matrix decomposition;Matching pursuit algorithms;Convergence;Signal processing algorithms
Y. Huang; L. Li; H. Zhu; B. Hu,"School of Information and Control Engineering, China University of Mining and Technology, Xuzhou, China; School of Artificial Intelligence, Xidian University, Xi’an, China; School of Information and Control Engineering, China University of Mining and Technology, Xuzhou, China; School of Information and Control Engineering, China University of Mining and Technology, Xuzhou, China",2020,"National Natural Science Foundation of China(grant numbers:61771473,61991451,61379143); Natural Science Foundation of Jiangsu Province(grant numbers:BK20181354); Science and Technology Plan of Xi’an(grant numbers:0191122015KYPT011JC013); Six Talent Peaks High-level Talents in Jiangsu Province(grant numbers:XYDXX-063); ",Quality assessment;view synthesis;depth image;structural distortion,Measurement;Distortion;Databases;Shape;Feature extraction;Image edge detection;Image coding
C. Panigrahy; A. Seal; N. K. Mahato,"PDPM Indian Institute of Information Technology, Design and Manufacturing, Jabalpur, India; PDPM Indian Institute of Information Technology, Design and Manufacturing, Jabalpur, India; PDPM Indian Institute of Information Technology, Design and Manufacturing, Jabalpur, India",2020,"Computer Science and Engineering Department; PDPM Indian Institute of Information Technology, Design and Manufacturing, Jabalpur, India(grant numbers:SPARC-MHRD-231); ",Fractal dimension;medical image fusion;non-subsampled shearlet transform;weighted parameter adaptive dual channel pulse coupled neural network,Neurons;Single photon emission computed tomography;Magnetic resonance imaging;Image fusion;Transforms;Medical diagnostic imaging
Y. Xu; Q. Wang,"School of Information Science and Engineering, Southeast University, Nanjing, China; School of Information Science and Engineering, Southeast University, Nanjing, China",2020,"National Natural Science Foundation of China(grant numbers:61901105,51578128); Natural Science Foundation of Jiangsu Province(grant numbers:BK20190343); National Science and Technology Major Project of China(grant numbers:2016ZX03001022-002); Youth Fund of MOE (Ministry of Education in China) Project of Humanities and Social Sciences(grant numbers:20YJC630245); Fundamental Research Funds for the Central Universities(grant numbers:30919013229); ",Asymptotic optimality;change point detection;CUSUM;industrial quality control;quickest detection;sequential test;Shiryaev-Roberts;universal hypothesis test;universal source coding,Testing;Delays;Process control;Source coding;Control charts;Indexes;Quality control
Y. Huang; G. Jia; B. Chen; Y. Zhang,"College of Automation, Harbin Engineering University, Harbin, China; College of Automation, Harbin Engineering University, Harbin, China; Institute of Artificial Intelligence and Robotics, Xi’an Jiaotong University, Xi’an; College of Automation, Harbin Engineering University, Harbin, China",2020,"National Natural Science Foundation of China(grant numbers:61903097,61773133,61801482); ",Kalman filter;variational Bayesian;heavy-tailed measurement noise;unknown and time-varying measurement bias;linear system,Noise measurement;Covariance matrices;Pollution measurement;Random variables;Probability density function;Kalman filters;Estimation
H. Zheng; D. Yang; X. Xie; Z. Zhang,"State Key Laboratory of Mechanical Systems and Vibration, Shanghai Jiao Tong University, Shanghai, China; State Key Laboratory of Mechanical Systems and Vibration, Shanghai Jiao Tong University, Shanghai, China; State Key Laboratory of Mechanical Systems and Vibration, Shanghai Jiao Tong University, Shanghai, China; State Key Laboratory of Mechanical Systems and Vibration, Shanghai Jiao Tong University, Shanghai, China",2020,National Natural Science Foundation of China(grant numbers:11672180); ,Active vibration control;FxLMS algorithm;auxiliary filter;new online secondary path estimation method,Finite impulse response filters;Signal processing algorithms;Filtering algorithms;Convergence;Estimation;Adaptation models
C. Yu; X. Zhu; Z. Lei; S. Z. Li,"Institute of Automation, Chinese Academy of Science and the School of Artificial Intelligence, CBSR & NLPR, University of Chinese Academy of Sciences (UCAS), Beijing, China; Institute of Automation, Chinese Academy of Science and the School of Artificial Intelligence, CBSR & NLPR, University of Chinese Academy of Sciences (UCAS), Beijing, China; Institute of Automation, Chinese Academy of Science and the School of Artificial Intelligence, CBSR & NLPR, University of Chinese Academy of Sciences (UCAS), Beijing, China; Institute of Automation, Chinese Academy of Science and the School of Artificial Intelligence, CBSR & NLPR, University of Chinese Academy of Sciences (UCAS), Beijing, China",2020,"National Natural Science Foundation of China(grant numbers:61806196,61876178); ",Face recognition;low-quality;non-face;out-of-distribution detection,Uncertainty;Face recognition;Face;Training;Feature extraction;Testing;Detectors
C. G. de Figueredo; C. J. Bordin; M. G. S. Bruno,"Instituto Tecnológico de Aeronáutica, São José dos Campos SP, Brazil; Universidade Federal do ABC, Santo André SP, Brazil; Instituto Tecnológico de Aeronáutica, São José dos Campos SP, Brazil",2020,São Paulo Research Foundation (FAPESP)(grant numbers:2018/26191-0); ,Statistics on manifolds;parameter estimation;diffusion method;particle filters,Manifolds;Signal processing algorithms;Particle filters;Approximation algorithms;Random variables;Bayes methods;Kalman filters
X. Liu; D. Zachariah; P. Stoica,"Department of Information Technology, Uppsala University, Uppsala, Sweden; Department of Information Technology, Uppsala University, Uppsala, Sweden; Department of Information Technology, Uppsala University, Uppsala, Sweden",2020,"Swedish Research Council(grant numbers:2017-04543,2017-04610,2018-05040); ",Predictive models;robustness;statistical learning,Robustness;Training data;Training;Data models;Predictive models;Task analysis;Signal processing
P. Jiang; G. Liu; Q. Wang; J. Wu,"School of Computer Science and Technology, Xidian University, Xi’an, China; School of Computer Science and Technology, Xidian University, Xi’an, China; School of Computer Science and Technology, Xidian University, Xi’an, China; School of Information Engineering, Yulin University, Yulin, China",2020,"National Natural Science Foundation of China(grant numbers:61702395,61972302,61711530248); Key Program of Shaanxi Technology Committee of China(grant numbers:2019NY-182,2020NY-167); High-Level Culture Program of Yulin College(grant numbers:207010074); ",Deep learning;convolutional neural networks;softmax loss;multiclass imbalance;facial expression recognition,Training;Reliability;Face recognition;Databases;Testing;Training data;Deep learning
F. Hua; R. Nassif; C. Richard; H. Wang; A. H. Sayed,"School of Marine Science and Technology, Northwestern Polytechnical University, Xi’an, China; American University of Beirut, Beirut, Lebanon; Université Côte d’Azur, OCA, CNRS, 06108 Nice, France; School of Marine Science and Technology, Northwestern Polytechnical University, Xi’an, China; School of Engineering, Ecole Polytechnique Fédérale de Lausanne, 1015 Lausanne, Switzerland",2020,"NSFC(grant numbers:61901385,61671386,61771396); National Key R&D Program of China(grant numbers:2016YFC1400200); ANR(grant numbers:ANR-19-CE48-0002); Swiss National Science Foundation(grant numbers:205121-184999); ",Communication delays;distributed estimation;diffusion LMS;performance analysis;stability,Delays;Performance analysis;Estimation;Stability criteria;Data models;Adaptive systems
P. Kulkarni; P. P. Vaidyanathan,"Department of Electrical Engineering, California Institute of Technology, Pasadena, CA, USA; Department of Electrical Engineering, California Institute of Technology, Pasadena, CA, USA",2020,ONR(grant numbers:N00014-18-1-2390); NSF(grant numbers:CCF-1712633); California Institute of Technology; ,Ramanujan sums;Ramanujan filter banks;period estimation;cyclotomic polynomials,Periodic structures;Signal processing;Dictionaries;Indexes;Estimation;Transforms;Brain-computer interfaces
Y. Su; D. Hong; Y. Li; P. Jing,"School of Electronic and Information Engineering, Tianjin University, Tianjin, China; Tianjin University, Tianjin, China; School of Electical and Information Engineering, Tianjin University, Tianjin, China; Tianjin University, Tianjin, China",2020,National Natural Science Foundation of China(grant numbers:61802277); China Postdoctoral Science Foundation(grant numbers:2019M651038); ,Micro-video;multi-label classification;deep matrix factorization;low-rank,Matrix decomposition;Feature extraction;Collaboration;Covariance matrices;Task analysis;Correlation;Semantics
S. Fernández-Menduiña; F. Pérez-González,"Department of Signal Theory and Communications, University of Vigo, Vigo, Spain; Department of Signal Theory and Communications, University of Vigo, Vigo, Spain",2020,GPSC; Agencia Estatal de Investigación; European Regional Development Fund; Xunta de Galicia; ERDF; Agrupación Estratéxica Consolidada de Galicia accreditation 2016–2019; Grupo de Referencia ED431C2017/53; ,ENF;PLL;frame rate;non-static videos,Videos;Estimation;Frequency estimation;Phase locked loops;Frequency modulation;Demodulation;Time-frequency analysis
M. Jiménez-Guarneros; P. Gómez-Gil,"Computer Science Department, National Institute of Astrophysics, Optics and Electronics, Santa María Tonantzintla, Mexico; Computer Science Department, National Institute of Astrophysics, Optics and Electronics, Santa María Tonantzintla, Mexico",2020,National Council of Science and Technology in Mexico(grant numbers:#554740); Magdiel Jiménez-Guarneros; ,Unsupervised domain adaptation;EEG-based classification;cognitive load;deep learning,Training;Electroencephalography;Neural networks;Deep learning;Task analysis;Testing;Computer vision
P. Zahradnik,"Department of Telecommunications Technology, Faculty of Electrical Engineering, Czech Technical University in Prague, Praha, Czechia",2020,,Digital filters;equiripple approximation;finite impulse response filters;low-pass filters;optimal filters,Finite impulse response filters;Erbium;Frequency response;Robustness;Differential equations;Attenuation;Chebyshev approximation
Y. Zhang; Y. Li; Y. Kong; B. Liu,"School of Information Science and Engineering, Yanshan University, Qinhuangdao, China; School of Electrical Engineering, Yanshan University, Qinhuangdao, China; School of Electrical Engineering, Yanshan University, Qinhuangdao, China; School of Information Science and Engineering, Yanshan University, Qinhuangdao, China",2020,National Science Foundation of Hebei Province China(grant numbers:F2019203320); ,Attention mechanism;deep learning;encoder-decoder structure;stereo matching,Three-dimensional displays;Encoding;Training;Semantics;Decoding;Feature extraction;Convolution
M. Sugawara; K. Uruma; S. Hangai; T. Hamamoto,"Graduate School of Engineering, Tokyo University of Science, Tokyo, Japan; Department of Computer Science, Kogakuin University, Tokyo, Japan; Graduate School of Engineering, Tokyo University of Science, Tokyo, Japan; Graduate School of Engineering, Tokyo University of Science, Tokyo, Japan",2020,JSPS KAKENHI(grant numbers:19K20300); ,Colorization;graph signal processing;image reconstruction,Image color analysis;Color;Signal processing algorithms;Gray-scale;Numerical models;Laplace equations;Image reconstruction
G. Hua,"School Electronic Information, Wuhan University, Wuhan, China",2020,National Natural Science Foundation of China(grant numbers:61802284); Hubei Provincial Natural Science Foundation of China(grant numbers:2018CFB225); ,Watermarking security;spread spectrum security;over-complete dictionary;compressive sensing security,Decoding;Watermarking;Transforms;Force;Matching pursuit algorithms;Dictionaries
R. Huang; Y. Xing; Y. Zou,"College of Computer Science and Technology, Civil Aviation University of China, Tianjin, China; College of Computer Science and Technology, Civil Aviation University of China, Tianjin, China; Hubei Key Laboratory of Intelligent Vision Based Monitoring for Hydroelectric Engineering, Three Gorges University, Yichang, China",2020,"Scientific Research Project of Tianjin Education Commission; Open Funds Hubei Key Laboratory of Intelligent Vision Based Monitoring for Hydroelectric Engineering(grant numbers:2018SDSJ02); Fundamental Research Funds for the Central Universities of Civil Aviation University of China(grant numbers:3122018C020,3122018C021); ",RGB-D saliency detection;saliency fusion;triple-complementary network,Saliency detection;Detectors;Training;Object detection;Feature extraction;Customer relationship management;Deep learning
C. -J. Wang; C. -K. Wen; S. -H. L. Tsai; S. Jin,"Institute of Electrical and Control Engineering, National Chiao Tung University, Hsinchu, Taiwan; Institute of Communications Engineering, National Sun Yat-sen University, Kaohsiung, Taiwan; Department of Electrical Engineering, National Chiao Tung University, Hsinchu, Taiwan; National Mobile Communications Research Laboratory, Southeast University, Nanjing, China",2020,"Ministry of Science and Technology, Taiwan(grant numbers:MOST 108-2218-E009-027); Ministry of Science and Technology, Taiwan(grant numbers:MOST 108-2218-E-110-014-,MOST 108-2628-E-110-001-MY3); National Science Foundation of China(grant numbers:61941104); ",Phase retrieval;deep neural network;unfolding;decentralized algorithm,Damping;Signal processing algorithms;Convergence;Training;Transforms;Chaotic communication;Robustness
