Authors,Author Affiliations,Publication Year,Funding Information,Author Keywords,IEEE Terms
S. Zheng; B. Lv; T. Zhang; R. Wang; P. C. Ching,"Department of Electrical and Electronic Engineering, Southern University of Science and Technology, Shenzhen, China; Department of Electrical and Electronic Engineering, Southern University of Science and Technology, Shenzhen, China; Department of Electronic Engineering, College of Information Science and Technology, Jinan University, Guangzhou, China; Department of Electrical and Electronic Engineering, Southern University of Science and Technology, Shenzhen, China; Department of Electronic Engineering, The Chinese University of Hong Kong, Hong Kong",2023,National Natural Science Foundation of China(grant numbers:62171213); Fundamental Research Funds for the Central Universities(grant numbers:11623336); ,Integrated sensing and communications;V2I;passive sensing;beamforming,Sensors;Downlink;Receivers;Array signal processing;Surveillance;Interference;Signal to noise ratio
Y. Xin; B. Wang; L. Shang,"School of Electronic and Computer Engineering, Peking University, Shenzhen, China; Noah's Ark Lab, Huawei, Shenzhen, China; Noah's Ark Lab, Huawei, Shenzhen, China",2023,,Audio-text retrieval;cooperative game modeling;weighted token-level alignment,Games;Semantics;Indexes;Training;Task analysis;Game theory;Correlation
X. P. Li; Y. Yan; E. E. Kuruoglu; H. C. So; Y. Chen,"State Key Laboratory of Radio Frequency Heterogeneous Integration, Shenzhen University, Shenzhen, China; Tsinghua-Berkeley Shenzhen Institute, Shenzhen International Graduate School, Tsinghua University, Shenzhen, China; Tsinghua-Berkeley Shenzhen Institute, Shenzhen International Graduate School, Tsinghua University, Shenzhen, China; Department of Electrical Engineering, City University of Hong Kong, Hong Kong, SAR, China; School of Computer and Communication Engineering, University of Science and Technology Beijing, Beijing, China",2023,National Science Fund for Distinguished Young Scholars(grant numbers:61925108); Key Project of International Cooperation and Exchanges of the National Natural Science Foundation of China(grant numbers:62220106009); Shenzhen Peacock Plan Teams(grant numbers:KQTD20210811090051046); ,Graph signal processing;impulsive noise;  $\ell _{0}$  -norm;robust recovery,Signal processing algorithms;Convergence;Steady-state;Data models;Computational complexity;Symmetric matrices;Optimization
S. Wandale; K. Ichige,"Department of Electrical and Computer Engineering, Yokohama National University, Yokohama, Kanagawa, Japan; Department of Electrical and Computer Engineering, Yokohama National University, Yokohama, Kanagawa, Japan",2023,JSPS KAKENHI(grant numbers:23K03865); ,Sparse linear arrays;degrees-of-freedom;mutual coupling;direction-of-arrival estimation,Sensor arrays;Sensors;Array signal processing;Mutual coupling;Direction-of-arrival estimation;Couplings;Sparse matrices
H. Chen; L. Kong; W. Qu; X. Xiu,"Academy of Mathematics and Systems Science, Chinese Academy of Sciences, Beijing, China; School of Mathematics and Statistics, Beijing Jiaotong University, Beijing, China; School of Mathematics and Statistics, Beijing Jiaotong University, Beijing, China; School of Mechatronic Engineering and Automation, Shanghai University, Shanghai, China",2023,"China Postdoctoral Science Foundation(grant numbers:2022M723327); National Natural Science Foundation of China(grant numbers:12071022,12371306,12001019); ",Alternating minimization algorithm;fusion penalty;regularized clustering;spurious connections,Clustering algorithms;Signal processing algorithms;Optimization;Linear programming;Minimization;Convergence;Monitoring
Q. Liu; X. Zhang; X. Liang; Y. Qian; S. Yao,"School of Computer and Information Technology (School of Big Data), Shanxi University, Taiyuan, China; School of Computer and Information Technology (School of Big Data), Shanxi University, Taiyuan, China; School of Computer and Information Technology (School of Big Data), Shanxi University, Taiyuan, China; School of Computer and Information Technology (School of Big Data), Shanxi University, Taiyuan, China; School of Computer and Information Technology (School of Big Data), Shanxi University, Taiyuan, China",2023,"National Natural Science Foundation of China(grant numbers:61906115,62072291,62306171); ",Loss function;representation learning;speaker verification,Training;Noise measurement;Data models;Computational modeling;Adaptation models;Speech enhancement;Quality assessment
B. Yang; X. Zhang; S. Li; R. Higashita; J. Liu,"Department of Computer Science and Engineering, Southern University of Science and Technology, Shenzhen, China; Department of Computer Science and Engineering, Southern University of Science and Technology, Shenzhen, China; Department of Computer Science and Engineering, Southern University of Science and Technology, Shenzhen, China; Department of Computer Science and Engineering, Southern University of Science and Technology, Shenzhen, China; Department of Computer Science and Engineering, Southern University of Science and Technology, Shenzhen, China",2023,National Natural Science Foundation of China(grant numbers:82272086); Guangdong Provincial Key Laboratory(grant numbers:2020B121201001); Shenzhen Natural Science(grant numbers:JCYJ20200109140820699); Stable Support Plan Program(grant numbers:20200925174052004); ,Ciliary muscle segmentation;AS-OCT;multi-task learning,Muscles;Image segmentation;Task analysis;Location awareness;Heating systems;Decoding;Estimation
G. Cheng; B. Yang; W. Xu; G. Cai; Z. Dai,"School of Physics and Electronic Science, Guizhou Normal University, Guiyang, China; School of Physics and Electronic Science, Guizhou Normal University, Guiyang, China; Department of Information and Communication, Xiamen University, Xiamen, China; Guangdong University of Technology, Guangzhou, China; School of Management Science and Engineering, Guizhou University of Finance and Economics, Guiyang, China",2023,"Guizhou Provincial Science and Technology Foundation(grant numbers:ZK [2021]302); National Natural Science Foundation of China(grant numbers:62361012,62071129); Intelligent Evaluation and Early Warning Innovation Team for the Quality of Electric Power Equipment Manufacturing in Higher Education Institutions in Guizhou Province(grant numbers:QJJ[2023]064); ",Index modulation;physical-layer security;OFDM;artificial noise;differential,OFDM;Indexes;Security;Receivers;Law;Frequency-domain analysis;Symbols
P. Zheng; Y. Zhou; W. Wang; T. Wang,"Guangdong Provincial Key Laboratory of Advanced Intellisense Technology, School of Electronics and Communication Engineering, Sun Yat-Sen University, Shenzhen, Guangdong, China; Guangdong Provincial Key Laboratory of Advanced Intellisense Technology, School of Electronics and Communication Engineering, Sun Yat-Sen University, Shenzhen, Guangdong, China; Guangdong Provincial Key Laboratory of Advanced Intellisense Technology, School of Electronics and Communication Engineering, Sun Yat-Sen University, Shenzhen, Guangdong, China; Guangdong Provincial Key Laboratory of Advanced Intellisense Technology, School of Electronics and Communication Engineering, Sun Yat-Sen University, Shenzhen, Guangdong, China",2023,"Shenzhen Science and Technology Innovation Program(grant numbers:KQTD20190929172704911); Science and Technology Planning Project of Guangdong Province(grant numbers:2019B121203006,2019ZT08X751); ",Automatic target recognition (ATR);multi-scale perception;noise component;sparse representation;synthetic aperture radar (SAR),Radar polarimetry;Target recognition;Sparse matrices;Radar imaging;Training;Speckle;Depression
Z. Yu; H. Fan; Q. Wang; Z. Li; Y. Tang,"State Key Laboratory of Robotics, Shenyang Institute of Automation, Chinese Academy of Sciences, Shenyang, China; State Key Laboratory of Robotics, Shenyang Institute of Automation, Chinese Academy of Sciences, Shenyang, China; Key Laboratory of Manufacturing Industrial Integrated, Shenyang University, Shenyang, China; School of Information Engineering, Shenyang University of Chemical Technology, Shenyang, China; State Key Laboratory of Robotics, Shenyang Institute of Automation, Chinese Academy of Sciences, Shenyang, China",2023,"National Natural Science Foundation of China(grant numbers:62273339,62073205,U20A20200); Youth Innovation Promotion Association of the Chinese Academy of Sciences(grant numbers:2019203); ",Deep visual tracking;neural networks;visible-infrared fusion;vision transformer,Target tracking;Feature extraction;Reliability;Mobile computing;Ad hoc networks;Head;Visualization
T. Suzuki; S. Yukikata; K. Yang; T. Yoshida,"Institute of Engineering, Information and Systems, University of Tsukuba, Ibaraki, Japan; Sky Company, Ltd., Tokyo, Japan; Da-Jiang Innovations Science and Technology Japan Co., Ltd., Tokyo, Japan; Department of Computer and Network Engineering, Graduate School of Informatics and Engineering, The University of Electro-Communications, Tokyo, Japan",2023,Japan Society for the Promotion of Science; Grant-in-Aid for Scientific Research(grant numbers:22K04084); ,Dual-layer lossless coding;high dynamic range image;low computational cost;mantissa estimator;Radiance format;simple linear regression,Encoding;Image coding;Decoding;Linear regression;Standards;Transform coding;High dynamic range
C. Bonenberger; M. Schneider; F. Schwenker; W. Ertel,"Institute of Neural Information Processing, Ulm University, Ulm, Germany; Institute of Neural Information Processing, Ulm University, Ulm, Germany; Institute of Neural Information Processing, Ulm University, Ulm, Germany; Institute of Neural Information Processing, Ulm University, Ulm, Germany",2023,,Moving average models;power spectral density estimation;autocorrelation;finite impulse response filter,Autoregressive processes;Mathematical models;Optimization;Discrete Fourier transforms;Computational modeling;Time series analysis;Maximum likelihood estimation
Y. Liu; C. Chen; Y. Wang; C. Liu,"School of Marine Science and Technology, Northwestern Polytechnical University, Xi'an, China; School of Marine Science and Technology, Northwestern Polytechnical University, Xi'an, China; School of Marine Science and Technology, Northwestern Polytechnical University, Xi'an, China; School of Electronics and Information, Northwestern Polytechnical University, Xi'an, China",2023,"National Natural Science Foundation of China(grant numbers:52101389); Natural Science Foundation of Shandong Province, China(grant numbers:ZR201910220437); Fundamental Research Funds for the Central Universities; Open Fund of State Key Laboratory of Acoustics(grant numbers:SKLA202103); ",Constrained quadratic optimization (QCQP);modified polar representation (MPR);source localization;time difference of arrival (TDOA),Estimation;Location awareness;Direction-of-arrival estimation;Optimization;Time difference of arrival;Symbols;Measurement errors
Z. Yang; S. Zheng; L. Zhang; Z. Zhao; X. Yang,"Telecommunication School, Hangzhou Dianzi University, Hangzhou, China; Innovation Studio of Academician Yang, National Key Laboratory of Electromagnetic Space Security, Jiaxing, China; Innovation Studio of Academician Yang, National Key Laboratory of Electromagnetic Space Security, Jiaxing, China; Telecommunication School, Hangzhou Dianzi University, Hangzhou, China; Innovation Studio of Academician Yang, National Key Laboratory of Electromagnetic Space Security, Jiaxing, China",2023,"National Natural Science Foundation of China(grant numbers:U19B2016,U20B2038); ",Adversarial attacks;direction of arrival estimation;deep learning,Direction-of-arrival estimation;Perturbation methods;Estimation;Covariance matrices;Deep learning;Convolution;Robustness
Y. Hou; S. Song; C. Yu; W. Wang; D. Botteldooren,"WAVES Research Group, Ghent University, Ghent, Belgium; School of Computing and Mathematical Science, University of Leicester, Leicester, U.K.; UCL Interaction Centre, University College London, London, U.K.; Centre for Vision, Speech, and Signal Processing, University of Surrey, Guildford, U.K.; WAVES Research Group, Ghent University, Ghent, Belgium",2023,"WAVES Research Group, Flemish Government; Onderzoeksprogramma Artificiële Intelligentie (AI) Vlaanderen; ",Acoustic scene classification;event-relational graph;multi-dimensional edge;graph representation learning,Acoustics;Semantics;Training;Scene classification;Representation learning;Logic gates;Feature extraction
C. H. Nga; D. -Q. Vu; H. H. Luong; C. -L. Huang; J. -C. Wang,"Department of Computer Science and Information Engineering, National Central University, Taoyuan, Taiwan; Department of Computer Science and Information Engineering, National Central University, Taoyuan, Taiwan; Department of Information Technology, FPT University, Can Tho, Vietnam; Department of Computer Science and Information Engineering, National Cheng Kung University, Tainan, Taiwan; Department of Computer Science and Information Engineering, National Central University, Taoyuan, Taiwan",2023,,Speech recognition;code-switching speech recognition;transfer learning;cyclic transfer learning,Task analysis;Speech recognition;Training;Transfer learning;Speech coding;Decoding;Transformers
O. L. Meur; C. -H. Demarty,"InterDigital, Rennes, France; InterDigital, Rennes, France",2023,U.S. Department of Commerce(grant numbers:BS123456); ,Energy consumption;invertible network,Neural networks;Streaming media;Energy consumption;Couplings;Wavelet transforms;Quality of experience;Organic light emitting diodes
E. Grassucci; L. Sigillo; A. Uncini; D. Comminiello,"Department of Information Engineering, Electronics and Telecommunications (DIET), Sapienza University of Rome, Rome, Italy; Department of Information Engineering, Electronics and Telecommunications (DIET), Sapienza University of Rome, Rome, Italy; Department of Information Engineering, Electronics and Telecommunications (DIET), Sapienza University of Rome, Rome, Italy; Department of Information Engineering, Electronics and Telecommunications (DIET), Sapienza University of Rome, Rome, Italy",2023,Sapienza Università di Roma(grant numbers:RM120172AC5A564); PNRR MUR(grant numbers:PE0000013-FAIR); Regione Lazio(grant numbers:21027NP000000136); PNRR MUR(grant numbers:PNC1221852F49EDDD); ,Generalizable deep learning;medical image analysis;mutual information;quaternion wavelet transform,Biomedical imaging;Quaternions;Wavelet transforms;Feature extraction;Task analysis;Discrete wavelet transforms;Mutual information
I. Achituve; W. Wang; E. Fetaya; A. Leshem,"Faculty of Engineering, Bar-Ilan University, Ramat Gan, Israel; Faculty of Mechanical and Electrical Engineering, Kunming University of Science and Technology, Kunming, China; Faculty of Engineering, Bar-Ilan University, Ramat Gan, Israel; Faculty of Engineering, Bar-Ilan University, Ramat Gan, Israel",2023,ISF(grant numbers:2197/22); ,Learning over wireless channels;max-pooling;opportunistic carrier sensing;vertically distributed learning,Wireless sensor networks;Wireless communication;Distance learning;Computer aided instruction;Distributed databases;Sensors;Training
K. Hu; W. Xiong; J. He; C. -S. Leung; H. C. So,"Department of Electrical Engineering, City University of Hong Kong, Hong Kong SAR, China; Department of Computer Science, University of Freiburg, Freiburg, Germany; Department of Electrical Engineering, City University of Hong Kong, Hong Kong SAR, China; Department of Electrical Engineering, City University of Hong Kong, Hong Kong SAR, China; Department of Electrical Engineering, City University of Hong Kong, Hong Kong SAR, China",2023,,Maximum correntropy criterion (MCC);non-line-of-sight (NLOS);outlier;passive multistatic localization (PML);variable center (VC),Location awareness;Transmitters;Kernel;Signal processing algorithms;Estimation;Bandwidth;Position measurement
C. Chen; J. Zhang; Y. Han; J. Lu; S. Jin,"Jiangsu Key Laboratory of Wireless Communications, Nanjing University of Posts and Telecommunications, Nanjing, China; Jiangsu Key Laboratory of Wireless Communications, Nanjing University of Posts and Telecommunications, Nanjing, China; National Mobile Communications Research Laboratory, Southeast University, Nanjing, China; Jiangsu Key Laboratory of Wireless Communications, Nanjing University of Posts and Telecommunications, Nanjing, China; National Mobile Communications Research Laboratory, Southeast University, Nanjing, China",2023,"National Key Research and Development Program of China(grant numbers:2020YFB1804900); National Natural Science Foundation of China(grant numbers:62261160576,62071247,62301148,62341107,61921004); ",OTFS;channel estimation;angle-delay-Doppler;coprime array;asymmetrical massive MIMO,Channel estimation;Uplink;Downlink;Delays;Signal processing algorithms;Radio frequency;Time-frequency analysis
W. Li; R. He; B. Liang; F. Yang; S. Han,"School of Aeronautics and Astronautics, College of Computer Science, Sichuan University and Robotic Satellite Key Laboratory of Sichuan Province, Chengdu, China; School of Aeronautics and Astronautics, College of Computer Science, Sichuan University and Robotic Satellite Key Laboratory of Sichuan Province, Chengdu, China; School of Aeronautics and Astronautics, College of Computer Science, Sichuan University and Robotic Satellite Key Laboratory of Sichuan Province, Chengdu, China; School of Aeronautics and Astronautics, College of Computer Science, Sichuan University and Robotic Satellite Key Laboratory of Sichuan Province, Chengdu, China; School of Aeronautics and Astronautics, College of Computer Science, Sichuan University and Robotic Satellite Key Laboratory of Sichuan Province, Chengdu, China",2023,"Key R&D Project of Sichuan Province, China(grant numbers:2022YFG0153); State Key Laboratory of Explosion Science and Technology; Beijing Institute of Technology(grant numbers:KFJJ23-06M); ",Context density;different sampling frequency;dynamic time warping;time series similarity,Time series analysis;Time measurement;Costs;Density measurement;Weight measurement;Signal processing algorithms;Q measurement
X. Yuan; S. Gu; Z. Liu; L. Zhao,"School of Software Technology, Dalian University of Technology, Dalian, China; School of Software Technology, Dalian University of Technology, Dalian, China; School of Software Technology, Dalian University of Technology, Dalian, China; School of Software Technology, Dalian University of Technology, Dalian, China",2023,High-level Talent Program(grant numbers:2022RG11); Science and Technology Project of Liaoning Province(grant numbers:2021JH2/10300064); Youth Science and Technology Star Support Program of Dalian City(grant numbers:2021RQ057); Fundamental Research Funds for the Central Universities(grant numbers:DUT22YG241); ,Deep multi-view clustering;interpretability space;clustering space mining,Integrated circuits;Semantics;Dimensionality reduction;Clustering methods;Tensors;Speech recognition;Signal processing
Y. Xiong; F. Liu,"School of Information and Communication Engineering, Beijing University of Posts and Telecommunications, Beijing, China; School of System Design and Intelligent Manufacturing, Southern University of Science and Technology, Shenzhen, China",2023,Fundamental Research Funds for the Central Universities of China; Guangdong Province “Pearl River” Young Talent Support Program(grant numbers:2021QN02X128); ,Signal-to-noise ratio (SNR)-adaptive ranging;waveform design;Ziv-Zakai bound (ZZB);localization;wireless sensing,Signal to noise ratio;Distance measurement;Bandwidth;Signal processing algorithms;Optimization;Location awareness;Baseband
F. Zhan; X. Zhou; S. Li; D. Jia; H. Song,"Key Laboratory of Networked Control System, Shenyang, China; Key Laboratory of Networked Control System, Shenyang, China; Key Laboratory of Networked Control System, Shenyang, China; Key Laboratory of Networked Control System, Shenyang, China; Key Laboratory of Networked Control System, Shenyang, China",2023,Basic Research Program Project of Shenyang Institute of Automation; Chinese Academy of Sciences(grant numbers:2022000346); ,Neural ODEs;spatio-temporal GNN;time-series signal;dynamic system,Convolution;Directed graphs;Predictive models;Mathematical models;Forecasting;Time series analysis;Recurrent neural networks
J. Zhu; S. Zhu; J. Xu; L. Lan,"National Key Laboratory of Radar Signal Processing, Xidian University, Xi'an, China; National Key Laboratory of Radar Signal Processing, Xidian University, Xi'an, China; National Key Laboratory of Radar Signal Processing, Xidian University, Xi'an, China; National Key Laboratory of Radar Signal Processing, Xidian University, Xi'an, China",2023,"National Natural Science Foundation of China(grant numbers:61931016,62071344,62101402); Science and Technology Innovation Team of Shaanxi Province(grant numbers:2022TD-38); Natural Science Basic Research Program of Shaanxi(grant numbers:2023-JC-JQ-55); Innovation Capability Support Program of Shaanxi(grant numbers:2022KJXX-38); Aeronautical Science Foundation of China(grant numbers:20200001081012); SAST Innovation fund(grant numbers:SAST2022-041); ",Adaptive target detection;FDA-MIMO radar;mutual coupling;GLRT,Detectors;Radar;Receivers;Radar detection;Transmitters;Antenna arrays;Iterative methods
Y. Chen; G. Wang; R. Chen,"School of Xizang Minzu University, Xianyang, Shaanxi, China; School of Xizang Minzu University, Xianyang, Shaanxi, China; School of Xizang Minzu University, Xianyang, Shaanxi, China",2023,Research Team Project for Xizang-related Network Information Content and Data Security(grant numbers:324042000709); Key Laboratory of Optical Information Processing and Visualized Technology of Tibet Autonomous Region(grant numbers:KLFPXZMU2302); Xizang Cyberspace Governance Research Center; ,Single image super-resolution;transformer;cosine self-attention;multi-scale,Transformers;Feature extraction;Computational modeling;Task analysis;Convolution;Kernel;Superresolution
C. D. Athalye; K. N. Chaudhury; B. Kumar,"Department of Electrical Engineering, Indian Institute of Science, Bengaluru, India; Department of Electrical Engineering, Indian Institute of Science, Bengaluru, India; Department of Electrical Engineering, Indian Institute of Science, Bengaluru, India",2023,"Department of Science and Technology, Ministry of Science and Technology, India(grant numbers:IFA17-ENG227); Science and Engineering Research Board, Government of India Research(grant numbers:CRG/2020/000527,STR/2021/000011); ",ADMM;contraction mapping;convergence;ISTA;kernel denoisers;plug-and-play;symmetric denoisers,Convergence;Kernel;Symmetric matrices;Superresolution;Eigenvalues and eigenfunctions;Signal processing algorithms;Image reconstruction
L. Bai; R. Chang; G. Chen; Y. Zhou,"School of Electrical Engineering, North China University of Water Resources and Electric Power, Zhengzhou, China; School of Electrical Engineering, North China University of Water Resources and Electric Power, Zhengzhou, China; School of Information Science and Engineering, Southeast University, Nanjing, China; School of Electrical Engineering, North China University of Water Resources and Electric Power, Zhengzhou, China",2023,National Natural Science Foundation of China(grant numbers:U1504622); Project of Training Plan for Young Backbone Teachers in Higher Education Institutions in Henan Province(grant numbers:2018GGJS079); ,Emotion recognition;modal decomposition;speech modality;visual modality,Feature extraction;Visualization;Speech recognition;Mel frequency cepstral coefficient;Emotion recognition;Data mining;Three-dimensional displays
C. A. Lopez; F. de Cabrera; J. Riba,"Signal Processing and Communications Group (SPCOM), Department de Teoria del Senyal i Comunicacions, Universitat Politècnica de Catalunya (UPC), Barcelona, Spain; Signal Processing and Communications Group (SPCOM), Department de Teoria del Senyal i Comunicacions, Universitat Politècnica de Catalunya (UPC), Barcelona, Spain; Signal Processing and Communications Group (SPCOM), Department de Teoria del Senyal i Comunicacions, Universitat Politècnica de Catalunya (UPC), Barcelona, Spain",2023,"Spanish Ministry of Science and Innovation project RODIN(grant numbers:PID2019-105717RB-C22); MAYTE(grant numbers:PID2022-1365120B-C21,2021 SGR 01033); Generalitat de Catalunya and the European Social Fund; Fellowships 2019 FI 00620 and 2023 FI-3 00155; ",Minimum error entropy;Rényi's entropy;concavity deficit;sparsity-promoting regularization;model-order selection,Entropy;Pollution measurement;Contamination;Indexes;Data models;Task analysis;Shape
Y. Gong; S. Luo; C. Wang; Y. Zheng,"Faculty of Electrical Engineering and Computer Science, Ningbo University, Ningbo, China; Faculty of Electrical Engineering and Computer Science, Ningbo University, Ningbo, China; Faculty of Electrical Engineering and Computer Science, Ningbo University, Ningbo, China; Faculty of Electrical Engineering and Computer Science, Ningbo University, Ningbo, China",2023,"Natural Science Foundation Project of Zhejiang Province(grant numbers:LQ22F020020); Open Project Program of the State Key Lab of CAD&CG, Zhejiang University(grant numbers:A2216); Ningbo Municipal Natural Science Foundation of China(grant numbers:2022J114); ",Differentiation reconstruction;representation enhancement;video anomaly detection;weakly supervised setting,Feature extraction;Training;Transformers;Anomaly detection;Visualization;Image reconstruction;Annotations
