Authors,Author Affiliations,Publication Year,Funding Information,Author Keywords,IEEE Terms
S. Sun; R. Liu; X. Yang,"Department of Electronic Information Engineering, Beihang University, Beijing, China; Department of Electronic Information Engineering, Beihang University, Beijing, China; Department of Electronic Information Engineering, Beihang University, Beijing, China",2023,"Science, Technology and Innovation Commission of Shenzhen Municipality; ",Depth estimation;stereoscopic vision;3D hand keypoints;multi-task,Three-dimensional displays;Estimation;Feature extraction;Crops;Costs;Task analysis;Multitasking
Z. Song; Y. Zhang; Y. Yu; C. Tang,"School of Electronics and Information, Northwestern Polytechnical University, Xi'an, Shaanxi, China; School of Electronics and Information, Northwestern Polytechnical University, Xi'an, Shaanxi, China; School of Electronics and Information, Northwestern Polytechnical University, Xi'an, Shaanxi, China; School of Electronics and Information, Northwestern Polytechnical University, Xi'an, Shaanxi, China",2023,"National Natural Science Foundation of China(grant numbers:62171735,62271397,62001392,61803310); Natural Science Basic Research Program of Shaanxi(grant numbers:2022GY-097); Shenzhen Science and Technology Program(grant numbers:JCYJ20220530161615033); ",Cooperative positioning;distributed system;statistical manifold;manifold gradient;information geometry,Manifolds;Navigation;Signal processing algorithms;Mathematical models;Position measurement;Filtering;Optimization
J. Yang; W. Zhou; R. Wu; M. Fang,"School of Information & Electronic Engineering, Zhejiang University of Science & Technology, Hangzhou, China; School of Information & Electronic Engineering, Zhejiang University of Science & Technology, Hangzhou, China; School of Information & Electronic Engineering, Zhejiang University of Science & Technology, Hangzhou, China; Zhejiang University School of Medicine, Hangzhou, China",2023,National Key Research and Development Program of China(grant numbers:2022YFE0196000); ,Bidirectional feature alignment;self-attention graph convolution;fusion quality;rail surface defect inspection,Feature extraction;Semantics;Convolution;Surface treatment;Surface morphology;Saliency detection;Rails
T. Montagu; A. Ferrari,"CEA Saclay, Gif-sur-Yvette, France; Université Côte d'Azur, CNRS, Observatoire de la Côte d'Azur, Nice, France",2023,U.S. Department of Commerce(grant numbers:BS123456); ,Shot noise;variance stabilization;Delta theorem;intensity estimator;pile-up effect;Campbell theorem;  $K$  -statistics;asymptotic normality,Transforms;Reactive power;Radar imaging;Estimation;Noise reduction;Stochastic processes;Monte Carlo methods
M. Mehrabi; M. H. Ardakani; M. Ardakani,"Department of Electrical and Computer Engineering, University of Alberta, Edmonton, AB, Canada; Department of Electrical and Computer Engineering, University of Alberta, Edmonton, AB, Canada; Department of Electrical and Computer Engineering, University of Alberta, Edmonton, AB, Canada",2023,Natural Sciences and Engineering Research Council of Canada; Alberta Innovates; ,Coded distributed computing;task scheduling;random task arrival;task allocation;coding rate,Task analysis;Computational modeling;Schedules;Distributed computing;Signal processing algorithms;Scheduling algorithms;Codes
M. Hu; H. Wang,"School of Cyber Science and Engineering, Sichuan University, Chengdu, China; School of Cyber Science and Engineering, Sichuan University, Chengdu, China",2023,"National Natural Science Foundation of China(grant numbers:61972269,62272331); Open Foundation of Henan Key Laboratory of Cyberspace Situation Awareness(grant numbers:HNTS2022003); Sichuan Science and Technology Program(grant numbers:2022YFG0320); ",Steganalysis;adversarial steganography;adversarial example;deep learning,Steganography;Perturbation methods;Feature extraction;Training;Streaming media;Optimization;Backpropagation
S. Wang; S. Bi,"College of Electronic and Information Engineering, Shenzhen University, Shenzhen, China; College of Electronic and Information Engineering, Shenzhen University, Shenzhen, China",2023,"National Natural Science Foundation of China(grant numbers:62101336,62271325); Open Research Project Programme of the State Key Laboratory of Internet of Things for Smart City(grant numbers:SKL-IoTSC(UM)- 2021-2023/ORPF/A03/2022); ",Auxiliary task;beam alignment;multi-task learning,Task analysis;Millimeter wave communication;Noise measurement;Multitasking;Training;Complexity theory;Antenna measurements
Y. Xie; X. Su; H. Ge,"School of Sports Engineering, Beijing Sport University, Beijing, China; School of Sports Engineering, Beijing Sport University, Beijing, China; School of Sports Engineering, Beijing Sport University, Beijing, China",2023,Beijing Natural Science Foundation(grant numbers:1232020); National Natural Science Foundation of China(grant numbers:11901037); ,Restricted isometry property;sparse recovery;the   $\ell _{1}/\ell _{p}$   minimization,Minimization;Upper bound;Signal processing algorithms;Measurement;Sparse matrices;Signal to noise ratio;Noise measurement
M. Greige; A. Karfoul; I. Merlet; R. L. B. Jeannès,"Univ Rennes, Inserm, LTSI - UMR 1099, Rennes, France; Univ Rennes, Inserm, LTSI - UMR 1099, Rennes, France; Univ Rennes, Inserm, LTSI - UMR 1099, Rennes, France; Univ Rennes, Inserm, LTSI - UMR 1099, Rennes, France",2023,,Brain connectivity;electroencephalography;epilepsy;PALM,Dictionaries;Brain modeling;Computational modeling;Epilepsy;Time series analysis;Signal processing algorithms;Nonlinear systems
H. H. Kang; C. K. Ahn,"School of Electrical Engineering, Korea University, Seoul, South Korea; School of Electrical Engineering, Korea University, Seoul, South Korea",2023,"National Research Foundation of Korea; Ministry of Science and ICT, South Korea(grant numbers:NRF-2020R1A2C1005449); ",Iterative learning;moving window;nonlinear system identification;recurrent neural network,Mathematical models;Signal processing algorithms;Robustness;Recurrent neural networks;Real-time systems;Nonlinear dynamical systems;Computational modeling
Z. -L. Shi; X. P. Li; W. Li; T. Yan; J. Wang; Y. Fu,"College of Science, China University of Petroleum (East China), Qingdao, China; State Key Laboratory of Radio Frequency Heterogeneous Integration, Shenzhen University, Shenzhen, China; College of Science, China University of Petroleum (East China), Qingdao, China; College of Science, China University of Petroleum (East China), Qingdao, China; College of Science, China University of Petroleum (East China), Qingdao, China; Department of Electronic Engineering and Computer Science, Hong Kong Metropolitan University, Hong Kong SAR, China",2023,Fundamental Research Funds for the Central Universities(grant numbers:22CX06039A); Research Matching(grant numbers:CP/2022/2.1); ,Robust low-rank matrix recovery;mixed integer programming;binary optimization;  $\ell _{0}$  -norm optimization,Optimization;Sparse matrices;Indexes;Manganese;Signal processing algorithms;Noise measurement;Integer programming
E. Ollila; D. P. Palomar; F. Pascal,"Department of Information and Communications Engineering, Aalto University, Aalto, Finland; Hong Kong University of Science and Technology, Hong Kong; CNRS Université Paris-Saclay, CentraleSupélec, Rennes, France",2023,Hong Kong GRF(grant numbers:16207820); ,Covariance matrix;elliptical distributions;scatter matrix;Tyler's M-estimator,Covariance matrices;Tail;Symmetric matrices;Generators;Harmonic analysis;Eigenvalues and eigenfunctions;Signal processing
T. Chen; B. Yang; L. Guo,"College of Information and Communication Engineering, Harbin Engineering University, Harbin, China; College of Information and Communication Engineering, Harbin Engineering University, Harbin, China; College of Information and Communication Engineering, Harbin Engineering University, Harbin, China",2023,,Clustering;instance segmentation;PDW;radar signal sorting,Radar;Lattices;Clustering algorithms;Signal processing algorithms;Radar imaging;Sorting;Image segmentation
S. Yang; T. Li; Y. Lv; Y. Xia; S. Li,"School of Computer Science and Technology, Anhui University, Hefei, China; School of Artificial Intelligence, Anhui University, Hefei, China; Shandong Provincial Hospital Affiliated to Shandong First Medical University, Jinan, China; School of Electrical and Automation, Anhui University, Hefei, China; Department of Computer and Data Science, Case Western Reserve University, Cleveland, OH, USA",2023,National Natural Science Foundation of China(grant numbers:11975312); Natural Science Foundation of Anhui Province(grant numbers:2108085MF232); ,Carotid lumen diameter;intima-media thickness;boundary-guided;pseudo labeling,Feature extraction;Training;Reliability;Heating systems;Uncertainty;Spatial resolution;Lumen
J. Wang; L. Lu; L. Shi; G. Zhu; X. Yang,"College of Electronics and Information Engineering, Sichuan University, Chengdu, China; College of Electronics and Information Engineering, Sichuan University, Chengdu, China; School of Computing and Artificial Intelligence, Southwestern University of Finance and Economics, Chengdu, China; High Voltage Laboratory in College of Electrical Engineering, Sichuan University, Chengdu, China; College of Electronics and Information Engineering, Sichuan University, Chengdu, China",2023,"National Natural Science Foundation of China(grant numbers:61901285,62201475); NSFSC(grant numbers:2023NSFSC0451,2021YFH0119,2023NSFSC0820); ",Maximum correntropy criterion;Euclidean direction search;impulsive noise;steady-state analysis,Signal processing algorithms;Kernel;Filtering algorithms;Convergence;Taylor series;Steady-state;Signal to noise ratio
Y. Sun; K. C. Ho; Y. Yang; L. Chen,"College of Computer Science, Sichuan University, Chengdu, China; EECS Department, University of Missouri, Columbia, MO, USA; College of Computer Science, Sichuan University, Chengdu, China; College of Computer Science, Sichuan University, Chengdu, China",2023,,Localization;TDOA;propagation speed,Sensors;Position measurement;Sun;Noise measurement;Location awareness;Covariance matrices;Computational efficiency
X. Zhang; Z. Xia; L. Liu; X. Feng,"School of Electronics and Information, Northwestern Polytechnical University (SEI@NPU), Xi'an, China; School of Electronics and Information, Northwestern Polytechnical University (SEI@NPU), Xi'an, China; School of Electronics and Information, Northwestern Polytechnical University (SEI@NPU), Xi'an, China; Research and Development Institute NPU in Shenzhen, Shenzhen, China",2023,"Key Research & Development Program of Shaanxi(grant numbers:2021ZDLGY15-01,2021ZDLGY09-04,2021GY-004,2022ZDLGY06-07); Natural Science Foundation of Chongqing(grant numbers:2022NSCQ-MSX3768); International Science and Technology Cooperation Research Project of Shenzhen(grant numbers:GJHZ20200731095204013); Doctorate Foundation of NWPU(grant numbers:CX2021019); ",HR estimation;demodulation-based transformer;Pwelch-based softmax;time-varying light,Lighting;Estimation;Skin;Optical filters;Optical scattering;Faces;Optical imaging
R. Yan; Y. Yang; T. Song,"School of Cyberspace Science and Technology, Beijing Institute of Technology, Beijing, China; School of Cyberspace Science and Technology, Beijing Institute of Technology, Beijing, China; School of Cyberspace Science and Technology, Beijing Institute of Technology, Beijing, China",2023,,Linguistic steganography;maximum weight independent set;segmentation ambiguity;disambiguation,Security;Codes;Steganography;Receivers;Ice;Probability distribution;Linguistics
T. Tian; H. Deng; G. Li; R. Ma,"School of Physics and Electronics, Henan University, Kaifeng, China; School of Physics and Electronics, Henan University, Kaifeng, China; The Key Laboratory of Information Fusion Technology, School of Automation, Northwestern Polytechnical University, Xi'an, China; School of Physics and Electronics, Henan University, Kaifeng, China",2023,Natural Science Foundation of Henan Province(grant numbers:202300410094); China Postdoctoral Science Foundation(grant numbers:2022M721027); National Natural Science Foundation of China(grant numbers:62201316); ,Intelligent reflecting surface;sensing;imperfect CSI;beamforming;stochastic optimization,Sensors;Array signal processing;Programming;Optimization;Stochastic processes;Channel estimation;Indexes
Z. Ye; D. Yan; L. Dong; J. Deng; S. Yu,"Faculty of Electrical Engineering and Computer Science, Ningbo University, Ningbo, China; Faculty of Electrical Engineering and Computer Science, Ningbo University, Ningbo, China; Faculty of Electrical Engineering and Computer Science, Ningbo University, Ningbo, China; Faculty of Electrical Engineering and Computer Science, Ningbo University, Ningbo, China; School of Computer Science, University of Technology Sydney, Ultimo, NSW, Australia",2023,"National Natural Science Foundation of China(grant numbers:62171244,61901237); Ningbo Science and Technology Innovation Project(grant numbers:2022Z074,2022Z075); Natural Science Foundation of Zhejiang Provincial(grant numbers:LY23F020011); Natural Science Foundation of Ningbo Municipality; Young Doctoral Innovation Research Project(grant numbers:2022J080); K. C. Wong Magna Fund in Ningbo University; ",Deep neural networks (DNNs);backdoor attacks;trigger;speaker recognition,Toxicology;Perturbation methods;Training;Spectrogram;Speaker recognition;Frequency-domain analysis;Ear
O. Coskun; G. Pages; J. Vilà-Valls; F. Vincent; E. Chaumette,"Capgemini Engineering, Blagnac, France; ISAE-SUPAERO, University of Toulouse, Toulouse, France; ISAE-SUPAERO, University of Toulouse, Toulouse, France; ISAE-SUPAERO, University of Toulouse, Toulouse, France; ISAE-SUPAERO, University of Toulouse, Toulouse, France",2023,"DGA/AID Projects(grant numbers:2021.65.0070,2022.65.0082); ",Fault detection;GLRT;integrity monitoring;invariant detectors;RAIM;solution separation,Detectors;Fault detection;Testing;Monitoring;Covariance matrices;Indexes;Global navigation satellite system
R. Peng; W. Wei; D. Sun; G. Wang,"School of Qingdao Innovation and Development Center, Harbin Engineering University, Qingdao, China; School of Qingdao Innovation and Development Center, Harbin Engineering University, Qingdao, China; School of Qingdao Innovation and Development Center, Harbin Engineering University, Qingdao, China; Institute of Information Fusion, Navy Aeronautical University, Yantai, China",2023,Basic Research Program(grant numbers:514010503-208); Equipment Pre Research(grant numbers:304060201); China Aerospace Science and Technology Corporation Stabilization Support Project(grant numbers:ZY0110020009); ,Coherent accumulation;frequency response;positive-unlabeled learning;pulse compression;radar false target jamming,Jamming;Feature extraction;Radar;Target recognition;Training;Frequency response;Support vector machines
R. Zhai; R. Ni; Y. Chen; Y. Yu; Y. Zhao,"Institute of Information Science, Beijing Jiaotong University, Beijing, China; Institute of Information Science, Beijing Jiaotong University, Beijing, China; Institute of Information Science, Beijing Jiaotong University, Beijing, China; Institute of Information Science, Beijing Jiaotong University, Beijing, China; Institute of Information Science, Beijing Jiaotong University, Beijing, China",2023,"National Key R&D Program of China(grant numbers:2021ZD0112100); National NSF of China(grant numbers:U1936212,62120106009); Beijing NSF(grant numbers:4222014); ",Face manipulation;proactive;deepfake;feature measure;adversarial examples;defense,Hidden Markov models;Faces;Perturbation methods;Metalearning;Forgery;Visualization;Training
E. Ly; J. Villegas,"Graduate School of Computer Science and Engineering, University of Aizu, Aizu-Wakamatsu, Fukushima, Japan; Graduate School of Computer Science and Engineering, University of Aizu, Aizu-Wakamatsu, Fukushima, Japan",2023,,Audio synthesis;Cartesian genetic programming;digital signal processing;evolutionary algorithms,Synthesizers;Additives;Genetic programming;Oscillators;Feedback loop;Computer languages;Wheels
K. Arai; K. Yamada; K. Yatabe,"Tokyo University of Agriculture and Technology, Tokyo, Japan; Tokyo University of Agriculture and Technology, Tokyo, Japan; Tokyo University of Agriculture and Technology, Tokyo, Japan",2023,,Sparse time-frequency analysis;basis pursuit;perspective function;convex optimization;primal-dual splitting,Manganese;Optimization;Spectrogram;Time-frequency analysis;Convex functions;Discrete cosine transforms;Signal processing algorithms
Z. -C. Fan; D. Li; S. Rahardja,"School of Marine Science and Technology, Northwestern Polytechnical University, Xi'an, China; School of Marine Science and Technology, Northwestern Polytechnical University, Xi'an, China; School of Marine Science and Technology, Northwestern Polytechnical University, Xi'an, China",2023,,Pure number discrete fractional complex Hadamard transform;self-Kronecker product;fast algorithm;multiplication reduction,Transforms;Fractionation;Eigenvalues and eigenfunctions;Fans;Computational complexity;Video compression;Spectral analysis
Z. Xu; X. Li; D. Zhang; H. Zhou,"Hubei Key Laboratory of Intelligent Robot, Wuhan Institute of Technology, Wuhan, China; Hubei Key Laboratory of Intelligent Robot, Wuhan Institute of Technology, Wuhan, China; CNNC Key Laboratory on Nuclear Industry Simulation, China Nuclear Power Operation Technology Corporation, Ltd., Wuhan, China; Hubei Key Laboratory of Intelligent Robot, Wuhan Institute of Technology, Wuhan, China",2023,"National Natural Science Foundation of China(grant numbers:62171327,62171328,62072350); Key R&D Program in Hubei Province, China(grant numbers:2022BAA079); Hubei Nuclear Power Operation Engineering Technology Research Center(grant numbers:B210610); 13th Postgraduate Education Innovation Fund of Wuhan Institute of Technology(grant numbers:CX2021255); ",Color histogram matching;generative adversarial network;image blending;image deformation,Faces;Deformation;Feature extraction;Image color analysis;Histograms;Generative adversarial networks;Generators
Y. Ai; Y. -X. Lu; Z. -H. Ling,"National Engineering Research Center of Speech and Language Information Processing, University of Science and Technology of China, Hefei, China; National Engineering Research Center of Speech and Language Information Processing, University of Science and Technology of China, Hefei, China; National Engineering Research Center of Speech and Language Information Processing, University of Science and Technology of China, Hefei, China",2023,Fundamental Research Funds for the Central Universities(grant numbers:WK2100000033); ,Error compensation;interpolation;neural network;spectral continuity;speech phase prediction,Interpolation;Signal processing algorithms;Predictive models;Prediction algorithms;Estimation;Training;Signal processing
J. Deng; Y. Lin; X. Jin; X. Ning; J. Wang,"Beijing Key Lab of Traffic Data Analysis and Mining, School of Computer and Information Technology, Beijing Jiaotong University, Beijing, China; Beijing Key Lab of Traffic Data Analysis and Mining, School of Computer and Information Technology, Beijing Jiaotong University, Beijing, China; Beijing Key Lab of Traffic Data Analysis and Mining, School of Computer and Information Technology, Beijing Jiaotong University, Beijing, China; Beijing Key Lab of Traffic Data Analysis and Mining, School of Computer and Information Technology, Beijing Jiaotong University, Beijing, China; Beijing Key Lab of Traffic Data Analysis and Mining, School of Computer and Information Technology, Beijing Jiaotong University, Beijing, China",2023,Fundamental Research Funds for the Central Universities(grant numbers:2023JBMC056); ,Contrastive learning;multi-view learning;sampling strategy;sleep stage,Sleep;Electrooculography;Electroencephalography;Physiology;Semantics;Loss measurement;Data augmentation
G. Huang; J. Benesty; J. Chen,"School of Electronic Information, Wuhan University, Wuhan, China; INRS-EMT, University of Quebec, Montreal, QC, Canada; Center of Intelligent Acoustics and Immersive Communications, Northwestern Polytechnical University, Xi'an, Shaanxi, China",2023,"Double first-class” Construction Talent Start-Up Funds(grant numbers:1501/600460049); National Key Research and Development Program of China(grant numbers:2018AAA0102200); Key Program of National Science Foundation of China(grant numbers:61831019,62192713); ",Dimensionality reduction;room acoustic impulse response;dynamic mode decomposition;acoustic system identification,Acoustics;Dimensionality reduction;System identification;Microphones;Training data;Jacobian matrices;Training
Z. Zhang; Z. Shi; Y. Gu; M. S. Greco; F. Gini,"College of Information Science and Electronic Engineering, Zhejiang University, Hangzhou, China; College of Information Science and Electronic Engineering, Zhejiang University, Hangzhou, China; Advanced Safety & User Experience, Aptiv, Agoura Hills, CA, USA; Department of Information Engineering, University of Pisa, Pisa, Italy; Department of Information Engineering, University of Pisa, Pisa, Italy",2023,"China Scholarship Council for his stay at the University of Pisa; National Natural Science Foundation of China(grant numbers:U21A20456,61901413,62271444); Italian Ministry of Education and Research; Dipartimenti di Eccellenza; ",Bayesian estimation;compressive sensing;mean square error;time delay estimation;stochastic Ziv-Zakai bound,Delay effects;Estimation;Radar;Signal to noise ratio;Kernel;Time measurement;Eigenvalues and eigenfunctions
T. Gao; Y. Liu; P. Cheng; T. Chen; L. Liu,"Department of Information Engineering, Chang'an University, Xi'an, China; Department of Information Engineering, Chang'an University, Xi'an, China; Department of Computer Science and Information Technology, La Trobe University, Melbourne, Victoria, Australia; Department of Information Engineering, Chang'an University, Xi'an, China; Department of Information Engineering, Chang'an University, Xi'an, China",2023,"National Key R&D Program of China(grant numbers:2019YFE0108300); National Natural Science Foundation of China(grant numbers:52172379,62001058,U1864204); Fundamental Research Funds of the Central Universities of Chang'an University(grant numbers:300102242901); ",Image dehazing;physical information guidance;uncertainty;attention mechanism,Uncertainty;Image restoration;Training;Scattering;Decoding;Task analysis;Estimation
F. Zhang; C. Yang,"School of Computer Science, Northwestern Polytechnical University, Xi'an, China; School of Computer Science, Northwestern Polytechnical University, Xi'an, China",2023,,Coarse-to-fine;dual-stream fused;video frame interpolation,Feature extraction;Interpolation;Estimation;Training;Optical flow;Streaming media;Image motion analysis
H. Xin; Y. Lu; H. Tang; R. Wang; F. Nie,"School of Artificial Intelligence, Optics and Electronics (iOPEN), Northwestern Polytechnical University, Xi'an, Shaanxi, China; School of Computer Science, School of Artificial Intelligence, Optics and Electronics (iOPEN), Northwestern Polytechnical University, Xi'an, Shaanxi, China; School of Artificial Intelligence, Optics and Electronics (iOPEN), Northwestern Polytechnical University, Xi'an, Shaanxi, China; School of Artificial Intelligence, Optics and Electronics (iOPEN), Northwestern Polytechnical University, Xi'an, Shaanxi, China; School of Computer Science, School of Artificial Intelligence, Optics and Electronics (iOPEN), Northwestern Polytechnical University, Xi'an, Shaanxi, China",2023,National Key Research and Development Program of China(grant numbers:2022ZD0160805); ,Euler kernel;feature selection;kernel clustering,Kernel;Computational modeling;Optimization;Signal processing;Task analysis;Feature extraction;Adaptation models
Y. Zhang; X. Ding; G. Li; Z. Zhang; K. Yang,"School of Information and Electronics, Beijing Institute of Technology, Beijing, China; School of Cyberspace Science and Technology, Beijing Institute of Technology, Beijing, China; Institute of Fluid Science, Tohoku University, Sendai, Japan; School of Cyberspace Science and Technology, Beijing Institute of Technology, Beijing, China; School of Information and Electronics, Beijing Institute of Technology, Beijing, China",2023,National Key Research and Development Program of China(grant numbers:2019YFB1803200); National Natural Science Foundation of China(grant numbers:62001030); ,Denoising diffusion probabilistic model (DDPM);generative adversarial network (GAN);neural network algorithm;wireless communication interference (WCI),Signal processing algorithms;Interference;Classification algorithms;Wireless communication;Feature extraction;Training;Noise reduction
M. Liang; T. Kropfreiter; F. Meyer,"University of California San Diego, La Jolla, CA, USA; University of California San Diego, La Jolla, CA, USA; University of California San Diego, La Jolla, CA, USA",2023,National Science Foundation; CAREER(grant numbers:2146261); ,Belief propagation;factor graph;multi-object tracking;track-before-detect,Probability density function;Data models;Sea measurements;Computational modeling;Bayes methods;Inference algorithms;Belief propagation
