"Document Title",Authors,"Author Affiliations","Publication Title",Date Added To Xplore,"Publication Year","Volume","Issue","Start Page","End Page","Abstract","ISSN",ISBNs,"DOI",Funding Information,PDF Link,"Author Keywords","IEEE Terms","Mesh_Terms",Article Citation Count,Patent Citation Count,"Reference Count","License",Online Date,Issue Date,"Meeting Date","Publisher",Document Identifier
"Front Cover","",,IEEE Signal Processing Letters,"21 Aug 2018","2018","25","7","C1","C1","Presents the front cover for this issue of the publication.","1558-2361","","10.1109/LSP.2018.2838880","","https://ieeexplore.ieee.org/stamp/stamp.jsp?arnumber=8443303","","","","1","","","IEEE","21 Aug 2018","","","IEEE","IEEE Journals"
"IEEE Signal Processing Society Editorial Board","",,IEEE Signal Processing Letters,"21 Aug 2018","2018","25","7","C2","C2","Presents a listing of the editorial board, board of governors, current staff, committee members, and/or society editors for this issue of the publication.","1558-2361","","10.1109/LSP.2018.2838881","","https://ieeexplore.ieee.org/stamp/stamp.jsp?arnumber=8443307","","","","","","","IEEE","21 Aug 2018","","","IEEE","IEEE Journals"
"Table of Contents","",,IEEE Signal Processing Letters,"28 Jun 2018","2018","25","7","907","908","Presents the table of contents for this issue of the publication.","1558-2361","","10.1109/LSP.2018.2838878","","https://ieeexplore.ieee.org/stamp/stamp.jsp?arnumber=8399515","","","","","","","IEEE","28 Jun 2018","","","IEEE","IEEE Journals"
"Table of Contents [Edics]","",,IEEE Signal Processing Letters,"28 Jun 2018","2018","25","7","909","910","Presents the table of contents for this issue of the publication.","1558-2361","","10.1109/LSP.2018.2838879","","https://ieeexplore.ieee.org/stamp/stamp.jsp?arnumber=8399514","","","","","","","IEEE","28 Jun 2018","","","IEEE","IEEE Journals"
"A Spectral Method for Stable Bispectrum Inversion With Application to Multireference Alignment","H. Chen; M. Zehni; Z. Zhao","Department of Electrical and Computer Engineering, University of Illinois at Urbana-Champaign, Urbana, IL, USA; Department of Electrical and Computer Engineering, University of Illinois at Urbana-Champaign, Urbana, IL, USA; Department of Electrical and Computer Engineering, University of Illinois at Urbana-Champaign, Urbana, IL, USA",IEEE Signal Processing Letters,"21 May 2018","2018","25","7","911","915","We focus on an alignment-free method to estimate the underlying signal from a large number of noisy randomly shifted observations. Specifically, we estimate the mean, power spectrum, and bispectrum of the signal from the observations. Since the bispectrum contains the phase information of the signal, reliable algorithms for bispectrum inversion are useful in many applications. We propose a new algorithm using spectral decomposition of the bispectrum phase matrix for this task. For clean signals, we show that the eigenvectors of the bispectrum phase matrix correspond to the true phases of the signal and its shifted copies. In addition, the spectral method is robust to noise. It can be used as a stable and efficient initialization technique for local nonconvex optimization for bispectrum inversion.","1558-2361","","10.1109/LSP.2018.2831631","UIUC COE SRI grant; ","https://ieeexplore.ieee.org/stamp/stamp.jsp?arnumber=8352518","","Eigenvalues and eigenfunctions;Signal processing algorithms;Noise measurement;Estimation;Discrete Fourier transforms;Robustness;Computational complexity","","15","","28","IEEE","30 Apr 2018","","","IEEE","IEEE Journals"
"Nonlocal Similarity Modeling and Deep CNN Gradient Prior for Super Resolution","C. Ren; X. He; Y. Pu","College of Electronics and Information Engineering, Sichuan University, Chengdu, China; College of Electronics and Information Engineering, Sichuan University, Chengdu, China; College of Computer Science, Sichuan University, Chengdu, China",IEEE Signal Processing Letters,"21 May 2018","2018","25","7","916","920","This letter presents a novel super-resolution (SR) method via nonlocal similarity modeling and deep convolutional neural network (CNN) gradient prior (GP). Specifically, on the one hand, the group similarity reliability (GSR) strategy is proposed for improving the adaptive high-dimensional nonlocal total variation (AHNLTV) model [statistical prior, GSR-based AHNLTV (GA)], which captures the structures of the underlying high-resolution (HR) image via the image itself. On the other hand, the GP is learned by using the deep CNN (learned prior), which predicts the gradients from external images. Finally, the GA-GP approach is proposed by incorporating the two complementary priors. The results show that GA-GP achieves better performance than other state-of-the-art SR methods.","1558-2361","","10.1109/LSP.2018.2829766","National Postdoctoral Program for Innovative Talents of China(grant numbers:BX201700163); Post-Doctoral Research and Development Foundation of Sichuan University(grant numbers:2017SCU12003); ","https://ieeexplore.ieee.org/stamp/stamp.jsp?arnumber=8345640","Gradient prior (GP);group similarity reliability (GSR);nonlocal similarity;super resolution","Image resolution;Reliability;Nickel;Convolution;Image reconstruction;Feature extraction;Signal resolution","","12","","39","IEEE","24 Apr 2018","","","IEEE","IEEE Journals"
"A New Information Theoretic Relation Between Minimum Error Entropy and Maximum Correntropy","A. R. Heravi; G. A. Hodtani","Electrical Engineering Deptartment, Ferdowsi University of Mashhad, Mashhad, Iran; Electrical Engineering Deptartment, Ferdowsi University of Mashhad, Mashhad, Iran",IEEE Signal Processing Letters,"21 May 2018","2018","25","7","921","925","The past decade has seen the rapid development of information theoretic learning and its applications in signal processing and machine learning. Specifically, minimum error entropy (MEE) and maximum correntropy criterion (MCC) have been widely studied in the literature. Although MEE and MCC are applied in many branches of knowledge and could outperform statistical criteria (such as mean square error), they have not been compared with each other from theoretical point of view. In some cases, MEE and MCC perform similarly to each other; however, under some conditions (e.g., in non-Gaussian environments), they act differently. This letter derives a new information theoretic relation between MEE and MCC, leading to better understanding of the theoretical differences, and illustrates the findings in a common example.","1558-2361","","10.1109/LSP.2018.2797079","Ferdowsi University of Mashhad; ","https://ieeexplore.ieee.org/stamp/stamp.jsp?arnumber=8267224","Correntropy;entropy;information theoretic learning;machine learning;mean square error;minimum error entropy","Entropy;Kernel;Mathematical model;Signal processing;Mean square error methods;Minimization;Probability density function","","33","","30","IEEE","23 Jan 2018","","","IEEE","IEEE Journals"
"Additive Margin Softmax for Face Verification","F. Wang; J. Cheng; W. Liu; H. Liu","Department of Information and Communication Engineering, University of Electronic Science and Technology of China, Chengdu, China; Department of Information and Communication Engineering, University of Electronic Science and Technology of China, Chengdu, China; College of Computing, Georgia Institute of Technology, Atlanta, GA, USA; Department of Information and Communication Engineering, University of Electronic Science and Technology of China, Chengdu, China",IEEE Signal Processing Letters,"22 May 2018","2018","25","7","926","930","In this letter, we propose a conceptually simple and intuitive learning objective function, i.e., additive margin softmax, for face verification. In general, face verification tasks can be viewed as metric learning problems, even though lots of face verification models are trained in classification schemes. It is possible when a large-margin strategy is introduced into the classification model to encourage intraclass variance minimization. As one alternative, angular softmax has been proposed to incorporate the margin. In this letter, we introduce another kind of margin to the softmax loss function, which is more intuitive and interpretable. Experiments on LFW and MegaFace show that our algorithm performs better when the evaluation criteria are designed for very low false alarm rate.","1558-2361","","10.1109/LSP.2018.2822810","National Natural Science Foundation of China(grant numbers:61671125,61201271,61301269); State Key Laboratory of Synthetical Automation for Process Industries(grant numbers:PAL-N201401); ","https://ieeexplore.ieee.org/stamp/stamp.jsp?arnumber=8331118","Deep learning;face verification;metric learning","Additives;Face;Measurement;Visualization;Annealing;Task analysis;Training","","976","","26","IEEE","4 Apr 2018","","","IEEE","IEEE Journals"
"Ramp Distribution-Based Image Enhancement Techniques for Infrared Images","S. Lee; D. Kim; C. Kim","School of Electrical Engineering, Korea Advanced Institute of Science and Technology, Daejeon, South Korea; School of Electrical Engineering, Korea Advanced Institute of Science and Technology, Daejeon, South Korea; School of Electrical Engineering, Korea Advanced Institute of Science and Technology, Daejeon, South Korea",IEEE Signal Processing Letters,"22 May 2018","2018","25","7","931","935","A novel image enhancement method for infrared (IR) images is presented. The proposed method consists of two parts considering the characteristics of high-dynamic-range IR images. First, we attempt to enhance image contrast by introducing the ramp distribution that increases with a constant slope in an ordered histogram domain. The ramp-distributed histogram is incorporated into an optimization problem with a sorted histogram of the input image to calculate a modified histogram. Second, to deal with blurred effects on IR images, we propose a relative edge-strength index for high-boost filtering to effectively suppress noise in relatively uniform regions. Compared with various conventional and state-of-the-art algorithms, the proposed method shows highly competitive performance.","1558-2361","","10.1109/LSP.2018.2834429","","https://ieeexplore.ieee.org/stamp/stamp.jsp?arnumber=8355902","Contrast enhancement;high-dynamic-range image;infrared image;image enhancement;image sharpening","Histograms;Image edge detection;Indexes;Image enhancement;Dynamic range;Standards","","20","","19","IEEE","8 May 2018","","","IEEE","IEEE Journals"
"Distortionless Beamforming Optimized With $\ell _1$ -Norm Minimization","S. Emura; S. Araki; T. Nakatani; N. Harada","Media Intelligence Laboratories, Musashino, NTT, Japan; Communication Science Laboratories, Kyoto, NTT, Japan; Communication Science Laboratories, Kyoto, NTT, Japan; Media Intelligence Laboratories, Musashino, NTT, Japan",IEEE Signal Processing Letters,"22 May 2018","2018","25","7","936","940","We propose beamforming method that minimizes the ℓ1 norm of a beamformer output vector under the same distortionless constraint as that of the conventional minimum power distortionless response (MPDR) beamformer. Using the ℓ1 norm makes the beamformer output sparse. This leads to reducing the residual elements of the interference signal. In addition, the sensitivity of the proposed beamformer can be controlled by adding a norm constraint as in the MPDR beamformer. The proposed method improved the signal-to-interference-noise ratio by 7 dB from that of the MPDR beamformer for reverberation time T60 = 300 ms in a simulation.","1558-2361","","10.1109/LSP.2018.2834870","","https://ieeexplore.ieee.org/stamp/stamp.jsp?arnumber=8358736","Beamformer; $\ell _1$  norm;minimum power distortionless response (MPDR);source separation","Interference;Array signal processing;Signal to noise ratio;Acoustic distortion;Microphone arrays;Sensitivity","","9","","24","IEEE","14 May 2018","","","IEEE","IEEE Journals"
"Data-Time Tradeoffs for Corrupted Sensing","J. Chen; Y. Liu","School of Physics, Beijing Institute of Technology, Beijing, China; School of Physics, Beijing Institute of Technology, Beijing, China",IEEE Signal Processing Letters,"23 May 2018","2018","25","7","941","945","In this letter, we characterize a data-time tradeoff for projected gradient descent (PGD) algorithms used for solving corrupted sensing problems under sub-Gaussian measurements. We also show that with a proper step size, the PGD method can achieve a linear rate of convergence when the number of measurements is sufficiently large.","1558-2361","","10.1109/LSP.2018.2833428","National Natural Science Foundation of China(grant numbers:61301188); ","https://ieeexplore.ieee.org/stamp/stamp.jsp?arnumber=8354890","Corrupted sensing;data-time tradeoffs;projected gradient descent (PGD)","Convergence;Pollution measurement;Sensors;Complexity theory;Signal processing algorithms;Size measurement;Linear matrix inequalities","","2","","26","IEEE","4 May 2018","","","IEEE","IEEE Journals"
"A Novel Multiconnected Convolutional Network for Super-Resolution","J. Chu; J. Zhang; W. Lu; X. Huang","School of Electrical and Information Engineering, Tianjin University, Tianjin, China; School of Electrical and Information Engineering, Tianjin University, Tianjin, China; School of Electrical and Information Engineering, Tianjin University, Tianjin, China; School of Electrical and Information Engineering, Tianjin University, Tianjin, China",IEEE Signal Processing Letters,"23 May 2018","2018","25","7","946","950","Convolutional neural networks exhibit superior performance for single image super-resolution (SISR) tasks. However, as the network grows deeper, features from the earlier layers are impeded or less used in later layers. In SISR, the earlier layers are mainly composed of local features that are essential to the task. In this letter, we present a novel multiconnected convolutional network for SISR tasks by enhancing the combination of both low- and high-level features. We design a structure built on multiconnected blocks to extract diversified and complicated features via the concatenation of low-level features to high-level features. In addition to stacking multiconnected blocks, a long skip-connection is implemented to further aggregate features of the first layer and a specific later layer. Furthermore, we employ a flexible two-parameter loss function to optimize the training process. The proposed method yields state-of-the-art performance both in terms of quantitative metrics and visual quality. The method also outperforms existing methods on datasets via unknown degrading operators, indicating an excellent generalization ability.","1558-2361","","10.1109/LSP.2018.2820057","","https://ieeexplore.ieee.org/stamp/stamp.jsp?arnumber=8326520","Aggregate features;convolutional neural networks (CNNs);multiconnected block;super-resolution","Feature extraction;Convolution;Task analysis;Image resolution;Loss measurement;Signal resolution;Stacking","","14","","25","IEEE","27 Mar 2018","","","IEEE","IEEE Journals"
"Is Self-Interference in Full-Duplex Communications a Foe or a Friend?","A. Yadav; O. A. Dobre; H. V. Poor","Faculty of Engineering and Applied Science, Memorial University, St. John's, Canada; Faculty of Engineering and Applied Science, Memorial University, St. John's, Canada; Department of Electrical Engineering, Princeton University, Princeton, USA",IEEE Signal Processing Letters,"23 May 2018","2018","25","7","951","955","This letter studies the potential of harvesting energy from the self-interference of a full-duplex base station. The base station is equipped with a self-interference cancellation switch, which is turned off for a fraction of the transmission period in order to harvest the energy from the self-interference that arises due to the downlink transmission. For the remaining transmission period, the switch is on such that the uplink transmission takes place simultaneously with the downlink transmission. A novel energy-efficiency maximization problem is formulated for the joint design of downlink beamformers, uplink power allocations, and the transmission time-splitting factor. The optimization problem is nonconvex, and hence, a rapidly converging iterative algorithm is proposed by employing the successive convex approximation approach. Numerical simulation results show significant improvement in the energy-efficiency by allowing self-energy recycling.","1558-2361","","10.1109/LSP.2018.2802780","Natural Sciences and Engineering Research Council of Canada; National Science Foundation(grant numbers:CNS-1702808,ECCS-1647198); ","https://ieeexplore.ieee.org/stamp/stamp.jsp?arnumber=8281512","Full-duplex communications;radio resource management;self-interference;self-energy harvesting;small cells","Switches;Downlink;Radio frequency;Energy harvesting;Signal to noise ratio","","22","","21","IEEE","5 Feb 2018","","","IEEE","IEEE Journals"
"Outage-Aware Secure Beamforming in MISO Wireless Interference Networks","Z. Sheng; H. D. Tuan; T. Q. Duong; H. V. Poor","School of Electrical and Data Engineering, University of Technology Sydney, Broadway, NSW, Australia; School of Electrical and Data Engineering, University of Technology Sydney, Broadway, NSW, Australia; Queen's University Belfast, Belfast, U.K.; Department of Electrical Engineering, Princeton University, Princeton, NJ, USA",IEEE Signal Processing Letters,"23 May 2018","2018","25","7","956","960","Based on the knowledge of the channel distributions of a multi-input single-output wireless network of multiple transmitter-user pairs overheard by an eavesdropper, this letter develops an outage-aware beamforming design to optimize the users' quality-of-service (QoS) in terms of their secrecy rates. This is a very computationally difficult problem with a nonconcave objective function and nonlinear equality constraints in beamforming vectors. A path-following algorithm of low-complexity and rapid convergence is proposed for computation, which is also extended to solving the problem of maximizing the network's secure energy efficiency under users' QoS constraints. Numerical examples are provided to verify the efficiency of the proposed algorithms.","1558-2361","","10.1109/LSP.2018.2829663","U.S. National Science Foundation(grant numbers:CNS-1702808,ECCS-1647198); ","https://ieeexplore.ieee.org/stamp/stamp.jsp?arnumber=8353393","Energy-efficient communication;interference networks;outage-aware beamforming;path-following algorithms;secure communication","Array signal processing;Transmitters;Optimization;Nonlinear equations;Quality of service;Signal processing algorithms;Channel estimation","","6","","14","IEEE","2 May 2018","","","IEEE","IEEE Journals"
"An Axially Variant Kernel Imaging Model Applied to Ultrasound Image Reconstruction","M. I. Florea; A. Basarab; D. Kouamé; S. A. Vorobyov","Department of Signal Processing and Acoustics, Aalto University, Aalto, Finland; IRIT, CNRS UMR 5505, University of Toulouse, Toulouse, France; IRIT, CNRS UMR 5505, University of Toulouse, Toulouse, France; Department of Signal Processing and Acoustics, Aalto University, Aalto, Finland",IEEE Signal Processing Letters,"23 May 2018","2018","25","7","961","965","Existing ultrasound deconvolution approaches unrealistically assume, primarily for computational reasons, that the convolution model relies on a spatially invariant kernel and circulant boundary conditions. We discard both restrictions and introduce an image formation model applicable to ultrasound imaging and deconvolution based on an axially varying kernel, which accounts for arbitrary boundary conditions. Our model has the same computational complexity as the one employing spatially invariant convolution and has negligible memory requirements. To accommodate the state-of-the-art deconvolution approaches when applied to a variety of inverse problem formulations, we also provide an equally efficient adjoint expression for our model. Simulation results confirm the tractability of our model for the deconvolution of large images. Moreover, in terms of accuracy metrics, the quality of reconstruction using our model is superior to that obtained using spatially invariant convolution.","1558-2361","","10.1109/LSP.2018.2824764","Academy of Finland(grant numbers:299243); CIMI Labex, Toulouse, France(grant numbers:ANR-11-LABX-0040-CIMI,ANR-11-IDEX-0002-02); ","https://ieeexplore.ieee.org/stamp/stamp.jsp?arnumber=8333807","Axially varying;deconvolution;forward model;kernel;matrix-free;point-spread function;ultrasound","Convolution;Kernel;Computational modeling;Ultrasonic imaging;Deconvolution;Imaging;Image reconstruction","","10","","18","IEEE","9 Apr 2018","","","IEEE","IEEE Journals"
"Perfect Sequences of Odd Prime Length","C. -P. Li; K. -J. Chang; H. -H. Chang; Y. -M. Chen","Institute of Communications Engineering and the Department of Electrical Engineering, National Sun Yat-Sen University, Kaohsiung, Taiwan; Civil Engineering Department, National Taipei University of Technology, Taipei, Taiwan; Communication Engineering Department, I-SHOU University, Kaohsiung, Taiwan; Institute of Communications Engineering, National Sun Yat-Sen University, Kaohsiung, Taiwan",IEEE Signal Processing Letters,"23 May 2018","2018","25","7","966","969","A sequence is said to be perfect if it has an ideal periodic autocorrelation function. In addition, the degree of a sequence is defined as the number of distinct nonzero elements within each period of the sequence. This study presents a systematic method for constructing perfect sequences (PSs) of odd prime periods, where the general constraint equations for the sequence coefficients are derived, providing a solid theoretical foundation to the construction of PSs. The proposed scheme commences by partitioning a cyclic group ZP = {1, 2,⋯, P - 1} into K cosets of cardinality M, where P = K · M + 1 is an odd prime. Based on this partition, the degree-(K + 1) PSs are then constructed. Finally, case studies are presented to illustrate the proposed construction.","1558-2361","","10.1109/LSP.2018.2832719","","https://ieeexplore.ieee.org/stamp/stamp.jsp?arnumber=8353777","Cyclic group;finite field;perfect sequence (PS);periodic autocorrelation function (PACF)","Correlation;Systematics;Solids;Synchronization;Indexes;Spread spectrum communication;Channel estimation","","8","","15","IEEE","3 May 2018","","","IEEE","IEEE Journals"
"New Sets of Even-Length Binary Z-Complementary Pairs With Asymptotic ZCZ Ratio of  $3/4$","A. R. Adhikary; S. Majhi; Z. Liu; Y. L. Guan","Department of Mathematics, Indian Institute of Technology Patna, Bihar, India; Department of Electrical Engineering, Indian Institute of Technology Patna, Bihar, India; Institute for Communication Systems, 5G Innovation Centre, University of Surrey, Guildford, U.K.; School of Electrical and Electronic Engineering, Nanyang Technological University, Singapore",IEEE Signal Processing Letters,"23 May 2018","2018","25","7","970","973","This letter is focused on increasing the zero correlation zone (ZCZ) of even-length binary Z-complementary pairs (EB-ZCPs). Till date, the maximum ZCZ ratio (i.e., ZCZ width over the sequence length) for systematically constructed EB-ZCPs is 2/3. In this letter, we give a construction of EB-ZCPs with lengths 2α+2 10β26γ + 2 (where α, β, and γ are nonnegative integers) and ZCZ widths 3 × 2α10β26γ + 1, thus achieving asymptotic ZCZ ratio of 3/4. The proposed EB-ZCPs are constructed via proper insertion of concatenated odd-length binary ZCPs. The ZCZ width is proved by exploiting several newly identified intrinsic structure properties of binary Golay complementary pairs, obtained from Turyn's method. The proposed EB-ZCPs have aperiodic autocorrelation sums (AACS) magnitude of 4 outside the ZCZ region (except for the last time-shift taking AACS value of zero).","1558-2361","","10.1109/LSP.2018.2834143","DST(grant numbers:2014/292); Visvesvaraya Ph.D. scheme for Electronics and IT, Ministry of Electronics and Information Technology, Government of India; Digital India Corporation; NRF-NSFC(grant numbers:NRF2016NRF-NSFC001-089); National Natural Science Foundation of China(grant numbers:61750110527); ","https://ieeexplore.ieee.org/stamp/stamp.jsp?arnumber=8355785","Even-length binary aperiodic Z-Complementary Pairs (EB-ZCPs);Golay complementary pair (GCP);zero correlation zone (ZCZ);Z-Complementary pair (ZCP)","Systematics;Correlation;Channel estimation;Kernel;Indexes;Spectroscopy;Doppler effect","","52","","20","IEEE","7 May 2018","","","IEEE","IEEE Journals"
