"Discriminative Multidimensional Scaling for Low-Resolution Face Recognition","F. Yang; W. Yang; R. Gao; Q. Liao","Shenzhen Key Laboratory of Information Sci& Tech/Shenzhen Engineering Laboratory of IS&DCP, Department of Electronic Engineering/Graduate School at Shenzhen, Tsinghua University, Shenzhen, China; Shenzhen Key Laboratory of Information Sci& Tech/Shenzhen Engineering Laboratory of IS&DCP, Department of Electronic Engineering/Graduate School at Shenzhen, Tsinghua University, Shenzhen, China; Shenzhen Key Laboratory of Information Sci& Tech/Shenzhen Engineering Laboratory of IS&DCP, Department of Electronic Engineering/Graduate School at Shenzhen, Tsinghua University, Shenzhen, China; Shenzhen Key Laboratory of Information Sci& Tech/Shenzhen Engineering Laboratory of IS&DCP, Department of Electronic Engineering/Graduate School at Shenzhen, Tsinghua University, Shenzhen, China",IEEE Signal Processing Letters,"2 Feb 2018","2018","25","3","388","392","Face images captured by surveillance videos usually have limited resolution. Due to resolution mismatch, it is hard to match high-resolution (HR) faces with low-resolution (LR) faces directly. Recently, multidimensional scaling (MDS) has been employed to solve the problem. In this letter, we proposed a more discriminative MDS method to learn a mapping matrix, which projects the HR images and LR images to a common subspace. Our method is discriminative since both interclass distances and intraclass distances are taken into consideration. We add an interclass constraint to enlarge the distances of different subjects in the subspace to ensure discriminability. Besides, we consider not only the relationship of HR-LR images, but also the relationship of HR-HR images and LR-LR images in order to preserve local consistency. Experimental results on FERET, Multi-PIE, and SCface databases demonstrate the effectiveness of our proposed approach.","1558-2361","","10.1109/LSP.2017.2746658","National Natural Science Foundation of China(grant numbers:61471216); National Basic Research Program of China (973 Program)(grant numbers:2016YFB0101001,2017YFC0112500); Special Foundation for the Development of Strategic Emerging Industries of Shenzhen(grant numbers:JCYJ20170307153940960,JCYJ20150831192224146); ","https://ieeexplore.ieee.org/stamp/stamp.jsp?arnumber=8022987","Coupled mapping;face recognition;low resolution;multidimensional scaling (MDS)","Image resolution;Face;Linear programming;Signal resolution;Face recognition;Training;Probes","","55","","24","IEEE","30 Aug 2017","","","IEEE","IEEE Journals"
"A Closed-Form Solution to Rotation Estimation for Structure from Small Motion","H. Ha; T. -H. Oh; I. S. Kweon","School of Electrical Engineering, Korea Advanced Institute of Science and Technology, Daejeon, South Korea; School of Electrical Engineering, Korea Advanced Institute of Science and Technology, Daejeon, South Korea; School of Electrical Engineering, Korea Advanced Institute of Science and Technology, Daejeon, South Korea",IEEE Signal Processing Letters,"2 Feb 2018","2018","25","3","393","397","The introduction of small motion techniques such as small angle rotation approximation has enabled the three-dimensional reconstruction from a small motion of a camera, so-called structure from small motion (SfSM). In this letter, we propose a closed-form solution dedicated to the rotation estimation problem in SfSM. We show that our method works with a minimal set of two points, and has mild conditions to produce a unique optimal solution in practice. Also, we introduce a three-step SfSM pipeline with better convergence and faster speed compared to the state-of-the-art SfSM approaches. The key to this improvement is the separated estimation of the rotation with the proposed two-point method in order to handle the bas-relief ambiguity that affects the convergence of the bundle adjustment. We demonstrate the effectiveness of our two-point minimal solution and the three-step SfSM approach in synthetic and real-world experiments under the small motion regime.","1558-2361","","10.1109/LSP.2017.2705138","National Research Foundation of Korea; Korea Government (MSIP)(grant numbers:2010-0028680); ","https://ieeexplore.ieee.org/stamp/stamp.jsp?arnumber=7930464","Relative pose problem;rotation estimation;structure from small motion (SfSM);two-point minimal solution","Cameras;Estimation;Pipelines;Three-dimensional displays;Signal processing algorithms;Robustness;Convergence","","7","","19","IEEE","17 May 2017","","","IEEE","IEEE Journals"
"A Unified Bayesian Inference Framework for Generalized Linear Models","X. Meng; S. Wu; J. Zhu","Huawei Technologies, Co. Ltd., Shanghai, China; Tsinghua Space Center, Tsinghua University, Beijing, China; Ocean College, Zhejiang University, Zhoushan, China",IEEE Signal Processing Letters,"2 Feb 2018","2018","25","3","398","402","In this letter, we present a unified Bayesian inference framework for generalized linear models (GLM), which iteratively reduces the GLM problem to a sequence of standard linear model (SLM) problems. This framework provides new perspectives on some established GLM algorithms derived from SLM ones and also suggests novel extensions for some other SLM algorithms. Specific instances elucidated under such framework are the GLM versions of approximate message passing (AMP), vector AMP, and sparse Bayesian learning. It is proved that the resultant GLM version of AMP is equivalent to the well-known generalized approximate message passing. Numerical results for one-bit quantized compressed sensing demonstrate the effectiveness of this unified framework.","1558-2361","","10.1109/LSP.2017.2789163","Zhejiang Province Natural Science Foundation of China(grant numbers:LQ18F010001); ","https://ieeexplore.ieee.org/stamp/stamp.jsp?arnumber=8244269","Approximate message passing (AMP);compressed sensing (CS);generalized linear models (GLM);sparse Bayesian learning (SBL);vector approximate message passing (VAMP)","Inference algorithms;Bayes methods;Signal processing algorithms;Message passing;Approximation algorithms;Compressed sensing;Sea measurements","","55","","31","IEEE","1 Jan 2018","","","IEEE","IEEE Journals"
"Semi-Supervised Spectral Clustering With Structured Sparsity Regularization","Y. Jia; S. Kwong; J. Hou","Department of Computer Science, City University of Hong Kong, Kowloon, Hong Kong; City University of Hong Kong, Shenzhen Research Institute, Shenzhen, China; Department of Computer Science, City University of Hong Kong, Kowloon, Hong Kong",IEEE Signal Processing Letters,"2 Feb 2018","2018","25","3","403","407","Spectral clustering (SC) is one of the most widely used clustering methods. In this letter, we extend the traditional SC with a semi-supervised manner. Specifically, with the guidance of small amount of supervisory information, we build a matrix with anti-block-diagonal appearance, which is further utilized to regularize the product of the low-dimensional embedding and its transpose. Technically, we formulate the proposed model as a constrained optimization problem. Then, we relax it as a convex problem, which can be efficiently solved with the global convergence guaranteed via the inexact augmented Lagrangian multiplier method. Experimental results over four real-world datasets demonstrate that higher accuracy and normalized mutual information are achieved when compared with state-of-the-art methods.","1558-2361","","10.1109/LSP.2018.2791606","Natural Science Foundation of China(grant numbers:61672443); ","https://ieeexplore.ieee.org/stamp/stamp.jsp?arnumber=8253493","Convex optimization;spectral clustering (SC);semi-supervised","Optimization;Clustering algorithms;Clustering methods;Signal processing algorithms;Convergence;Mutual information;Eigenvalues and eigenfunctions","","31","","28","IEEE","10 Jan 2018","","","IEEE","IEEE Journals"
"Iterative Filtering and Smoothing in Nonlinear and Non-Gaussian Systems Using Conditional Moments","F. Tronarp; Á. F. García-Fernández; S. Särkkä","Department of Electrical Engineering and Automation, Aalto University, Espoo, Finland; Department of Electrical Engineering and Electronics, University of Liverpool, Liverpool, U.K.; Department of Electrical Engineering and Automation, Aalto University, Espoo, Finland",IEEE Signal Processing Letters,"2 Feb 2018","2018","25","3","408","412","This letter presents the development of novel iterated filters and smoothers that only require specification of the conditional moments of the dynamic and measurement models. This leads to generalizations of the iterated extended Kalman filter, the iterated extended Kalman smoother, the iterated posterior linearization filter, and the iterated posterior linearization smoother. The connections to the previous algorithms are clarified and a convergence analysis is provided. Furthermore, the merits of the proposed algorithms are demonstrated in simulations of the stochastic Ricker map where they are shown to have a similar or superior performance to competing algorithms.","1558-2361","","10.1109/LSP.2018.2794767","Academy of Finland(grant numbers:#295080,#266940); ","https://ieeexplore.ieee.org/stamp/stamp.jsp?arnumber=8260875","Iterative methods;nonlinear/non-Gaussian systems;state estimation;statistical linear regression (SLR)","Smoothing methods;Kalman filters;Signal processing algorithms;Approximation algorithms;Random variables;Estimation;Computational modeling","","41","","29","IEEE","17 Jan 2018","","","IEEE","IEEE Journals"
"Ramanujan Sums as Derivatives and Applications","D. K. Yadav; G. Kuldeep; S. D. Joshi","SAG, Delhi, India; SAG, Delhi, India; Department of Electrical Engineering, Indian Institute of Technology Delhi, New Delhi, India",IEEE Signal Processing Letters,"5 Feb 2018","2018","25","3","413","416","In 1918, S. Ramanujan defined a family of trigonometric sums now known as Ramanujan sums. In this letter, we define a class of operators based on the Ramanujan sums termed here as Ramanujan class of operators. We then prove that these operators possess properties of first derivative and with a particular shift, of second derivative also. Applications of Ramanujan class of operators for edge detection and noise level estimation are also demonstrated.","1558-2361","","10.1109/LSP.2017.2721966","","https://ieeexplore.ieee.org/stamp/stamp.jsp?arnumber=7964706","Discrete fourier transform;edge detection;noise level estimation;Ramanujan sums (RS)","Image edge detection;Estimation;Noise level;Kernel;Signal processing;Presses","","18","","11","IEEE","30 Jun 2017","","","IEEE","IEEE Journals"
"Fine Virtual View Distortion Estimation Method for Depth Map Coding","Z. Zheng; J. Huo; B. Li; H. Yuan","State Key Laboratory of Integrated Services Networks, Xidian University, Xian, China; State Key Laboratory of Integrated Services Networks, Xidian University, Xian, China; State Key Laboratory of Integrated Services Networks, Xidian University, Xian, China; School of Information Science and Engineering, Shandong University, Jinan, China",IEEE Signal Processing Letters,"5 Feb 2018","2018","25","3","417","421","In three-dimensional (3-D) video coding systems, depth maps represent the geometric information of a 3-D scene. Since depth maps are not displayed to viewers but to generate virtual views, the quality of depth maps needs to be measured by its effect on the virtual view quality, which is indicated by the virtual view distortion (VVD) in depth map coding. In this letter, a fine VVD estimation method is proposed based on the analysis of the VVD. Specifically, the depth distortion of the current pixel, the texture gradient of the colocated color video and the depth distortions of adjacent pixels are all taken into consideration to estimate the VVD accurately. Experimental results demonstrate that the proposed method can improve 13.1% bitrate saving compared with the sum of squared differences based depth distortion calculation method and can improve 1.2% bitrate saving compared with the VVD estimation method in three dimensional high efficiency video coding (3D-HEVC) reference software.","1558-2361","","10.1109/LSP.2017.2723910","NSF of China(grant numbers:61571274); 111 Project(grant numbers:B08038); Shandong Natural Science Funds for Distinguished Young Scholar(grant numbers:JQ201614); Young Scholars Program of Shandong University(grant numbers:2015WLJH39); ","https://ieeexplore.ieee.org/stamp/stamp.jsp?arnumber=7970181","Multiview video plus depth (MVD);rate-distortion optimization (RDO);three dimensional high efficiency video coding (3D-HEVC);3-D video (3DV);virtual view distortion (VVD)","Distortion;Image analysis;Encoding;Estimation;Three-dimensional displays;Color;Image color analysis","","8","","23","IEEE","6 Jul 2017","","","IEEE","IEEE Journals"
"Colocated MIMO Radar SINR Maximization Under ISL and PSL Constraints","S. Imani; M. M. Nayebi; S. A. Ghorashi","Department of Electrical Engineering, Sharif University, Tehran, Iran; Department of Electrical Engineering, Sharif University, Tehran, Iran; Department of Electrical Engineering, Shahid Beheshti University, Tehran, Iran",IEEE Signal Processing Letters,"8 Feb 2018","2018","25","3","422","426","This letter considers joint design of transmit waveform and receive filter in colocated multiple-input multiple-output (MIMO) radars in order to enhance target detection performance in the presence of signal-dependent interference. Here, signal-to-interference-plus-noise ratio (SINR) is maximized under the practical constraints of integrated sidelobe level (ISL) and peak sidelobe level (PSL) at the pulse compression output. We have also shown that the joint transmit signal and receive filter design can be formulated as a convex optimization problem, which can be efficiently solved using optimization toolbox (CVX). Simulation results show that our proposed algorithm is able to suppress interference efficiently under ISL and PSL constraints and get close to the SINR efficiency of unconstrained methods.","1558-2361","","10.1109/LSP.2018.2796603","","https://ieeexplore.ieee.org/stamp/stamp.jsp?arnumber=8267026","Filter design;multiple-input multiple-output radar (MIMO);pulse compression;waveform design","Interference;Signal to noise ratio;MIMO radar;Radar antennas;Antenna arrays;Optimization","","34","","16","IEEE","23 Jan 2018","","","IEEE","IEEE Journals"
"Permutation Preference Based Alternate Sampling and Clustering for Motion Segmentation","Y. Zhang; B. Luo; L. Zhang","State Key Laboratory of Information Engineering in Surveying, Mapping and Remote Sensing, Wuhan University, Wuhan, China; State Key Laboratory of Information Engineering in Surveying, Mapping and Remote Sensing, Wuhan University, Wuhan, China; State Key Laboratory of Information Engineering in Surveying, Mapping and Remote Sensing, Wuhan University, Wuhan, China",IEEE Signal Processing Letters,"7 Feb 2018","2018","25","3","432","436","In this letter, permutation preference is used to represent the data points for the linkage clustering to segment the tracking points belonging to different motions. In order to exclude the impact of outliers, an alternate sampling and clustering strategy is performed, that iteratively alternates between sampling the hypotheses within the clusters and clustering the points with the permutation preference. As a result, points with similar permutation preferences are sampled as the hypotheses, and outliers are effectively excluded, thus, making the preferences more distinguishable and improving the clustering. The iterative interaction between sampling and clustering results in a good convergent result. The proposed method obtains robust segmentation results with the Hopkins 155 dataset, which are better than the results obtained by the state-of-the-art methods.","1558-2361","","10.1109/LSP.2017.2777997","National Natural Science Foundation Project(grant numbers:61261130587,61571332); ","https://ieeexplore.ieee.org/stamp/stamp.jsp?arnumber=8120119","Motion segmentation;permutation preference;sampling and clustering","Motion segmentation;Computer vision;Couplings;Shape;Tracking;Image color analysis;Clustering algorithms","","9","","44","IEEE","27 Nov 2017","","","IEEE","IEEE Journals"
"Sparse Circulant Binary Embedding: An Asymptotic Analysis","S. Kim; S. Choi","Department of Computer Science and Engineering, Pohang University of Science and Technology, Pohang, South Korea; Department of Computer Science and Engineering, Pohang University of Science and Technology, Pohang, South Korea",IEEE Signal Processing Letters,"7 Feb 2018","2018","25","3","432","436","Binary embedding refers to methods for embedding points in ℝd into vertices in the Hamming cube of dimension O(d), such that the normalized Hamming distance between the codes preserves a prespecified distance between vectors in the original space. A common approach to binary embedding is to use random projection, followed by one-bit quantization to produce binary codes. Of particular interest, in this letter, is sparse circulant binary embedding (SCBE), where a sparse random circulant matrix with random sampling at a rate of 1 - s for s E (0, 1) is used for random projection. The SCBE has the space complexity O((1 - s)d), while unstructured random projection has the space complexity O(d2). We present an asymptotic analysis of SCBE, when d approaches ∞, showing that the performance of SCBE is comparable to that of binary embedding with unstructured random projection whilethe former has the space complexity O((1 - s)d) and the time complexity O(d log d) but the latter has both space and time complexities O(d2).","1558-2361","","10.1109/LSP.2018.2794768","NAVER; ","https://ieeexplore.ieee.org/stamp/stamp.jsp?arnumber=8260897","Binary embedding (BE);circulant matrix;locality-sensitive hashing;random projection;sparse embedding","Hamming distance;Sparse matrices;Binary codes;Time complexity;Convergence;Quantization (signal)","","","","17","IEEE","17 Jan 2018","","","IEEE","IEEE Journals"
"Ultrasound Image Improvement by Code Bit Elongation","I. Trots; A. Nowicki; M. Postema","Institute of Fundamental Technological Research of the Polish Academy of Sciences, Warsaw, Poland; Institute of Fundamental Technological Research of the Polish Academy of Sciences, Warsaw, Poland; LE STUDIUM Loire Valley Institute for Advanced Studies, Orléans, France",IEEE Signal Processing Letters,"8 Feb 2018","2018","25","3","437","441","This letter analyses the influence of the transducer bandwidth on the compression and the axial resolution of an ultrasound image. The distortion of an electrical signal visible in the final image is a major problem in ultrasonography. To solve this problem, the bit length in Golay-complementary sequences was elongated, narrowing the fractional bandwidth of the coded sequences. Therefore, more energy of the burst signal could be transferred through the ultrasound transducer. The experimental results obtained for transmission of the complementary Golay-coded sequences with two different bit lengths-one-cycle and two-cycles-have been compared, and the efficiency of the pulse compression and its influence on the axial resolution for two fractional bandwidths have been discussed. The results are presented for two transducers having a fractional bandwidth of 25% and 80% and operating at a 6-MHz frequency. The results obtained show that the elongation of the Golay single bit length (doubled in our case) compensate for the limited transducer bandwidth. Two-dimensional ultrasound images of a tissue-mimicking phantom are presented and demonstrate the benefits of the use of two-cycle bit length.","1558-2361","","10.1109/LSP.2017.2776040","","https://ieeexplore.ieee.org/stamp/stamp.jsp?arnumber=8115266","Coded excitation;Golay sequences;synthetic aperture method;transducer bandwidth;ultrasound imaging","Bandwidth;Transducers;Ultrasonic imaging;Correlation;Matched filters;Image coding;Image resolution","","3","","20","IEEE","20 Nov 2017","","","IEEE","IEEE Journals"
"A Novel Chinese Sign Language Recognition Method Based on Keyframe-Centered Clips","S. Huang; C. Mao; J. Tao; Z. Ye","National Engineering Laboratory for Speech and Language Information Processing, Hefei, Anhui, China; National Engineering Laboratory for Speech and Language Information Processing, Hefei, Anhui, China; National Engineering Laboratory for Speech and Language Information Processing, Hefei, Anhui, China; National Engineering Laboratory for Speech and Language Information Processing, Hefei, Anhui, China",IEEE Signal Processing Letters,"8 Feb 2018","2018","25","3","442","446","Isolated sign language recognition (SLR) is a long-standing research problem. The existing methods consider inclusively ambiguous data to represent a sign and ignore the fact that only scarce key information can represent the sign efficiently since most information are redundant. Furthermore, inclusion of redundant information may result in inefficiency and difficulty in modeling the long-term dependency for SLR. This letter delivers a novel sequence-to-sequence learning method based on keyframe centered clips (KCCs) for Chinese SLR. Different from conventional methods, only key information is considered to represent a sign significantly. The frames-to-word task is transformed into a KCCs-to-subwords task successfully, to allow for different attention in the input data. The empirical results of the proposed method outperform significantly the state-of-the-art SLR systems on our dataset containing 310 Chinese sign language words.","1558-2361","","10.1109/LSP.2018.2797228","Fundamental Research Funds for the Central Universities(grant numbers:WK2350000002); ","https://ieeexplore.ieee.org/stamp/stamp.jsp?arnumber=8267225","Efficient;keyframe centered clip (KCC);key information;sequence-to-sequence;sign language recognition (SLR)","Assistive technology;Gesture recognition;Hidden Markov models;Feature extraction;Trajectory;Task analysis;Adaptation models","","44","","22","IEEE","23 Jan 2018","","","IEEE","IEEE Journals"
"QML-RANSAC Instantaneous Frequency Estimator for Overlapping Multicomponent Signals in the Time-Frequency Plane","I. Djurović","University of Montenegro, Podgorica, Montenegro",IEEE Signal Processing Letters,"8 Feb 2018","2018","25","3","447","451","Effective quasi maximum likelihood - random samples consensus algorithm is proposed for the instantaneous frequency (IF) estimation of overlapping signals in the time-frequency (TF) plane. The proposed algorithm is tested on signal with five overlapping components. The IF estimation accuracy is excellent with signal-to-noise ratio threshold below 0 dB.","1558-2361","","10.1109/LSP.2018.2795554","","https://ieeexplore.ieee.org/stamp/stamp.jsp?arnumber=8263623","Instantaneous frequency (IF);quasi maximum likelihood (QML);random samples consensus (RANSAC);short-time Fourier transform (STFT)","Signal processing algorithms;Frequency modulation;Signal to noise ratio;Maximum likelihood estimation;Frequency estimation;Time-frequency analysis","","49","","43","IEEE","22 Jan 2018","","","IEEE","IEEE Journals"
"Underdetermined Direct Localization of Emitters Based on Spatio-Temporal Processing","M. Chen; X. Mao; X. Long; L. Xin","School of Electronics and Information Engineering, Harbin Institute of Technology, Harbin, China; School of Electronics and Information Engineering, Harbin Institute of Technology, Harbin, China; Science and Technology on Electronic Information Control Laboratory, Chengdu, China; School of Electronics and Information Engineering, Harbin Institute of Technology, Harbin, China",IEEE Signal Processing Letters,"9 Feb 2018","2018","25","3","452","456","Without maintaining the internal constraint of the received data, conventional two-step passive localization methods are considered to be suboptimal. Following the thought of direct processing, a novel localization method based on the information of time-difference-of-arrival and angle-of-arrival (AOA) is proposed in this letter. Similar to other direct localization algorithms, the proposed method does not require the procedure of data association. By taking advantages of the spatio-temporal processing, the proposed method can handle the underdetermined scenario (i.e., the number of emitters exceeds the number of sensors from all the stations) without the prior knowledge about the number of emitters. Compared with the localization algorithms based on AOA only, the proposed method has superior performance on the condition of low signal-to-noise ratio and large bandwidth.","1558-2361","","10.1109/LSP.2018.2799224","National Natural Science Foundation of China(grant numbers:61171180); ","https://ieeexplore.ieee.org/stamp/stamp.jsp?arnumber=8272392","Direct processing;passive localization;spatio-temporal processing;underdetermined scenario","Signal processing algorithms;Sensors;Signal to noise ratio;Bandwidth;Indexing;Time difference of arrival","","3","","17","IEEE","30 Jan 2018","","","IEEE","IEEE Journals"
"SPL EDICS","",,IEEE Signal Processing Letters,"21 Feb 2018","2018","25","3","457","457","Presents the EDICS (Editors' information classification scheme) subject categories for this issue of the publication.","1558-2361","","10.1109/LSP.2018.2806631","","https://ieeexplore.ieee.org/stamp/stamp.jsp?arnumber=8299613","","","","","","","IEEE","21 Feb 2018","","","IEEE","IEEE Journals"
"IEEE Signal Processing Letters information for authors","",,IEEE Signal Processing Letters,"21 Feb 2018","2018","25","3","458","459","These instructions give guidelines for preparing papers for this publication. Presents information for authors publishing in this journal.","1558-2361","","10.1109/LSP.2018.2806633","","https://ieeexplore.ieee.org/stamp/stamp.jsp?arnumber=8299627","","","","","","","IEEE","21 Feb 2018","","","IEEE","IEEE Journals"
