"Riemann–Langevin Particle Filtering in Track-Before-Detect","F. J. I. Garcia; P. K. Mandal; M. Bocquel; A. G. Marques","Department of Signal Theory and Communications, King Juan Carlos University, Mstoles, Spain; Faculty of Electrical Engineering, University of Twente, Enschede, NB, The Netherlands; Faculty of Electrical Engineering, University of Twente, Enschede, NB, The Netherlands; Department of Signal Theory and Communications, King Juan Carlos University, Mstoles, Spain",IEEE Signal Processing Letters,"12 Jun 2018","2018","25","7","1039","1043","Track-before-detect (TBD) is a powerful approach that consists in providing the tracker directly with the sensor measurements without any predetection. Due to the measurement model nonlinearities, online state estimation in TBD is most commonly solved via particle filtering. Existing particle filters for TBD do not incorporate measurement information in their proposal distribution. The Langevin Monte Carlo (LMC) is a sampling method whose proposal is able to exploit all available knowledge of the posterior (that is, both prior and measurement information). This letter synthesizes recent advances in differential-geometric LMC-based filtering to introduce its application to TBD. The benefits of LMC filtering in TBD are illustrated in a challenging low-noise scenario.","1558-2361","","10.1109/LSP.2018.2841507","Spanish Ministerio de conomía y competitividad(grant numbers:TEC2013-41604-R,TEC2016-75361-R); TRAX project from the Seventh Framework Programme(grant numbers:Nº607400); ","https://ieeexplore.ieee.org/stamp/stamp.jsp?arnumber=8368123","Langevin Monte Carlo (LMC);particle filter (PF);track-before-detect (TBD)","Proposals;Monte Carlo methods;Atmospheric measurements;Particle measurements;Mathematical model;Markov processes;Noise measurement","","10","","18","IEEE","28 May 2018","","","IEEE","IEEE Journals"
"Ensemble One-Dimensional Convolution Neural Networks for Skeleton-Based Action Recognition","Y. Xu; J. Cheng; L. Wang; H. Xia; F. Liu; D. Tao","School of Electronic Engineering, Guangxi Normal University, Guilin, China; Guangdong Provincial Key Laboratory of Robotics and Intelligent System, Shenzhen Institutes of Advanced Technology, Chinese Academy of Sciences, Shenzhen, China; Guangdong Provincial Key Laboratory of Robotics and Intelligent System, Shenzhen Institutes of Advanced Technology, Chinese Academy of Sciences, Shenzhen, China; School of Electronic Engineering, Guangxi Normal University, Guilin, China; College of Computer Science and Software Engineering, Shenzhen University, Shenzhen, China; School of Information Science and Engineering, Yunnan University, Kunming, China",IEEE Signal Processing Letters,"13 Jun 2018","2018","25","7","1044","1048","This letter proposes an ensemble neural network (Ensem-NN) for skeleton-based action recognition. The Ensem-NN is introduced based on the idea of ensemble learning, “two heads are better than one.” According to the property of skeleton sequences, we design one-dimensional convolution neural network with residual structure as Base-Net. From entirety to local, from focus to motion, we designed four different subnets based on the Base-Net to extract diverse features. The first subnet is a Two-stream Entirety Net , which performs on the entirety skeleton and explores both temporal and spatial features. The second is a Body-part Net, which can extract fine-grained spatial and temporal features. The third is an  Attention Net, in which a channel-wised attention mechanism can learn important frames and feature channels. Frame-difference Net, as the fourth subnet, aims at exploring motion features. Finally, the four subnets are fused as one ensemble network. Experimental results show that the proposed Ensem-NN performs better than state-of-the-art methods on three widely used datasets.","1558-2361","","10.1109/LSP.2018.2841649","National Natural Science Foundation of China(grant numbers:61772508,U1713213,61762014,61775175,61673192); Shenzhen Technology Project(grant numbers:JCYJ20170413152535587,JCYJ 20170307164023599,JSGG20170823091924128,JSGG20160331185256983,JSGG20160229115709109); CAS Key Technology Talent Program; Guangdong Technology Program(grant numbers:2016B010108010,2016B010125003,2017B010110007); Shenzhen Engineering Laboratory for 3-D Content Generating Technologies(grant numbers:[2017] 476); Colleges and Universities Key Laboratory of Intelligent Integrated Automation(grant numbers:201502); Key Laboratory of Human–Machine Intelligence-Synergy Systems, Shenzhen Institutes of Advanced Technology, Chinese Academy of Sciences(grant numbers:2014DP173025); ","https://ieeexplore.ieee.org/stamp/stamp.jsp?arnumber=8368136","Action recognition;ensemble neural network (Ensem-NN);skeleton","Feature extraction;Skeleton;Convolution;Neural networks;Two dimensional displays;Three-dimensional displays;Robots","","78","","38","IEEE","28 May 2018","","","IEEE","IEEE Journals"
"Robust Covariance Adaptation in Adaptive Importance Sampling","Y. El-Laham; V. Elvira; M. F. Bugallo","Department of Electrical and Computer Engineering, Stony Brook University, New York, NY, USA; IMT Lille Douai & CRIStAL (UMR CNRS 9189), Villeneuve d’Ascq, France; Department of Electrical and Computer Engineering, Stony Brook University, New York, NY, USA",IEEE Signal Processing Letters,"13 Jun 2018","2018","25","7","1049","1053","Importance sampling (IS) is a Monte Carlo methodology that allows for the approximation of a target distribution using weighted samples generated from another proposal distribution. Adaptive importance sampling (AIS) implements an iterative version of IS, which adapts the parameters of the proposal distribution in order to improve estimation of the target. While the adaptation of the location (mean) of the proposals has been largely studied, an important challenge of AIS relates to the difficulty of adapting the scale parameter (covariance matrix). In the case of weight degeneracy, adapting the covariance matrix using the empirical covariance results in a singular matrix, which leads to a poor performance in subsequent iterations of the algorithm. In this letter, we propose a novel scheme which exploits recent advances in the IS literature to prevent the so-called weight degeneracy. The method efficiently adapts the covariance matrix of a population of proposal distributions and achieves a significant performance improvement in high-dimensional scenarios. We validate the new method through computer simulations.","1558-2361","","10.1109/LSP.2018.2841641","ANR(grant numbers:ANR-17-CE40-0031-01); French-American Fulbright Commission under the Fulbright scholarship; National Science Foundation(grant numbers:CCF-1617986); ","https://ieeexplore.ieee.org/stamp/stamp.jsp?arnumber=8368102","Covariance adaptation;importance sampling;Monte Carlo;nonlinear weight transformation;weight degeneracy","Proposals;Covariance matrices;Monte Carlo methods;Artificial intelligence;Sociology;Robustness","","17","","22","IEEE","28 May 2018","","","IEEE","IEEE Journals"
"Self-Paced AutoEncoder","T. Yu; C. Guo; L. Wang; S. Xiang; C. Pan","School of Computer and Control Engineering, University of Chinese Academy of Sciences, Beijing, China; School of Computer and Control Engineering, University of Chinese Academy of Sciences, Beijing, China; National Laboratory of Pattern Recognition, Institute of Automation, Chinese Academy of Sciences, Beijing, China; School of Computer and Control Engineering, University of Chinese Academy of Sciences, Beijing, China; School of Computer and Control Engineering, University of Chinese Academy of Sciences, Beijing, China",IEEE Signal Processing Letters,"13 Jun 2018","2018","25","7","1054","1058","Autoencoder, which learns latent representations of samples in an unsupervised manner, has great potential in computer vision and signal processing. However, the diversity of samples makes learning a component autoencoder remaining a challenging task. This letter proposes a novel Self-Paced AutoEncoder (SPAE) for unsupervised feature extraction. The motivation behind this letter is to take samples gradually from simple to complex into consideration during training, which is similar to the mechanism of knowledge acquisition for humans. Under the unsupervised learning framework constructed on the autoencoder infrastructure, our SPAE first learns a weak autoencoder via samples with small losses and, then, elevates itself to a relatively strong autoencoder through samples with large losses. Then, the SPAE is generalized to a temporal domain, resulting to temporal SPAE (TSPAE), where the temporal information is explored and exploited to improve the performance. Typically, a TSPAE is capable of compressing temporal sequences into temporal-independent data. Experiments on the image classification and action recognition demonstrate the effectiveness of SPAE and TSPAE.","1558-2361","","10.1109/LSP.2018.2843295","National Natural Science Foundation of China(grant numbers:91646207,61573352,61773377); ","https://ieeexplore.ieee.org/stamp/stamp.jsp?arnumber=8370666","Autoencoder (AE);self-paced learning (SPL);temporal encoding (TE);video analysis","Training;Image reconstruction;Optimization;Task analysis;Feature extraction;Signal processing;Unsupervised learning","","18","","29","IEEE","1 Jun 2018","","","IEEE","IEEE Journals"
"Saliency Detection by Adaptive Channel Fusion","K. Huang; C. Zhu; G. Li","School of Electronic and Computer Engineering Shenzhen Graduate School, Peking University, Shenzhen, China; School of Electronic and Computer Engineering Shenzhen Graduate School, Peking University, Shenzhen, China; School of Electronic and Computer Engineering Shenzhen Graduate School, Peking University, Shenzhen, China",IEEE Signal Processing Letters,"14 Jun 2018","2018","25","7","1059","1063","Saliency detection has received tremendous attention from the research community and has become an increasingly important preprocessing tool in many computer vision tasks, such as object recognition. Saliency detection in the frequency domain possesses great advantages compared with that in the spatial domain due to its computational efficiency and succinct model design. Many excellent frequency domain based models, such as SR, phase spectrum of quaternion Fourier transform, hypercomplex Fourier transform (HFT), have made great progress in predicting human eye fixations. However, there still exists a vital drawback among them-ignoring the different contributions of image channels to saliency detection. In our observation, chrominance component of an image may play an unequally important role as luminance component in different situations. In this letter, we propose a frequency domain based framework, which exploits HFT-based saliency algorithm and finds a way to weigh the importance of different channels in saliency detection across space. In the first step, saliency maps corresponding to different channels are generated independently. In the second step, a combination of both saliency maps is performed using an adaptive entropy-based uncertainty weighting approach. We provide an extensive evaluation and show that our proposed method outperforms nine outstanding eye fixation prediction models on four most commonly-used datasets.","1558-2361","","10.1109/LSP.2018.2830755","National Natural Science Foundation of China(grant numbers:U1611461); Shenzhen Peacock Plan(grant numbers:20130408,183003656); ","https://ieeexplore.ieee.org/stamp/stamp.jsp?arnumber=8350306","Eye fixation model;frequency domain;saliency detection","Saliency detection;Uncertainty;Frequency-domain analysis;Computational modeling;Fourier transforms;Signal processing algorithms;Quaternions","","6","","27","IEEE","26 Apr 2018","","","IEEE","IEEE Journals"
"AMI-Net: Convolution Neural Networks With Affine Moment Invariants","Y. Hao; Q. Li; H. Mo; H. Zhang; H. Li","Key Laboratory of Intelligent Information Processing, Institute of Computing Technology, Chinese Academy of Science and University of Chinese Academy of Sciences, Beijing, China; Key Laboratory of Intelligent Information Processing, Institute of Computing Technology, Chinese Academy of Science and University of Chinese Academy of Sciences, Beijing, China; Key Laboratory of Intelligent Information Processing, Institute of Computing Technology, Chinese Academy of Science and University of Chinese Academy of Sciences, Beijing, China; Key Laboratory of Intelligent Information Processing, Institute of Computing Technology, Chinese Academy of Science and University of Chinese Academy of Sciences, Beijing, China; Key Laboratory of Intelligent Information Processing, Institute of Computing Technology, Chinese Academy of Science, Beijing, China",IEEE Signal Processing Letters,"14 Jun 2018","2018","25","7","1064","1068","Affine moment invariant (AMI) is a kind of hand-crafted image feature, which is invariant to affine transformations. This property is precisely what the standard convolution neural network (CNN) is difficult to achieve. In this letter, we present a kind of network architecture to introduce AMI into CNN, which is called AMI-Net. We achieved this by calculating AMI on the feature maps of the hidden layers. These AMIs will be concatenated with the standard CNN's FC layer to determine the network's final output. By calculating AMI on the feature maps, we can not only extend the dimension of AMIs, but also introduce affine transformation invariant into CNN. Two network architectures and training strategies of AMI-Net are illuminated, one is two-stage, and the other is end-to-end. To prove the effectiveness of the AMI-Net, several experiments have been conducted on common image datasets, MNIST, MNIST-rot, affNIST, SVHN, and CIFAR-10. By comparing with the corresponding standard CNN, respectively, we verify the validity of AMI-net.","1558-2361","","10.1109/LSP.2018.2843296","National Key R&D Program of China(grant numbers:2017YFB1002703); National Science Foundation of China(grant numbers:61379082,61227802); ","https://ieeexplore.ieee.org/stamp/stamp.jsp?arnumber=8370715","Affine moment invariants (AMIs);convolution neural network (CNN);transformation;invariant","Training;Convolution;Neural networks;Standards;Computer vision;Task analysis;Network architecture","","14","","30","IEEE","1 Jun 2018","","","IEEE","IEEE Journals"
"Adaptive Matrix Sketching and Clustering for Semisupervised Incremental Learning","Z. Zhang; Y. Li; Z. Zhang; C. Jin; M. Gao","Beijing Institute of Technology, Beijing, China; Beijing Institute of Technology, Beijing, China; Beijing Institute of Technology, Beijing, China; Beijing Institute of Technology, Beijing, China; Beijing Institute of Technology, Beijing, China",IEEE Signal Processing Letters,"14 Jun 2018","2018","25","7","1069","1073","Semisupervised incremental learning is the task of classifying data streams with partially labeled data when annotation information is difficult to obtain. Besides the sequential learning manner and lack of label information, multiple novel classes and concept drift may emerge from incremental learning. Most previous studies have only considered these problems in part. To tackle challenges involved in semisupervised incremental learning, an adaptive matrix sketching and clustering method is proposed in this letter, which cohesively and adaptively classifies known classes, identifies multiple novel classes, and updates the learning model. Experiments were conducted to evaluate this method on three benchmark datasets, containing various data types, including network attack analysis, the geospatial information of forests, and images of handwritten numbers. Results validated the effectiveness of our proposed method and its superiority over many previous studies.","1558-2361","","10.1109/LSP.2018.2843281","National Natural Science Foundation of China(grant numbers:61501033); Fundamental Research Funds for the Central Universities(grant numbers:2017RC02); ","https://ieeexplore.ieee.org/stamp/stamp.jsp?arnumber=8370674","Incremental learning;matrix sketching;semisupervised classification","Neural networks;Feature extraction;Data models;Matrix decomposition;Support vector machines;Clustering methods;Adaptation models","","13","1","28","IEEE","1 Jun 2018","","","IEEE","IEEE Journals"
"Circumferential Binary Feature Extraction and Matching Search Algorithms","Z. Zhang; D. Yang; M. Lian","Research and Development Center, Chinese Academy of Sciences, Shenyang, China; Research and Development Center, Shenyang Institute of Computing Technology, Chinese Academy of Sciences, Shenyang, China; Research and Development Center, Chinese Academy of Sciences, Shenyang, China",IEEE Signal Processing Letters,"15 Jun 2018","2018","25","7","1074","1078","Binary features allow for the effective comparison, fast calculation, and compact storage in image matching and localization. Binary feature extraction algorithms, however, tend to have poor mirror invariance, and search algorithms that match binary features have a lower inlier ratio. To address these issues, we employ a scale space pyramid to simulate human eye imaging and then detect FAST (FAST feature detector) points at each level in the pyramid and calculate the FAST point feature's orientation with an image intensity centroid. We propose circumferential binary string mirror invariance rules and a circumferential binary feature (CBF) extraction algorithm to enhance the mirror invariance of binary features, and a fast calculate bitmap (FCBM) algorithm and bitmap local sensitive hash (BMLSH) to improve the inlier ratio of matching binary features. Experiments show that the CBF performs well in mirror invariance and has stronger adaptability and that BMLSH searches inliers more efficiently.","1558-2361","","10.1109/LSP.2018.2820645","“Core electronic devices, high-end generic chips, and basic software” national science and technology major projects(grant numbers:2017ZX01030-201); ","https://ieeexplore.ieee.org/stamp/stamp.jsp?arnumber=8327483","Adaptability;bitmap local sensitive hash;circumferential binary feature;mirror invariance","Mirrors;Feature extraction;Signal processing algorithms;Interpolation;Indexes;Clustering algorithms;Image retrieval","","1","","16","IEEE","28 Mar 2018","","","IEEE","IEEE Journals"
"Directional Emphasis in Ambisonics","W. B. Kleijn","Victoria University of Wellington, Wellington, New Zealand",IEEE Signal Processing Letters,"15 Jun 2018","2018","25","7","1079","1083","We describe an ambisonics enhancement method that increases the signal strength in specified directions at a low-computational cost. The method can be used in a static setup to emphasize the signal arriving from a particular direction or set of directions. It can also be used in an adaptive arrangement where it sharpens directionality and reduces the distortion in timbre associated with low-degree ambisonics representations. The emphasis operator has a very low-computational complexity and can be applied to time domain as well as time-frequency ambisonics representations. The operator upscales a low-degree ambisonics representation to a higher degree representation.","1558-2361","","10.1109/LSP.2018.2841652","","https://ieeexplore.ieee.org/stamp/stamp.jsp?arnumber=8368153","Ambisonics;directionality;emphasis","Harmonic analysis;Time-domain analysis;Time-frequency analysis;Rendering (computer graphics);Loudspeakers;Computational complexity","","3","","16","IEEE","28 May 2018","","","IEEE","IEEE Journals"
"Gamma-Correction-Based Visibility Restoration for Single Hazy Images","M. Ju; C. Ding; D. Zhang; Y. J. Guo","School of Internet of Things, Nanjing University of Posts and Telecommunications, Nanjing, China; Global Big Data Technologies Centre, University of Technology Sydney, Ultimo, N.S.W., Australia; School of Internet of Things, Nanjing University of Posts and Telecommunications, Nanjing, China; Global Big Data Technologies Centre, University of Technology Sydney, Ultimo, N.S.W., Australia",IEEE Signal Processing Letters,"20 Jun 2018","2018","25","7","1084","1088","In this letter, a concise gamma-correction-based dehazing model (GDM) is proposed. This GDM explicitly describes the inner relationship between the gamma correction (GC) and the traditional scattering model. Combined with the existing priori constraints, GDM is further approximated into a one-dimensional (1-D) function to seek the only unknown constant that is used for haze removal. Using the determined constant, the scene albedo can be recovered, eliminating the haze from single hazy images. The proposed GDM is able to suppress the halo/blocking artifacts in the recovered results due to the scene albedo, which is less sensitive to the determined constant. Simulation results on different types of benchmark images verify that the proposed technique outperforms state-of-the-art methods in terms of both recovery, quality, and real-time performance.","1558-2361","","10.1109/LSP.2018.2839580","Research Innovation Program for College Graduates of Jiangsu Province(grant numbers:KYLX16 0665); National Natural Science Foundation of China(grant numbers:61571241); Major Projects of Jiangsu Province University Natural Science Research(grant numbers:15KJA510002); ","https://ieeexplore.ieee.org/stamp/stamp.jsp?arnumber=8362729","Dehazing model;gamma correction;haze removal;image prior;maximum contrast","Image restoration;Atmospheric modeling;Mathematical model;Image color analysis;Scattering;Image edge detection;Brightness","","65","","23","IEEE","22 May 2018","","","IEEE","IEEE Journals"
"A Constrained Radial Agglomerative Clustering Algorithm for Efficient Structure From Motion","K. Sun; W. Tao","Hubei Key Laboratory of Intelligent Geo-Information Processing, School of Computer Science, China University of Geosciences, Wuhan, China; National Key Laboratory of Science and Technology on Multi-spectral Information Processing, School of Automation, Huazhong University of Science and Technology, Wuhan, China",IEEE Signal Processing Letters,"20 Jun 2018","2018","25","7","1089","1093","Building three-dimensional models effectively and accurately is an important issue. In this letter, a new image set partition method for efficient structure from motion (SfM) from a set of unevenly distributed images is proposed. Given the largest connected component in the image matching graph, we first reconstruct a base model from a set of images with large overlap and sufficient feature correspondences. Then, a novel constrained radial agglomerative clustering algorithm is proposed to divide the remaining images, so that each image cluster could be independently added to the base model in parallel. Finally, all the partial models are merged into a complete scene. Experiment results show that the proposed method works better than the popular normalized-cuts-based SfM method.","1558-2361","","10.1109/LSP.2018.2839022","Fundamental Research Funds for the Central Universities(grant numbers:CUG170675); Open Research Project of The Hubei Key Laboratory of Intelligent Geo-Information Processing(grant numbers:KLIGIP-2017B04); National Natural Science Foundation of China(grant numbers:61772213,91748204,2017010201010121); ","https://ieeexplore.ieee.org/stamp/stamp.jsp?arnumber=8361473","Radial agglomerative clustering;structure from motion (SfM)","Kernel;Image reconstruction;Clustering algorithms;Solid modeling;Signal processing algorithms;Three-dimensional displays;Computational modeling","","22","","26","IEEE","21 May 2018","","","IEEE","IEEE Journals"
