"Document Title",Authors,"Author Affiliations","Publication Title",Date Added To Xplore,"Publication Year","Volume","Issue","Start Page","End Page","Abstract","ISSN",ISBNs,"DOI",Funding Information,PDF Link,"Author Keywords","IEEE Terms","Mesh_Terms",Article Citation Count,Patent Citation Count,"Reference Count","License",Online Date,Issue Date,"Meeting Date","Publisher",Document Identifier
"Front Cover","",,IEEE Signal Processing Letters,"21 Feb 2018","2018","25","3","C1","C1","Presents the front cover for this issue of the publication.","1558-2361","","10.1109/LSP.2018.2807658","","https://ieeexplore.ieee.org/stamp/stamp.jsp?arnumber=8299631","","","","","","","IEEE","21 Feb 2018","","","IEEE","IEEE Journals"
"IEEE Signal Processing Society Editorial Board","",,IEEE Signal Processing Letters,"21 Feb 2018","2018","25","3","C2","C2","Presents a listing of the editorial board, board of governors, current staff, committee members, and/or society editors for this issue of the publication.","1558-2361","","10.1109/LSP.2018.2807659","","https://ieeexplore.ieee.org/stamp/stamp.jsp?arnumber=8299605","","","","","","","IEEE","21 Feb 2018","","","IEEE","IEEE Journals"
"Table of Contents","",,IEEE Signal Processing Letters,"21 Feb 2018","2018","25","3","319","320","Presents the table of contents for this issue of the publication.","1558-2361","","10.1109/LSP.2018.2797399","","https://ieeexplore.ieee.org/stamp/stamp.jsp?arnumber=8299607","","","","","","","IEEE","21 Feb 2018","","","IEEE","IEEE Journals"
"Table of Contents [Edics]","",,IEEE Signal Processing Letters,"21 Feb 2018","2018","25","3","321","322","Presents the table of contents for this issue of the publication.","1558-2361","","10.1109/LSP.2018.2797400","","https://ieeexplore.ieee.org/stamp/stamp.jsp?arnumber=8299643","","","","","","","IEEE","21 Feb 2018","","","IEEE","IEEE Journals"
"Emerging From Water: Underwater Image Color Correction Based on Weakly Supervised Color Transfer","C. Li; J. Guo; C. Guo","School of Electrical and Information Engineering, Tianjin University, Tianjin, China; School of Electrical and Information Engineering, Tianjin University, Tianjin, China; School of Electrical and Information Engineering, Tianjin University, Tianjin, China",IEEE Signal Processing Letters,"26 Jan 2018","2018","25","3","323","327","Underwater vision suffers from severe effects due to selective attenuation and scattering when light propagates through water. Such degradation not only affects the quality of underwater images, but limits the ability of vision tasks. Different from existing methods that either ignore the wavelength dependence on the attenuation or assume a specific spectral profile, we tackle color distortion problem of underwater images from a new view. In this letter, we propose a weakly supervised color transfer method to correct color distortion. The proposed method relaxes the need for paired underwater images for training and allows the underwater images being taken in unknown locations. Inspired by cycle-consistent adversarial networks, we design a multiterm loss function including adversarial loss, cycle consistency loss, and structural similarity index measure loss, which makes the content and structure of the outputs same as the inputs, meanwhile the color is similar to the images that were taken without the water. Experiments on underwater images captured under diverse scenes show that our method produces visually pleasing results, even outperforms the state-of-the-art methods. Besides, our method can improve the performance of vision tasks.","1558-2361","","10.1109/LSP.2018.2792050","National Key Basic Research Program of China(grant numbers:2014CB340403); National Natural Science Foundation of China(grant numbers:61771334); ","https://ieeexplore.ieee.org/stamp/stamp.jsp?arnumber=8253820","Color casts;color correction;color transfer;Generative Adversarial Networks (GANs);underwater image","Image color analysis;Atmospheric modeling;Training;Visualization;Loss measurement;Scattering","","460","","41","IEEE","11 Jan 2018","","","IEEE","IEEE Journals"
"On Identifiability of Nonnegative Matrix Factorization","X. Fu; K. Huang; N. D. Sidiropoulos","School of Electrical Engineering and Computer Science, Oregon State University, Corvallis; School of Electrical Engineering and Computer Science, Oregon State University, Corvallis; School of Electrical Engineering and Computer Science, Oregon State University, Corvallis",IEEE Signal Processing Letters,"1 Feb 2018","2018","25","3","328","332","In this letter, we propose a new identification criterion that guarantees the recovery of the low-rank latent factors in the nonnegative matrix factorization (NMF) generative model, under mild conditions. Specifically, using the proposed criterion, it suffices to identify the latent factors if the rows of one factor are sufficiently scattered over the nonnegative orthant, while no structural assumption is imposed on the other factor except being full-rank. This is by far the mildest condition under which the latent factors are provably identifiable from the NMF model.","1558-2361","","10.1109/LSP.2018.2789405","National Science Foundation(grant numbers:ECCS-1608961,IIS-1447788); ","https://ieeexplore.ieee.org/stamp/stamp.jsp?arnumber=8253847","Convex analysis;identifiability;nonnegative matrix factorization (NMF);sufficiently scattered","Matrix decomposition;Indexes;Data models;Sensors;Hyperspectral sensors;US Government;Science - general","","74","","32","IEEE","11 Jan 2018","","","IEEE","IEEE Journals"
"Low-Rank Regularized Heterogeneous Tensor Decomposition for Subspace Clustering","J. Zhang; X. Li; P. Jing; J. Liu; Y. Su","School of Electronics and Information Engineering, Tianjin University, Tianjin, China; School of Electronics and Information Engineering, Tianjin University, Tianjin, China; School of Electronics and Information Engineering, Tianjin University, Tianjin, China; School of Electronics and Information Engineering, Tianjin University, Tianjin, China; School of Electronics and Information Engineering, Tianjin University, Tianjin, China",IEEE Signal Processing Letters,"1 Feb 2018","2018","25","3","333","337","This letter proposes a low-rank regularized heterogeneous tensor decomposition (LRRHTD) algorithm for subspace clustering, in which various constrains in different modes are incorporated to enhance the robustness of the proposed model. Specifically, due to the presence of noise and redundancy in the original tensor, LRRHTD seeks a set of orthogonal factor matrices for all but the last mode to map the high-dimensional tensor into a low-dimensional latent subspace. Furthermore, by imposing a low-rank constraint on the last mode, which is relaxed by using a nuclear norm, the lowest rank representation that reveals the global structure of samples is obtained for the purpose of clustering. We develop an effective algorithm based on the augmented Lagrange multiplier to optimize our model. Experiments on two public datasets demonstrate that our method reaches convergence within a small number of iterations and achieves promising results in comparison with the state of the arts.","1558-2361","","10.1109/LSP.2017.2748604","National Natural Science Foundation of China(grant numbers:61572356,61303208,61701341); ","https://ieeexplore.ieee.org/stamp/stamp.jsp?arnumber=8025385","Low-rank;subspace clustering;tensor decomposition","Tensile stress;Signal processing algorithms;Matrix decomposition;Clustering algorithms;Robustness;Sparse matrices;Algorithm design and analysis","","39","","34","IEEE","4 Sep 2017","","","IEEE","IEEE Journals"
"DNN Uncertainty Propagation Using GMM-Derived Uncertainty Features for Noise Robust ASR","K. Nathwani; E. Vincent; I. Illina","Indian Institute of Technology, India; Inria, Villers-lès-Nancy, France; LORIA, Université de Lorraine, UMR 7503, Vandœuvre-lès-Nancy, France",IEEE Signal Processing Letters,"1 Feb 2018","2018","25","3","338","342","The uncertainty decoding framework is known to improve the deep neural network (DNN)-based automatic speech recognition (ASR) performance in noisy environments. It operates by estimating the statistical uncertainty about the input features and propagating it to the output senone posteriors by sampling. Unfortunately, this approximate propagation scheme limits the performance improvement. In this letter, we exploit the fact that uncertainty propagation can be achieved in closed form for Gaussian mixture acoustic models (GMMs). We introduce new GMM-derived (GMMD) uncertainty features for the robust DNN-based acoustic model training and decoding. The GMMD features are computed as the difference between the GMM log-likelihoods obtained with versus without uncertainty. They are concatenated with conventional acoustic features and used as inputs to the DNN. We evaluate the resulting ASR performance on the CHiME-2 and CHiME-3 datasets. The proposed features are shown to improve the performance on both datasets, both for the conventional decoding and for the uncertainty decoding with different uncertainty estimation/propagation techniques.","1558-2361","","10.1109/LSP.2018.2791534","Bpifrance (FUI voiceHome); Scientific Interest Group hosted by Inria; ","https://ieeexplore.ieee.org/stamp/stamp.jsp?arnumber=8252723","DNN acoustic model;GMM-derived uncertainty features;robust ASR;uncertainty decoding","Uncertainty;Acoustics;Noise measurement;Maximum likelihood decoding;Computational modeling;Training","","6","","35","IEEE","9 Jan 2018","","","IEEE","IEEE Journals"
"On Deterministic Sampling Patterns for Robust Low-Rank Matrix Completion","M. Ashraphijuo; V. Aggarwal; X. Wang","Department of Electrical Engineering, Columbia University, New York, NY, USA; School of Industrial Engineering, Purdue University, West Lafayette, IN, USA; Department of Electrical Engineering, Columbia University, New York, NY, USA",IEEE Signal Processing Letters,"1 Feb 2018","2018","25","3","343","347","In this letter, we study the deterministic sampling patterns for the completion of low-rank matrix, when corrupted with a sparse noise, also known as robust matrix completion. We extend the recent results on the deterministic sampling patterns in the absence of noise based on the geometric analysis on the Grassmannian manifold. A special case where each column has a certain number of noisy entries is considered, where our probabilistic analysis performs very efficiently. Furthermore, assuming that the rank of the original matrix is not given, we provide an analysis to determine if the rank of a valid completion is indeed the actual rank of the data corrupted with sparse noise by verifying some conditions.","1558-2361","","10.1109/LSP.2017.2780983","National Science Foundation(grant numbers:CIF1064575); Office of Naval Research(grant numbers:N000141410667); ","https://ieeexplore.ieee.org/stamp/stamp.jsp?arnumber=8169042","Deterministic guarantees;probabilistic guarantees;robust matrix completion;sampling pattern;sparse noise","Sparse matrices;Noise measurement;Probabilistic logic;Robustness;Manifolds;Electronic mail;Signal processing algorithms","","15","","19","IEEE","7 Dec 2017","","","IEEE","IEEE Journals"
"Phase Retrieval From Binary Measurements","S. Mukherjee; C. S. Seelamantula","Department of Electrical Engineering, Indian Institute of Science, Bengaluru, India; Department of Electrical Engineering, Indian Institute of Science, Bengaluru, India",IEEE Signal Processing Letters,"5 Feb 2018","2018","25","3","348","352","We consider the problem of signal reconstruction from quadratic measurements that are encoded as +1 or -1 depending on whether they exceed a predetermined positive threshold or not. Binary measurements are fast to acquire and inexpensive in terms of hardware. We formulate the problem of signal reconstruction using a consistency criterion, wherein one seeks to find a signal that is in agreement with the acquired measurements. To enforce consistency, we construct a convex cost using a one-sided quadratic penalty and minimize it using an iterative accelerated projected gradient-descent technique. The projected gradient-descent (PGD) scheme reduces the cost function in each iteration, whereas incorporating momentum into PGD, notwithstanding the lack of such a descent property, exhibits faster convergence than PGD empirically. We refer to the resulting algorithm as binary phase retrieval (BPR). Considering additive white noise contamination prior to quantization, we also derive the Cramér-Rao Bound (CRB) for the binary encoding model. Experimental results demonstrate that the BPR algorithm yields a signal-to-reconstruction error ratio (SRER) of approximately 25 dB in the absence of noise. In the presence of noise prior to quantization, the SRER is within 2 to 3 dB of the CRB.","1558-2361","","10.1109/LSP.2018.2791102","","https://ieeexplore.ieee.org/stamp/stamp.jsp?arnumber=8249796","Accelerated projected gradient-descent (APGD);binary phase retrieval (BPR);consistent reconstruction;Cramér–Rao Bound (CRB);lifting","Business process re-engineering;Pollution measurement;Phase measurement;Signal processing algorithms;Quantization (signal);Encoding;Signal reconstruction","","10","","54","IEEE","8 Jan 2018","","","IEEE","IEEE Journals"
"Low-Complexity Optimal Hard Decision Fusion Under the Neyman–Pearson Criterion","M. F. Rahaman; M. Z. A. Khan","Indian Institute of Technology Hyderabad, Sangareddy, India; Indian Institute of Technology Hyderabad, Sangareddy, India",IEEE Signal Processing Letters,"1 Feb 2018","2018","25","3","353","357","The design of the optimal nonrandomized hard decision fusion rule under the Neyman-Pearson criterion is known to be exponential in complexity. In this letter, we formulate a more generalized version of this problem called the “generalized decision fusion problem (GDFP)” and relate it to the classical 0-1 knapsack problem. Consequently, we show that the GDFP has a worst-case polynomial time solution. Numerical results are presented to verify the effectiveness of the proposed solution.","1558-2361","","10.1109/LSP.2017.2766245","Visvesvarya YFRF; Miety; ","https://ieeexplore.ieee.org/stamp/stamp.jsp?arnumber=8082491","Bayesian;cognitive radio;fusion;knapsack;likelihood ratio (LR);monotonic;multithreshold;Neyman–Pearson (NP)","Complexity theory;Bayes methods;Cognitive radio;Cascading style sheets;Search methods;Optimization;Mathematical model","","13","","46","IEEE","25 Oct 2017","","","IEEE","IEEE Journals"
"Vertex-Frequency Energy Distributions","L. Stanković; E. Sejdić; M. Daković","University of Montenegro, Podgorica, Montenegro; University of Pittsburgh, Pittsburgh, PA, USA; University of Montenegro, Podgorica, Montenegro",IEEE Signal Processing Letters,"1 Feb 2018","2018","25","3","358","362","A vertex-varying spectral content on graphs challenges the assumption of vertex invariance and requires vertex-frequency representations for an adequate analysis. In this letter, we introduce a class of vertex-frequency energy distributions inspired by traditional time-frequency energy distributions. These newly introduced distributions do not use localization windows. Their efficiency in energy concentration is illustrated through examples.","1558-2361","","10.1109/LSP.2017.2764884","","https://ieeexplore.ieee.org/stamp/stamp.jsp?arnumber=8078234","Energy distribution;graph signal processing;graph spectral representation;vertex-frequency","Laplace equations;Signal processing;Time-frequency analysis;Indexes;Artificial neural networks;Smoothing methods;Matrix decomposition","","12","","16","IEEE","23 Oct 2017","","","IEEE","IEEE Journals"
"Locally Linear Embedded Sparse Coding for Spectral Reconstruction From RGB Images","Y. Li; C. Wang; J. Zhao","Ningbo University, Ningbo, China; Ningbo University, Ningbo, China; Ningbo University, Ningbo, China",IEEE Signal Processing Letters,"1 Feb 2018","2018","25","3","363","367","Training-based spectral reconstruction is an efficient, inexpensive technique to recover spectral images from the RGB images captured by trichromatic cameras. Existing methods handle training samples individually without any consideration of local spatial and spectral correlations between samples, which results in high metamerism and inaccurate reconstruction. In this letter, we exploit for the first time the concept of spectral image reconstruction from RGB images with both chromatic and texture priors. We reduce redundancy of the sample set by applying a volume maximization based selection strategy. Taking advantage of the local linearity and sparsity of spectra in dictionary learning, we propose a locally linear embedded sparse reconstruction method taking into account both RGB values of pixels and the features of patch texture. Experimental results show that our method is significantly more accurate than the state-of-the-art methods.","1558-2361","","10.1109/LSP.2017.2776167","National Natural Science Foundation of China(grant numbers:61602268,61603202,61571247); K. C. Wong Magna Fund in Ningbo University; ","https://ieeexplore.ieee.org/stamp/stamp.jsp?arnumber=8116687","Multispectral image;sparse coding;spectral reconstruction","Dictionaries;Image reconstruction;Cameras;Image color analysis;Training;Image resolution;Feature extraction","","25","","31","IEEE","21 Nov 2017","","","IEEE","IEEE Journals"
"Inherently Stable Weighted Least-Squares Estimation of Common Acoustical Poles With the Application in Feedback Path Modeling Utilizing a Kautz Filter","S. Hashemgeloogerdi; M. F. Bocko","Department of Electrical and Computer Engineering, University of Rochester, Rochester, NY, USA; Department of Electrical and Computer Engineering, University of Rochester, Rochester, NY, USA",IEEE Signal Processing Letters,"1 Feb 2018","2018","25","3","368","372","In adaptive feedback cancellation, the feedback path must be modeled precisely using as few adaptive parameters as possible to reduce computational complexity and enable rapid convergence. To reduce the number of adaptive parameters, the feedback path is usually modeled with a transfer function composed of an invariant component and a variable component using all-pole, all-zero, and pole-zero filters. These filters may be inefficient, requiring a large number of parameters for their specification, particularly in reverberant environments. In this letter, we present a weighted least-squares algorithm to precisely estimate the common poles of feedback paths, and we then model the invariant basis functions employing a Kautz filter. The Kautz filter is defined by a set of the fixed poles and a corresponding set of tap output weights. The fixed poles are associated with prominent peaks that are common to the measured feedback path frequency responses. The algorithm guarantees unconditionally the stability of the estimated poles of the inferred model. The experimental results using measured acoustic feedback paths from a two-microphone, behind-the-ear hearing aid show that the proposed method provides an accurate model of the feedback paths for a variety of acoustic environments that were not employed in estimating the common poles.","1558-2361","","10.1109/LSP.2017.2785355","","https://ieeexplore.ieee.org/stamp/stamp.jsp?arnumber=8231177","Common acoustical poles;feedback path (FP) modeling;kautz filter;stability;weighted least-squares (WLS) estimation","Estimation;Computational modeling;Transfer functions;Adaptation models;Acoustics;Signal processing algorithms;Stability analysis","","5","","25","IEEE","20 Dec 2017","","","IEEE","IEEE Journals"
"Low Latency Acoustic Modeling Using Temporal Convolution and LSTMs","V. Peddinti; Y. Wang; D. Povey; S. Khudanpur","Center for Language and Speech Processing and Human Language Technology Center of Excellence, Johns Hopkins University, Baltimore, MD, USA; Center for Language and Speech Processing, Johns Hopkins University, Baltimore, MD, USA; Center for Language and Speech Processing and Human Language Technology Center of Excellence, Johns Hopkins University, Baltimore, MD, USA; Center for Language and Speech Processing and Human Language Technology Center of Excellence, Johns Hopkins University, Baltimore, MD, USA",IEEE Signal Processing Letters,"1 Feb 2018","2018","25","3","373","377","Bidirectional long short-term memory (BLSTM) acoustic models provide a significant word error rate reduction compared to their unidirectional counterpart, as they model both the past and future temporal contexts. However, it is nontrivial to deploy bidirectional acoustic models for online speech recognition due to an increase in latency. In this letter, we propose the use of temporal convolution, in the form of time-delay neural network (TDNN) layers, along with unidirectional LSTM layers to limit the latency to 200 ms. This architecture has been shown to outperform the state-of-the-art low frame rate (LFR) BLSTM models. We further improve these LFR BLSTM acoustic models by operating them at higher frame rates at lower layers and show that the proposed model performs similar to these mixed frame rate BLSTMs. We present results on the Switchboard 300 h LVCSR task and the AMI LVCSR task, in the three microphone conditions.","1558-2361","","10.1109/LSP.2017.2723507","DARPA LORELEI(grant numbers:HR0011-15-2-0024); NSF(grant numbers:CRI-1513128); IARPA(grant numbers:2012-12050800010); ","https://ieeexplore.ieee.org/stamp/stamp.jsp?arnumber=7968318","Acoustic model;long short-term memory (LSTM);recurrent neural networks;time-delay neural networks","Context;Computational modeling;Convolution;Context modeling;Acoustics;Neural networks;Switches","","86","","29","IEEE","4 Jul 2017","","","IEEE","IEEE Journals"
"Accurate Rigid Body Localization via Semidefinite Relaxation Using Range Measurements","J. Jiang; G. Wang; K. C. Ho","Faculty of Electrical Engineering and Computer Science, Ningbo University, Ningbo, China; Faculty of Electrical Engineering and Computer Science, Ningbo University, Ningbo, China; Department of Electrical Engineering and Computer Science, University of Missouri, Columbia, MO, USA",IEEE Signal Processing Letters,"1 Feb 2018","2018","25","3","378","382","In this letter, we propose a method to improve the localization accuracy of a rigid body using the range measurements between the anchors and several sensors mounted on the body. Rigid body localization aims to estimate the rotation matrix and position vector of the sensor array on the body and it is a nonlinear and challenging problem to solve. Through the application of semidefinite relaxation to the original maximum likelihood formulation, we can obtain a coarse estimate of the rotation matrix and position vector that is robust to measurement noise. We next apply orthogonalization and refinement to the estimate and gain back the performance loss from relaxation and approximation. Simulation results show that the proposed method can reach the Cramér–Rao lower bound performance even at high noise levels where existing estimators cannot.","1558-2361","","10.1109/LSP.2017.2779830","National Natural Science Foundation of China(grant numbers:61571249); K. C. Wong Magna Fund in Ningbo University; ","https://ieeexplore.ieee.org/stamp/stamp.jsp?arnumber=8141958","Orthogonalization;rigid body localization;semidefinite relaxation (SDR)","Noise measurement;Rotation measurement;Sensor arrays;Position measurement;Robustness;Two dimensional displays","","32","","17","IEEE","4 Dec 2017","","","IEEE","IEEE Journals"
"Multidimensional Sampling of Isotropically Bandlimited Signals","E. Agrell; B. Csébfalvi","Department of Electrical Engineering, Chalmers University of Technology, Gothenburg, Sweden; Department of Control Engineering and Information Technology, Budapest University of Technology and Economics, Budapest, Hungary",IEEE Signal Processing Letters,"1 Feb 2018","2018","25","3","383","387","A new lower bound on the average reconstruction error variance of multidimensional sampling and reconstruction is presented. It applies to sampling on arbitrary lattices in arbitrary dimensions, assuming a stochastic process with constant, isotropically bandlimited spectrum and reconstruction by the best linear interpolator. The lower bound is exact for any lattice at sufficiently high and low sampling rates. The two threshold rates where the error variance deviates from the lower bound gives two optimality criteria for sampling lattices. It is proved that at low rates, near the first threshold, the optimal lattice is the dual of the best sphere-covering lattice, which for the first time establishes a rigorous relation between optimal sampling and optimal sphere covering. A previously known result is confirmed at high rates, near the second threshold, namely, that the optimal lattice is the dual of the best sphere-packing lattice. Numerical results quantify the performance of various lattices for sampling and support the theoretical optimality criteria.","1558-2361","","10.1109/LSP.2017.2720143","","https://ieeexplore.ieee.org/stamp/stamp.jsp?arnumber=7959129","Lattice theory;multidimensional signal processing;Nyquist rate;sampling theorem;sphere covering;sphere packing;volume visualization","Lattices;FCC;Image reconstruction;Frequency-domain analysis;Stochastic processes;Bandwidth;Standards","","3","","12","IEEE","26 Jun 2017","","","IEEE","IEEE Journals"
