"Adaptive Detection in Distributed Networks Using Maximum Likelihood Detector","A. E. Feitosa; V. H. Nascimento; C. G. Lopes","Department of Electronic Systems Engineering, University of São Paulo, Sao Paulo, Brazil; Department of Electronic Systems Engineering, University of São Paulo, Sao Paulo, Brazil; Department of Electronic Systems Engineering, University of São Paulo, Sao Paulo, Brazil",IEEE Signal Processing Letters,"25 May 2018","2018","25","7","974","978","This letter describes a maximum likelihood distributed detector algorithm with a special initialization that yields an exponential decay rate on error probabilities in transient, using the adaptive diffusion least mean squares (LMS) algorithm in a distributed sensor network. The nodes that compose the network must decide between two concurrent hypotheses concerning the environment where they are inserted, using local measurements and shared estimates coming from their neighbors. It is shown analytically and by simulations that the exponential performance does not depend on the LMS step size, provided it is sufficiently small.","1558-2361","","10.1109/LSP.2018.2832029","FAPESP and EMBRAER(grant numbers:2016/06529-1,GDT0109-15); ","https://ieeexplore.ieee.org/stamp/stamp.jsp?arnumber=8354850","Adaptive networks;distributed detection;exponential decay rate;maximum likelihood (ML) detector","Detectors;Error probability;Maximum likelihood estimation;Transient analysis;Mathematical model;Maximum likelihood detection","","8","","26","IEEE","4 May 2018","","","IEEE","IEEE Journals"
"Distributed Nonlinear System Identification in $\alpha$ -Stable Noise","L. Lu; H. Zhao; B. Champagne","College of Electronics and Information Engineering, Sichuan University, Chengdu, China; School of Electrical Engineering, Southwest Jiaotong University, Chengdu, China; Department of Electrical and Computer Engineering, McGill University, Montreal, Canada",IEEE Signal Processing Letters,"28 May 2018","2018","25","7","979","983","In this letter, a novel diffusion Volterra (DV) algorithm is proposed for distributed in-network system identification in the presence of α-stable noise. The proposed algorithm is based on the logarithmic least mean pth-power criterion, which makes it robust against impulsive interferences, at the price of increased complexity. To overcome this shortcoming, we further develop the diffusion interpolated Volterra algorithm, which provides computational savings and good performance in comparison with the DV algorithm. Simulations results show that the proposed adaptive algorithms achieve better performance than the state-of-the-art approaches for distributed nonlinear system identification in impulsive noise.","1558-2361","","10.1109/LSP.2018.2835763","National Science Foundation of P.R. China(grant numbers:61571374,61271340,61433011); ","https://ieeexplore.ieee.org/stamp/stamp.jsp?arnumber=8357807","Distributed nonlinear network;interpolation;sparse filter; $\alpha$ -stable noise;Volterra filter","Kernel;Signal processing algorithms;Memory management;Complexity theory;Interpolation;Noise measurement","","23","","28","IEEE","11 May 2018","","","IEEE","IEEE Journals"
"Hardware-Oriented Compression of Long Short-Term Memory for Efficient Inference","Z. Wang; J. Lin; Z. Wang","School of Electronic Science and Engineering, Nanjing University, Nanjing, China; School of Electronic Science and Engineering, Nanjing University, Nanjing, China; School of Electronic Science and Engineering, Nanjing University, Nanjing, China",IEEE Signal Processing Letters,"28 May 2018","2018","25","7","984","988","Long short-term memory (LSTM) and its variants have been widely adopted in processing sequential data. However, the intrinsic large memory requirement and high computational complexity make it hard to be employed in embedded systems. This incurs the need of model compression and dedicated hardware accelerator for LSTM. In this letter, efficient clipped gating and top-k pruning schemes are introduced to convert the dense matrix computations in LSTM into structured sparse-matrix-sparse-vector multiplications. Then, mixed quantization schemes are developed to eliminate most of the multiplications in LSTM. The proposed compression scheme is well suited for efficient hardware implementations. Experimental results show that the model size and the number of matrix operations can be reduced by 32× and 18.5×, respectively, at a cost of less than 1% accuracy loss on a word-level language modeling task.","1558-2361","","10.1109/LSP.2018.2834872","National Natural Science Foundation of China(grant numbers:61774082,61604068); Fundamental Research Funds for the Central Universities(grant numbers:021014380065); ","https://ieeexplore.ieee.org/stamp/stamp.jsp?arnumber=8358763","Deep learning;long short-term memory (LSTM);network compression;recurrent neural networks (RNNs)","Computational modeling;Quantization (signal);Computational complexity;Hardware;Sparse matrices;Logic gates;Training","","8","","28","IEEE","14 May 2018","","","IEEE","IEEE Journals"
"Learning-Based Image Reconstruction via Parallel Proximal Algorithm","E. Bostan; U. S. Kamilov; L. Waller","Department of Electrical Engineering & Computer Sciences, University of California, Berkeley, CA, USA; Departments of Computer Science & Engineering and Electrical & Systems Engineering, Washington University in St. Louis, St. Louis, MO, USA; Department of Electrical Engineering & Computer Sciences, University of California, Berkeley, CA, USA",IEEE Signal Processing Letters,"31 May 2018","2018","25","7","989","993","In the past decade, sparsity-driven regularization has led to the advancement of image reconstruction algorithms. Traditionally, such regularizers rely on analytical models of sparsity [e.g., total variation (TV)]. However, more recent methods are increasingly centered around data-driven arguments inspired by deep learning. In this letter, we propose to generalize TV regularization by replacing the 11 -penalty with an alternative prior that is trainable. Specifically, our method learns the prior via extending the recently proposed fast parallel proximal algorithm to incorporate data-adaptive proximal operators. The proposed framework does not require additional inner iterations for evaluating the proximal mappings of the corresponding learned prior. Moreover, our formalism ensures that the training and reconstruction processes share the same algorithmic structure, making the endto-end implementation intuitive. As an example, we demonstrate our algorithm on the problem of deconvolution in a fluorescence microscope.","1558-2361","","10.1109/LSP.2018.2833812","Schweizerischer Nationalfonds zur Förderung der Wissenschaftlichen Forschung(grant numbers:P2ELP2_172278); ","https://ieeexplore.ieee.org/stamp/stamp.jsp?arnumber=8355585","Image reconstruction;inverse problems;iterative shrinkage;learning;statistical modeling","TV;Image reconstruction;Signal processing algorithms;Training;Transforms;Computational modeling;Analytical models","","12","","40","IEEE","7 May 2018","","","IEEE","IEEE Journals"
"On the Observability of a Linear System With a Sparse Initial State","G. Joseph; C. R. Murthy","Department of ECE, the, Indian Institute of Science, Bangalore, India; Department of ECE, the, Indian Institute of Science, Bangalore, India",IEEE Signal Processing Letters,"1 Jun 2018","2018","25","7","994","998","In this letter, we address the problem of observability of a linear dynamical system from compressive measurements and the knowledge of its external inputs. Observability of a high dimensional system state may require a large number of measurements in general, but we show that if the initial state vector admits a sparse representation, the number of measurements can be significantly reduced by using random projections for obtaining the measurements. We derive guarantees for the observability of the system using tools from probability theory and compressed sensing. Our analysis uses properties of the transfer matrix and random measurement matrices to derive concentration of measure bounds, which lead to sufficient conditions for the restricted isometry property of the observability matrix to hold. Hence, under the derived conditions, the initial state can be recovered by solving a computationally tractable convex optimization problem.","1558-2361","","10.1109/LSP.2018.2830966","Ministry of Information Technology, Government of India; Intel India PhD fellowship; ","https://ieeexplore.ieee.org/stamp/stamp.jsp?arnumber=8354720","Compressive sensing;linear dynamical systems;observability;restricted isometry property","Observability;Sparse matrices;Pollution measurement;Mathematical model;Compressed sensing;Linear systems;Random variables","","8","","30","IEEE","4 May 2018","","","IEEE","IEEE Journals"
"On Adaptive Length of Temporal Filter for Space-Time Equalization With Cochannel Interference","Y. Ge; W. Zhang; H. Wang; F. Liu","School of Electronic and Information Engineering, Xi’an Jiaotong University, Xi’an, Shaanxi, P.R. China; School of Electronic and Information Engineering, Xi’an Jiaotong University, Xi’an, Shaanxi, P.R. China; School of Electronic and Information Engineering, Xi’an Jiaotong University, Xi’an, Shaanxi, P.R. China; School of Electronics and Information Engineering, Beihang University, Beijing, P.R. China",IEEE Signal Processing Letters,"1 Jun 2018","2018","25","7","999","1003","In this letter, we take the initiative in adaptively determining the optimal temporal filter (TF) length for space-time equalization (STE) schemes, where overfitting may occur under too large TF length. We specifically consider the system without employing cyclic-prefix such that the spectral efficiency could be maintained. Based on the delicately derived connection between the mean square error (MSE) of equalized training symbols and unknown data symbols, the MSE of the latter can be predicated and serves as the decision metric for determining the optimal TF length. Numerical results demonstrate that the proposed STE scheme with TF of adaptively optimized length can work properly, even in the presence of cochannel interference.","1558-2361","","10.1109/LSP.2018.2834149","National Natural Science Foundation of China(grant numbers:61671366,61231013); Natural Science Basic Research Plan in Shaanxi Province of China(grant numbers:2016JQ6005); Fundamental Research Funds for the Central Universities; ","https://ieeexplore.ieee.org/stamp/stamp.jsp?arnumber=8355776","Adaptive temporal filter (TF) length;co-channel interference;MSE prediction;space-time equalization (STE)","Training;Adaptive equalizers;Interchannel interference;Channel estimation;Receiving antennas","","3","","14","IEEE","7 May 2018","","","IEEE","IEEE Journals"
"Spectrally Constrained Unimodular Sequence Design Without Spectral Level Mask","Y. Jing; J. Liang; D. Zhou; H. C. So","School of Electronics and Information, Northwestern Polytechnical University, Xi’an, China; School of Electronics and Information, Northwestern Polytechnical University, Xi’an, China; School of Electronics and Information, Northwestern Polytechnical University, Xi’an, China; Department of Electronic Engineering, City University of Hong Kong, Hong Kong, China",IEEE Signal Processing Letters,"1 Jun 2018","2018","25","7","1004","1008","Due to the freedom degree loss resulted from the unimodular constraints, it is not easy to specify proper and feasible stopband and passband levels for frequency grids of interest in spectrally constrained sequence design problems. In an attempt to avoid this difficulty, we devise a cost function that minimizes the ratio of the maximal stopband level to the minimal passband level. Next, we introduce auxiliary variables to simplify the optimization problem via decoupling the numerator and denominator. Then, the feasible solution is obtained by approximating the nondifferentiable objective function with a smooth function. We also apply an acceleration scheme to increase the algorithm convergence speed. The effectiveness of the proposed approach is demonstrated via numerical examples.","1558-2361","","10.1109/LSP.2018.2836219","National Natural Science Foundation of China(grant numbers:61471295); Aeronautical Science Foundation of China(grant numbers:20172053017); Central University Funds(grant numbers:G2016KY0308,G2016KY0002,17GH030144); ","https://ieeexplore.ieee.org/stamp/stamp.jsp?arnumber=8358735","Active sensing;sequence design;spectral level","Passband;Acceleration;Convergence;Linear programming;Approximation algorithms;Signal processing algorithms;Shape","","25","","25","IEEE","14 May 2018","","","IEEE","IEEE Journals"
"Video Denoising via Dynamic Video Layering","H. Guo; N. Vaswani","Iowa State University, Ames, IA, USA; Iowa State University, Ames, IA, USA",IEEE Signal Processing Letters,"7 Jun 2018","2018","25","7","1009","1013","Video denoising refers to the problem of removing “noise” from a video sequence. Here, the term “noise” is used in a broad sense to refer to any corruption or outlier or interference that is not the quantity of interest. We develop a novel solution framework, which we call layering denoising (LD), for denoising highly noisy or otherwise corrupted videos that are well modeled as the sum of a low-rank matrix plus a sparse matrix. We show that the performance of existing state-of-the-art denoisers can be significantly improved (especially in large noise settings) if the video is first decomposed into the two layers and the denoiser is applied on each layer separately. Our proposed solution uses a recursive projected compressive sensing (ReProCS) based algorithm for the layering task and video block matching and three-dimensional filtering for denoising each layer. We show the power of our proposed approach, ReProCS-LD, using exhaustive experimental comparisons.","1558-2361","","10.1109/LSP.2018.2833429","Rockwell Collins project on “Novel Machine Learning Approaches for Low-light Image or Video Denoising”; NSF(grant numbers:1509372); ","https://ieeexplore.ieee.org/stamp/stamp.jsp?arnumber=8354718","","Noise reduction;Sparse matrices;Signal processing algorithms;Gaussian noise;Robustness;Principal component analysis;Task analysis","","12","","36","IEEE","4 May 2018","","","IEEE","IEEE Journals"
"Dynamic Asymmetric Power Splitting Scheme for SWIPT-Based Two-Way Multiplicative AF Relaying","Y. Ye; Y. Li; Z. Wang; X. Chu; H. Zhang","State Key Laboratory of Integrated Service Networks, Xidian University, Xi’an, China; State Key Laboratory of Integrated Service Networks, Xidian University, Xi’an, China; State Key Laboratory of Integrated Service Networks, Xidian University, Xi’an, China; Department of Electronic and Electrical Engineering, University of Sheffield, Sheffield, U.K.; State Key Laboratory of Integrated Service Networks, Xidian University, Xi’an, China",IEEE Signal Processing Letters,"7 Jun 2018","2018","25","7","1014","1018","Power splitting (PS) scheme design is one of the most important challenges in simultaneous wireless information and power transfer-based two-way multiplicative amplify-and-forward relay networks. In this letter, we propose a novel dynamic asymmetric PS (DAPS) scheme to minimize the system outage probability by exploiting the asymmetric instantaneous channel gains between the relay node and the destination nodes. As the formulated optimization problem is a nonconvex problem and difficult to solve, we reformulate it as a fractional programming problem and propose a Dinkelbach-based iterative algorithm to obtain the optimal asymmetric PS ratios. Both the analytical and simulation results demonstrate that the proposed DAPS scheme with the same channel state information overhead can significantly reduce the system outage probability as compared with the existing static symmetric PS scheme.","1558-2361","","10.1109/LSP.2018.2839036","National Key Research and Development Program of China(grant numbers:2016YFB1200202); Natural Science Foundation of Shaanxi Province(grant numbers:2017JZ022); Natural Science Foundation of China(grant numbers:61771365); 111 Project of China(grant numbers:B08038); Research Program of Education Bureau of Shaanxi Province(grant numbers:17JK0699); ","https://ieeexplore.ieee.org/stamp/stamp.jsp?arnumber=8361446","Dynamic asymmetric power splitting (DAPS);dinkelbach-based iterative algorithm;simultaneous wireless information and power transfer (SWIPT);two-way multiplicative amplify-and-forward relay","Power system reliability;Probability;Iterative methods;Optimization;Energy harvesting;Relay networks (telecommunications)","","36","","21","IEEE","21 May 2018","","","IEEE","IEEE Journals"
"Densely Connected Discriminative Correlation Filters for Visual Tracking","C. Peng; F. Liu; J. Yang; N. Kasabov","Institute of Image Processing and Pattern Recognition, Shanghai Jiao Tong University, Shanghai, China; Institute of Image Processing and Pattern Recognition, Shanghai Jiao Tong University, Shanghai, China; Institute of Image Processing and Pattern Recognition, Shanghai Jiao Tong University, Shanghai, China; Knowledge Engineering and Discovery Research Institute, Auckland University of Technology, Auckland, New Zealand",IEEE Signal Processing Letters,"7 Jun 2018","2018","25","7","1019","1023","Discriminative Correlation Filters (DCFs)-based approaches have recently achieved competitive performance in visual tracking. However, such conventional DCF-based trackers often lack the discriminative ability due to the shallow architecture. As a result, they can hardly tackle drastic appearance variations and easily drift when the target suffers heavy occlusions. To address this issue, a novel densely connected DCFs framework is proposed for visual tracking. We incorporate multiple nested DCFs into the deep learning architecture, and then train the compact network with the data-specific target. Specifically, feature maps and interim response maps are shared and reused throughout the whole network. By doing so, the implicit information carried out by each DCF is fully exploited to enhance the model representation ability during the tracking process. Moreover, a multiscale estimation scheme is developed to account for scale variations. Experimental results on the benchmarks demonstrate that the proposed approach achieves outstanding performance compared to the existing state-of-the-art trackers.","1558-2361","","10.1109/LSP.2018.2836360","National Natural Science Foundation of China(grant numbers:61572315,6151101179); 973 Plan of China(grant numbers:2015CB856004); ","https://ieeexplore.ieee.org/stamp/stamp.jsp?arnumber=8359334","Correlation filters;deep learning;visual tracking","Target tracking;Correlation;Feature extraction;Visualization;Machine learning;Estimation;Training","","4","","41","IEEE","15 May 2018","","","IEEE","IEEE Journals"
"An Adaptive Correlated Image Prior for Image Restoration Problems","J. Ševčík; V. Šmídl; F. Šroubek","Regional Innovation Centre for Electrical Engineering, University of West Bohemia, Pilsen, Czech republic; Czech Academy of Science, Institute of Information Theory and Automation, Prague, Czech Republic; Czech Academy of Science, Institute of Information Theory and Automation, Prague, Czech Republic",IEEE Signal Processing Letters,"7 Jun 2018","2018","25","7","1024","1028","Image restoration is typically defined as an ill-posed problem which has to be regularized to obtain an acceptable solution. In Bayesian interpretation, regularization is equivalent to prior model of the image. An added value of Bayesian point of view is the ability to form a hierarchical model and estimate the hyperparameters of the prior from the data. Many prior models are available, usually based on automatic relevance determination principle applied to the transformed image. However, the transformation (the most common is a differential operator) is assumed to be known. In this letter, we propose to relax this assumption and estimate the image transformation from the data. The resulting algorithm is analytically tractable using the variational Bayes method. Properties of the new prior are demonstrated on the problem of image superresolution.","1558-2361","","10.1109/LSP.2018.2836964","Ministry of Education, Youth and Sports of the Czech Republic; RICE New Technologies and Concepts for Smart Industrial Systems(grant numbers:LO1607); Czech Science Foundation project(grant numbers:GA18-05360S); ","https://ieeexplore.ieee.org/stamp/stamp.jsp?arnumber=8359409","Adaptive image prior;image restoration;variational Bayes","Bayes methods;Estimation;Image restoration;Tuning;TV;Adaptation models;Image resolution","","5","","24","IEEE","15 May 2018","","","IEEE","IEEE Journals"
"Residual LSTM Attention Network for Object Tracking","H. -I. Kim; R. -H. Park","Department of Electronic Engineering, Sogang University, Seoul, South Korea; Department of Electronic Engineering, Sogang University, Seoul, South Korea",IEEE Signal Processing Letters,"8 Jun 2018","2018","25","7","1029","1033","In this letter, we propose an attention network for object tracking. To construct the proposed attention network for sequential data, we combine long-short term memory (LSTM) and a residual framework into a residual LSTM (RLSTM). The LSTM, which learns temporal correlation, is used for a temporal learning of object tracking. In the proposed RLSTM method, the residual framework, which achieves the highest accuracy in ImageNet large scale visual recognition competition (ILSVRC) 2016, learns the variations of spatial inputs and thus achieves the spatio-temporal attention of the target object. Also, a rule-based RLSTM learning is used for robust attention. Experimental results on large tracking benchmark datasets object tracking benchmark (OTB)-2013, OTB-100, and OTB-50 show that the proposed RLSTM tracker achieves the highest performance among existing trackers including the Siamese trackers, attention trackers, and correlation trackers, and also has comparable performance with the state-of-the-art deep trackers.","1558-2361","","10.1109/LSP.2018.2835768","BK21 Plus Program; ","https://ieeexplore.ieee.org/stamp/stamp.jsp?arnumber=8357947","Attention network;attention tracker;deep tracker;object tracking;residual long–short term memory (RLSTM);Siamese network;spatio-temporal attention;visual tracking","Target tracking;Object tracking;Feature extraction;Correlation;Robustness;Adaptation models;Task analysis","","37","","38","IEEE","11 May 2018","","","IEEE","IEEE Journals"
"Dynamic Rate Allocation and Forwarding Strategy Adaption for Wireless Networks","L. Feng; Q. Yang; K. Kim; K. Kwak","State Key Laboratory on ISN, School of Telecommunications Engineering, and the Collaborative Innovation Center of Information Sensing and Understanding, Xidian University, Xi’an, China; State Key Laboratory on ISN, School of Telecommunications Engineering, and the Collaborative Innovation Center of Information Sensing and Understanding, Xidian University, Xi’an, China; Department of Information and Communication Engineering, Inha University, Incheon, South Korea; Department of Information and Communication Engineering, Inha University, Incheon, South Korea",IEEE Signal Processing Letters,"11 Jun 2018","2018","25","7","1034","1038","In this letter, we investigate the dynamic rate allocation and forwarding strategy adaption scheme for wireless networks with potential selfish nodes. Aided by an incentive mechanism, we develop a stochastic differential equation (SDE) to portray the dynamic node selfishness in terms of node's energy resource and incentives. Then, a stochastic optimization model is employed to maximize the average network utility while bounding the node selfishness. Based on the continuous-time Lyapunov optimization theory, we solve the optimization problem and propose a dynamic rate allocation and forwarding strategy update (DRAF) algorithm to accommodate the dynamic network state. We further analyze the tracking errors between the output of DRFA algorithm and the optimal solution. Then, an adaptive-compensation rate allocation and forwarding strategy update (ACRAF) algorithm is designed, which iterates only once when network state changes. Finally, we provide a sufficient condition that the ACRAF algorithm asymptotically tracks the moving equilibrium point with no tracking errors. Simulation results validate the theoretical analysis.","1558-2361","","10.1109/LSP.2018.2833425","National Research Foundation of Korea(grant numbers:(MSIT)-NRF-2017R1A2B2012337); NSF of China(grant numbers:61471287); ","https://ieeexplore.ieee.org/stamp/stamp.jsp?arnumber=8357439","Continuous-time Lyapunov theory;dynamic node selfishness;stochastic optimization","Relays;Heuristic algorithms;Dynamic scheduling;Resource management;Optimization;Wireless networks;Stochastic processes","","4","","15","IEEE","10 May 2018","","","IEEE","IEEE Journals"
