"End-to-End Temporal Action Detection Using Bag of Discriminant Snippets","F. Murtaza; M. H. Yousaf; S. A. Velastin; Y. Qian","Department of Computer Engineering, University of Engineering and Technology Taxila, Taxila, Pakistan; Department of Computer Engineering, University of Engineering and Technology Taxila, Taxila, Pakistan; Cortexica Vision Systems Ltd., London, U.K.; Cortexica Vision Systems Ltd., London, U.K.",IEEE Signal Processing Letters,"4 Jan 2019","2019","26","2","272","276","Detecting human actions in long untrimmed videos is a challenging problem. Existing temporal-action detection methods have difficulties in finding the precise starting and ending times of the actions in untrimmed videos. In this letter, we propose a temporal-action detection framework that can detect multiple actions in an end-to-end manner, based on a Bag of Discriminant Snippets (BoDS). BoDS is based on the observation that multiple actions and the background classes have similar snippets, which cause incorrect classification of action regions and imprecise boundaries. We solve this issue by finding the key-snippets from the training data of each class and compute their discriminative power, which is used in BoDS encoding. During testing of an untrimmed video, we find the BoDS representation for multiple candidate proposals and find their class label based on a majority voting scheme. We test BoDS on the Thumos14 and ActivityNet datasets and obtain state-of-the-art results. For the sports subset of ActivityNet dataset, we obtain a mean Average Precision (mAP) value of 29% at 0.7 temporal Intersection over Union (tIoU) threshold. For the Thumos14 dataset, we obtain a significant gain in terms of mAP, i.e., improving from 20.8% to 31.6% at tIoU = 0.7.","1558-2361","","10.1109/LSP.2018.2888758","Directorate of Advance Studies, Research and Technological development (ASR)&TD, University of Engineering and Technology (UET) Taxila, Pakistan; Universidad Carlos III de Madrid(grant numbers:600371); El Ministerio de Economia y Competitividad(grant numbers:COFUND2013-51509); ","https://ieeexplore.ieee.org/stamp/stamp.jsp?arnumber=8581478","Temporal-action detection;3D-convolutional network (C3D);untrimmed videos;Thumos14;ActivityNet;temporal-action proposals","Proposals;Videos;Encoding;Testing;Feature extraction;Sports;Visualization","","11","","27","IEEE","19 Dec 2018","","","IEEE","IEEE Journals"
"One-Class Convolutional Neural Network","P. Oza; V. M. Patel","Department of Electrical and Computer Engineering, Johns Hopkins University, Baltimore, MD, USA; Department of Electrical and Computer Engineering, Johns Hopkins University, Baltimore, MD, USA",IEEE Signal Processing Letters,"4 Jan 2019","2019","26","2","277","281","We present a novel convolutional neural network (CNN) based approach for one-class classification. The idea is to use a zero centered Gaussian noise in the latent space as the pseudo-negative class and train the network using the cross-entropy loss to learn a good representation as well as the decision boundary for the given class. A key feature of the proposed approach is that any pre-trained CNN can be used as the base network for one-class classification. The proposed one-class CNN is evaluated on the UMDAA-02 Face, Abnormality-1001, and FounderType-200 datasets. These datasets are related to a variety of one-class application problems such as user authentication, abnormality detection, and novelty detection. Extensive experiments demonstrate that the proposed method achieves significant improvements over the recent state-of-the-art methods. The source code is available at: github.com/otkupjnoz/oc-cnn.","1558-2361","","10.1109/LSP.2018.2889273","National Science Foundation(grant numbers:1801435); ","https://ieeexplore.ieee.org/stamp/stamp.jsp?arnumber=8586962","One class classification;convolutional neural networks;representation learning","Feature extraction;Face;Authentication;Support vector machines;Training;Convolutional neural networks","","137","","40","IEEE","23 Dec 2018","","","IEEE","IEEE Journals"
"Analysis of Nonorthogonal Training in Massive MIMO Under Channel Aging With SIC Receivers","R. Chopra; C. R. Murthy; H. A. Suraweera; E. G. Larsson","Department of Electronics and Electrical Engineering, IIT Guwahati, Guwahati, India; Department of Electrical Communication Engineering, IISc Bangalore, Bangalore, India; Department of Electrical and Electronic Engineering, University of Peradeniya, Peradeniya, Sri Lanka; Department of Electrical Engineering (ISY), Linkoping University, Linkoping, Sweden",IEEE Signal Processing Letters,"8 Jan 2019","2019","26","2","282","286","We analyze the effect of channel aging on the achievable rate of time division duplexed massive multiple input multiple output systems serving a number of users under aging channels, using nonorthogonal multiple access (NOMA) and orthogonal multiple access (OMA). Using the recently proposed shared uplink pilot based channel estimation for NOMA, we derive bounds on the channel estimation error variance for the two schemes. We then derive the achievable spectral efficiencies of the two schemes. Using numerical results, we show that, in slowly varying channels, using NOMA with shared pilots is preferable over OMA, while the reverse is true under fast varying channels.","1558-2361","","10.1109/LSP.2018.2889955","ELLIIT; Swedish Research Council; ","https://ieeexplore.ieee.org/stamp/stamp.jsp?arnumber=8598847","Massive MIMO, Non-orthogonal multiple access, channel aging, channel estimation, performance analysis","Channel estimation;Aging;NOMA;MIMO communication;Training;Antennas;Downlink","","17","","17","IEEE","1 Jan 2019","","","IEEE","IEEE Journals"
"Median Filtering Forensics in Compressed Video","V. Amanipour; S. Ghaemmaghami","Department of Electrical Engineering, Sharif University of Technology, Tehran, Iran; Electronics Research Institute and Department of Electrical Engineering, Sharif University of Technology, Tehran, Iran",IEEE Signal Processing Letters,"9 Jan 2019","2019","26","2","287","291","Median filtering has received extensive attention from forensics analyzers, as a common content-preserving, smoothing, and denoising manipulation. We propose a detection scheme for median filtering of video sequences in compressed domain based on the singular value decomposition of the process matrix, which approximates the median filtering. Projection over some of the eigenspaces of the process matrix gives a set of features of small dimension, even as small as three, making the proposed scheme a fast and suitable detector for video median filtering. The experimental evaluations show that the proposed method outperforms the state-of-the-art detectors of median filtering, and its edge becomes significant for localized detection over small blocks within frames. The new method can potentially be used as a detector of other editing processes.","1558-2361","","10.1109/LSP.2018.2889921","","https://ieeexplore.ieee.org/stamp/stamp.jsp?arnumber=8590685","Median filter;singular value decomposition;video forensics","Feature extraction;Singular value decomposition;Matrix decomposition;Video sequences;Image coding;Training;Forensics","","8","","22","IEEE","27 Dec 2018","","","IEEE","IEEE Journals"
"Passive Joint Localization and Synchronization of Distributed Microphone Arrays","S. Woźniak; K. Kowalczyk","Department of Electronics, AGH University of Science and Technology, Krakow, Poland; Department of Electronics, AGH University of Science and Technology, Krakow, Poland",IEEE Signal Processing Letters,"9 Jan 2019","2019","26","2","292","296","Collaborative processing of signals recorded by distributed sensors brings about new opportunities as well as challenges to classical array signal processing. In this letter, we present a method for passive self-calibration of a distributed system in which each distributed node consists of an array of sensors. The proposed method estimates the positions and orientations of distributed sensor arrays, the synchronization timeline offsets as well as the positions of spatially distributed events emitted by an uncontrolled source or sources. The proposed two-step optimization consists in finding the maximum likelihood estimate of the relative geometry of a distributed system based on Directions of Arrival (DoAs) observed independently at each array. Next, the final positions of distributed arrays, the positions of acoustic events, and the synchronization offsets between the nodes are computed by solving a linear least square problem based on the observed Time Differences of Arrival (TDoAs) between the arrays and the relative positions estimated in the first optimization step. The evaluation results indicate that passive self-calibration of distributed sensor arrays can be conveniently achieved by observing acoustic events generated by an uncontrolled source based on the measured DoAs and TDoAs.","1558-2361","","10.1109/LSP.2018.2889438","Fundacja na rzecz Nauki Polskiej(grant numbers:TEAM/2017-3/23); European Regional Development Fund; ","https://ieeexplore.ieee.org/stamp/stamp.jsp?arnumber=8586946","Microphone array processing;distributed sensor networks;geometry calibration;synchronization;maximum likelihood estimation;least squares approximation","Synchronization;Geometry;Direction-of-arrival estimation;Sensor arrays;Acoustics;Microphones","","34","","21","IEEE","23 Dec 2018","","","IEEE","IEEE Journals"
"A Regularization Framework for Learning Over Multitask Graphs","R. Nassif; S. Vlaski; C. Richard; A. H. Sayed","Institute of Electrical Engineering, École Polytechnique Fédérale de Lausanne, Lausanne, Switzerland; Institute of Electrical Engineering, École Polytechnique Fédérale de Lausanne, Lausanne, Switzerland; Université de Nice Sophia-Antipolis, Nice, France; Institute of Electrical Engineering, École Polytechnique Fédérale de Lausanne, Lausanne, Switzerland",IEEE Signal Processing Letters,"9 Jan 2019","2019","26","2","297","301","This letter proposes a general regularization framework for inference over multitask networks. The optimization approach relies on minimizing a global cost consisting of the aggregate sum of individual costs regularized by a term that allows to incorporate global information about the graph structure and the individual parameter vectors into the solution of the inference problem. An adaptive strategy, which responds to streaming data and employs stochastic approximations in place of actual gradient vectors, is devised and studied. Methods allowing the distributed implementation of the regularization step are also discussed. This letter shows how to blend real-time adaptation with graph filtering and a generalized regularization framework to result in a graph diffusion strategy for distributed learning over multitask networks.","1558-2361","","10.1109/LSP.2018.2889267","National Science Foundation(grant numbers:CCF-1524250); ","https://ieeexplore.ieee.org/stamp/stamp.jsp?arnumber=8586885","Multitask graphs;spectral based regularization;gradient noise;distributed implementation","Task analysis;Laplace equations;Symmetric matrices;Spectral analysis;Manganese;Optimization;Aggregates","","14","","33","IEEE","23 Dec 2018","","","IEEE","IEEE Journals"
"Akaike and Bayesian Information Criteria for Hidden Markov Models","N. Dridi; M. Hadzagic","Hatem Bettaher IResCoMath Research Unit, National Engineering School of Gabès, University of Gabès, Gabès, Tunisia; OODA Technologies, Montreal, QC, Canada",IEEE Signal Processing Letters,"9 Jan 2019","2019","26","2","302","306","We propose the Bayesian information criterion (BIC) and the Akaike information criterion (AIC) for model selection in hidden Markov models (HMM) when the number of states is unknown. The exact solutions exploit the properties of HMM that allow tractable forms of both criteria to be obtained while transgressing the common assumption in AIC and BIC model selection approaches on the independence of data. The proposed algorithm is presented and evaluated in application to blind channel estimation and symbol detection when the channel length is assumed unknown.","1558-2361","","10.1109/LSP.2018.2886933","","https://ieeexplore.ieee.org/stamp/stamp.jsp?arnumber=8576678","Akaike information criterion (AIC);bayesian information criterion (BIC);hidden markov model (HMM);model selection;blind estimation","Hidden Markov models;Data models;Signal processing algorithms;Channel estimation;Estimation;Bit error rate","","35","","14","IEEE","14 Dec 2018","","","IEEE","IEEE Journals"
"Learning Bilevel Layer Priors for Single Image Rain Streaks Removal","P. Mu; J. Chen; R. Liu; X. Fan; Z. Luo","School of Mathematical Sciences, Dalian University of Technology, Dalian, China; DUT-RU International School of Information Science & Engineering, Dalian University of Technology, Dalian, China; DUT-RU International School of Information Science & Engineering, Dalian University of Technology, Dalian, China; DUT-RU International School of Information Science & Engineering, Dalian University of Technology, Dalian, China; School of Mathematical Sciences, Dalian University of Technology, Dalian, China",IEEE Signal Processing Letters,"9 Jan 2019","2019","26","2","307","311","Rain streaks removal is an important issue of the outdoor vision system and recently has been investigated extensively. In the past decades, maximum a posterior and network-based architecture have been attracting considerable attention for this problem. However, it is challenging to establish effective regularization priors and the cost function with complex prior is hard to optimize. On the other hand, it is still hard to incorporate data-dependent information into conventional numerical iterations. To partially address the above limits and inspired by the leader-follower gaming perspective, we introduce an unrolling strategy to incorporate data-dependent network architectures into the established iterations, i.e., a learning bilevel layer priors method to jointly investigate the learnable feasibility and optimality of rain streaks removal problem. Both visual and quantitative comparison results demonstrate that our method outperforms the state of the art.","1558-2361","","10.1109/LSP.2018.2889277","National Natural Science Foundation of China(grant numbers:61672125,61562062,61733002,61632019,61806057,61572096); Fundamental Research Funds for the Central Universities; ","https://ieeexplore.ieee.org/stamp/stamp.jsp?arnumber=8586910","Learning-based optimization;rain streaks removal;deep unrolling;bilevel layer priors","Rain;Optimization;Network architecture;Manganese;Convolution;Fans;Visualization","","37","","37","IEEE","23 Dec 2018","","","IEEE","IEEE Journals"
"A Generic Receiver Architecture for MIMO Wireless Power Transfer With Nonlinear Energy Harvesting","G. Ma; J. Xu; Y. Zeng; M. R. V. Moghadam","School of Information Engineering, Guangdong University of Technology, Guangzhou, China; National Mobile Communications Research Laboratory, Southeast University, Nanjing, China; School of Electrical and Information Engineering, The University of Sydney, Sydney, NSW, Australia; TransferFi Pte Ltd., Singapore",IEEE Signal Processing Letters,"10 Jan 2019","2019","26","2","312","316","This letter investigates a multiple-input multiple-output (MIMO) wireless power transfer system under practical nonliner energy harvesting (EH) models. We propose a new generic energy receiver (ER) architecture consisting of N receive antennas and L rectifiers, for which one power splitter is inserted after each antenna to adaptively split the received radio frequency (RF) signals among the L rectifiers for efficient nonlinear RF-to-direct current (dc) conversion. With the proposed architecture, we maximize the total harvested dc power at the ER, by jointly optimizing the transmit energy beamforming at the energy transmitter and the power splitting ratios at the ER. Numerical results show that our proposed design by exploiting the nonlinearity of EH significantly improves the harvested dc power at the ER, as compared to two conventional designs.","1558-2361","","10.1109/LSP.2018.2890164","National Natural Science Foundation of China(grant numbers:61871137); National Mobile Communications Research Laboratory, Southeast University(grant numbers:2019D08); ","https://ieeexplore.ieee.org/stamp/stamp.jsp?arnumber=8598854","Wireless power transfer (WPT);non-linear energy harvesting (EH);transmit energy beamforming;adaptive power splitting","Erbium;Radio frequency;Receiving antennas;MIMO communication;RF signals;Adaptation models","","43","","19","IEEE","1 Jan 2019","","","IEEE","IEEE Journals"
"Bilateral Angle 2DPCA for Face Recognition","S. Zhou; D. Zhang","School of Mathematics and Statistics, Xidian University, Xi’an, China; School of Mathematics and Statistics, Xidian University, Xi’an, China",IEEE Signal Processing Letters,"11 Jan 2019","2019","26","2","317","321","Two-dimensional principal component analysis (2DPCA), as a state-of-the-art method for dimensionality reduction, has been widely used in face recognition. However, it is very sensitive to outliers since it minimizes the sum of squared F-norm, which is least-squares loss in nature. Recently, angle 2DPCA was presented to alleviate this problem by minimizing the sum of Fnorm, which is corresponding to L1 loss. But a vital unresolved problem of angle 2DPCA is that it needs many more coefficients for image representation because it works only in the row direction. In this letter, we first give a new angle 2DPCA called Sin-2DPCA by minimizing the relative error, which has a better explanation than the original one. Furthermore, in order to obtain better performance with fewer reduced coefficients, we project the input image to a lower dimension from right and left simultaneously, and then, the bilateral angle 2DPCA (BA2DPCA) is proposed. The experimental results on two benchmark face recognition datasets with outlier noises illustrate that the Sin-2DPCA has the similar performance with original angle 2DPCA, and BA2DPCA can obtain the highest performance in all compared algorithms with the minimal number of representation coefficients.","1558-2361","","10.1109/LSP.2018.2889925","National Natural Science Foundation of China(grant numbers:61772020,61472303); ","https://ieeexplore.ieee.org/stamp/stamp.jsp?arnumber=8590694","Face recognition;dimensionality reduction;2DPCA;F-norm;angle 2DPCA","Image reconstruction;Principal component analysis;Signal processing algorithms;Covariance matrices;Training;Face recognition;Image representation","","15","","17","IEEE","27 Dec 2018","","","IEEE","IEEE Journals"
"Local Feature Descriptor and Derivative Filters for Blind Image Quality Assessment","M. Oszust","Department of Computer and Control Engineering, Rzeszow University of Technology, Rzeszow, Poland",IEEE Signal Processing Letters,"15 Jan 2019","2019","26","2","322","326","In this letter, a novel blind image quality assessment (BIQA) technique is introduced to provide an automatic and reproducible evaluation of distorted images. In the approach, the information carried by image derivatives of different orders is captured by local features and used for the image quality prediction. Since a typical local feature descriptor is designed to ensure a robust image patch representation, in this letter, a novel descriptor that additionally highlights local differences enhanced by the filtering is proposed. Furthermore, a set of derivative kernels is introduced. Finally, the support vector regression technique is used to map statistics of described local features into subjective scores, providing an objective quality score for an image. Extensive experimental validation on popular IQA image datasets reveals that the proposed method outperforms the state-of-the-art handcrafted and deep learning BIQA measures.","1558-2361","","10.1109/LSP.2019.2891416","","https://ieeexplore.ieee.org/stamp/stamp.jsp?arnumber=8604059","Blind image quality assessment;local features;feature descriptor;derivative filters;support vector regression","Distortion measurement;Kernel;Feature extraction;Distortion;Image quality;Detectors;Image color analysis","","22","","43","IEEE","6 Jan 2019","","","IEEE","IEEE Journals"
"Supervised Sparse Coding With Decision Forest","Y. Huang; Y. Quan; T. Liu","School of Computer Science and Engineering, South China University of Technology, Guangzhou, China; School of Computer Science and Engineering, South China University of Technology, Guangzhou, China; School of Computer Science and Engineering, South China University of Technology, Guangzhou, China",IEEE Signal Processing Letters,"15 Jan 2019","2019","26","2","327","331","By jointly conducting sparse coding and classifier training, supervised sparse coding has shown its effectiveness in a variety of recognition tasks. However, the existing supervised sparse coding methods often consider linear classification, which limits their discrimination in handling highly nonlinear data. In this letter, we propose a new supervised sparse coding model by incorporating decision tree classifiers. Since decision trees can well deal with the non-linear properties of data, the introduction of decision trees to sparse coding can noticeably improve the discrimination of coding. Meanwhile, sparse coding is able to produce sparse de-correlated features that decision tree is in favor of. For further improvement, we close the loop of sparse coding and decision tree learning with an ensemble framework, which alternatively learns a dictionary for sparse coding and a decision tree for classification. The resulting series of decision trees as well as series of dictionaries are used to construct a decision forest for classification. The proposed method was applied to face recognition and scene classification, and the experimental results have demonstrated its power in comparison with recent supervised sparse coding methods.","1558-2361","","10.1109/LSP.2018.2890765","National Natural Science Foundation of China(grant numbers:61602184,61872151,U1611461); Natural Science Foundation of China(grant numbers:61602184,61872151); Natural Science Foundation of Guangdong Province(grant numbers:2017A030313376); Science and Technology Program of Guangzhou(grant numbers:201707010147); Fundamental Research Funds for the Central Universities(grant numbers:x2js-D2181690); ","https://ieeexplore.ieee.org/stamp/stamp.jsp?arnumber=8600359","Sparse coding;dictionary learning;decision tree;decision forest;classification","Encoding;Decision trees;Dictionaries;Forestry;Training;Sparse matrices;Vegetation","","12","","22","IEEE","3 Jan 2019","","","IEEE","IEEE Journals"
"Exact Recovery in Community Detection With Continuous-Valued Side Information","H. Saad; A. Nosratinia","Department of Electrical Engineering, The University of Texas at Dallas, Richardson, TX, USA; Department of Electrical Engineering, The University of Texas at Dallas, Richardson, TX, USA",IEEE Signal Processing Letters,"15 Jan 2019","2019","26","2","332","336","The community detection problem, as a special case of inference on graphs, has received much attention lately. However, in the presence of continuous-valued side information, the behavior of a sharp threshold for exact recovery has remained open, and is addressed in this letter. The new proof presented herein has the further advantage of closing the gap between necessary and sufficient conditions for exact recovery threshold that has existed in community detection under finite-alphabet side information.","1558-2361","","10.1109/LSP.2018.2889920","","https://ieeexplore.ieee.org/stamp/stamp.jsp?arnumber=8590784","","Two dimensional displays;Random variables;Signal processing algorithms;Social network services;Image edge detection;Signal processing;Stochastic processes","","6","","15","IEEE","27 Dec 2018","","","IEEE","IEEE Journals"
