"A Finite Algorithm to Compute Rank-1 Tensor Approximations","A. P. da Silva; P. Comon; A. L. F. de Almeida","Saint Martin d’Hères cedex, GIPSA-Lab, France; Saint Martin d’Hères cedex, GIPSA-Lab, France; Department of Teleinformatics Engineering, Federal University of Ceará, Fortaleza, Ceará, Brazil",IEEE Signal Processing Letters,"15 Jun 2016","2016","23","7","959","963","We propose a noniterative algorithm, called SeROAP,1 to estimate a rank-1 approximation of a tensor in the real or complex field. Our algorithm is based on a sequence of singular value decompositions followed by a sequence of projections onto Kronecker vectors. For three-way tensors, we show that our algorithm is always at least as good as the state-of-the-art truncation algorithm, ST-HOSVD,2 in terms of approximation error. Thus, it gives a good starting point to iterative rank-1 tensor approximation algorithms. By means of computational experiments, it also turns out that for fourth order tensors, SeROAP yields a better approximation with high probability when compared to the standard THOSVD3 algorithm.","1558-2361","","10.1109/LSP.2016.2570862","European Research Council; 7th Framework Program(grant numbers:FP7/2007-2013,320594); Conselho Nacional de Desenvolvimento Científico e Tecnológico; Cêencias sem Fronteiras; ","https://ieeexplore.ieee.org/stamp/stamp.jsp?arnumber=7473918","rank-1 approximation;tensor;singular value decomposition;Singular value decomposition (SVD);rank-1 approximation;tensor","Tensile stress;Approximation algorithms;Signal processing algorithms;Singular value decomposition;Complexity theory;Iterative methods;Standards","","37","","38","IEEE","19 May 2016","","","IEEE","IEEE Journals"
"On the Definition and Existence of a Minimum Variance Unbiased Estimator for Target Localization","A. Shoari; G. Mateos","Department of Electrical and Computer Engineering, University of Rochester, Rochester, NY, USA; Department of Electrical and Computer Engineering, University of Rochester, Rochester, NY, USA",IEEE Signal Processing Letters,"16 Jun 2016","2016","23","7","964","968","The problem of target localization with ideal, binary detectors is considered in one-dimensional space for both the censored and noncensored scenarios. In the censored setting, the problem is equivalent to estimating the center of a uniform distribution, and does not admit a minimum-variance unbiasedestimator (MVUE). However, it is proven that if the detection range is known and the sensor deployment region is large, both censored and noncensored cases will have an MVUE within the class of functions that are invariant to Euclidean motion. In addition, it is shown that when the detection range is unknown, for the censored case one can still form an MVUE whereas in the noncensored case, an MVUE does not exist. Numerical tests support the theoretical findings of this letter.","1558-2361","","10.1109/LSP.2016.2575739","","https://ieeexplore.ieee.org/stamp/stamp.jsp?arnumber=7484338","Target localization;ideal binary detectors;censoring;minimum-variance unbiased estimation;Censoring;ideal binary detectors;minimum-variance unbiased estimation;target localization","Cascading style sheets;Estimation;Detectors;Fading channels;Measurement uncertainty;Noise measurement;Limiting","","1","","34","IEEE","2 Jun 2016","","","IEEE","IEEE Journals"
"EEF: Exponentially Embedded Families With Class-Specific Features for Classification","B. Tang; S. Kay; H. He; P. M. Baggenstoss","Department of Electrical, Computer and Biomedical Engineering, University of Rhode Island, Kingston, RI, USA; Department of Electrical, Computer and Biomedical Engineering, University of Rhode Island, Kingston, RI, USA; Department of Electrical, Computer and Biomedical Engineering, University of Rhode Island, Kingston, RI, USA; Fraunhofer FKIE, Wachtberg, Germany",IEEE Signal Processing Letters,"20 Jun 2016","2016","23","7","969","973","In this paper, we present a novel exponentially embedded families (EEF) based classification method, in which the probability density function (PDF) on raw data is estimated from the PDF on features. With the PDF construction, we show that class-specific features can be used in the proposed classification method, instead of a common feature subset for all classes as used in conventional approaches. We apply the proposed EEF classifier for text categorization as a case study and derive an optimal Bayesian classification rule with class-specific feature selection based on the Information Gain score. The promising performance on real-life data sets demonstrates the effectiveness of the proposed approach and indicates its wide potential applications.","1558-2361","","10.1109/LSP.2016.2574327","National Science Foundation(grant numbers:1053717,1439011); Army Research Office(grant numbers:W911NF-12-1-0378); ","https://ieeexplore.ieee.org/stamp/stamp.jsp?arnumber=7480813","Exponentially embedded families;classspecific features;feature selection;text categorization;probability density function estimation;naive Bayes;Class-specific features;exponentially embedded families (EEF);feature selection;naive bayes;probability density function (PDF) estimation;text categorization","Probability density function;Text categorization;Bayes methods;Portable document format;Estimation;Principal component analysis;Training data","","14","","23","IEEE","30 May 2016","","","IEEE","IEEE Journals"
"Sparse Signal Detection for Space Shift Keying Using the Monte Carlo EM Algorithm","J. Choi","School of Electrical Engineering and Computer Science, Gwangju Institute of Science and Technology, Gwangju, South Korea",IEEE Signal Processing Letters,"20 Jun 2016","2016","23","7","974","978","In order to detect space shift keying (SSK) signals, we propose to use the Monte Carlo (MC) expectation maximization (EM) algorithm in this paper. First, we formulate the EM algorithm for the maximum likelihood detection of SSK signals. Then, we derive a Gibbs sampler to approximate the E-step. Through simulation results, we can see that the performance of the derived MCEM algorithm is better than that of the orthogonal matching pursuit algorithm, which was adopted to detect SSK signals with low complexity by Yu et al.","1558-2361","","10.1109/LSP.2016.2577707","GIST; ","https://ieeexplore.ieee.org/stamp/stamp.jsp?arnumber=7486038","sparsity;index modulation;Gibbs sampling;Gibbs sampling;index modulation;sparsity","Approximation algorithms;Complexity theory;Signal processing algorithms;Transmitting antennas;Signal detection;Matching pursuit algorithms;Indexes","","5","","20","IEEE","7 Jun 2016","","","IEEE","IEEE Journals"
"Correlation Detection for Adaptive Feedback Cancellation in Hearing Aids","F. Strasser; H. Puder","Graduate School of Computational Engineering, Technische Universitt Darmstadt, Darmstadt, Germany; Graduate School of Computational Engineering, Technische Universitt Darmstadt, Darmstadt, Germany",IEEE Signal Processing Letters,"20 Jun 2016","2016","23","7","979","983","Acoustic feedback is a well-known phenomenon in hearing aids. Under certain conditions, it causes the so-called howling effect, which is highly annoying for the hearing aid user and limits the maximum amplification of the hearing aid. The standard adaptive feedback cancellation algorithms suffer from a biased adaptation if the input signal is spectrally colored or tonal, as it is for speech and music signals. Due to this bias distortion artifacts (entrainment) are generated. In this letter, we present a method to detect tonal, high correlated parts of the input signal. In particular, the method is able to distinguish between correlation resulting from the input signal and from feedback path changes. A subband feedback cancellation system which applies decorrelation methods is the basis for the proposed method. Additionally, we suggest to use the correlation detection to increase the performance of the mentioned feedback cancellation system. The performance is measured by preventing entrainment and reacting to feedback path changes.","1558-2361","","10.1109/LSP.2016.2575447","Excellence Initiative; Technische Universität Darmstadt; German Federal and State Governments; Graduate School of Computationng at Technische Universität Darmstadt; ","https://ieeexplore.ieee.org/stamp/stamp.jsp?arnumber=7482781","Adaptive feedback cancellation;NLMS filter adaptation;adaptation control;variable step size;hearing aids;frequency shift;prediction error filter;correlation detection;Adaptation control;adaptive feedback cancellation (AFC);correlation detection;frequency shift (FS);hearing aids (HAs);NLMS filter adaptation;prediction error filter (PEF);variable step size","Correlation;Frequency control;Decorrelation;Stability analysis;Acoustics;Auditory system;Loudspeakers","","8","","11","IEEE","1 Jun 2016","","","IEEE","IEEE Journals"
"Semidefinite Relaxations for MIMO Transmissions With High-Order QAM Constellations","N. Souto; M. Ribeiro; P. Sebastião","Instituto de Telecomunicações, Lisboa, Portugal; Instituto de Telecomunicações, Lisboa, Portugal; Instituto de Telecomunicações, Lisboa, Portugal",IEEE Signal Processing Letters,"20 Jun 2016","2016","23","7","984","988","In this letter, simple semidefinite relaxations are proposed for the detection of high-order quadrature amplitude modulations in multiple-input–multiple-output systems. The detector is based on the addition of several convex and concave quadratic inequality constraints into the maximum-likelihood detector before relaxing the problem into a convex one. Combined with a randomized sampling procedure, it is shown that the performance and worst-case computational complexity of the proposed approach makes it very competitive against existing detectors in large problem sizes.","1558-2361","","10.1109/LSP.2016.2576640","Fundação para a Ciência e Tecnologia and Instituto de Telecomunicações; ","https://ieeexplore.ieee.org/stamp/stamp.jsp?arnumber=7484739","Semidefinite relaxation;MIMO detection;QAM constellations;Multiple-input–multiple-output (MIMO) detection;quadrature amplitude modulations (QAM) constellations;semidefinite relaxation (SDR)","MIMO;Complexity theory;Detectors;Quadrature amplitude modulation;Constellation diagram;Decoding;Lattices","","6","","31","IEEE","7 Jun 2016","","","IEEE","IEEE Journals"
"Spatial Steganalysis Using Contrast of Residuals","J. Yu; F. Li; H. Cheng; X. Zhang","School of Communication and Information Engineering, Shanghai University, Shanghai, China; College of Computer Science and Technology, Shanghai University of Electric Power, Shanghai, China; College of Mathematics and Computer Science, Fuzhou University, Fuzhou, China; School of Communication and Information Engineering and the Key Laboratory of Specialty Fiber Optics and Optical Access, Shanghai University, Shanghai, China",IEEE Signal Processing Letters,"22 Jun 2016","2016","23","7","989","992","This letter proposes a novel scheme for spatial steganalysis based on contrast of residuals (CoR). After selecting complex blocks from an uncompressed image by a fluctuation function, the residuals are calculated from the selected blocks and the whole image after applying diverse filters. The CoR is represented as an angle and the norm of residuals is considered as the corresponding weight of angle, which is used as the new steganalysis feature. In the proposed scheme, no quantization and truncation is required and the effective information of long-range dependencies among pixels is kept properly. Also, the dimensionality of feature is linear with the number of residuals. The accuracy of proposed scheme is evaluated on HUGO and WOW algorithms, and the experimental results show that the proposed CoR feature has superior performance at low embedding rate with lower dimensionality.","1558-2361","","10.1109/LSP.2016.2575100","Natural Science Foundation of China(grant numbers:61525203,61472235); Program of Shanghai Dawn Scholar(grant numbers:14SG36); Shanghai Academic Research Leader(grant numbers:16XD1401200); Natural Science Foundation of Shanghai(grant numbers:16ZR1413100); Excellent University Young Teachers Training Program of Shanghai Municipal Education Commission(grant numbers:ZZsdl15105); ","https://ieeexplore.ieee.org/stamp/stamp.jsp?arnumber=7482790","Steganalysis;residuals;contrast;angle;weight;Angle;contrast;residuals;steganalysis;weight","Feature extraction;Maximum likelihood detection;Nonlinear filters;Histograms;Quantization (signal);Fluctuations;Training","","23","","18","IEEE","1 Jun 2016","","","IEEE","IEEE Journals"
"Partitioned Alternating Least Squares Technique for Canonical Polyadic Tensor Decomposition","P. Tichavský; A. -H. Phan; A. Cichocki","Institute of Information Theory and Automation, Prague, Czech Republic; Laboratory for Advanced Brain Signal Processing, Brain Science Institute, RIKEN, Wakoshi, Japan; System Research Institute, Warsaw, Poland",IEEE Signal Processing Letters,"22 Jun 2016","2016","23","7","993","997","Canonical polyadic decomposition (CPD), also known as parallel factor analysis, is a representation of a given tensor as a sum of rank-one components. Traditional method for accomplishing CPD is the alternating least squares (ALS) algorithm. Convergence of ALS is known to be slow, especially when some factor matrices of the tensor contain nearly collinear columns. We propose a novel variant of this technique, in which the factor matrices are partitioned into blocks, and each iteration jointly updates blocks of different factor matrices. Each partial optimization is quadratic and can be done in closed form. The algorithm alternates between different random partitionings of the matrices. As a result, a faster convergence is achieved. Another improvement can be obtained when the method is combined with the enhanced line search of Rajih et al. Complexity per iteration is between those of the ALS and the Levenberg–Marquardt (damped Gauss–Newton) method. It is important, however, that the idea of alternating quadratic optimization with partitioned factor matrices is general and can be applied to other variants of the tensor decomposition problems, e.g., when non-Gaussian additive noise is considered.","1558-2361","","10.1109/LSP.2016.2577383","Czech Science Foundation(grant numbers:14-13713S); ","https://ieeexplore.ieee.org/stamp/stamp.jsp?arnumber=7485893","","Tensile stress;Signal processing algorithms;Convergence;Partitioning algorithms;Matrix decomposition;Optimization;Complexity theory","","12","","15","IEEE","6 Jun 2016","","","IEEE","IEEE Journals"
"Person Re-identification by Exploiting Spatio-Temporal Cues and Multi-view Metric Learning","J. Chen; Y. Wang; Y. Y. Tang","Laboratory of Intelligent Recognition and Image Processing, Beijing Key Laboratory of Digital Media, School of Computer Science and Engineering, Beihang University, Beijing, China; Laboratory of Intelligent Recognition and Image Processing, Beijing Key Laboratory of Digital Media, School of Computer Science and Engineering, Beihang University, Beijing, China; Department of Computer and Information Science, Faculty of Science and Technology, University of Macau, Macau, China",IEEE Signal Processing Letters,"22 Jun 2016","2016","23","7","998","1002","In this letter, we introduce a new spatio-temporal feature, namely optical flow energy image (OFEI), for video-based person re-identification. OFEI aims to exploit spatio-temporally stable regions across frames, which can capture discriminative cues such as human body parts and carry-on stuffs. Furthermore, we propose a novel matching method, denoted by multi-view relevance metric learning with list-wise constraints (mvRMLLC), to integrate the spatio-temporal (i.e., OFEI) and appearance features. Unlike previous works, mvRMLLC assumes that multiple features are generated from different views with distinct data distributions, while their similarities should be globally consistent. Multiple similarity metrics are then learned and fused by maximizing their global consistency and simultaneously allowing local discrepancies. Extensive experiments on two benchmarks demonstrate that OFEI outperforms the state-of-the-art spatio-temporal features, and mvRMLLC could further enhance the overall performance significantly.","1558-2361","","10.1109/LSP.2016.2574323","Hong Kong, Macao; Taiwan Science and Technology Cooperation Program of China(grant numbers:L2015TGA9004); Foundation for Innovative Research Groups; National Natural Science Foundation of China(grant numbers:61573045); ","https://ieeexplore.ieee.org/stamp/stamp.jsp?arnumber=7480858","Metric learning;multi-view data fusion;person re-identification;spatio-temporal representation;Metric learning;multi-view data fusion;person re-identification;spatio-temporal representation","Feature extraction;Measurement;Optical imaging;Robustness;Wireless application protocol;Optical signal processing;Image motion analysis","","30","","46","IEEE","30 May 2016","","","IEEE","IEEE Journals"
"Fold-based Kolmogorov–Smirnov Modulation Classifier","F. Wang; O. A. Dobre; C. Chan; J. Zhang","Beijing Jiaotong University, Beijing, China; Memorial University, NL, Canada; Chinese University of Hong Kong, Hong Kong; Beijing Jiaotong University, Beijing, China",IEEE Signal Processing Letters,"22 Jun 2016","2016","23","7","1003","1007","Modulation classification is crucial in applications such as electronic warfare and interference cancellation. In this letter, a novel feature-based Kolmogorov-Smirnov classifier is proposed for the identification of the modulation formats. The received signal is first preprocessed with a folding operation that helps identify the modulation formats based on their different axes of symmetry. Simulation results show that the performance of the proposed classifier is close to that of the optimal likelihood-based classifier, while its robustness to noise uncertainty is improved and its computational complexity is reduced compared to that of the optimal likelihood-based classifier.","1558-2361","","10.1109/LSP.2016.2572666","National Natural Science Foundation(grant numbers:61571034,U1334202); Fundamental Research Funds for the Central Universities(grant numbers:2015JBM112); State Key Laboratory of Rail Traffic Control and Safety(grant numbers:RCS2016ZT013); Natural Sciences and Engineering Research Council of Canada(grant numbers:327285); ","https://ieeexplore.ieee.org/stamp/stamp.jsp?arnumber=7478067","","Constellation diagram;Quadrature amplitude modulation;Binary phase shift keying;Signal to noise ratio;Zirconium","","28","","15","IEEE","24 May 2016","","","IEEE","IEEE Journals"
"Structural Optimization and Online Evolutionary Learning for Spoken Dialog Management","H. Ren; Y. Yan","Key Laboratory of Speech Acoustics and Content Understanding, Institute of Acoustics, Chinese Academy of Sciences, Beijing, China; Key Laboratory of Speech Acoustics and Content Understanding, Institute of Acoustics, Chinese Academy of Sciences, Beijing, China",IEEE Signal Processing Letters,"22 Jun 2016","2016","23","7","1013","1017","Designing dialog management (DM) policies that are robust to environmental noises is a nontrivial task. Approaches based on reinforcement learning (RL) are popular in academia and have been empirically shown to exhibit much better performance than handcrafted policies. However, the policies trained using RL are mostly incomprehensible, thus limiting the deployments for commercial applications. Policy optimization using genetic algorithm (GA) is a relatively new approach to spoken DM. The most notable advantage of this approach is that the trained policies can be directly interpreted by human experts. In this letter, we make several contributions to the GA-based framework. First, a structural policy learning procedure is presented. Second, a new fitness estimation method based on fitted policy evaluation is proposed. Finally, combining with these methods, an online evolutionary policy learning algorithm is designed which is much more data efficient than direct policy search using Monte Carlo simulations. These proposed approaches are empirically evaluated and compared with several state-of-the-art methods in a simulated environment. The experiments show favorable results for our approach.","1558-2361","","10.1109/LSP.2016.2574890","National Natural Science Foundation of China(grant numbers:11461141004,61271426,11504406,11590770,11590771,11590772,11590773,11590774); Strategic Priority Research Program; Chinese Academy of Sciences(grant numbers:XDA06030100,XDA06030500,XDA06040603); National 863 Program(grant numbers:2015AA016306); National 973 Program(grant numbers:2013CB329302); Key Science and Technology Project; Xinjiang Uygur Autonomous Region(grant numbers:201230118-3); ","https://ieeexplore.ieee.org/stamp/stamp.jsp?arnumber=7482741","Human--computer interaction;speech processing;genetic algorithms","Optimization;Signal processing algorithms;Genetic algorithms;Sociology;Statistics;Genetics;Estimation","","1","","31","IEEE","1 Jun 2016","","","IEEE","IEEE Journals"
"Feature Selection Embedded Subspace Clustering","C. Peng; Z. Kang; M. Yang; Q. Cheng","Department of Computer Science, Southern Illinois University Carbondale, Carbondale, IL, USA; Department of Computer Science, Southern Illinois University Carbondale, Carbondale, IL, USA; Department of Computer Science, Southern Illinois University Carbondale, Carbondale, IL, USA; Department of Computer Science, Southern Illinois University Carbondale, Carbondale, IL, USA",IEEE Signal Processing Letters,"23 Jun 2016","2016","23","7","1018","1022","We propose a new subspace clustering method that integrates feature selection into subspace clustering. Rather than using all features to construct a low-rank representation of the data, we find such a representation using only relevant features, which helps in revealing more accurate data relationships. Two variants are proposed by using both convex and nonconvex rank approximations. Extensive experimental results confirm the effectiveness of the proposed method and models.","1558-2361","","10.1109/LSP.2016.2573159","NSF(grant numbers:IIS-1218712); ","https://ieeexplore.ieee.org/stamp/stamp.jsp?arnumber=7479529","","Power capacitors;Face;Clustering algorithms;Optimization;Clustering methods;Signal processing algorithms;Closed-form solutions","","35","","32","IEEE","26 May 2016","","","IEEE","IEEE Journals"
"Window-Based Three-Dimensional Aggregation for Stereo Matching","T. Liu; X. Peng; L. Qiao","Department of Automatic Test and Control, Harbin Institute of Technology, Harbin, China; Department of Automatic Test and Control, Harbin Institute of Technology, Harbin, China; Department of Automatic Test and Control, Harbin Institute of Technology, Harbin, China",IEEE Signal Processing Letters,"22 Jun 2016","2016","23","7","1008","1012","This paper presents a window-based three-dimens-ional (3-D) aggregation technique, which can approximate the surfaces of all kinds of objects, in stereo matching. The 3-D aggregation, which means to aggregate in 3-D surfaces, is implemented by decomposing the adaptive support window into horizontal segments; we allow the disparity to change smoothly in or between segments. Compared to traditional local stereo methods, the 3-D aggregation greatly improves the accuracy of results in slanted surfaces and occlusion areas while keeping excellent performance near depth discontinuities. We also propose an acceleration method that surprisingly improves the accuracy at the same time. The evaluation experiments confirm our achievements.","1558-2361","","10.1109/LSP.2016.2578944","","https://ieeexplore.ieee.org/stamp/stamp.jsp?arnumber=7488233","3D/stereo scene analysis;slanted surfaces;3D aggregation;stereo matching;3-D aggregation;3-D/stereo scene analysis;slanted surfaces;stereo matching","Three-dimensional displays;Aggregates;Erbium;Complexity theory;Surface treatment;Signal processing algorithms;Training","","5","","16","IEEE","9 Jun 2016","","","IEEE","IEEE Journals"
"SPL EDICS","",,IEEE Signal Processing Letters,"12 Aug 2016","2016","23","7","1023","1023","Presents the EDICS (Editors' information classification scheme) subject categories for this issue of the publication.","1558-2361","","10.1109/LSP.2016.2586609","","https://ieeexplore.ieee.org/stamp/stamp.jsp?arnumber=7542662","","","","","","","IEEE","12 Aug 2016","","","IEEE","IEEE Journals"
"IEEE Transactions on Multimedia information for authors","",,IEEE Signal Processing Letters,"12 Aug 2016","2016","23","7","1024","1025","Provides instructions and guidelines to prospective authors who wish to submit manuscripts.","1558-2361","","10.1109/LSP.2016.2586610","","https://ieeexplore.ieee.org/stamp/stamp.jsp?arnumber=7542664","","","","","","","IEEE","12 Aug 2016","","","IEEE","IEEE Journals"
"IEEE Signal Processing Society Board of Governors","",,IEEE Signal Processing Letters,"12 Aug 2016","2016","23","7","C3","C3","Provides a listing of current committee members and society officers.","1558-2361","","10.1109/LSP.2016.2586618","","https://ieeexplore.ieee.org/stamp/stamp.jsp?arnumber=7542665","","","","","","","IEEE","12 Aug 2016","","","IEEE","IEEE Journals"
"[Blank page]","",,IEEE Signal Processing Letters,"12 Aug 2016","2016","23","7","C4","C4","This page or pages intentionally left blank.","1558-2361","","10.1109/LSP.2016.2592558","","https://ieeexplore.ieee.org/stamp/stamp.jsp?arnumber=7542607","","","","","","","IEEE","12 Aug 2016","","","IEEE","IEEE Journals"
