"Document Title",Authors,"Author Affiliations","Publication Title",Date Added To Xplore,"Publication Year","Volume","Issue","Start Page","End Page","Abstract","ISSN",ISBNs,"DOI",Funding Information,PDF Link,"Author Keywords","IEEE Terms","Mesh_Terms",Article Citation Count,Patent Citation Count,"Reference Count","License",Online Date,Issue Date,"Meeting Date","Publisher",Document Identifier
"Front Cover","",,IEEE Signal Processing Letters,"12 Aug 2016","2016","23","7","C1","C1","Presents the front cover for this issue of the publication.","1558-2361","","10.1109/LSP.2016.2586612","","https://ieeexplore.ieee.org/stamp/stamp.jsp?arnumber=7542615","","","","","","","IEEE","12 Aug 2016","","","IEEE","IEEE Journals"
"IEEE Signal Processing Society Editorial Board","",,IEEE Signal Processing Letters,"12 Aug 2016","2016","23","7","C2","C2","Provides a listing of current staff, committee members and society officers.","1558-2361","","10.1109/LSP.2016.2586611","","https://ieeexplore.ieee.org/stamp/stamp.jsp?arnumber=7542488","","","","","","","IEEE","12 Aug 2016","","","IEEE","IEEE Journals"
"Table of Contents","",,IEEE Signal Processing Letters,"12 Jul 2016","2016","23","7","901","902","Presents the table of contents for this issue of the publication.","1558-2361","","10.1109/LSP.2016.2586138","","https://ieeexplore.ieee.org/stamp/stamp.jsp?arnumber=7509722","","","","","","","IEEE","12 Jul 2016","","","IEEE","IEEE Journals"
"Table of Contents","",,IEEE Signal Processing Letters,"11 Jul 2016","2016","23","7","903","904","Presents the table of contents for this issue of the publication.","1558-2361","","10.1109/LSP.2016.2586139","","https://ieeexplore.ieee.org/stamp/stamp.jsp?arnumber=7509005","","","","","","","IEEE","11 Jul 2016","","","IEEE","IEEE Journals"
"Decimation Double-Phase Estimator: An Efficient and Unambiguous High-Order Binary Offset Carrier Tracking Algorithm","T. Feng","National University of Defense Technology, Changsha, China",IEEE Signal Processing Letters,"23 May 2016","2016","23","7","905","909","Traditional binary offset carrier (BOC) tracking algorithms process the upper and lower sideband signals together, and thus, the sampling frequency and computational requirements are much higher than that required for binary phase-shift keying tracking algorithms, especially for high-order BOC signals. Addressing existing limitations, this letter proposes a decimation double-phase estimator (DDPE) tracking algorithm for BOC signals. The algorithm uses a normal carrier and a subcarrier with a constant frequency to shift the upper and lower sideband signals of BOC to the zero frequency and decimates the signal before processing by the correlator. The residual carrier and the subcarrier are then tracked by the double-phase estimator algorithm. Decimating the signals significantly reduces the computational complexity, and for a BOC(6n, n) signal, the DDPE is found to reduce 86% of correlator operations with a signal-to-noise ratio loss of 0.5 dB.","1558-2361","","10.1109/LSP.2016.2565511","","https://ieeexplore.ieee.org/stamp/stamp.jsp?arnumber=7467482","BOC signal;decimation double-phase estimator;unambiguous tracking;low computational complexity;Binary offset carrier (BOC) signal;decimation double-phase estimator (DDPE);low computational complexity;unambiguous tracking","Signal processing algorithms;Signal to noise ratio;Tracking loops;Bandwidth;Algorithm design and analysis;Computational complexity;Correlation","","13","","10","IEEE","10 May 2016","","","IEEE","IEEE Journals"
"Novel Pilot Position Detection for SC-FDE Systems With Frequency Domain Pilot Multiplexing Technique","M. Wen; B. Zheng; Q. Guan; F. Chen; H. Yu; F. Ji","School of Electronic and Information Engineering, South China University of Technology, Guangzhou, China; School of Electronic and Information Engineering, South China University of Technology, Guangzhou, China; School of Electronic and Information Engineering, South China University of Technology, Guangzhou, China; School of Electronic and Information Engineering, South China University of Technology, Guangzhou, China; School of Electronic and Information Engineering, South China University of Technology, Guangzhou, China; School of Electronic and Information Engineering, South China University of Technology, Guangzhou, China",IEEE Signal Processing Letters,"24 May 2016","2016","23","7","910","914","Frequency domain pilot multiplexing technique (FDPMT) has recently emerged as an appealing technique for channel estimation in single-carrier frequency domain equalization systems as it achieves high spectral efficiency at the expense of tiny signal distortion. In FDPMT, pilot positions are dynamically selected to achieve a relatively low level of signal distortion, rendering pilot position detection (PPD) indispensable at the receiver. In this letter, by exploiting both the prior known pilots and the statistical information of the data tones, we propose a novel PPD scheme based on the maximum-likelihood criterion. Simulation results show that our proposed PPD scheme significantly improves the PPD accuracy and outperforms the existing counterparts in terms of bit error rate.","1558-2361","","10.1109/LSP.2016.2564981","National Natural Science Foundation of China(grant numbers:61431005,61372081,61322108,61302058); Guangdong Provincial Research Project(grant numbers:2014A030311034,2015B010101007); Program for New Century Excellent Talents in University(grant numbers:NCET-12-0196); Chinese Postdoctoral Science Foundation(grant numbers:2015M570712); ","https://ieeexplore.ieee.org/stamp/stamp.jsp?arnumber=7466805","SC-FDE;FDPMT;pilot position detection;ML;Frequency domain pilot multiplexing technique (FDPMT);maximum-likelihood (ML);pilot position detection;single-carrier frequency domain equalization (SC-FDE)","Frequency-domain analysis;Distortion;Receivers;Bit error rate;Discrete Fourier transforms;Channel estimation;Multiplexing","","3","","12","IEEE","9 May 2016","","","IEEE","IEEE Journals"
"An Accurate Method for Frequency Estimation of a Real Sinusoid","S. Djukanović","Faculty of Electrical Engineering, University of Montenegro, Podgorica, Montenegro",IEEE Signal Processing Letters,"25 May 2016","2016","23","7","915","918","It is well known that the positive- and negative-frequency components of a real sinusoid spectrally interact with each other; thus, introducing bias in frequency estimation based on the periodogram maximization. We propose to filter out the negative-frequency component. To that end, a coarse frequency estimation is obtained using the windowing approach, known to reduce the estimation bias, and then used to filter out the negative-frequency component via modulation and discrete Fourier transform bin excision approach. Fine estimation is performed using accurate frequency estimators, developed for complex sinusoids, on the filtered signal. The proposed method is characterized by the $ O(N\log _2N)$ complexity in terms of additions/multiplications and the $ O(N)$ complexity in terms of sine/cosine operations and comparisons. Moreover, it achieves the Cramér–Rao lower bound and is not sensitive to sinusoid frequency and initial phase, thus, outperforming the state-of-the-art methods.","1558-2361","","10.1109/LSP.2016.2564102","Ministry of Science of Montenegro; HERIC project through the BIO-ICT Centre of Excellence(grant numbers:01-1001); ","https://ieeexplore.ieee.org/stamp/stamp.jsp?arnumber=7465728","Cramer-Rao lower bound;estimation bias;frequency estimation;periodogram;real-valued sinusoid;Cramér-Rao lower bound;estimation bias;frequency estimation;periodogram;real-valued sinusoid","Frequency estimation;Signal to noise ratio;Complexity theory;Discrete Fourier transforms;Frequency modulation;Maximum likelihood estimation","","52","","14","IEEE","5 May 2016","","","IEEE","IEEE Journals"
"Cramér–Rao Bounds for Underdetermined Source Localization","A. Koochakzadeh; P. Pal","Department of Electrical and Computer Engineering, University of Maryland, College Park, MD, USA; Department of Electrical and Computer Engineering, University of Maryland, College Park, MD, USA",IEEE Signal Processing Letters,"30 May 2016","2016","23","7","919","923","Although Cramér-Rao Bounds (CRB) for direction-of-arrival (DOA) estimation have been extensively studied for decades, existing results are mainly applicable when there are fewer sources than sensors. In contrast, this letter considers an underdetermined signal model (more sources than sensors) and investigates conditions under which CRB exist. Necessary and sufficient conditions are derived for the associated Fisher information matrix to be nonsingular, which in turn, leads to closed-form expressions for the CRBs for underdetermined DOA estimation. These conditions highlight crucial roles played by the array geometry, as well as the correlation between source signals. The CRB for different array geometries are numerically compared both in the overdetermined and underdetermined settings.","1558-2361","","10.1109/LSP.2016.2569504","University of Maryland, College Park, and the Department of Defense; ","https://ieeexplore.ieee.org/stamp/stamp.jsp?arnumber=7470549","Coprime arrays;Cramér–Rao bound (CRB);direction-of-arrival (DOA) estimation;nested arrays;singular Fisher information;Coprime arrays;Cramér–Rao bound (CRB);direction-of-arrival (DOA) estimation;nested arrays;singular Fisher information","Sensor arrays;Direction-of-arrival estimation;Estimation;Geometry;Array signal processing;Antenna arrays","","90","","17","IEEE","17 May 2016","","","IEEE","IEEE Journals"
"A De-noising Scheme Based on the Null Hypothesis of Intrinsic Mode Functions","M. H. Al-Badrawi; B. Z. Al-Jewad; W. J. Smith; N. J. Kirsch","Department of Electrical and Computer Engineering, University of New Hampshire, Durham, NH, USA; Department of Communication and Computer Engineering, Cihan University, Erbil, Iraq; Department of Electrical and Computer Engineering, University of New Hampshire, Durham, NH, USA; Department of Electrical and Computer Engineering, University of New Hampshire, Durham, NH, USA",IEEE Signal Processing Letters,"2 Jun 2016","2016","23","7","924","928","Empirical mode decomposition is a nonparametric adaptive tool that decomposes signals into a set of zero-mean modes called intrinsic mode functions (IMFs) that can be used to denoise a signal by selecting the relevant (noise-free) modes. In this paper, the statistical properties of IMFs, produced by a range of signal distributions, are examined. Insight from the statistical analysis is used in a null hypothesis test that validates a best fit model distribution of the IMFs. This test is then used in a de-noising scheme, which is evaluated using different test signals corrupted with white and colored noise. Simulations under different scenarios demonstrate the efficacy of the proposed method as compared to other EMD-based de-noising techniques.","1558-2361","","10.1109/LSP.2016.2569494","National Science Foundation(grant numbers:1336824); ","https://ieeexplore.ieee.org/stamp/stamp.jsp?arnumber=7470606","Empirical mode decomposition;signal denoising;null hypothesis;intrinsic mode function;Empirical mode decomposition (EMD);intrinsic mode function (IMF);null hypothesis;signal de-noising","Noise reduction;Probability density function;Gaussian distribution;Laplace equations;Signal to noise ratio;Statistical analysis;Indexes","","10","","25","IEEE","18 May 2016","","","IEEE","IEEE Journals"
"Robust Bayesian Precoding for Mitigation of TDD Hardware Calibration Errors","S. Bazzi; W. Xu","Huawei Technologies, European Research Center, Munich, Germany; Huawei Technologies, European Research Center, Munich, Germany",IEEE Signal Processing Letters,"2 Jun 2016","2016","23","7","929","933","The predominantly used channel reciprocity condition in time-division-duplex mode only holds in practical systems if the transmit and receive hardware chains at the base station (BS) and at the user equipments are perfectly calibrated. Otherwise, there is a mismatch between the uplink (UL) and downlink channel state information (CSI) that leads to performance degradations. In this paper, we consider a multi-user MIMO system with hardware calibration errors (CaEs) at the BS and derive robust Bayesian precoders that minimize inter-user interference using the UL CSI and CaEs statistics as side information. The proposed robust precoding outperforms conventional non-robust precoding, and its gains compared to non-robust precoding increase with increasing numbers of users and CaEs. Furthermore, robust precoding can be used to relax calibration requirements, which is a result of practical interest. Our approach is applicable to any number of BS antennas but is especially important for massive MIMO systems where larger CaEs might be expected.","1558-2361","","10.1109/LSP.2016.2569199","Horizon 2020 project FANTASTIC-5G(grant numbers:ICT- 671660); European Union; ","https://ieeexplore.ieee.org/stamp/stamp.jsp?arnumber=7470241","Time-division-duplex mode;calibration errors;robust precoding;Bayesian estimation;Bayesian estimation;calibration errors (CaEs);robust precoding;time-division-duplex (TDD) mode","Calibration;Antennas;Robustness;Precoding;Bayes methods;Antenna measurements;Interference","","9","","15","IEEE","16 May 2016","","","IEEE","IEEE Journals"
"Square-Root Lasso With Nonconvex Regularization: An ADMM Approach","X. Shen; L. Chen; Y. Gu; H. C. So","Department of Electronic Engineering and Tsinghua National Laboratory for Information Science and Technology, Tsinghua University, Beijing, China; Department of Electronic Engineering and Tsinghua National Laboratory for Information Science and Technology, Tsinghua University, Beijing, China; Department of Electronic Engineering and Tsinghua National Laboratory for Information Science and Technology, Tsinghua University, Beijing, China; Department of Electronic Engineering, City University of Hong Kong, Hong Kong",IEEE Signal Processing Letters,"7 Jun 2016","2016","23","7","934","938","Square-root least absolute shrinkage and selection operator (Lasso), a variant of Lasso, has recently been proposed with a key advantage that the optimal regularization parameter is independent of the noise level in the measurements. In this letter, we introduce a class of nonconvex sparsity-inducing penalties to the square-root Lasso to achieve better sparse recovery performance over the convex counterpart. The resultant formulation is converted to a nonconvex but multiconvex optimization problem, i.e., it is convex in each block of variables. Alternating direction method of multipliers is applied as the solver, according to which two efficient algorithms are devised for row-orthonormal sensing matrix and general sensing matrix, respectively. Numerical experiments are conducted to evaluate the performance of the proposed methods.","1558-2361","","10.1109/LSP.2016.2567482","NSFC/RGC Joint Research Scheme; National Natural Science Foundation of China; Research Grants Council of Hong Kong(grant numbers:61531166005,N_CityU 104/15); ","https://ieeexplore.ieee.org/stamp/stamp.jsp?arnumber=7469302","Sparse recovery;square-root penalty;non-convex regularization;alternating direction method of multipliers (ADMM);linearized ADMM;Alternating direction method of multipliers (ADMM);linearized ADMM;nonconvex regularization;sparse recovery;square-root penalty","Sensors;Sparse matrices;Signal processing algorithms;Noise level;Noise measurement;Optimization;Matrix converters","","27","","16","IEEE","12 May 2016","","","IEEE","IEEE Journals"
"A Robust Design for MISO Physical-Layer Multicasting Over Line-of-Sight Channels","M. -C. Yue; S. X. Wu; A. M. -C. So","Department of Systems Engineering and Engineering Management, The Chinese University of Hong Kong, Shatin, Hong Kong; Department of Systems Engineering and Engineering Management, The Chinese University of Hong Kong, Shatin, Hong Kong; Department of Systems Engineering and Engineering Management, The Chinese University of Hong Kong, Shatin, Hong Kong",IEEE Signal Processing Letters,"6 Jun 2016","2016","23","7","939","943","This letter studies a robust design problem for far-field line-of-sight (LOS) propagation channels where phase errors are present. Compared with the commonly used additive error model, the phase error model is more suitable for capturing the uncertainty in an LOS propagation channel, as the dominant source of uncertainty lies in the phase. We consider a multiple-input single-output multicast scenario, in which our goal is to design a beamformer that minimizes the transmit power while satisfying probabilistic signal-to-noise ratio constraints. In particular, the probabilistic constraints give rise to a new computational challenge, as they involve random trigonometric forms. In this study, we propose to first approximate the random trigonometric form by its second-order Taylor expansion and then tackle the resulting random quadratic form using a Bernstein-type inequality. It follows that an approximately optimal beamformer can be obtained using the standard semidefinite relaxation technique. Such a design approach is applicable to both independent and correlated phase errors. In the simulations, we first show that if a nonrobust design (i.e., one that does not take phase errors into account) is used; then, the whole system may collapse. We then show that our proposed method is less conservative than the existing robust design based on Gaussian approximation and thus requires a lower power budget.","1558-2361","","10.1109/LSP.2016.2569600","","https://ieeexplore.ieee.org/stamp/stamp.jsp?arnumber=7470608","Beamforming;line-of-sight (LOS);MISO;multicast;phase error;robust","Probabilistic logic;Modeling;Robustness;Array signal processing;Signal to noise ratio;Receivers","","34","","11","IEEE","18 May 2016","","","IEEE","IEEE Journals"
"Robust X-Ray Phase Ptycho-Tomography","S. V. Venkatakrishnan; M. Farmand; Y. -S. Yu; H. Majidi; K. van Benthem; S. Marchesini; D. A. Shapiro; A. Hexemer","Advanced Light Source, Lawrence Berkeley National Laboratory, Berkeley, CA, USA; Advanced Light Source, Lawrence Berkeley National Laboratory, Berkeley, CA, USA; Advanced Light Source, Lawrence Berkeley National Laboratory, Berkeley, CA, USA; Department of Materials Science and Engineering, University of California, Davis, CA, USA; Department of Materials Science and Engineering, University of California, Davis, CA, USA; Advanced Light Source, Lawrence Berkeley National Laboratory, Berkeley, CA, USA; Advanced Light Source, Lawrence Berkeley National Laboratory, Berkeley, CA, USA; Advanced Light Source, Lawrence Berkeley National Laboratory, Berkeley, CA, USA",IEEE Signal Processing Letters,"9 Jun 2016","2016","23","7","944","948","Synchrotron-based soft X-ray ptychography has enabled the reconstruction of both the phase and attenuation projections of samples relevant to the physical and biological sciences. The phase projection images typically have higher fidelity and hence are used for tomographic reconstruction. In practice, three-dimensional tomographic reconstruction can be challenging because the measurements may have outliers, a fluctuating background and may be restricted to a limited angular range of sample rotations. Thus, conventional reconstruction algorithms such as filtered back projection can result in reconstructions with strong artifacts. In this paper, we present a robust model-based iterative reconstruction algorithm for X-ray ptychography-based phase tomography. Our method casts the reconstruction as a regularized inverse problem, involving a novel data fitting term that accounts for noise, the fluctuating background as well as outliers, combined with an image model term that enforces regularity on the volume to be reconstructed. We use a majorization-minimization strategy to find a minimum of the formulated cost function. Reconstructions on a simulated as well as a real dataset show that it is possible to acquire high-quality phase reconstructions compared to the typically used filtered-back projection algorithm as well as conventional regularized inversion approaches.","1558-2361","","10.1109/LSP.2016.2562504","Director, Office of Science; Office of Basic Energy Sciences; U.S. Department of Energy(grant numbers:DE-AC02-05CH11231); Center for Applied Mathematics for Energy Research Applications; ASCR-BES; U.S. Department of Energy(grant numbers:DOE-DE-AC03-76SF00098); A.H's DOE Early; Army Research Office(grant numbers:#W911NF1210491); ","https://ieeexplore.ieee.org/stamp/stamp.jsp?arnumber=7464924","Computed tomography;iterative methods;ptychography;X-ray tomography;Computed tomography;iterative methods;ptychography;X-ray tomography","Image reconstruction;Tomography;Signal processing algorithms;Cost function;Phase measurement;Robustness","","14","","24","IEEE","4 May 2016","","","IEEE","IEEE Journals"
"Adaptive Objectness for Object Tracking","P. Liang; Y. Pang; C. Liao; X. Mei; H. Ling","Department of Computer and Information Sciences, Temple University, Philadelphia, PA, USA; Department of Computer and Information Sciences, Temple University, Philadelphia, PA, USA; HiScene Information Technologies, Shanghai, China; Toyota Research Institute, North America, Ann Arbor, MI, USA; Department of Computer and Information Sciences, Temple University, Philadelphia, PA, USA",IEEE Signal Processing Letters,"9 Jun 2016","2016","23","7","949","953","To exploit the reliable prior knowledge that the target object in tracking must be an object other than nonobject, in this letter, we propose to adapt objectness for visual object tracking. Instead of directly applying an existing objectness measure that is generic and handles various objects and environments, we adapt it to be compatible to the specific tracking sequence and object. More specifically, we use the newly proposed binarized normed gradient (BING) objectness as the base, and then train an object-adaptive objectness for each tracking task. The training is implemented by using an adaptive support vector machine that integrates information from the specific tracking target into the BING measure. We emphasize that the benefit of the proposed adaptive objectness, named ADOBING, is generic. To show this, we combine ADOBING with eight top performed trackers in recent evaluations. We run the ADOBING-enhanced trackers along with their base trackers on the CVPR2013 benchmark, and our methods consistently improve the base trackers both in overall performance and under all challenge factors. Noting that the way we integrate objectness in visual tracking is generic and straightforward, we expect even more improvement by using tracker-specific objectness.","1558-2361","","10.1109/LSP.2016.2556706","NSF(grant numbers:IIS-1407156,IIS-1350521,IIS-1218156); ","https://ieeexplore.ieee.org/stamp/stamp.jsp?arnumber=7457299","Model adaptation;objectness;object tracking;Model adaptation;objectness;object tracking","Target tracking;Visualization;Training;Object tracking;Support vector machines;Benchmark testing;Adaptation models","","33","","33","IEEE","20 Apr 2016","","","IEEE","IEEE Journals"
"An Efficient Framework for Automatic Highlights Generation from Sports Videos","A. Javed; K. B. Bajwa; H. Malik; A. Irtaza","Department of Software Engineering, University of Engineering and Technology, Taxila, Pakistan; Department of Software Engineering, University of Engineering and Technology, Taxila, Pakistan; Electrical and Computer Engineering Department, University of Michigan-Dearborn, Dearborn, MI, USA; Department of Software Engineering, University of Engineering and Technology, Taxila, Pakistan",IEEE Signal Processing Letters,"13 Jun 2016","2016","23","7","954","958","This letter presents a framework for replay detection in sports videos to generate highlights. For replay detection, the proposed work exploits the following facts: 1) broadcasters introduce gradual transition (GT) effect both at the start and at the end of a replay segment (RS), and 2) the absence of score captions (SCs) in an RS. The dual-threshold-based method is used to detect GT frames from the input video. A pair of successive GT frames is used to extract the candidate RSs. All frames in the selected segment are processed to detect SC. To this end, temporal running average is used to filter out temporal variations. First- and second-order statistics are used to binarize the running average image, which is fed to optical character recognition stage for character recognition. The absence/presence of SC is used for replay/live frame labeling. The SC detection stage complements the GT detection process, therefore, a combination of both is expected to result in superior computational complexity and detection accuracy. The performance of the proposed system is evaluated on 22 videos of four different sports (e.g., Cricket, tennis, baseball, and basketball). Experimental results indicate that the proposed method can achieve average detection accuracy ≥ 94.7%.","1558-2361","","10.1109/LSP.2016.2573042","","https://ieeexplore.ieee.org/stamp/stamp.jsp?arnumber=7479531","Gradual transition;highlights;replay detection;score-caption;temporal running average;Gradual transition (GT);highlights;replay detection;score caption (SC);temporal running average","Videos;Character recognition;Histograms;Optical character recognition software;Sports equipment;Lighting;Computational efficiency","","27","","27","IEEE","26 May 2016","","","IEEE","IEEE Journals"
