Long Term Relevance Feedback: A Probabilistic Axis Re-Weighting Update Scheme,A. Lakshmi; M. Nema; S. Rakshit,"Centre for artificial intelligence and robotics, Bangalore, India; Centre for artificial intelligence and robotics, Bangalore, India; Centre for artificial intelligence and robotics, Bangalore, India",IEEE Signal Processing Letters,25 Nov 2014,2015,22,7,852,856,"Content Based Retrieval (CBR) systems use Relevance Feedback (RF) to fill the semantic gap. RF can be short-term or long-term. The introduction of long-term learning methods address the memory problem in short-term learning methods. In this letter we propose a new method to enhance the gain of long-term relevance feedback. We have come up with a long term learning scheme in relevance feedback for CBR. The proposed system integrates the user feedback from all iterationations and instills memory into the feedback system of CBR without saving any log of earlier retrievals. In this letter, we have come up with a method to update the cluster parameters and weights assigned to features by accumulating the knowledge obtained from the user over iterations. The proposed update method is validated in the image retrieval context in terms of conventional recall-precision graph and retrieval accuracy.",1558-2361,,10.1109/LSP.2014.2372073,,https://ieeexplore.ieee.org/stamp/stamp.jsp?arnumber=6963328,Axis-re-weighting;CBR;relevance feedback,Radio frequency;Signal processing algorithms;Equations;Nickel;Semantics;Learning systems;Convergence,,2,,20,IEEE,20 Nov 2014,,,IEEE,IEEE Journals
Robust One-Bit Bayesian Compressed Sensing with Sign-Flip Errors,F. Li; J. Fang; H. Li; L. Huang,"National Key Lab. on Communications, University of Electronic Science and Technology of China, Chengdu, China; National Key Lab. on Communications, University of Electronic Science and Technology of China, Chengdu, China; Dept. of Electrical and Computer Engineering, Stevens Institute of Technology, Hoboken, NJ, USA; Department of Electronic and Information Engineering, Shenzhen Graduate School, Shenzhen, China",IEEE Signal Processing Letters,3 Dec 2014,2015,22,7,857,861,"We consider the problem of sparse signal recovery from one-bit measurements. Due to the noise present in the acquisition and transmission process, some quantized bits may be flipped to their opposite states. These bit-flip errors, also referred to as the sign-flip errors, may result in severe performance degradation. To address this issue, we introduce a robust Bayesian compressed sensing framework to account for sign flip errors. Specifically, sign-flip errors are considered as a result of a sparse noise-corrupted model in which original (unquantized) observations are corrupted by sparse (impulse) noise. A Gaussian-inverse Gamma hierarchical prior is assigned to the noise vector to promote sparsity. Based on the modified hierarchical model, we develop a variational expectation-maximization (EM) algorithm to identify the sign-flip errors and recover the sparse signal simultaneously. Numerical results are provided to illustrate the effectiveness and superiority of the proposed method.",1558-2361,,10.1109/LSP.2014.2373380,,https://ieeexplore.ieee.org/stamp/stamp.jsp?arnumber=6963346,One-bit Bayesian compressed sensing;sign-flip errors;variational expectation-maximization,Noise;Bayes methods;Compressed sensing;Vectors;Signal processing algorithms;Robustness;Electronic mail,,52,,13,IEEE,20 Nov 2014,,,IEEE,IEEE Journals
Fast Decomposition of Large Nonnegative Tensors,J. Cohen; R. C. Farias; P. Comon,"Images and Signal Departement, Domaine Universitaire, St Martin d'Heres Cedex, France; Images and Signal Departement, Domaine Universitaire, St Martin d'Heres Cedex, France; Images and Signal Departement, Domaine Universitaire, St Martin d'Heres Cedex, France",IEEE Signal Processing Letters,3 Dec 2014,2015,22,7,862,866,"In signal processing, tensor decompositions have gained in popularity this last decade. In the meantime, the volume of data to be processed has drastically increased. This calls for novel methods to handle Big Data tensors. Since most of these huge data are issued from physical measurements, which are intrinsically real nonnegative, being able to compress nonnegative tensors has become mandatory. Following recent works on HOSVD compression for Big Data, we detail solutions to decompose a nonnegative tensor into decomposable terms in a compressed domain.",1558-2361,,10.1109/LSP.2014.2374838,,https://ieeexplore.ieee.org/stamp/stamp.jsp?arnumber=6967733,Big Data;compression;CP decomposition;HOSVD;nonnegative;PARAFAC;tensor,Tensile stress;Image coding;Signal processing algorithms;Convergence;Linear programming;Big data;Approximation methods,,40,,21,IEEE,26 Nov 2014,,,IEEE,IEEE Journals
On the Performance of Secure Full-Duplex Relaying under Composite Fading Channels,H. Alves; G. Brante; R. D. Souza; D. B. da Costa; M. Latva-aho,"Federal University of Technology - Paraná (UTFPR), Paraná, Brazil; Federal University of Technology - Paraná (UTFPR), Paraná, Brazil; Federal University of Technology - Paraná (UTFPR), Paraná, Brazil; Federal University of Ceará (UFC), Ceará, Brazil; Centre for Wireless Communications, University of Oulu, Oulu, Finland",IEEE Signal Processing Letters,4 Dec 2014,2015,22,7,867,870,"We assume a full-duplex (FD) cooperative network subject to hostile attacks and undergoing composite fading channels. We focus on two scenarios: a) the transmitter has full CSI, for which we derive closed-form expressions for the average secrecy rate; and b) the transmitter only knows the CSI of the legitimate nodes, for which we obtain closed-form expressions for the secrecy outage probability. We show that secure FD relaying is feasible, even under strong self-interference and in the presence of sophisticated multiple antenna eavesdropper.",1558-2361,,10.1109/LSP.2014.2374994,,https://ieeexplore.ieee.org/stamp/stamp.jsp?arnumber=6966715,Full-duplex relaying;PHY security;secrecy ergodic capacity;secrecy outage probability,Relays;Fading;Educational institutions;Approximation methods;Decoding;Closed-form solutions;Cooperative systems,,19,,18,IEEE,25 Nov 2014,,,IEEE,IEEE Journals
Local Topographic Shape Patterns for Texture Description,C. He; T. Zhuo; X. Su; F. Tu; D. Chen,"State Key Laboratory for Information Engineering in Surveying, Mapping and Remote Sensing, Wuhan University, Wuhan, China; Electronic Information School, Wuhan University, Wuhan, China; Telecom ParisTech, CNRS LTCI, Institut Mines-Telecom, Paris, France; Electronic Information School, Wuhan University, Wuhan, China; National University of Defense Technology, China",IEEE Signal Processing Letters,4 Dec 2014,2015,22,7,871,875,"This letter introduces a new image descriptor named Local Topographic Shape Pattern (LTSP) for texture description by relying on complete shape-based image representation. Firstly, a texture image is decomposed into a tree of shapes, i.e., topographic map, to obtain a multi-scale and contrast-invariant representation. Secondly, the shape of each node in the tree is handled with four shape patterns which are proposed as spatial codes of the shape. Finally, statistical histograms of shape patterns are used as texture descriptors. Contrast experiments of the proposed method show satisfactory performance in terms of both texture retrieval and classification tasks when applied to the Brodatz and UMD texture datasets.",1558-2361,,10.1109/LSP.2014.2374608,"National Natural Science Foundation of China(grant numbers:41371342,61331016)); ",https://ieeexplore.ieee.org/stamp/stamp.jsp?arnumber=6966719,Local topographic map;shape pattern;texture description,Shape;Histograms;Indexing;Educational institutions;Image representation;Materials;Electronic mail,,4,,24,IEEE,25 Nov 2014,,,IEEE,IEEE Journals
A Novel Biometric Approach for Human Identification and Verification Using Eye Blinking Signal,M. Abo-Zahhad; S. M. Ahmed; S. N. Abbas,"Department of Electrical and Electronics Engineering, Assiut University, Assiut, Egypt; Department of Electrical and Electronics Engineering, Assiut University, Assiut, Egypt; Department of Electrical and Electronics Engineering, Assiut University, Assiut, Egypt",IEEE Signal Processing Letters,4 Dec 2014,2015,22,7,876,880,"In this letter, a novel technique is adopted for human recognition based on eye blinking waveform extracted from electro-oculogram signals. For this purpose, a database of 25 subjects is collected using Neurosky Mindwave headset. Then, the eye blinking signal is extracted and applied for identification and verification tasks. The pre-processing stage includes empirical mode decomposition to isolate electro-oculogram signal from brainwaves. Then, time delineation of the eye blinking waveform is utilized for feature extraction. Finally, linear discriminant analysis is adopted for classification. Based on the achieved results, the proposed system can identify subjects with best accuracy of 97.3% and verify them with an equal error rate of 3.7%. The obtained results in this letter confirm that eye blinking waveform carries discriminant information and is therefore appropriate as a basis for human recognition task.",1558-2361,,10.1109/LSP.2014.2374338,,https://ieeexplore.ieee.org/stamp/stamp.jsp?arnumber=6966714,Biometric authentication;discriminant analysis;electro-oculogram;empirical mode decomposition;eye blinking;time delineation,Electrooculography;Feature extraction;Electroencephalography;Headphones;Authentication;Databases;Electrodes,,56,,14,IEEE,25 Nov 2014,,,IEEE,IEEE Journals
"Perfect Gaussian Integer Sequences of Odd Period ${2^m} - 1$ ",C. -D. Lee; Y. -P. Huang; Y. Chang; H. -H. Chang,"Department of Communication Engineering, I-Shou University, Dashu District, Kaohsiung City, Taiwan, R.O.C.; Department of Applied Mathematics, I-Shou University, Dashu District, Kaohsiung City, Taiwan, R.O.C.; Department of Applied Mathematics, I-Shou University, Dashu District, Kaohsiung City, Taiwan, R.O.C.; Department of Communication Engineering, I-Shou University, Dashu District, Kaohsiung City, Taiwan, R.O.C.",IEEE Signal Processing Letters,5 Dec 2014,2015,22,7,881,885,"In this letter, some perfect Gaussian integer sequences of period 2m - 1 are proposed based on the trace representations of Legendre sequences, Hall's sextic residue sequences, m-sequences, and Gordon-Mills-Welch (GMW) sequences over the finite field \BBF2m. Moreover, the energy efficiency of these sequences is approximately 1 for sufficiently large m.",1558-2361,,10.1109/LSP.2014.2375313,,https://ieeexplore.ieee.org/stamp/stamp.jsp?arnumber=6967790,Hall’s sextic residue sequences;Legendre sequences;$m$-sequences;perfect Gaussian integer sequences;trace representation,Polynomials;Correlation;Peak to average power ratio;Gaussian integer sequences,,30,,16,IEEE,26 Nov 2014,,,IEEE,IEEE Journals
A Multi-Modal Topic Model for Image Annotation Using Text Analysis,J. Tian; Y. Huang; Z. Guo; X. Qi; Z. Chen; T. Huang,"Key Laboratory of Technology in Geospatial Information Processing and Application System, Chinese Academy of Sciences, Beijing, China; Key Laboratory of Technology in Geospatial Information Processing and Application System, Chinese Academy of Sciences, Beijing, China; Key Laboratory of Technology in Geospatial Information Processing and Application System, Chinese Academy of Sciences, Beijing, China; Key Laboratory of Technology in Geospatial Information Processing and Application System, Chinese Academy of Sciences, Beijing, China; Key Laboratory of Technology in Geospatial Information Processing and Application System, Chinese Academy of Sciences, Beijing, China; Key Laboratory of Technology in Geospatial Information Processing and Application System, Chinese Academy of Sciences, Beijing, China",IEEE Signal Processing Letters,5 Dec 2014,2015,22,7,886,890,"Most of the existing approaches for image annotation generally demand exactly labeled training data, which are often difficult to obtain. In this letter we present a novel model that utilizes the rich surrounding text of images to perform image annotation. Our work makes two main contributions. First, by integrating text analysis, words that describe the salient objects in images are extracted. Second, a new probabilistic topic model is built to jointly model image features, extracted words and surrounding text. Our model is demonstrated to be flexible enough to handle multi-modal features and provide better performance than the state-of-the-art annotation methods.",1558-2361,,10.1109/LSP.2014.2375341,,https://ieeexplore.ieee.org/stamp/stamp.jsp?arnumber=6971080,Graphical models;image analysis;statistical learning;text analysis,Visualization;Data models;Feature extraction;Text analysis;Probabilistic logic;Computational modeling;Refrigerators,,6,,20,IEEE,2 Dec 2014,,,IEEE,IEEE Journals
Minor Surfaces are Boundaries of Mode-Based Clusters,E. Ataer-Cansizoglu; M. Akcakaya; D. Erdogmus,"Department of Electrical and Computer Engineering, Northeastern University, Boston, MA, USA; Department of Electrical an Computer Engineering, University of Pittsburgh, Pittsburgh, PA, USA; Department of Electrical and Computer Engineering, Northeastern University, Boston, MA, USA",IEEE Signal Processing Letters,8 Dec 2014,2015,22,7,891,895,"We show that mode-based cluster boundaries exhibit themselves as minor surfaces of the data probability density function. Based on this result, we provide a connectivity measure depending on minor surface search between sample pairs. Accordingly, we build a connectivity graph among data samples. The use of graph construction is particularly demonstrated for clustering, but applications in other machine learning areas are possible. On Gaussian mixture and kernel density estimate type probability density models, we illustrate the theoretical results with examples and demonstrate that cluster boundaries between sample pairs can be detected using a line integral. We also demonstrate an example where the data distribution has a continuous line segment as its set of local maxima (not strict), for which mean-shift like gradient flow and other mode-seeking algorithms fail to identify a single cluster, while the proposed approach successfully determines this fact.",1558-2361,,10.1109/LSP.2014.2376192,"National Science Foundation(grant numbers:IIS-1118061,IIS-1149570); National Institutes of Health(grant numbers:1R21EY022387); ",https://ieeexplore.ieee.org/stamp/stamp.jsp?arnumber=6967697,Clustering;kernel density estimation;minor surfaces;mode-seeking,Clustering algorithms;Signal processing algorithms;Eigenvalues and eigenfunctions;Trajectory;Surface treatment;Probability density function;Machine learning algorithms,,1,,16,IEEE,26 Nov 2014,,,IEEE,IEEE Journals
An Efficient Frame-Content Based Intra Frame Rate Control for High Efficiency Video Coding,M. Wang; K. N. Ngan; H. Li,"Department of Electronic Engineering, The Chinese University of Hong Kong, Hong Kong; Department of Electronic Engineering, The Chinese University of Hong Kong, Hong Kong; School of Electronic Engineering, University of Electronic Science and Technology of China, Chengdu, China",IEEE Signal Processing Letters,8 Dec 2014,2015,22,7,896,900,"Rate control plays an important role in the rapid development of high-fidelity video services. As the High Efficiency Video Coding (HEVC) standard has been finalized, many rate control algorithms are being developed to promote its commercial use. The HEVC encoder adopts a new R-lambda based rate control model to reduce the bit estimation error. However, the R-lambda model fails to consider the frame-content complexity that ultimately degrades the performance of the bit rate control. In this letter, a gradient based R-lambda (GRL) model is proposed for the intra frame rate control, where the gradient can effectively measure the frame-content complexity and enhance the performance of the traditional R-lambda method. In addition, a new coding tree unit (CTU) level bit allocation method is developed. The simulation results show that the proposed GRL method can reduce the bit estimation error and improve the video quality in HEVC all intra frame coding.",1558-2361,,10.1109/LSP.2014.2377032,,https://ieeexplore.ieee.org/stamp/stamp.jsp?arnumber=6975151,Frame-content complexity;HEVC;lagrange multiplier;perceptual coding;rate control,Encoding;Bit rate;Video coding;Complexity theory;Computational modeling;Bandwidth;Signal processing algorithms,,80,2,16,IEEE,4 Dec 2014,,,IEEE,IEEE Journals
A General Solution to Optimal Fixed-Gain ($\alpha$-$\beta$-$\gamma$ etc.) Filters,D. F. Crouse,"Radar Division, Naval Research Laboratory, District of Columbia, United States",IEEE Signal Processing Letters,9 Dec 2014,2015,22,7,901,904,"A considerable number of papers in the literature provide solutions for fixed-gain filters, such as the $\alpha$ -$\beta$  filter, that minimize the mean squared error under various dynamic models. This note demonstrates that those specialized models are unnecessary as the tools to explicitly find optimal fixed gains for arbitrary observable systems are already in the literature. The results produced by this method agree with published results for specialized algorithms. The solution of this letter also obviates the need for special “aeolotropic” filter design. Code implementing the algorithm and simulations is available in Matlab on IEEEXplore.",1558-2361,,10.1109/LSP.2014.2376876,,https://ieeexplore.ieee.org/stamp/stamp.jsp?arnumber=6971161,Filtering;linear systems;optimal control,Signal processing algorithms;Mathematical model;Q measurement;Kalman filters;Riccati equations;Noise measurement,,23,,34,USGov,2 Dec 2014,,,IEEE,IEEE Journals
The Effects of Multiple Carrier Frequency Offsets on the Performance of Virtual MISO FSK Systems,M. Hussain; S. A. Hassan,"School of Electrical Engineering and Computer Science (SEECS), National University of Sciences and Technology, Islamabad, Pakistan; School of Electrical Engineering and Computer Science (SEECS), National University of Sciences and Technology, Islamabad, Pakistan",IEEE Signal Processing Letters,11 Dec 2014,2015,22,7,905,909,"In this letter, a virtual multiple-input single-output (VMISO) network employing non-coherent frequency shift keying (FSK) is considered. In the VMISO network, spatially separated single-antenna nodes transmit the same information cooperatively to a single receiver where each received signal is affected by an independent carrier frequency offset (CFO). The existing works in this area assume a perfect carrier synchronization between the nodes. However, in this letter, the effects of CFOs on the performance degradation of this network are analyzed. For that purpose, the expression for the probability of symbol error has been derived. The results indicate that the performance is degraded due to CFOs, which is dependent upon the magnitude of CFOs, signal-to-noise ratio (SNR), number of transmitting nodes, and the modulation order of FSK. At high SNR, the CFOs affect the system severely and the performance margin is minimum.",1558-2361,,10.1109/LSP.2014.2375172,,https://ieeexplore.ieee.org/stamp/stamp.jsp?arnumber=6967769,Carrier frequency offset (CFO);cooperative communication;non-coherent FSK;virtual multiple-input single-output (VMISO),Frequency shift keying;Receivers;Degradation;Wireless sensor networks;Transmitters;Synchronization;Signal to noise ratio,,8,,16,IEEE,26 Nov 2014,,,IEEE,IEEE Journals
Kernelized Relaxed Margin Components Analysis for Person Re-identification,H. Liu; M. Qi; J. Jiang,"School of Computer and Information, Hefei University of Technology, Hefei, Anhui, China; School of Computer and Information, Hefei University of Technology, Hefei, Anhui, China; School of Computer and Information, Hefei University of Technology, Hefei, Anhui, China",IEEE Signal Processing Letters,12 Dec 2014,2015,22,7,910,914,"Person re-identification across disjoint camera views plays a significant role in video surveillance. Several margin-based metric learning algorithms have recently been proposed to learn an optimal metric, with the goal that samples of the same person always belong to the same class while those from different classes are separated by a large margin. These approaches require no modification or extension in order to solve problems of multiple (as opposed to binary) classification. However, the formation of the margin in these methods is not scalable, and thus cannot adequately use inter-class information according to the relevant practical application. To address this issue, we propose a novel algorithm called Relaxed Margin Components Analysis (RMCA) to “relax” the margin constraint. Furthermore, we equip our RMCA with a kernel function to form a Kernelized RMCA (KRMCA) to learn non-linear distance metrics in order to further improve re-identification accuracy. Promising results from experiments on several public datasets demonstrate the effectiveness of our method.",1558-2361,,10.1109/LSP.2014.2377204,"National Natural Science Foundation of China; ",https://ieeexplore.ieee.org/stamp/stamp.jsp?arnumber=6975129,Distance metric learning;kernelization;margin;person re-identification,Feature extraction;Training;Cameras;Measurement;Kernel;Signal processing algorithms;Testing,,17,,21,IEEE,4 Dec 2014,,,IEEE,IEEE Journals
On Computing Jeffrey’s Divergence Between Time-Varying Autoregressive Models,C. Magnant; A. Giremus; E. Grivel,"Thales Systemes Aeroportes S. A., Pessac, France; Université de Bordeaux–INP Bordeaux ENSEIRB-MATMECA–IMS–UMR CNRS 5218, Talence Cedex, France; Université de Bordeaux–INP Bordeaux ENSEIRB-MATMECA–IMS–UMR CNRS 5218, Talence Cedex, France",IEEE Signal Processing Letters,11 Dec 2014,2015,22,7,915,919,"Autoregressive (AR) and time-varying AR (TVAR) models are widely used in various applications, from speech processing to biomedical signal analysis. Various dissimilarity measures such as the Itakura divergence have been proposed to compare two AR models. However, they do not take into account the variances of the driving processes and only apply to stationary processes. More generally, the comparison between Gaussian processes is based on the Kullback-Leibler (KL) divergence but only asymptotic expressions are classically used. In this letter, we suggest analyzing the similarities of two TVAR models, sample after sample, by recursively computing the Jeffrey's divergence between the joint distributions of the successive values of each TVAR model. Then, we show that, under some assumptions, this divergence tends to the Itakura divergence in the stationary case.",1558-2361,,10.1109/LSP.2014.2377473,,https://ieeexplore.ieee.org/stamp/stamp.jsp?arnumber=6975076,Autoregressive process;Itakura divergence;Jeffrey’s divergence;time-varying autoregressive process,Computational modeling;Biological system modeling;Analytical models;Biomedical measurement;Joints;Mathematical model;Vectors,,15,,15,OAPA,4 Dec 2014,,,IEEE,IEEE Journals
Binary Tomography Reconstructions With Stochastic Level-Set Methods,L. Wang; B. Sixou; F. Peyrin,"CNRS UMR5220, Inserm U1044, INSA-Lyon, Université de Lyon, Villeurbanne Cedex, France; CNRS UMR5220, Inserm U1044, INSA-Lyon, Université de Lyon, Villeurbanne Cedex, France; CNRS UMR5220, Inserm U1044, INSA-Lyon, Université de Lyon, Villeurbanne Cedex, France",IEEE Signal Processing Letters,11 Dec 2014,2015,22,7,920,924,"In this work, we propose a stochastic level-set method to reconstruct binary tomography cross-sections from few projections. A first reconstruction image is obtained with a level-set regularization method. The reconstruction is then refined with a stochastic partial differential equation based on a Stratanovitch formulation. The reconstruction results are compared with the ones obtained with the classical simulated annealing method. The methods are tested on a complex bone μ- CT cross-section for different noise levels and number of projections. The best reconstruction results are obtained with the stochastic level set-method.",1558-2361,,10.1109/LSP.2014.2375511,,https://ieeexplore.ieee.org/stamp/stamp.jsp?arnumber=6977898,Binary tomography;inverse problems;level-set;x-ray imaging,Image reconstruction;Simulated annealing;Noise level;Bones;Computed tomography,,9,,33,IEEE,5 Dec 2014,,,IEEE,IEEE Journals
Non-Coherent Direction of Arrival Estimation from Magnitude-Only Measurements,H. Kim; A. M. Haimovich; Y. C. Eldar,"New Jersey Institute of Technology, Newark, NJ, USA; New Jersey Institute of Technology, Newark, NJ, USA; Technion - Israel Institute of Technology, Haifa, Israel",IEEE Signal Processing Letters,11 Dec 2014,2015,22,7,925,929,"We consider the classical Direction of arrival (DOA) estimation problem in the presence of random sensor phase errors are present at each sensor. To eliminate the effect of these phase errors, we propose a DOA recovery technique that relies only on magnitude measurements. This approach is inspired by phase retrieval for applications in other fields. Ambiguities typically associated with phase retrieval methods are resolved by introducing reference targets with known DOA. The DOA estimation problem is formulated as a nonlinear optimization in a sparse framework, and is solved by the recently proposed GESPAR algorithm modified to accommodate multiple snapshots. Numerical results demonstrate good DOA estimation performance. For example, the probability of error in locating a single target within 2 degrees is less than 0.1 for SNR ≥ 15 dB and one snapshot, and negligible for SNR ≥ 10 dB and five snapshots.",1558-2361,,10.1109/LSP.2014.2377556,,https://ieeexplore.ieee.org/stamp/stamp.jsp?arnumber=6975080,Direction of arrival;phase retrieval;sparsity,Direction-of-arrival estimation;Estimation;Arrays;Synchronization;Phase measurement;Signal to noise ratio;Vectors,,43,,20,IEEE,4 Dec 2014,,,IEEE,IEEE Journals
