"On Outage Probability for Stochastic Energy Harvesting Communications in Fading Channels","W. Li; M. -L. Ku; Y. Chen; K. J. R. Liu","Department of Information and Communication Engineering, Xi'an Jiaotong University, Xi'an, China; Department of Communication Engineering, National Central University, Jung-li, Taiwan; Department of Electrical and Computer Engineering, University of Maryland, College Park, MD, USA; Department of Electrical and Computer Engineering, University of Maryland, College Park, MD, USA",IEEE Signal Processing Letters,"15 Jun 2015","2015","22","11","1893","1897","An optimal transmission policy is considered for energy harvesting (EH) wireless point-to-point communications, wherein the source node is solar-powered and equipped with a finite-sized battery. The long-term outage probability is minimized by adapting the transmission power to the causal energy arrival information, battery energy amount and channel fading through a Markov decision process (MDP) framework. We reveal an interesting saturated structure of the expected outage probability for which it eventually converges to a battery empty probability in high signal-to-noise power ratio (SNR). This phenomenon that links outage probability with EH capability is derived based on a monotonic and bounded differential structure of the long-term reward and a threshold structure of the optimal policy. Furthermore, a saturation-free condition on the outage performance is presented as well. Simulations confirm the theoretical analysis and the superiority of the proposed policy.","1558-2361","","10.1109/LSP.2015.2442952","","https://ieeexplore.ieee.org/stamp/stamp.jsp?arnumber=7120117","Markov decision process;outage probability;stochastic energy harvesting","Batteries;Fading;Markov processes;Wireless communication;Data models;Energy harvesting","","19","","16","IEEE","9 Jun 2015","","","IEEE","IEEE Journals"
"Robust Inference for State-Space Models with Skewed Measurement Noise","H. Nurminen; T. Ardeshiri; R. Piché; F. Gustafsson","Department of Automation Science and Engineering, Tampere University of Technology (TUT), Tampere, Finland; Department of Electrical Engineering, Linköping University, Linköping, Sweden; Department of Automation Science and Engineering, Tampere University of Technology (TUT), Tampere, Finland; Department of Electrical Engineering, Linköping University, Linköping, Sweden",IEEE Signal Processing Letters,"15 Jun 2015","2015","22","11","1898","1902","Filtering and smoothing algorithms for linear discrete- time state-space models with skewed and heavy-tailed measurement noise are presented. The algorithms use a variational Bayes approximation of the posterior distribution of models that have normal prior and skew- $t$-distributed measurement noise. The proposed filter and smoother are compared with conventional low- complexity alternatives in a simulated pseudorange positioning scenario. In the simulations the proposed methods achieve better accuracy than the alternative methods, the computational complexity of the filter being roughly 5 to 10 times that of the Kalman filter.","1558-2361","","10.1109/LSP.2015.2437456","Vetenskapsrådet(grant numbers:621-2010-4301); Tampereen Teknillinen Yliopisto; Finnish Doctoral Programme in Computational Sciences; Nokia Foundation; ","https://ieeexplore.ieee.org/stamp/stamp.jsp?arnumber=7112463","Kalman filter;robust filtering;RTS smoother;skew $t$ ;skewness;$t$-distribution;variational Bayes","Noise;Computational modeling;Signal processing algorithms;Noise measurement;Approximation methods;Smoothing methods;Approximation algorithms","","113","","37","IEEE","25 May 2015","","","IEEE","IEEE Journals"
"Iterative Convex Refinement for Sparse Recovery","H. S. Mousavi; V. Monga; T. D. Tran","Department of Electrical Engineering, The Pennsylvania State University, University Park, PA, USA; Department of Electrical Engineering, The Pennsylvania State University, University Park, PA, USA; Department of Electrical and Computer Engineering, Johns Hopkins University, Baltimore, MD, USA",IEEE Signal Processing Letters,"18 Jun 2015","2015","22","11","1903","1907","In this letter, we address sparse signal recovery in a Bayesian framework where sparsity is enforced on reconstruction coefficients via probabilistic priors. In particular, we focus on the setup of Yen    who employ a variant of spike and slab prior to encourage sparsity. The optimization problem resulting from this model has broad applicability in recovery and regression problems and is known to be a hard non-convex problem whose existing solutions involve simplifying assumptions and/or relaxations. We propose an approach called Iterative Convex Refinement (ICR) that aims to solve the aforementioned optimization problem directly allowing for greater generality in the sparse structure. Essentially, ICR solves a sequence of convex optimization problems such that sequence of solutions converges to a sub-optimal solution of the original hard optimization problem. We propose two versions of our algorithm: a.) an unconstrained version, and b.) with a non-negativity constraint on sparse coefficients, which may be required in some real-world problems. Experimental validation is performed on both synthetic data and for a real-world image recovery problem, which illustrates merits of ICR over state of the art alternatives.","1558-2361","","10.1109/LSP.2015.2438255","National Science Foundation(grant numbers:CAREER award); Office of Naval Research(grant numbers:N00014-12-1-0765); ","https://ieeexplore.ieee.org/stamp/stamp.jsp?arnumber=7114220","Bayesian inference;compressive sensing;image reconstruction;optimization;sparse recovery;spike and slab prior","Optimization;Bayes methods;Slabs;Signal processing algorithms;Approximation methods;Image reconstruction;Dictionaries","","32","","50","IEEE","1 Jun 2015","","","IEEE","IEEE Journals"
"Block Region of Interest Method for Real-Time Implementation of Large and Scalable Image Reconstruction","L. Li; F. Yu","Zhejiang University, Hangzhou, China; Zhejiang University, Hangzhou, China",IEEE Signal Processing Letters,"23 Jun 2015","2015","22","11","1908","1912","In field programmable gate array (FPGA)-based reconstruction of high-resolution (several-gigabyte) images, architectures that store the entire source image in block memory are no longer feasible. In this letter, a block region of interest (ROI) method is proposed for large and scalable image reconstruction, using 2D 4 × 4 truncated sinc interpolation by storing only a slice of the source image in block memory. To ensure a high hit rate in block memory for interpolation and improve memory access efficiency, this method provides an effective criterion for partitioning, which subdivides the output image into blocks based on the ROI in the source image. Moreover, a special storage pattern is designed to simultaneously provide 16 pixels for each interpolation to enable real-time implementation by full pipelining with no memory data redundancy. The proposed method was validated by experimental results on an FPGA board along with the corresponding simulations on MATLAB. Various image sizes were tested to prove its flexibility. The time required to reconstruct an output image of 32 k × 32 k at 200 MHz was 2.79 s, thereby achieving a processing speed of 385 Mpixels/s in single floating point precision.","1558-2361","","10.1109/LSP.2015.2435803","","https://ieeexplore.ieee.org/stamp/stamp.jsp?arnumber=7111236","2D sinc interpolation;block region of interest (ROI);large-image reconstruction;real-time implementation;scalable","Image reconstruction;Interpolation;Memory management;SDRAM;Real-time systems;Field programmable gate arrays;Redundancy","","4","","20","IEEE","21 May 2015","","","IEEE","IEEE Journals"
"Intra-Prediction and Generalized Graph Fourier Transform for Image Coding","W. Hu; G. Cheung; A. Ortega","Department of Electronic and Computer Engineering, The Hong Kong University of Science and Technology, Clear Water Bay, Hong Kong, China; National Institute of Informatics, Chiyoda-ku, Tokyo, Japan; Department of Electrical Engineering, University of Southern California, Los Angeles, CA, USA",IEEE Signal Processing Letters,"24 Jun 2015","2015","22","11","1913","1917","Intra-prediction is employed in block-based image coding to reduce energy in the prediction residual before transform coding. Conventional intra-prediction schemes copy directly from known pixels across block boundaries as prediction. In this letter, we first cluster differences between neighboring pixel pairs. Then, for each pixel pair, we add the cluster mean to the known pixel for prediction of the neighboring unknown pixel. The cluster indices are transmitted per block, allowing the decoder to mimic the same intra-prediction. We then propose an optimized transform for the prediction residual, based on a generalized version of previously developed Graph Fourier Transform (GFT). Experimental results show that our generalized intra-prediction plus transform coding outperforms combinations of previous intra-prediction and ADST coding by 2.5 dB in PSNR on average.","1558-2361","","10.1109/LSP.2015.2446683","","https://ieeexplore.ieee.org/stamp/stamp.jsp?arnumber=7126941","Graph signal processing;image compression","Image coding;Predictive models;Fourier transforms;Decoding;Standards;Discrete cosine transforms","","56","1","20","IEEE","17 Jun 2015","","","IEEE","IEEE Journals"
"Optimal Isotropic Wavelets for Localized Tight Frame Representations","J. P. Ward; P. Pad; M. Unser","Biomedical Imaging Group, École polytechnique fédérale de Lausanne (EPFL), Lausanne, VD, Switzerland; Biomedical Imaging Group, École polytechnique fédérale de Lausanne (EPFL), Lausanne, VD, Switzerland; Biomedical Imaging Group, École polytechnique fédérale de Lausanne (EPFL), Lausanne, VD, Switzerland",IEEE Signal Processing Letters,"24 Jun 2015","2015","22","11","1918","1921","In this letter, we aim to identify the optimal isotropic mother wavelet for a given spatial dimension based on a localization criterion. Within the framework of the calculus of variations, we specify an Euler-Lagrange equation for this problem, and we find the unique analytic solutions. In the one- and two-dimensional cases, the derived wavelets are well known.","1558-2361","","10.1109/LSP.2015.2448233","Swiss National Science Foundation(grant numbers:200020-144355); European Research Council(grant numbers:267439); ","https://ieeexplore.ieee.org/stamp/stamp.jsp?arnumber=7130607","Calculus of variations;localization;Simoncelli wavelets;wavelet tight frames","Wavelet transforms;Fourier transforms;Wavelet analysis;Biomedical imaging;Calculus;Europe","","4","","26","IEEE","22 Jun 2015","","","IEEE","IEEE Journals"
"Entropy Minimization for Groupwise Planar Shape Co-alignment and its Applications","Y. Kee; H. S. Lee; J. Yim; D. Cremers; J. Kim","Department of Electrical Engineering, KAIST, Daejeon, South Korea; Department of Electrical Engineering, KAIST, Daejeon, South Korea; Department of Electrical Engineering, KAIST, Daejeon, South Korea; Department of Computer Science, TUM, Garching, Germany; Department of Electrical Engineering, KAIST, Daejeon, South Korea",IEEE Signal Processing Letters,"24 Jun 2015","2015","22","11","1922","1926","We propose an information-theoretic criterion, entropy estimate, for the joint alignment of a group of shape observations drawn from an unknown shape distribution. Employing a nonparametric density estimation technique with implicit shape representation, we minimize the entropy estimate with respect to the pose parameters of similarity transformations based on gradient descent optimization for which we provide implementation details. We demonstrate the capacity of our approach in numerous experiments with an application of building a shape prior to prostate MR image segmentation.","1558-2361","","10.1109/LSP.2015.2441745","","https://ieeexplore.ieee.org/stamp/stamp.jsp?arnumber=7118138","Entropy;groupwise planar shape co-alignment;implicit shape representation;nonparametric density estimation","Shape;Entropy;Space vehicles;Estimation;Minimization;Optimization;Orbits","","","","22","IEEE","4 Jun 2015","","","IEEE","IEEE Journals"
"Fusion of Quantized and Unquantized Sensor Data for Estimation","D. Saska; R. S. Blum; L. Kaplan","Department of Electrical and Computer Engineering, Lehigh University, Bethlehem, PA, USA; Department of Electrical and Computer Engineering, Lehigh University, Bethlehem, PA, USA; Army Research Laboratory, Adelphi, MD, USA",IEEE Signal Processing Letters,"25 Jun 2015","2015","22","11","1927","1930","This letter investigates the usefulness of quantized data for estimation problems in which unquantized data is already available. A worst case scenario is considered in which a fusion center has access to continuous and binary-valued measurements of the same uniformly distributed parameter observed in Gaussian noise. The difference in mean squared error between a minimum mean squared error estimate using unquantized data and a minimum mean squared error estimate using both quantized and unquantized data is used to quantify the value of fusing the two kinds of data. Discussion of the Cramér-Rao Bound predicts how noise in the quantized data affects the reduction in estimate mean squared error from fusing the data types. It is then determined that the maximum reduction in estimate mean squared error from fusion can be approximated as a rational function of the ratio of the standard deviations of the measurement noise in the two data types. Finally, similarities between the approximation to the reduction in estimate mean squared error for the most favorable uniform prior width and a closed form expression based on the Cramér-Rao Bound are discussed.","1558-2361","","10.1109/LSP.2015.2446975","","https://ieeexplore.ieee.org/stamp/stamp.jsp?arnumber=7128352","Cramér-Rao bound;parameter estimation;quantization;wireless sensor networks","Noise;Noise measurement;Approximation methods;Temperature measurement;Estimation;Standards;Wireless sensor networks","","9","","11","IEEE","18 Jun 2015","","","IEEE","IEEE Journals"
"Distributed Autoregressive Moving Average Graph Filters","A. Loukas; A. Simonetto; G. Leus","Faculty of EEMCS, Delft University of Technology, Delft, The Netherlands; Faculty of EEMCS, Delft University of Technology, Delft, The Netherlands; Faculty of EEMCS, Delft University of Technology, Delft, The Netherlands",IEEE Signal Processing Letters,"25 Jun 2015","2015","22","11","1931","1935","We introduce the concept of autoregressive moving average (ARMA) filters on a graph and show how they can be implemented in a distributed fashion. Our graph filter design philosophy is independent of the particular graph, meaning that the filter coefficients are derived irrespective of the graph. In contrast to finite-impulse response (FIR) graph filters, ARMA graph filters are robust against changes in the signal and/or graph. In addition, when time-varying signals are considered, we prove that the proposed graph filters behave as ARMA filters in the graph domain and, depending on the implementation, as first or higher order ARMA filters in the time domain.","1558-2361","","10.1109/LSP.2015.2448655","","https://ieeexplore.ieee.org/stamp/stamp.jsp?arnumber=7131465","Distributed time-varying computations;graph filters;graph Fourier transform;signal processing on graphs","Frequency response;Finite impulse response filters;Fourier transforms;Convergence;Steady-state;Kernel","","89","","17","IEEE","23 Jun 2015","","","IEEE","IEEE Journals"
"An Implicit Contour Morphing Framework Applied to Computer-Aided Severe Weather Forecasting","D. Brunet; D. Sills","Cloud Physics and Severe Weather Research Section, Environment Canada, King City, ON, Canada; Cloud Physics and Severe Weather Research Section, Environment Canada, King City, ON, Canada",IEEE Signal Processing Letters,"26 Jun 2015","2015","22","11","1936","1939","We propose a contour morphing framework that allows large deformations and topological changes while guaranteeing non self-intersecting contours. Instead of explicitly matching contour points, the proposed algorithm combines an implicit contour representation with state-of-the-art deformable image registration. Synthetic and real-life examples from a meteorological application are presented to demonstrate the efficacy of the framework.","1558-2361","","10.1109/LSP.2015.2447279","","https://ieeexplore.ieee.org/stamp/stamp.jsp?arnumber=7134721","Contour morphing;level-set methods;meteorological data;non-rigid image registration","Interpolation;Image registration;Transforms;Weather forecasting;Shape;Signal processing algorithms","","4","","22","Crown","25 Jun 2015","","","IEEE","IEEE Journals"
"High SNR Consistent Thresholding for Variable Selection","S. K; S. Kalyani","Department of Electrical Engineering, Indian Institute of Technology Madras, Chennai, India; Department of Electrical Engineering, Indian Institute of Technology Madras, Chennai, India",IEEE Signal Processing Letters,"26 Jun 2015","2015","22","11","1940","1944","This work states and proves necessary and sufficient condition for a threshold based estimate of set of active regression coefficients to be high SNR consistent. It is further shown that popular thresholding schemes like universal threshold, Bonferroni correction etc fails to meet the necessary condition and hence are inconsistent at high SNR. The sufficient conditions provides a very rich class of threshold based estimators with varying rate of convergence to consistency. Simulation results demonstrates the superior performance of the proposed threshold based estimator over Lasso, Dantzig selector and Orthogonal Matching Pursuit.","1558-2361","","10.1109/LSP.2015.2448657","","https://ieeexplore.ieee.org/stamp/stamp.jsp?arnumber=7131481","","Signal to noise ratio;Input variables;Integrated circuits;Computational modeling;Convergence","","3","","19","IEEE","23 Jun 2015","","","IEEE","IEEE Journals"
"Recovery of Low Rank and Jointly Sparse Matrices with Two Sampling Matrices","S. Biswas; H. K. Achanta; M. Jacob; S. Dasgupta; R. Mudumbai","Department of Electrical and Computer Engineering, Univ. Iowa, IA, USA; Department of Electrical and Computer Engineering, Univ. Iowa, IA, USA; Department of Electrical and Computer Engineering, Univ. Iowa, IA, USA; Department of Electrical and Computer Engineering, Univ. Iowa, IA, USA; Department of Electrical and Computer Engineering, Univ. Iowa, IA, USA",IEEE Signal Processing Letters,"25 Jun 2015","2015","22","11","1945","1949","We provide a two-step approach to recover a jointly k-sparse matrix X, (at most k rows of X are nonzero), with rank r <; <; k from its under sampled measurements. Unlike the classical recovery algorithms that use the same measurement matrix for every column of X, the proposed algorithm comprises two stages, in each of which the measurement is taken by a different measurement matrix. The first stage uses a standard algorithm, [4] to recover any r columns (e.g. the first r) of X. The second uses a new set of measurements and the subspace estimate provided by these columns to recover the rest. We derive conditions on the second measurement matrix to guarantee perfect subspace aware recovery for two cases: First a worst-case setting that applies to all matrices. The second a generic case that works for almost all matrices. We demonstrate both theoretically and through simulations that when r <; <; k our approach needs far fewer measurements. It compares favorably with recent results using dense linear combinations, that do not use column-wise measurements.","1558-2361","","10.1109/LSP.2015.2447455","Division of Computing and Communication Foundations(grant numbers:1116067,1302456); National Institutes of Health(grant numbers:1R21HL109710-01A1); Division of Computer and Network Systems(grant numbers:1329657); Office of Naval Research(grant numbers:N00014-13-1-0202); ","https://ieeexplore.ieee.org/stamp/stamp.jsp?arnumber=7128706","Dynamic imaging;joint sparsity;low rank;rank aware ORMP","Signal processing algorithms;Government;Sparse matrices;Jacobian matrices;Algorithm design and analysis;Current measurement;Imaging","","1","","13","USGov","19 Jun 2015","","","IEEE","IEEE Journals"
"Estimating Parameters of Optimal Average and Adaptive Wiener Filters for Image Restoration with Sequential Gaussian Simulation","T. D. Pham","Aizu Research Cluster for Medical Engineering and Informatics, The University of Aizu, Aizuwakamatsu, Japan",IEEE Signal Processing Letters,"29 Jun 2015","2015","22","11","1950","1954","Filtering additive white Gaussian noise in images using the best linear unbiased estimator (BLUE) is technically sound in a sense that it is an optimal average filter derived from the statistical estimation theory. The BLUE filter mask has the theoretical advantage in that its shape and its size are formulated in terms of the image signals and associated noise components. However, like many other noise filtering problems, prior knowledge about the additive noise needs to be available, which is often obtained using training data. This paper presents the sequential Gaussian simulation in geostatistics for measuring signal and noise variances in images without the need of training data for the BLUE filter implementation. The simulated signal variance and the BLUE average can be further used as parameters of the adaptive Wiener filter for image restoration.","1558-2361","","10.1109/LSP.2015.2448732","","https://ieeexplore.ieee.org/stamp/stamp.jsp?arnumber=7131489","Adaptive Wiener filter;best linear unbiased estimator;image restoration;kriging;optimal average filter;sequential Gaussian simulation","Mathematical model;Noise;Image restoration;Adaptation models;Computational modeling;Noise level","","20","","22","IEEE","23 Jun 2015","","","IEEE","IEEE Journals"
"Fast Optimal Antenna Placement for Distributed MIMO Radar with Surveillance Performance","Y. Yang; W. Yi; T. Zhang; G. Cui; L. Kong; X. Yang; J. Yang","University of Electronic Science and Technology of China, School of Electronic Engineering, Chengdu, Sichuan, P. R. China; University of Electronic Science and Technology of China, School of Electronic Engineering, Chengdu, Sichuan, P. R. China; University of Electronic Science and Technology of China, School of Electronic Engineering, Chengdu, Sichuan, P. R. China; University of Electronic Science and Technology of China, School of Electronic Engineering, Chengdu, Sichuan, P. R. China; University of Electronic Science and Technology of China, School of Electronic Engineering, Chengdu, Sichuan, P. R. China; University of Electronic Science and Technology of China, School of Electronic Engineering, Chengdu, Sichuan, P. R. China; University of Electronic Science and Technology of China, School of Electronic Engineering, Chengdu, Sichuan, P. R. China",IEEE Signal Processing Letters,"1 Jul 2015","2015","22","11","1955","1959","In this letter, we demonstrate an optimization problem of antenna placement of distributed multi-input multi- output (MIMO) radar. To evaluate the surveillance performance of the radar system, a coverage ratio is proposed as a criterion. Since the problem is of extremely huge computational complexity due to its complicated objective function and high dimensionality, we propose a solution that contains two parts: 1) a low- complexity method to simplify the objective function; 2) a placement algorithm based on particle swarm optimization (PSO) to deal with the challenge of high dimensionality. We also analyse the computational complexity of our solution. Simulation results verify the validity and advantage in computational complexity of our solution. Our contributions include a novel optimization placement model of distributed MIMO radar and a computational efficient solution to establish the optimal positions of antennas.","1558-2361","","10.1109/LSP.2015.2445413","","https://ieeexplore.ieee.org/stamp/stamp.jsp?arnumber=7123600","Antenna placement;MIMO radar;PSO","Radar antennas;Surveillance;Optimization;MIMO radar;Linear programming","","60","","20","IEEE","15 Jun 2015","","","IEEE","IEEE Journals"
"Deterministic Construction of Compressed Sensing Matrices from Protograph LDPC Codes","J. Zhang; G. Han; Y. Fang","College of Information Engineering, Guangdong University of Technology, Panyu District, Guangzhou, China; College of Information Engineering, Guangdong University of Technology, Panyu District, Guangzhou, China; College of Information Engineering, Guangdong University of Technology, Panyu District, Guangzhou, China",IEEE Signal Processing Letters,"1 Jul 2015","2015","22","11","1960","1964","This letter considers the design of measurement matrices with low complexity, easy hardware implementation and good sensing performance for practical compressed sensing applications. We construct a class of sparse binary measurement matrices from protograph Low-density parity-check (LDPC) codes, which can satisfy these features simultaneously. The optimal performance of proposed matrices is analyzed from the mutual coherence aspect. Moreover, we obtain a sufficient condition for optimal construction of the matrices using proposed algorithm. Simulation experiments also demonstrate that orthogonal matching pursuit (OMP) algorithm performs better using the constructed matrices as compared with several state-of-the-art measurement matrices, such as random Gaussian matrices.","1558-2361","","10.1109/LSP.2015.2447934","","https://ieeexplore.ieee.org/stamp/stamp.jsp?arnumber=7128663","Compressed Sensing;measurement matrices design;mutual coherence;protograph LDPC codes","Sparse matrices;Parity check codes;Hardware;Signal processing algorithms;Compressed sensing;Coherence;Matching pursuit algorithms","","46","","25","IEEE","19 Jun 2015","","","IEEE","IEEE Journals"
