"Document Title",Authors,"Author Affiliations","Publication Title",Date Added To Xplore,"Publication Year","Volume","Issue","Start Page","End Page","Abstract","ISSN",ISBNs,"DOI",Funding Information,PDF Link,"Author Keywords","IEEE Terms","Mesh_Terms",Article Citation Count,Patent Citation Count,"Reference Count","License",Online Date,Issue Date,"Meeting Date","Publisher",Document Identifier
"Front Cover","",,IEEE Signal Processing Letters,"19 Nov 2015","2015","22","11","C1","C1","Presents the front cover for this issue of the publication.","1558-2361","","10.1109/LSP.2015.2500838","","https://ieeexplore.ieee.org/stamp/stamp.jsp?arnumber=7332285","","","","","","","IEEE","19 Nov 2015","","","IEEE","IEEE Journals"
"IEEE Signal Processing Letters publication information","",,IEEE Signal Processing Letters,"19 Nov 2015","2015","22","11","C2","C2","Provides a listing of the editors, board members, and current staff for this issue of the publication.","1558-2361","","10.1109/LSP.2015.2499943","","https://ieeexplore.ieee.org/stamp/stamp.jsp?arnumber=7332273","","","","","","","IEEE","19 Nov 2015","","","IEEE","IEEE Journals"
"Table of Contents","",,IEEE Signal Processing Letters,"27 Aug 2015","2015","22","11","1823","1825","Presents the table of contents for this issue of the publication.","1558-2361","","10.1109/LSP.2015.2468391","","https://ieeexplore.ieee.org/stamp/stamp.jsp?arnumber=7226896","","","","","","","IEEE","27 Aug 2015","","","IEEE","IEEE Journals"
"Table of Contents","",,IEEE Signal Processing Letters,"27 Aug 2015","2015","22","11","1826","1828","Presents the table of contents for this issue of the publication.","1558-2361","","10.1109/LSP.2015.2468392","","https://ieeexplore.ieee.org/stamp/stamp.jsp?arnumber=7226894","","","","","","","IEEE","27 Aug 2015","","","IEEE","IEEE Journals"
"Compressive Hyperspectral Imaging for Stellar Spectroscopy","M. Fickus; M. E. Lewis; D. G. Mixon; J. Peterson","Department of Mathematics and Statistics, Air Force Institute of Technology, Wright-Patterson Air Force Base, Ohio; Department of Mathematics and Statistics, Air Force Institute of Technology, Wright-Patterson Air Force Base, Ohio; Department of Mathematics and Statistics, Air Force Institute of Technology, Wright-Patterson Air Force Base, Ohio; Department of Mathematics and Statistics, Air Force Institute of Technology, Wright-Patterson Air Force Base, Ohio",IEEE Signal Processing Letters,"4 Jun 2015","2015","22","11","1829","1833","Hyperspectral data is commonly used by astronomers to discern the chemical composition of stars. Unfortunately, conventional hyperspectral platforms require long exposure times, which can hamper their use in applications like celestial navigation. We propose a compressed sensing platform that exploits the spatial sparsity of stars to quickly sample the hyperspectral data. We leverage certain combinatorial designs to devise coded apertures, and then we apply block orthogonal matching pursuit to quickly reconstruct the desired imagery.","1558-2361","","10.1109/LSP.2015.2433837","Division of Mathematical Sciences; ","https://ieeexplore.ieee.org/stamp/stamp.jsp?arnumber=7115943","Block sparsity;compressive hyperspectral imaging;compressed sensing;matching pursuit;stellar spectroscopy","Hyperspectral imaging;Apertures;Charge coupled devices;Imaging;Matching pursuit algorithms;Government","","6","","19","USGov","1 Jun 2015","","","IEEE","IEEE Journals"
"A Low-Complexity Near-ML Differential Spatial Modulation Detector","M. Wen; X. Cheng; Y. Bian; H. V. Poor","School of Electronic and Information Engineering, South China University of Technology, Guangzhou, China; School of Electronics Engineering and Computer Science, Peking University, Beijing, China; School of Electronics Engineering and Computer Science, Peking University, Beijing, China; Department of Electrical Engineering, Princeton University, Princeton, NJ, USA",IEEE Signal Processing Letters,"4 Jun 2015","2015","22","11","1834","1838","Differential spatial modulation (DSM) is a newly-emerging differential scheme tailored to the spatial modulation technique, which selects only one among a group of antennas for transmission at any time instant. DSM, however, gives rise to prohibitive search complexity when the number of transmit antennas is large. In this letter, a low-complexity suboptimal detector is proposed for DSM. It is designed based on the maximum-likelihood criterion but takes more candidates for the antenna activation orders into account. The detection is performed in two steps: the first step is to confine the number of candidates for the modulated symbols to a small portion by exploiting the symmetry of the signal constellation; the second step is to select the most likely modulated symbols from the output of the first step according to the determined antenna activation order via a Viterbi-like algorithm. Analyses and simulations show that the proposed detector achieves near-optimal performance yet largely reduces the search complexity.","1558-2361","","10.1109/LSP.2015.2425042","National 973 project(grant numbers:2013CB336700); ","https://ieeexplore.ieee.org/stamp/stamp.jsp?arnumber=7090939","Differential modulation;search complexity;spatial modulation (SM)","Detectors;Transmitting antennas;Modulation;Complexity theory;Covariance matrices;Electronic mail","","50","","11","IEEE","21 Apr 2015","","","IEEE","IEEE Journals"
"A Color Channel Fusion Approach for Face Recognition","Z. Lu; X. Jiang; A. C. Kot","School of Electrical and Electronic Engineering, Nanyang Technological University, Singapore; School of Electrical and Electronic Engineering, Nanyang Technological University, Singapore; School of Electrical and Electronic Engineering, Nanyang Technological University, Singapore",IEEE Signal Processing Letters,"4 Jun 2015","2015","22","11","1839","1843","Due to high dimensionality of images or generated color features, different color channels are usually processed separately and then concatenated together into a feature vector for classification. This makes channel fusion a crucial step in color face recognition (FR) systems. However, existing methods simply concatenate channel-wise color features without identifying the importance or reliability of features in different color channels. In this paper, we propose a color channel fusion (CCF) approach using jointly dimension reduction algorithms to select more features from reliable and discriminative channels. Experiments using two different dimension reduction approaches, two different types of features on three image datasets show that CCF achieves consistently better performance than color channel concatenation (CCC) method which deals with different color channels equally.","1558-2361","","10.1109/LSP.2015.2438024","Nanyang Technological University; National Research Foundation Prime Ministers Office Singapore; ","https://ieeexplore.ieee.org/stamp/stamp.jsp?arnumber=7113819","Channel fusion;color face recognition;dimension reduction","Image color analysis;Color;Principal component analysis;Feature extraction;Face recognition;Reliability;Eigenvalues and eigenfunctions","","18","","30","IEEE","1 Jun 2015","","","IEEE","IEEE Journals"
"Generalized Nested Sampling for Compressing Low Rank Toeplitz Matrices","H. Qiao; P. Pal","Dept. of Electrical and Computer Engineering, University of Maryland, College Park, MD, USAE; Dept. of Electrical and Computer Engineering, University of Maryland, College Park, MD, USAE",IEEE Signal Processing Letters,"4 Jun 2015","2015","22","11","1844","1848","This paper considers the problem of compressively sampling wide sense stationary random vectors with a low rank Toeplitz correlation matrix. A new structured deterministic sampling method known as the “Generalized Nested Sampling” (GNS) is used to fully exploit the inherent redundancy of low rank Toeplitz matrices. For a Toeplitz matrix of size N ×N with rank r, this sampling scheme uses only O(√r) measurements and allows exact recovery from noiseless measurements. This compression factor is independent of N and is shown to be larger than that achieved by existing random sampling based techniques for compressing Toeplitz matrices. The recovery procedure exploits the connection between Toeplitz matrices and linear prediction.","1558-2361","","10.1109/LSP.2015.2438066","University of Maryland; ","https://ieeexplore.ieee.org/stamp/stamp.jsp?arnumber=7113829","Compressive covariance sampling;low rank recovery;matrix sketching;nested sampling;toeplitz matrix","Covariance matrices;Matrix decomposition;Correlation;Signal processing algorithms;Noise measurement;Prediction algorithms;Symmetric matrices","","20","","16","IEEE","1 Jun 2015","","","IEEE","IEEE Journals"
"Median Filtering Forensics Based on Convolutional Neural Networks","J. Chen; X. Kang; Y. Liu; Z. J. Wang","School of Information Science and Technology, Sun Yat-sen University, Guangzhou, China; School of Information Science and Technology, Sun Yat-sen University, Guangzhou, China; School of Information Science and Technology, Sun Yat-sen University, Guangzhou, China; Electrical and Computer Engineering Department, University of British Columbia, Vancouver, Canada",IEEE Signal Processing Letters,"4 Jun 2015","2015","22","11","1849","1853","Median filtering detection has recently drawn much attention in image editing and image anti-forensic techniques. Current image median filtering forensics algorithms mainly extract features manually. To deal with the challenge of detecting median filtering from small-size and compressed image blocks, by taking into account of the properties of median filtering, we propose a median filtering detection method based on convolutional neural networks (CNNs), which can automatically learn and obtain features directly from the image. To our best knowledge, this is the first work of applying CNNs in median filtering image forensics. Unlike conventional CNN models, the first layer of our CNN framework is a filter layer that accepts an image as the input and outputs its median filtering residual (MFR). Then, via alternating convolutional layers and pooling layers to learn hierarchical representations, we obtain multiple features for further classification. We test the proposed method on several experiments. The results show that the proposed method achieves significant performance improvements, especially in the cut-and-paste forgery detection.","1558-2361","","10.1109/LSP.2015.2438008","National Science Foundation of China(grant numbers:61379155,U1135001,61332012); 973 Program(grant numbers:2011CB302204); NSF of Guangdong province(grant numbers:s2013020012788); ","https://ieeexplore.ieee.org/stamp/stamp.jsp?arnumber=7113799","Convolutional neural networks;deep learning;hierarchical representations;median filtering forensics","Filtering;Convolution;Forensics;Feature extraction;Kernel;Image coding;Image edge detection","","366","","24","IEEE","1 Jun 2015","","","IEEE","IEEE Journals"
"Learning Visual-Spatial Saliency for Multiple-Shot Person Re-Identification","Y. Xie; H. Yu; X. Gong; Z. Dong; Y. Gao","Department of Information Science and Electronic Engineering, Zhejiang University, Hangzhou, Zhejiang, China; Department of Information Science and Electronic Engineering, Zhejiang University, Hangzhou, Zhejiang, China; Department of Information Science and Electronic Engineering, Zhejiang University, Hangzhou, Zhejiang, China; Department of System Architecture, ZTE Corporation, Shenzhen, China; Department of System Architecture, ZTE Corporation, Shenzhen, China",IEEE Signal Processing Letters,"8 Jun 2015","2015","22","11","1854","1858","Recognizing persons across non-overlapping camera views, known as person re-identification, has received increasing attentions for its importance in many surveillance applications. However, most of existing methods rely on pre-training steps to ensure their performance and ignore the body prior knowledge of pedestrians. In this letter, we propose a novel non-training method for person re-identification which learns visual-spatial saliency from voter images and the given query image. First we segment pedestrian images into small regions and use two hypergraphs to represent the visual and spatial relationship among regions. Then we formulate the visual-spatial saliency learning as a joint hypergraph ranking problem by simultaneously considering the human body prior and the appearance similarity among pedestrians. Finally, the visual-spatial saliency is incorporated in region-based matching to improve the performance of person re-identification. Experimental evaluation on three publicly available datasets demonstrates the effectiveness of our approach.","1558-2361","","10.1109/LSP.2015.2440294","","https://ieeexplore.ieee.org/stamp/stamp.jsp?arnumber=7116518","Hypergraph learning;person re-identification;visual-spatial saliency","Visualization;Joints;Signal processing algorithms;Cameras;Measurement;Surveillance;Image color analysis","","13","","38","IEEE","2 Jun 2015","","","IEEE","IEEE Journals"
"Robust Whisper Activity Detection Using Long-Term Log Energy Variation of Sub-Band Signal","G. N. Meenakshi; P. K. Ghosh","Indian Institute of Science (IISc), Bangalore, India; Indian Institute of Science (IISc), Bangalore, India",IEEE Signal Processing Letters,"9 Jun 2015","2015","22","11","1859","1863","The goal in the whisper activity detection (WAD) is to find the whispered speech segments in a given noisy recording of whispered speech. Since whispering lacks the periodic glottal excitation, it resembles an unvoiced speech. This noise-like nature of the whispered speech makes WAD a more challenging task compared to a typical voice activity detection (VAD) problem. In this paper, we propose a feature based on the long term variation of the logarithm of the short-time sub-band signal energy for WAD. We also propose an automatic sub-band selection algorithm to maximally discriminate noisy whisper from noise. Experiments with eight noise types in four different signal-to-noise ratio (SNR) conditions show that, for most of the noises, the performance of the proposed WAD scheme is significantly better than that of the existing VAD schemes and whisper detection schemes when used for WAD.","1558-2361","","10.1109/LSP.2015.2439514","","https://ieeexplore.ieee.org/stamp/stamp.jsp?arnumber=7115062","Long-term signal measure;sub-band selection;whisper activity detection;whispered speech","Speech;Noise measurement;Signal to noise ratio;Histograms;Signal processing algorithms;Radio frequency","","16","2","32","IEEE","1 Jun 2015","","","IEEE","IEEE Journals"
"Physical Modeling and Performance Bounds for Device-free Localization Systems","V. Rampa; S. Savazzi; M. Nicoli; M. D’Amico","Computer and Telecommunication Engineering (IEIIT), National Research Council of Italy (CNR), Rome, Italy; Computer and Telecommunication Engineering (IEIIT), National Research Council of Italy (CNR), Rome, Italy; Dipartimento di Elettronica, Informazione e Bioingegneria (DEIB), Politecnico di Milano, Milano, Italy; Dipartimento di Elettronica, Informazione e Bioingegneria (DEIB), Politecnico di Milano, Milano, Italy",IEEE Signal Processing Letters,"10 Jun 2015","2015","22","11","1864","1868","In this letter, an analytically tractable model based on diffraction theory is proposed to describe the perturbations of the electromagnetic propagation of radio signals caused by the presence of a moving object in the two-dimensional (2-D) area near the transmitting/receiving devices. This novel model is instrumental to the evaluation of non-cooperative device-free localization (DFL) systems as it allows to relate the received signal strength measurements of multiple radio links to the object size, orientation and position. The proposed model is validated experimentally using radio devices and it is used to derive closed-form fundamental limits to DFL accuracy, providing an analytical tool for DFL system design and network 2-D pre-deployment assessment.","1558-2361","","10.1109/LSP.2015.2438176","","https://ieeexplore.ieee.org/stamp/stamp.jsp?arnumber=7113801","Cramer–Rao lower bound;device-free localization;human body shadowing;wireless sensor network","Diffraction;Analytical models;Approximation methods;Fading;Predictive models;Sensitivity;Computational modeling","","47","","23","IEEE","1 Jun 2015","","","IEEE","IEEE Journals"
"Resource Allocation Optimization for Users with Different Levels of Service in Multicarrier Systems","M. G. Kibria; L. Shan","Wireless Network Research Institute, National Institute of Information and Communications Technology (NICT), Yokosuka Research Park, Japan; Wireless Network Research Institute, National Institute of Information and Communications Technology (NICT), Yokosuka Research Park, Japan",IEEE Signal Processing Letters,"11 Jun 2015","2015","22","11","1869","1873","We optimize the throughput of a single cell multiuser orthogonal frequency division multiplexing system with proportional data rate fairness among the users. The concept is to support mobile users with different levels of service. The optimization problem is a mixed integer nonlinear programming problem, which is computationally very expensive. We propose a novel and efficient near-optimal solution adopting a two-phase optimization approach that separates the subcarrier and power allocation. In the first phase, we relax the strict proportional data rate requirements and employ an iterative subcarrier allocation approach that coarsely satisfies desired data rate proportionality constraints. In the second phase, we reallocate the power among the users in an iterative way to further enhance the adherence to the desired proportions by exploiting the normalized proportionality deviation measure. The simulation results show that the proposed solution exhibits very strong adherence to the desired proportional data rate fairness while achieving higher system throughput compared to the other existing solutions.","1558-2361","","10.1109/LSP.2015.2440440","","https://ieeexplore.ieee.org/stamp/stamp.jsp?arnumber=7116529","Fairness;multicarrier;resource allocation","Resource management;Throughput;Optimization;OFDM;Signal processing algorithms;Signal to noise ratio;Time division multiple access","","10","","13","IEEE","2 Jun 2015","","","IEEE","IEEE Journals"
"The NLMS Algorithm with Time-Variant Optimum Stepsize Derived from a Bayesian Network Perspective","C. Huemmer; R. Maas; W. Kellermann","Chair of Multimedia Communications and Signal Processing (LMS), University of Erlangen-Nuremberg, Erlangen, Germany; Chair of Multimedia Communications and Signal Processing (LMS), University of Erlangen-Nuremberg, Erlangen, Germany; Chair of Multimedia Communications and Signal Processing (LMS), University of Erlangen-Nuremberg, Erlangen, Germany",IEEE Signal Processing Letters,"11 Jun 2015","2015","22","11","1874","1878","In this letter, we derive a new stepsize adaptation for the normalized least mean square algorithm (NLMS) by describing the task of linear acoustic echo cancellation from a Bayesian network perspective. Similar to the well-known Kalman filter equations, we model the acoustic wave propagation from the loudspeaker to the microphone by a latent state vector and define a linear observation equation (to model the relation between the state vector and the observation) as well as a linear process equation (to model the temporal progress of the state vector). Based on additional assumptions on the statistics of the random variables in observation and process equation, we apply the expectation-maximization (EM) algorithm to derive an NLMS-like filter adaptation. By exploiting the conditional independence rules for Bayesian networks, we reveal that the resulting EM-NLMS algorithm has a stepsize update equivalent to the optimal-stepsize calculation proposed by Yamamoto and Kitayama in 1982, which has been adopted in many textbooks. As main difference, the instantaneous stepsize value is estimated in the M step of the EM algorithm (instead of being approximated by artificially extending the acoustic echo path). The EM-NLMS algorithm is experimentally verified for synthesized scenarios with both, white noise and male speech as input signal.","1558-2361","","10.1109/LSP.2015.2439392","","https://ieeexplore.ieee.org/stamp/stamp.jsp?arnumber=7115075","Adaptive stepsize;EM algorithm;NLMS","Signal processing algorithms;Mathematical model;Approximation algorithms;Bayes methods;Acoustics;Adaptation models;Random variables","","18","","25","IEEE","1 Jun 2015","","","IEEE","IEEE Journals"
"A Novel Framework for Pulse Pressure Wave Analysis Using Persistent Homology","S. Emrani; T. S. Saponas; D. Morris; H. Krim","Department of Electrical and Computer Engineering, North Carolina State University, Raleigh, NC, USA; Microsoft Research, Redmond, WA, USA; Microsoft Research, Redmond, WA, USA; Department of Electrical and Computer Engineering, North Carolina State University, Raleigh, NC, USA",IEEE Signal Processing Letters,"11 Jun 2015","2015","22","11","1879","1883","Four characteristic points of pulse pressure waves-the systolic peak, the anacrotic notch, the dicrotic notch, and the diastolic foot-are used to estimate various aspects of cardiovascular function, such as heart rate and augmentation index. We propose a novel approach to extracting these characteristic points using a topological signal processing framework. We characterize the topology of the signals using a collection of persistence intervals, which are encapsulated in a persistence diagram. The characteristic points are identified based on their time of occurrence and their distance from the identity line in the persistence diagram. We validate this approach by collecting radial pulse pressure data from twenty-eight participants using a wearable tonometer, and computing the peripheral augmentation index using a traditional derivative-based method and our novel persistence-based method. The augmentation index values computed using the two methods are statistically indistinguishable, suggesting that this representation merits further exploration as a tool for analyzing pulse pressure waves.","1558-2361","","10.1109/LSP.2015.2441068","","https://ieeexplore.ieee.org/stamp/stamp.jsp?arnumber=7117387","Algebraic topology algorithms;pulse pressure waves;topological signal analysis;wearable sensors","Pressure measurement;Heart;Indexes;Arteries;Blood;Signal processing;Topology","","8","","12","IEEE","3 Jun 2015","","","IEEE","IEEE Journals"
"Fast Computation of Generalized Waterfilling Problems","N. Kalpana; M. Z. A. Khan","Department of Electrical Engineering, Indian Institute of Technology, Hyderabad, TS, India; Department of Electrical Engineering, Indian Institute of Technology, Hyderabad, TS, India",IEEE Signal Processing Letters,"12 Jun 2015","2015","22","11","1884","1887","In this letter, we present a novel method of solving the Generalized Waterfilling problem (GWFP) using equivalence with a waterfilling problem (WFP) which has a closed form solution. Consequentially, a class of WFPs with only one-step called `1-step' WFP is used to derive a low complexity algorithm which has the smallest worst case complexity reported. The proposed algorithm is verified by simulations.","1558-2361","","10.1109/LSP.2015.2440653","","https://ieeexplore.ieee.org/stamp/stamp.jsp?arnumber=7116486","Fast computation;generalized waterfilling problem;iterative waterfilling algorithm","Nickel;Signal processing algorithms;Closed-form solutions;Noise level;OFDM;Computational complexity","","25","","33","IEEE","2 Jun 2015","","","IEEE","IEEE Journals"
"Both Minimum MSE and Maximum SNR Channel Training Designs for MIMO AF Multi-Relay Networks with Spatially Correlated Fading","J. -M. Kang; H. -M. Kim","Department of Electrical Engineering, KAIST, Daejeon, Korea; Department of Electrical Engineering, KAIST, Daejeon, Korea",IEEE Signal Processing Letters,"15 Jun 2015","2015","22","11","1888","1892","This letter proposes channel training designs for two-hop multi-relay networks, where a source, a destination and multiple amplify-and-forward (AF) relays are all equipped with multi-antenna, based on mean square error (MSE) and signal-to-noise ratio (SNR) criteria with taking into account spatial fading correlation between multiple-input multiple-output (MIMO) channel elements. The minimum MSE and maximum SNR channel estimators are initially derived and, then, optimal structures on source training signal and relay matrices are determined. An iterative and a closed-form power allocation solutions are proposed for both channel estimators. Simulation results show that the proposed schemes outperform the conventional schemes.","1558-2361","","10.1109/LSP.2015.2442587","Ministry of Education Science and Technology(grant numbers:NRF-2013R1A1A2013291); ","https://ieeexplore.ieee.org/stamp/stamp.jsp?arnumber=7119573","Channel estimation;MIMO;MSE;multi-relay network;SNR;training design","Relays;Channel estimation;Training;Signal to noise ratio;MIMO;Antennas","","5","","32","IEEE","8 Jun 2015","","","IEEE","IEEE Journals"
