Slow Adaptive Power Control and Outage Avoidance in Composite Fading Wireless Channels,Y. Seyedi; E. Bolouki; J. -F. Frigon,"Department of Electrical Engineering, Polytechnique Montreal, Montreal, QC, Canada; Department of Electrical Engineering, Polytechnique Montreal, Montreal, QC, Canada; Department of Electrical Engineering, Polytechnique Montreal, Montreal, QC, Canada",IEEE Signal Processing Letters,11 Dec 2014,2015,22,7,930,934,"Composite fading wireless channels possess both fast and slow fading dynamics. In such channels, the average bit error probability varies slowly over time, hence, it is feasible to harness a power control mechanism to effectively avoid the bit error outage (BEO). In this letter, we focus on a new adaptive power allocation scheme for M-ary phase shift keying ( M-PSK) signals. The proposed power control technique is designed to track the moments of the composite fading envelope. Analytical expressions are derived which provide the optimal transmit power (under long-term power constraint) and the minimum transmit power to cope with the BEO. Numerical results indicate that the transmit power can be potentially decreased depending on the fading gain observed in the coherent and diffuse components of the received signal.",1558-2361,,10.1109/LSP.2014.2378773,,https://ieeexplore.ieee.org/stamp/stamp.jsp?arnumber=6979207,Bit error outage;composite fading;phase shift keying;power control;shadowing,Fading;Shadow mapping;Power control;Resource management;Signal to noise ratio;Rician channels;Adaptation models,,2,,12,IEEE,8 Dec 2014,,,IEEE,IEEE Journals
A Probabilistic Interpretation of the Exponential Mixture,S. Kay,"Dept. of Electrical, Computer, and Biomedical Engineering, University of Rhode Island, Kingston, RI",IEEE Signal Processing Letters,11 Dec 2014,2015,22,7,935,937,"The exponential mixture of probability mass functions arises in many fields. Although straightforward to characterize and utilize, it does not lead to a simple probabilistic interpretation as does the linear mixture. We remedy this by giving a general probabilistic problem whereby the exponential mixture describes the probabilities involved.",1558-2361,,10.1109/LSP.2014.2379014,,https://ieeexplore.ieee.org/stamp/stamp.jsp?arnumber=6979208,Information geometry;probability distributions;random variables,Sensors;Probabilistic logic;Probability density function;Random variables;Computer simulation;Gaussian noise,,,,5,IEEE,8 Dec 2014,,,IEEE,IEEE Journals
Maximizing Network Capacity with Optimal Source Selection: A Network Science Perspective,C. Jiang; Y. Chen; Y. Ren; K. J. R. Liu,"Department of Electronic Engineering, Tsinghua University, Beijing, P. R. China; Department of Electrical and Computer Engineeringg, University of Maryland, College Park, MD, USA; Department of Electronic Engineering, Tsinghua University, Beijing, P. R. China; Department of Electrical and Computer Engineeringg, University of Maryland, College Park, MD, USA",IEEE Signal Processing Letters,18 Dec 2014,2015,22,7,938,942,"How to enhance the network capacity is one of the most important issues. To achieve this, the existing works have focused on improving either the network structure or routing strategies with a common assumption of uniformly distributing the replicas of information among the nodes in the network. The nodes associated with information replicas are considered as source nodes (or server). However, for many networks such as the Internet, some nodes have much more traffics than the others, exhibiting an asymmetric phenomenon. In this letter, we study the optimal source selection strategy to enhance the network capacity, where an optimization model is proposed to find the optimal source selection probability distribution. Simulation results show that in homogeneous networks, most of the nodes can be the sources. While in heterogeneous networks such as the scale-free networks, only a small number of the nodes can be the sources. Moreover, an interesting phenomenon is observed that the optimal proportion of source nodes in Erdös-Rényi random network and Barabási-Albert scale-free network exhibits a power law relationship with the network size.",1558-2361,,10.1109/LSP.2014.2378264,,https://ieeexplore.ieee.org/stamp/stamp.jsp?arnumber=6979235,Client-server;network capacity;network science;source selection,Routing;Optimization;Complex networks;Internet;Servers;Simulation;Educational institutions,,24,,16,IEEE,8 Dec 2014,,,IEEE,IEEE Journals
Efficient Sub-Regional Multiple-Source Detection Based on Subspace Matrix Filtering,Z. Fan; G. Liang; Y. Wang; Y. Wang; Q. Li,"College of Underwater Acoustic Engineering, Harbin Engineering University, Harbin, China; College of Underwater Acoustic Engineering, Harbin Engineering University, Harbin, China; College of Underwater Acoustic Engineering, Harbin Engineering University, Harbin, China; College of Underwater Acoustic Engineering, Harbin Engineering University, Harbin, China; College of Underwater Acoustic Engineering, Harbin Engineering University, Harbin, China",IEEE Signal Processing Letters,18 Dec 2014,2015,22,7,943,947,"We present an efficient approach for the sub-regional multiple-source detection. The essence of this approach is to extract the characteristic components of the signals of interest (SOIs) from the estimated signal-plus-interference subspace by a matrix filter. Compared with some other spatial filtering-based approaches, it has two significant advantages. First, since the power of each source in the signal-plus-interference subspace is normalized, the proposed approach is effective to filter out interferences regardless of their strengths. Second, the matrix filter would not reduce the dimension of SOIs, thus, the proposed approach is able to distinguish multiple SOIs from the output of the matrix filter.",1558-2361,,10.1109/LSP.2014.2379619,"National Natural Science Foundation of China(grant numbers:51209059,51279043,61201411); ",https://ieeexplore.ieee.org/stamp/stamp.jsp?arnumber=6980464,Matrix filter;multiple-source detection;signal-plus-interference subspace,Arrays;Interference;Matrix decomposition;Covariance matrices;Filtering;Signal processing;Narrowband,,9,,13,IEEE,9 Dec 2014,,,IEEE,IEEE Journals
On the Ozarow-Leung Scheme for the Gaussian Broadcast Channel with Feedback,Y. Murin; Y. Kaspi; R. Dabora,"Electrical and computer engineering, Ben-Gurion University, Israel, USA; University of California, San Diego, USA; Electrical and computer engineering, Ben-Gurion University, Israel, USA",IEEE Signal Processing Letters,18 Dec 2014,2015,22,7,948,952,"In this work, we consider linear-feedback schemes for the two-user Gaussian broadcast channel with noiseless feedback. We extend the transmission scheme of [Ozarow and Leung, 1984] by applying estimators with memory instead of the memoryless estimators used by Ozarow and Leung (OL) in their original work. A recursive formulation of the mean square errors achieved by the proposed estimators is provided, along with a proof for the existence of a fixed point. This enables characterizing the achievable rates of the extended scheme. Finally, via numerical simulations it is shown that the extended scheme can improve upon the original OL scheme in terms of achievable rates, as well as achieve a low probability of error after a finite number of channel uses.",1558-2361,,10.1109/LSP.2014.2375893,"Israel Science Foundation; ",https://ieeexplore.ieee.org/stamp/stamp.jsp?arnumber=6971154,,Channel estimation;Receivers;Noise;Estimation error;Numerical simulation;Materials,,4,,13,IEEE,2 Dec 2014,,,IEEE,IEEE Journals
Kernel Least Mean Square with Single Feedback,J. Zhao; X. Liao; S. Wang; C. K. Tse,"School of Electronics and Information Engineering, Southwest University, Chongqing, China; School of Electronics and Information Engineering, Southwest University, Chongqing, China; School of Electronics and Information Engineering, Southwest University, Chongqing, China; Department of Electronic and Information Engineering, Hong Kong Polytechnic University, Hong Kong, China",IEEE Signal Processing Letters,18 Dec 2014,2015,22,7,953,957,"In this letter, a novel kernel adaptive filtering algorithm, namely the kernel least mean square with single feedback (SF-KLMS) algorithm, is proposed. In SF-KLMS, only a single delayed output is used to update the weights in a recurrent fashion. The use of past information accelerates the convergence rate significantly. Compared with the kernel adaptive filter using multiple feedback, SF-KLMS has a more compact and efficient structure. Simulations in the context of time-series prediction and nonlinear regression show that SF-KLMS outperforms not only the kernel adaptive filter with multiple feedback but also the kernel adaptive filter without feedback in terms of convergence rate and mean square error.",1558-2361,,10.1109/LSP.2014.2377726,"the Doctoral Fund of Southwest University China(grant numbers:SWU111027); Fundamental and Frontier Research Project of Chongqing(grant numbers:cstc2014jcyjA40020); Fundamental Research Funds for Central Universities(grant numbers:XDJK2014B001); National Natural Science Foundation of China(grant numbers:61101232,61472331); ",https://ieeexplore.ieee.org/stamp/stamp.jsp?arnumber=6977884,Kernel adaptive filter;KLMS;recurrent fashion;single feedback,Kernel;Signal processing algorithms;Convergence;Algorithm design and analysis;Least squares approximations;Prediction algorithms;Testing,,36,,20,IEEE,5 Dec 2014,,,IEEE,IEEE Journals
Discrete Receive Beamforming,J. Israel; A. Fischer; J. Martinovic; E. A. Jorswieck; M. Mesyagutov,"Institute of Numerical Mathematics, Technische Universität Dresden, Dresden, Germany; Institute of Numerical Mathematics, Technische Universität Dresden, Dresden, Germany; Institute of Numerical Mathematics, Technische Universität Dresden, Dresden, Germany; Chair for Communications Theory, Communications Laboratory, Technische Universität Dresden, Dresden, Germany; Institute of Numerical Mathematics, Technische Universität Dresden, Dresden, Germany",IEEE Signal Processing Letters,18 Dec 2014,2015,22,7,958,962,"We present a new approach for analog receive beamforming if phase shifters and amplifiers have finite resolution only. Then, the maximization of the signal-to-interference-plus-noise ratio (SINR) is a discrete optimization problem with a nonconcave objective function. The discrete maximization problem is solved exactly by means of a branch-and-bound algorithm. Based on the Capon method, we derive a new and efficient way of computing upper SINR-bounds for the subproblems occurring at the nodes of the branch-and-bound tree. Results of numerical simulations are provided and compared to an earlier approximate approach.",1558-2361,,10.1109/LSP.2014.2379333,,https://ieeexplore.ieee.org/stamp/stamp.jsp?arnumber=6980459,Branch-and-bound;discrete antenna weights;receive beamforming;SINR maximization,Array signal processing;Arrays;Upper bound;Signal to noise ratio;Vectors;Interference;Signal processing algorithms,,8,,28,IEEE,9 Dec 2014,,,IEEE,IEEE Journals
Scene Text Identification by Leveraging Mid-level Patches and Context Information,R. Wang; N. Sang; C. Gao,"Science and Technology on Multi-spectral Information Processing Laboratory, Huazhong University of Science and Technology, Wuhan, China; Science and Technology on Multi-spectral Information Processing Laboratory, Huazhong University of Science and Technology, Wuhan, China; Science and Technology on Multi-spectral Information Processing Laboratory, Huazhong University of Science and Technology, Wuhan, China",IEEE Signal Processing Letters,18 Dec 2014,2015,22,7,963,967,"In order to identify scene texts from the background interferences, many existing methods are developed just rely on exploring heuristic rules or designing sophisticated text-specific features. In this letter, we solve this problem from a different perspective, not only the low-level texture feature is adopted to describe the candidate regions, but also the mid-level patches and the context information are integrated for boosting the classification robustness. Experimental results on the three benchmark datasets show that the proposed approach has obtained the promising classification performance.",1558-2361,,10.1109/LSP.2014.2379625,"National Natural Science Foundation of China(grant numbers:61105014,61302137,61401170); ",https://ieeexplore.ieee.org/stamp/stamp.jsp?arnumber=6980452,Context information;mid-level patch;Scene text detection,Context;Feature extraction;Signal processing algorithms;Character recognition;Educational institutions;Support vector machines;Color,,4,,25,IEEE,9 Dec 2014,,,IEEE,IEEE Journals
Estimating Long Tail Models for Risk Trends,S. Shenoy; D. Gorinevsky,"Stanford University, Stanford, CA, US; Stanford University, Stanford, CA, US",IEEE Signal Processing Letters,18 Dec 2014,2015,22,7,968,972,"This letter develops a method for estimating trends of extreme events statistics across multiple time periods. Some of the periods might have no extreme events and some might have much data. The extreme event distribution is modeled with a Pareto or exponential tail. The method requires selecting an extreme event threshold and then solving two convex problems for the tail parameters. Solving one provides a smoothed tail rate trend, solving another, the smoothed trend of the tail quantile level. The approach is illustrated by trending the 10-year extreme event risks for S&P 500 index daily losses and for peak power load in electrical utility data.",1558-2361,,10.1109/LSP.2014.2378787,,https://ieeexplore.ieee.org/stamp/stamp.jsp?arnumber=6980088,,Market research;Computational modeling;Indexes;Bayes methods;Maximum likelihood estimation;Educational institutions,,6,,28,OAPA,9 Dec 2014,,,IEEE,IEEE Journals
Fast Digital Filtering of Spectrometric Data for Pile-up Correction,T. Trigano; E. Barat; T. Dautremer; T. Montagu,"Department of Electrical Engineering, Shamoon College of Engineering, Ashdod, Israel; CEA, LIST, Gif sur Yvette, France; CEA, LIST, Gif sur Yvette, France; CEA, LIST, Gif sur Yvette, France",IEEE Signal Processing Letters,18 Dec 2014,2015,22,7,973,977,"This letter considers a problem stemming from the analysis of spectrometric data. When performing experiments on highly radioactive matter, electrical pulses recorded by the spectrometer tend to overlap, thus yielding severe distortions when computing the histogram of the pulses’ energies. In this letter, we propose a fast recursive algorithm which estimates efficiently this histogram from measurements of the duration and energies of overlapping pulses. Its good performances are shown both on simulations and real data. Furthermore, its lower algorithmic complexity makes it more fitting for real-time implementation.",1558-2361,,10.1109/LSP.2014.2377352,,https://ieeexplore.ieee.org/stamp/stamp.jsp?arnumber=6975112,Digital signal processing;nonlinear inverse problem;pile-up correction;signal restoration and enhancement,Signal processing algorithms;Mathematical model;Nonlinear distortion;Histograms;Photonics;Real-time systems;Detectors,,13,,8,IEEE,4 Dec 2014,,,IEEE,IEEE Journals
A Time Regularization Technique for Discrete Spectral Envelopes Through Frequency Derivative,G. Degottex,"University of Crete and FORTH, Heraklion, Greece",IEEE Signal Processing Letters,18 Dec 2014,2015,22,7,978,982,"In most applications of sinusoidal models for speech signal, an amplitude spectral envelope is necessary. This envelope is not only assumed to fit the vocal tract filter response as accurately as possible, but it should also exhibit slow varying shapes across time. Indeed, time irregularities can generate artifacts in signal manipulations or increase improperly the features variance used in statistical models. In this letter, a simple technique is suggested to improve this time regularity. Considering that time regularity is characterized by slowly varying spectral shapes among successive frames, the basic idea is to smooth the frequency derivative of the envelope instead of its absolute value. Even though, this idea could be applied to different envelope models, the present letter describes its application to the simple linear interpolation envelope. Using real speech signals, the evaluation shows that the time irregularity can be drastically reduced. Additional experiments using synthetic signals also show that the accuracy of the original envelope is not degraded by the process.",1558-2361,,10.1109/LSP.2014.2380412,"Swiss National Science Foundation(grant numbers:PBSKP2_140021); ",https://ieeexplore.ieee.org/stamp/stamp.jsp?arnumber=6980109,Amplitude spectral envelope;sinusoidal model;speech modeling;time regularity,Harmonic analysis;Time-frequency analysis;Cepstral analysis;Hidden Markov models;Speech;Shape;Frequency estimation,,2,,24,IEEE,9 Dec 2014,,,IEEE,IEEE Journals
Performance Analysis of Time of Arrival Estimation on OFDM Signals,M. Driusso; M. Comisso; F. Babich; C. Marshall,"Department of Engineering and Architecture, University of Trieste, Italy; Department of Engineering and Architecture, University of Trieste, Italy; Department of Engineering and Architecture, University of Trieste, Italy; u-blox UK Ltd, Reigate, United Kingdom",IEEE Signal Processing Letters,18 Dec 2014,2015,22,7,983,987,"This letter characterizes the error performance of realistically modelled orthogonal frequency division multiplexing (OFDM) signals, when their time of arrival has to be estimated in an additive white Gaussian noise channel. In particular, different power distributions on the available sub-carriers of the OFDM signal are considered, and bounds on the corresponding root mean square estimation error (RMSEE) are evaluated. The tools used for such purpose are the widely adopted Cramér-Rao bound and the Ziv-Zakai bound, which is tight in a wide range of signal-to-noise ratio (SNR) values. The presented analysis reveals that, for a given signal bandwidth, a proper power distribution on the OFDM sub-carriers is crucial for achieving a good performance in the low to medium SNR region, where the RMSEE curve exhibits the typical threshold behavior. Moreover, a trade-off between asymptotic and threshold performance is identified, thanks to the adoption of a novel performance figure, which directly describes the threshold RMSEE behavior.",1558-2361,,10.1109/LSP.2014.2378994,,https://ieeexplore.ieee.org/stamp/stamp.jsp?arnumber=6979218,Cramér-Rao bound;OFDM;root mean square;time of arrival estimation;Ziv-Zakai bound,OFDM;Power distribution;Time of arrival estimation;Bandwidth;Signal to noise ratio;Root mean square;Estimation,,18,,20,IEEE,8 Dec 2014,,,IEEE,IEEE Journals
Empirical Non-Parametric Estimation of the Fisher Information,V. Berisha; A. O. Hero,"Department of Speech and Hearing Science, Arizona State University, Tempe, AZ; Department of Electrical Engineering and Computer Science(EECS), Ann Arbor, MI",IEEE Signal Processing Letters,18 Dec 2014,2015,22,7,988,992,"The Fisher information matrix (FIM) is a foundational concept in statistical signal processing. The FIM depends on the probability distribution, assumed to belong to a smooth parametric family. Traditional approaches to estimating the FIM require estimating the probability distribution function (PDF), or its parameters, along with its gradient or Hessian. However, in many practical situations the PDF of the data is not known but the statistician has access to an observation sample for any parameter value. Here we propose a method of estimating the FIM directly from sampled data that does not require knowledge of the underlying PDF. The method is based on non-parametric estimation of an f-divergence over a local neighborhood of the parameter space and a relation between curvature of the f-divergence and the FIM. Thus we obtain an empirical estimator of the FIM that does not require density estimation and is asymptotically consistent. We empirically evaluate the validity of our approach using two experiments.",1558-2361,,10.1109/LSP.2014.2378514,"National Science Foundation(grant numbers:CCF-1217880); Army Research Office(grant numbers:W911NF-11-1-0391); Office of Naval Research(grant numbers:N000141410722); ",https://ieeexplore.ieee.org/stamp/stamp.jsp?arnumber=6975144,Cochlear implant modeling;Cramer-Rao lower bound;empirical Fisher information;$f$-divergence;graph signal processing,Estimation;Probability density function;Educational institutions;Density measurement;Least squares approximations;Vectors;Signal processing,,36,,22,IEEE,4 Dec 2014,,,IEEE,IEEE Journals
Soft-Output MIMO Detectors with Channel Estimation Error,L. M. A. Jalloul; S. P. Alex; M. M. Mansour,"Broadcom Corporation, Sunnyvale, CA, USA; Broadcom Corporation, Sunnyvale, CA, USA; Department of Electrical and Computer Engineering, American University of Beirut, Beirut, Lebanon",IEEE Signal Processing Letters,18 Dec 2014,2015,22,7,993,997,"New expressions for the soft decision bit log-likelihood ratio (LLR) of a MIMO system using quadrature amplitude modulation (QAM) taking into account channel estimation error (CEE). The bit LLR for the maximum likelihood (ML) and the linear minimum mean-squared error (MMSE) receivers are derived, showing in both receivers explicit scaling of the LLR that is a function of the QAM symbol and the CEE variance. These new expressions for the LLRs are used to show that only modest improvements in the link performance are achieved relative to the LLRs that do not take into account the CEE. This indicates that separating the detector design from channel estimation does not significantly impact the system performance, which leads to simplifications in the overall receiver implementation.",1558-2361,,10.1109/LSP.2014.2374425,,https://ieeexplore.ieee.org/stamp/stamp.jsp?arnumber=6967799,Channel estimation error;log-likelihood ratio;maximum likelihood;MIMO;MMSE;QAM,Receivers;Channel estimation;Vectors;Quadrature amplitude modulation;MIMO;Measurement;Detectors,,15,,19,IEEE,26 Nov 2014,,,IEEE,IEEE Journals
[Blank page],,,IEEE Signal Processing Letters,13 Aug 2015,2015,22,7,B998,B1000,This page or pages intentionally left blank.,1558-2361,,10.1109/LSP.2015.2446772,,https://ieeexplore.ieee.org/stamp/stamp.jsp?arnumber=7194930,,,,,,,IEEE,13 Aug 2015,,,IEEE,IEEE Journals
IEEE Signal Processing Letters EDICS,,,IEEE Signal Processing Letters,12 Aug 2015,2015,22,7,1001,1001,Presents the EDICS (Editors' information classification scheme) subject categories for this issue of the publication.,1558-2361,,10.1109/LSP.2015.2460275,,https://ieeexplore.ieee.org/stamp/stamp.jsp?arnumber=7192771,,,,,,,IEEE,12 Aug 2015,,,IEEE,IEEE Journals
IEEE Signal Processing Letters information for authors,,,IEEE Signal Processing Letters,12 Aug 2015,2015,22,7,1002,1003,These instructions give guidelines for preparing papers for this publication. Presents information for authors publishing in this journal.,1558-2361,,10.1109/LSP.2015.2460276,,https://ieeexplore.ieee.org/stamp/stamp.jsp?arnumber=7192799,,,,,,,IEEE,12 Aug 2015,,,IEEE,IEEE Journals
IEEE Signal Processing Society Information,,,IEEE Signal Processing Letters,12 Aug 2015,2015,22,7,C3,C3,"Provides a listing of board members, committee members and society officers.",1558-2361,,10.1109/LSP.2015.2467491,,https://ieeexplore.ieee.org/stamp/stamp.jsp?arnumber=7192803,,,,,,,IEEE,12 Aug 2015,,,IEEE,IEEE Journals
[Blank page],,,IEEE Signal Processing Letters,12 Aug 2015,2015,22,7,C4,C4,This page or pages intentionally left blank.,1558-2361,,10.1109/LSP.2015.2467511,,https://ieeexplore.ieee.org/stamp/stamp.jsp?arnumber=7192805,,,,,,,IEEE,12 Aug 2015,,,IEEE,IEEE Journals
