Document Title,Authors,Author Affiliations,Publication Title,Date Added To Xplore,Publication Year,Volume,Issue,Start Page,End Page,Abstract,ISSN,ISBNs,DOI,Funding Information,PDF Link,Author Keywords,IEEE Terms,Mesh_Terms,Article Citation Count,Patent Citation Count,Reference Count,License,Online Date,Issue Date,Meeting Date,Publisher,Document Identifier
Front Cover,,,IEEE Signal Processing Letters,12 Aug 2015,2015,22,7,C1,C1,Presents the front cover for this issue of the publication.,1558-2361,,10.1109/LSP.2015.2411559,,https://ieeexplore.ieee.org/stamp/stamp.jsp?arnumber=7192751,,,,,,,IEEE,12 Aug 2015,,,IEEE,IEEE Journals
IEEE Signal Processing Letters publication information,,,IEEE Signal Processing Letters,12 Aug 2015,2015,22,7,C2,C2,"Provides a listing of the editors, board members, and current staff for this issue of the publication.",1558-2361,,10.1109/LSP.2015.2467437,,https://ieeexplore.ieee.org/stamp/stamp.jsp?arnumber=7192800,,,,,,,IEEE,12 Aug 2015,,,IEEE,IEEE Journals
Table of Contents,,,IEEE Signal Processing Letters,9 Mar 2015,2015,22,7,785,786,Presents the table of contents for this issue of the publication.,1558-2361,,10.1109/LSP.2015.2392574,,https://ieeexplore.ieee.org/stamp/stamp.jsp?arnumber=7056605,,,,,,,IEEE,9 Mar 2015,,,IEEE,IEEE Journals
Table of Contents,,,IEEE Signal Processing Letters,9 Mar 2015,2015,22,7,787,788,Presents the table of contents for this issue of the publication.,1558-2361,,10.1109/LSP.2015.2392575,,https://ieeexplore.ieee.org/stamp/stamp.jsp?arnumber=7056604,,,,,,,IEEE,9 Mar 2015,,,IEEE,IEEE Journals
Higher-Order-Statistics-Based Fractal Dimension for Noisy Bowel Sound Detection,M. -J. Sheu; P. -Y. Lin; J. -Y. Chen; C. -C. Lee; B. -S. Lin,"Division of Gastroenterology and Hepatology, Chi Mei Medical Center, Tainan, Taiwan; Institute of Imaging and Biomedical Photonics, National Chiao Tung University, Hsinchu, Taiwan; Department of Anesthesiology, Chimei Medical Center, Tainan, Taiwan; Department of Anesthesiology, Chimei Medical Center, Tainan, Taiwan; Institute of Imaging and Biomedical Photonics, National Chiao Tung University, Hsinchu, Taiwan",IEEE Signal Processing Letters,20 Nov 2014,2015,22,7,789,793,"Bowel sounds is an important physiological parameter of distinguishing the gastrointestinal motility dysfunction. Auscultation of bowel sounds provides a noninvasive way for clinical diagnosis, but it is also easily affected by environmental noise. In this study, a novel higher-order-statistics (HOS)-based fractal dimension algorithm was proposed for detecting noisy bowel sounds. By using the nature of preserving non-Gaussianity for higher order statistics technique, the proposed method can effectively detect bowel sounds under different noise conditions, and its performance is insensitive to the change of noise type and noise level.",1558-2361,,10.1109/LSP.2014.2369856,,https://ieeexplore.ieee.org/stamp/stamp.jsp?arnumber=6952970,Bowel sound;environmental noise;fractal dimension;higher order statistics,Fractals;Signal processing algorithms;Noise;Higher order statistics;Noise measurement;Biomedical imaging;Electronic mail,,22,,19,IEEE,11 Nov 2014,,,IEEE,IEEE Journals
Visual Tracking via Structure Constrained Grouping,L. Wang; H. Lu; D. Wang,"Faculty of Electronic Information and Electrical Engineering, Dalian University of Technology, Dalian, China; Faculty of Electronic Information and Electrical Engineering, Dalian University of Technology, Dalian, China; Faculty of Electronic Information and Electrical Engineering, Dalian University of Technology, Dalian, China",IEEE Signal Processing Letters,20 Nov 2014,2015,22,7,794,798,"This letter introduces a novel two-pass structural grouping algorithm and casts visual tracking as foreground superpixels grouping problem. In the first step, pairwise superpixel grouping is conducted in four orientations. Grouping prototypes containing the prior information of foreground and background are generated to determine whether any pair of neighboring superpixels should be grouped together. In the second step, superpixels selected by the first step are grouped into a single region which serves as the object region. The proposed grouping method has two benefits over the state-of-the-art ones. First, pairwise grouping is independently conducted in four orientations, which exploits the local structure of the foregound/backgroud and facilitates a more robust grouping process. Second, rather than considering the similarity of two neighboring superpixels, the grouping process is performed via accounting for the prior information of the object and the background, which is more suitable for visual tracking. Many experiments on challenging video clips demonstrate that our method achieves good performance than the state-of-the-art trackers in a wide range of tracking scenarios.",1558-2361,,10.1109/LSP.2014.2369476,,https://ieeexplore.ieee.org/stamp/stamp.jsp?arnumber=6952967,Sparse representation;structural grouping;visual tracking,Prototypes;Visualization;Training;Image color analysis;Signal processing algorithms;Educational institutions;Materials,,10,,21,IEEE,11 Nov 2014,,,IEEE,IEEE Journals
Adaptive Array Thinning for Enhanced DOA Estimation,X. Wang; E. Aboutanios; M. G. Amin,"School of Electrical Engineering and Telecommunication, University of New South Wales, Sydney, Australia; School of Electrical Engineering and Telecommunication, University of New South Wales, Sydney, Australia; Center for Advanced Communications, Villanova University, Villanova, PA, USA",IEEE Signal Processing Letters,21 Nov 2014,2015,22,7,799,803,"Antenna array configurations play an important role in direction of arrival (DOA) estimation. In this letter, performance enhancement of DOA estimation is achieved by reconfiguring the multi-antenna receiver through an antenna selection strategy. We derive the Cramer-Rao Bound (CRB) in terms of the selected antennas and associated subarray for both peak sidelobe level (PSL) constrained isotropic and directional arrays in single source cases. Since directional arrays are angle dependent, a Dinklebach type algorithm and convex relaxation are introduced to maintain the optimum selection by adaptively reconfiguring the directional subarrays using semi-definite programming. Simulation results validate the effectiveness of the proposed antenna selection strategy.",1558-2361,,10.1109/LSP.2014.2370632,"Office of Naval Research ONR(grant numbers:N00014-13-1-0061); ",https://ieeexplore.ieee.org/stamp/stamp.jsp?arnumber=6955794,Antenna selection;Cramer-Rao bound;dinklebach algorithm;directional array;isotropic array,Arrays;Antenna arrays;Direction-of-arrival estimation;Estimation;Directive antennas;Signal processing algorithms,,43,,23,IEEE,13 Nov 2014,,,IEEE,IEEE Journals
Feasible Point Pursuit and Successive Approximation of Non-Convex QCQPs,O. Mehanna; K. Huang; B. Gopalakrishnan; A. Konar; N. D. Sidiropoulos,"Qualcomm., San Jose, CA, US; Department of Electrical and Computer Engineering, University of Minnesota, Minneapolis, MN, US; Department of Electrical and Computer Engineering, University of Minnesota, Minneapolis, MN, US; Department of Electrical and Computer Engineering, University of Minnesota, Minneapolis, MN, US; Department of Electrical and Computer Engineering, University of Minnesota, Minneapolis, MN, US",IEEE Signal Processing Letters,20 Nov 2014,2015,22,7,804,808,"Quadratically constrained quadratic programs (QCQPs) have a wide range of applications in signal processing and wireless communications. Non-convex QCQPs are NP-hard in general. Existing approaches relax the non-convexity using semi-definite relaxation (SDR) or linearize the non-convex part and solve the resulting convex problem. However, these techniques are seldom successful in even obtaining a feasible solution when the QCQP matrices are indefinite. In this letter, a new feasible point pursuit successive convex approximation (FPP-SCA) algorithm is proposed for non-convex QCQPs. FPP-SCA linearizes the non-convex parts of the problem as conventional SCA does, but adds slack variables to sustain feasibility, and a penalty to ensure slacks are sparingly used. When FPP-SCA is successful in identifying a feasible point of the non-convex QCQP, convergence to a Karush-Kuhn-Tucker (KKT) point is thereafter ensured. Simulations show the effectiveness of our proposed algorithm in obtaining feasible and near-optimal solutions, significantly outperforming existing approaches.",1558-2361,,10.1109/LSP.2014.2370033,"Division of Information and Intelligent Systems(grant numbers:IIS-1247632); Division of Electrical Communications and Cyber Systems(grant numbers:ECCS-1231504); Division of Astronomical Sciences(grant numbers:AST-1247885); ",https://ieeexplore.ieee.org/stamp/stamp.jsp?arnumber=6954488,Feasible point pursuit;linearization;multicast beamforming;non-convex QCQP;semi-definite relaxation;successive convex approximation,Signal processing algorithms;Convergence;Linear approximation;Approximation algorithms;Linear matrix inequalities;Ellipsoids,,206,,20,IEEE,12 Nov 2014,,,IEEE,IEEE Journals
Gradient Radial Basis Function Based Varying-Coefficient Autoregressive Model for Nonlinear and Nonstationary Time Series,M. Gan; C. L. P. Chen; H. -X. Li; L. Chen,"School of Electrical Engineering and Automation, Hefei University of Technology, Hefei, Anhui, P. R. China; Faculty of Science and Technology, University of Macau, Macau, China; Department of Systems Engineering and Engineering Management, City University of Hong Kong, Hong Kong; Faculty of Science and Technology, University of Macau, Macau, China",IEEE Signal Processing Letters,21 Nov 2014,2015,22,7,809,812,"We propose a gradient radial basis function based varying-coefficient autoregressive (GRBF-AR) model for modeling and predicting time series that exhibit nonlinearity and homogeneous nonstationarity. This GRBF-AR model is a synthesis of the gradient RBF and the functional-coefficient autoregressive (FAR) model. The gradient RBFs, which react to the gradient of the series, are used to construct varying coefficients of the FAR model. The Mackey-Glass chaotic time series are used to evaluate the performance of the proposed method. It is shown that the GRBF-AR model not only achieves much more parsimonious structure but also much better prediction performance than that of GRBF network.",1558-2361,,10.1109/LSP.2014.2369415,,https://ieeexplore.ieee.org/stamp/stamp.jsp?arnumber=6953131,Functional-coefficient autoregressive model;gradient radial basis function;nonlinear and nonstationary time series;separable nonlinear least squares,Time series analysis;Adaptation models;Predictive models;Numerical models;Vectors;Educational institutions,,51,,28,IEEE,11 Nov 2014,,,IEEE,IEEE Journals
Performance of Transmit Beamforming Codebooks with Separate Amplitude and Phase Quantization,A. Dowhuszko; J. Hämäläinen,"Department of Communications and Networking, Aalto University, Aalto, Finland; Department of Communications and Networking, Aalto University, Aalto, Finland",IEEE Signal Processing Letters,25 Nov 2014,2015,22,7,813,817,"A simple quantization scheme is proposed to adjust separately the amplitudes and phases of signals in a codebook-based Transmit Beamforming (TBF) scheme. The proposed quantization scheme is valid for both desired signal power maximization (egoistic TBF) and co-channel interference mitigation (altruistic TBF), and does not require an exhaustive search to find the optimal TBF vector. Performance results are presented when variable numbers of bits for amplitude and phase feedback resolutions are used for both egoistic and altruistic TBF schemes.",1558-2361,,10.1109/LSP.2014.2370762,,https://ieeexplore.ieee.org/stamp/stamp.jsp?arnumber=6955807,Codebook design;interference mitigation;limited feedback terms;separate quantization;transmit beamforming,Quantization (signal);Vectors;Array signal processing;Signal to noise ratio;Interchannel interference;Antennas,,13,,13,OAPA,13 Nov 2014,,,IEEE,IEEE Journals
On the Behavior of EMD and MEMD in Presence of Symmetric $\alpha $ -Stable Noise,A. Komaty; A. O. Boudraa; J. P. Nolan; D. Dare,"IRENav, Ecole Navale, BREST Cedex 9, France; IRENav, Ecole Navale, BREST Cedex 9, France; American University, Washington, DC, USA; IRENav, Ecole Navale, BREST Cedex 9, France",IEEE Signal Processing Letters,25 Nov 2014,2015,22,7,818,822,"Empirical Mode Decomposition (EMD) and its extended versions such as Multivariate EMD (MEMD) are data-driven techniques that represent nonlinear and non-stationary data as a sum of a finite zero-mean AM-FM components referred to as Intrinsic Mode Functions (IMFs). The aim of this work is to analyze the behavior of EMD and MEMD in stochastic situations involving non-Gaussian noise, more precisely, we examine the case of Symmetric α-Stable (SαS) noise. We report numerical experiments supporting the claim that both EMD and MEMD act, essentially, as filter banks on each channel of the input signal in the case of SαS noise. Reported results show that, unlike EMD, MEMD has the ability to align common frequency modes across multiple channels in same index IMFs. Further, simulations show that, contrary to EMD, for MEMD the stability property is well satisfied for the modes of lower indices and this result is exploited for the estimation of the stability index of the SαS input signal.",1558-2361,,10.1109/LSP.2014.2371132,,https://ieeexplore.ieee.org/stamp/stamp.jsp?arnumber=6957520,EMD;filter banks;MEMD;symmetric  $\alpha$–stable noise,Noise;Indexes;Stability criteria;Frequency measurement;Estimation;Gaussian distribution,,1,,21,IEEE,14 Nov 2014,,,IEEE,IEEE Journals
Joint Power Splitting and Antenna Selection in Energy Harvesting Relay Channels,Z. Zhou; M. Peng; Z. Zhao; Y. Li,"Ministry of Education, Beijing University of Posts and Telecommunications, China; Ministry of Education, Beijing University of Posts and Telecommunications, China; Ministry of Education, Beijing University of Posts and Telecommunications, China; Ministry of Education, Beijing University of Posts and Telecommunications, China",IEEE Signal Processing Letters,25 Nov 2014,2015,22,7,823,827,"The simultaneous wireless transfer of information and power with the help of a relay equipped with multiple antennas is considered in this letter, where a “harvest-and-forward” strategy is proposed. In particular, the relay harvests energy and obtains information from the source with the radio-frequent signals by jointly using the antenna selection (AS) and power splitting (PS) techniques, and then the processed information is amplified and forwarded to the destination relying on the harvested energy. This letter jointly optimizes AS and PS to maximize the achievable rate for the proposed strategy. Considering that the joint optimization is according to the non-convex problem, a two-stage procedure is proposed to determine the optimal ratio of received signal power split for energy harvesting, and the optimized antenna set engaged in information forwarding. Simulation results confirm the accuracy of the two-stage procedure, and demonstrate that the proposed “harvest-and-forward” strategy outperforms the conventional amplify-and-forward (AF) relaying and the direct transmission.",1558-2361,,10.1109/LSP.2014.2369748,,https://ieeexplore.ieee.org/stamp/stamp.jsp?arnumber=6952965,Antenna selection;energy harvesting;power splitting,Antennas;Energy harvesting;Relays;Signal to noise ratio;Joints;Wireless communication;Optimization,,95,,5,IEEE,11 Nov 2014,,,IEEE,IEEE Journals
Colocated MIMO Radar Transmit Beamspace Design for Randomly Present Target Detection,H. Xu; J. Wang; J. Yuan; X. Shan,"Department of Electronic Engineering, Tsinghua University, Beijing, P. R. China; Department of Electronic Engineering, Tsinghua University, Beijing, P. R. China; Department of Electronic Engineering, Tsinghua University, Beijing, P. R. China; Department of Electronic Engineering, Tsinghua University, Beijing, P. R. China",IEEE Signal Processing Letters,25 Nov 2014,2015,22,7,828,832,"In general detection problems, targets or sources may be present at an unknown direction. This letter proposes a detection scheme for the randomly present case based on the MIMO radar transmit beamspace (TB) technique. An average likelihood ratio (ALR) detector for randomly present target detection is formulated firstly. Then two TB design strategies for different present cases are proposed accordingly to get optimal detectors. Numerical results demonstrate that a significant gain in detection can be achieved by these designs comparing to the conventional methods. Finally, theoretical and numerical analyses illustrate the influence of the transceiver parameters on detection performance.",1558-2361,,10.1109/LSP.2014.2371241,"National Natural Science Foundation of China NNSFC(grant numbers:61273214); ",https://ieeexplore.ieee.org/stamp/stamp.jsp?arnumber=6957532,Beampattern (BP);detection;likelihood ratio;multiple-input multi-output (MIMO) Radar;optimization,Detectors;Object detection;Vectors;MIMO radar;MIMO;Radar antennas,,15,,34,IEEE,14 Nov 2014,,,IEEE,IEEE Journals
Non-Local Means Image Denoising With a Soft Threshold,L. Lu; W. Jin; X. Wang,"Ministry of Education of China, Beijing Institute of Technology, Beijing, P. R. China; Ministry of Education of China, Beijing Institute of Technology, Beijing, P. R. China; Ministry of Education of China, Beijing Institute of Technology, Beijing, P. R. China",IEEE Signal Processing Letters,25 Nov 2014,2015,22,7,833,837,"Non-local means (NLM) are typically biased by the accumulation of small weights associated with dissimilar patches, especially at image edges. Hence, we propose to null the small weights with a soft threshold to reduce this accumulation. We call this method the NLM filter with a soft threshold (NLM-ST). Its Stein’s unbiased risk estimate (SURE) approaches the true mean square error; thus, we can linearly aggregate multiple NLM-STs of Monte-Carlo-generated parameters by minimizing SURE to surpass the performance limit of single NLM-ST, which is referred to as the Monte-Carlo-based linear aggregation (MCLA). Finally, we employ a simple moving average filter to smooth the MCLA image sequence to further improve the denoising performance and stability. Experiments indicate that the NLM-ST outperforms the classic patchwise NLM and three other well-known recent variants in terms of the peak signal-to-noise ratio (PSNR), structural similarity (SSIM), and visual quality. Furthermore, its PSNR is higher than that of BM3D for certain images.",1558-2361,,10.1109/LSP.2014.2371332,"Key Program of National Natural Science Foundation of China(grant numbers:Grant No. 61231014); Key Pre-research Foundation of General Armament Department of China(grant numbers:Grant No. 40405030302,Grant No. 9140A01010113BQ01001); ",https://ieeexplore.ieee.org/stamp/stamp.jsp?arnumber=6957527,Image denoising;non-local means;soft threshold;Stein’s unbiased risk estimate,Signal processing algorithms;Noise reduction;Monte Carlo methods;Image restoration;PSNR;Smoothing methods;Filtering,,48,,45,IEEE,14 Nov 2014,,,IEEE,IEEE Journals
No-Reference Quality Assessment of Contrast-Distorted Images Based on Natural Scene Statistics,Y. Fang; K. Ma; Z. Wang; W. Lin; Z. Fang; G. Zhai,"School of Information Technology, Jiangxi University of Finance and Economics, Nanchang, Jiangxi, China; Department of Electrical and Computer Engineering, University of Waterloo, ON, Canada; Department of Electrical and Computer Engineering, University of Waterloo, ON, Canada; School of Computer Engineering, Nanyang Technological University, Singapore; School of Information Technology, Jiangxi University of Finance and Economics, Nanchang, Jiangxi, China; Institute of Image Communication and Information Processing, Shanghai Jiao Tong University, Shanghai, China",IEEE Signal Processing Letters,25 Nov 2014,2015,22,7,838,842,"Contrast distortion is often a determining factor in human perception of image quality, but little investigation has been dedicated to quality assessment of contrast-distorted images without assuming the availability of a perfect-quality reference image. In this letter, we propose a simple but effective method for no-reference quality assessment of contrast distorted images based on the principle of natural scene statistics (NSS). A large scale image database is employed to build NSS models based on moment and entropy features. The quality of a contrast-distorted image is then evaluated based on its unnaturalness characterized by the degree of deviation from the NSS models. Support vector regression (SVR) is employed to predict human mean opinion score (MOS) from multiple NSS features as the input. Experiments based on three publicly available databases demonstrate the promising performance of the proposed method.",1558-2361,,10.1109/LSP.2014.2372333,,https://ieeexplore.ieee.org/stamp/stamp.jsp?arnumber=6963354,Contrast distortion;image quality assessment;natural scene statistics;no-reference image quality assessment;support vector regression,Measurement;Image quality;Entropy;Standards;Feature extraction;Distortion;Educational institutions,,157,,26,IEEE,20 Nov 2014,,,IEEE,IEEE Journals
Two Efficient Algorithms for Approximately Orthogonal Nonnegative Matrix Factorization,B. Li; G. Zhou; A. Cichocki,"School of Electronic and Information Engineering, South China University of Technology, Guangzhou, China; Department of Automation, Guangdong University of Technology, Guangzhou, China; RIKEN, Brain Science Institute, Wako-shi, Saitama, Japan",IEEE Signal Processing Letters,25 Nov 2014,2015,22,7,843,846,"Nonnegative matrix factorization (NMF) with orthogonality constraints is quite important due to its close relation with the K-means clustering. While existing algorithms for orthogonal NMF impose strict orthogonality constraints, in this letter we propose a penalty method with the aim of performing approximately orthogonal NMF, together with two efficient algorithms respectively based on the Hierarchical Alternating Least Squares (HALS) and the Accelerated Proximate Gradient (APG) approaches. Experimental evidence was provided to show their high efficiency and flexibility by using synthetic and real-world data.",1558-2361,,10.1109/LSP.2014.2371895,"Japan Society for the Promotion of Science(grant numbers:26730125); ",https://ieeexplore.ieee.org/stamp/stamp.jsp?arnumber=6960861,Accelerated proximal gradient;nonnegative matrix factorization,Signal processing algorithms;Clustering algorithms;Cost function;Approximation algorithms;Acceleration;Least squares approximations;Sparse matrices,,41,,13,IEEE,20 Nov 2014,,,IEEE,IEEE Journals
Bi-DCT: DCT-based Local Binary Descriptor for Dense Stereo Matching,S. Kim; K. Paeng; J. -W. Seo; S. D. Kim,"Department of Electrical Engineering, KAIST, Daejeon, Republic of Korea; Department of Electrical Engineering, KAIST, Daejeon, Republic of Korea; Department of Electrical Engineering, KAIST, Daejeon, Republic of Korea; Department of Electrical Engineering, KAIST, Daejeon, Republic of Korea",IEEE Signal Processing Letters,25 Nov 2014,2015,22,7,847,851,"In this letter, we present a novel DCT-based local binary descriptor for the dense matching of multiple view stereo (MVS). Recently, although much progress has been made in the field of MVS, a key component of which, i.e., dense matching, is still a challenging task because it has two difficult issues: robust matching over non-salient regions (e.g., lines and textureless regions) and fast matching of a large number of pixels. To deal with these issues effectively, in the proposed dense descriptor, 2D DCT-based local features are utilized to achieve high discriminative power even for the non-salient regions. A binary representation is adopted to increase the matching performance as well as accelerate the matching speed via the Hamming distance. In addition, the discriminability of binarized vectors is further improved by a space-frequency pooling scheme. Through extensive experiments on the benchmark datasets for MVS, we demonstrate the superiority of the proposed descriptor over the state-of-the-art descriptors in terms of accuracy and efficiency.",1558-2361,,10.1109/LSP.2014.2369211,,https://ieeexplore.ieee.org/stamp/stamp.jsp?arnumber=6951352,Binary descriptor;DCT (Discrete Cosine Transform);dense matching;multiple view stereo,Discrete cosine transforms;Vectors;Feature extraction;Robustness;Acceleration;Hamming distance;Materials,,2,,16,IEEE,10 Nov 2014,,,IEEE,IEEE Journals
