"Sequential Estimation of Mixtures in Diffusion Networks","K. Dedecius; J. Reichl; P. M. Djurić","Academy of Sciences of the Czech Republic, Institute of Information Theory and Automation, Prague 8, Czech Republic; Academy of Sciences of the Czech Republic, Institute of Information Theory and Automation, Prague 8, Czech Republic; Department of Electrical and Computer Engineering, Stony Brook University, NY, USA",IEEE Signal Processing Letters,"10 Sep 2014","2015","22","2","197","201","The letter studies the problem of sequential estimation of mixtures in diffusion networks whose nodes communicate only with their adjacent neighbors. The adopted quasi-Bayesian approach yields a probabilistically consistent and computationally non-intensive and fast method, applicable to a wide class of mixture models with unknown component parameters and weights. Moreover, if conjugate priors are used for inferring the component parameters, the solution attains a closed analytic form.","1558-2361","","10.1109/LSP.2014.2353652","Division of Computing and Communication Foundations(grant numbers:1320626); Czech Science Foundation(grant numbers:14-06678P); Division of Electrical Communications and Cyber Systems(grant numbers:1346854); ","https://ieeexplore.ieee.org/stamp/stamp.jsp?arnumber=6892971","Diffusion;distributed parameter estimation;sensor networks;sequential mixture estimation","Sequential estimation;Signal processing algorithms;Bayes methods;Wireless sensor networks","","17","","21","IEEE","5 Sep 2014","","","IEEE","IEEE Journals"
"Quantitative Error Analysis of Bilateral Filtering","S. An; F. Boussaid; M. Bennamoun; F. Sohel","School of Computer Science and Software Engineering, The University of Western Australia (UWA), Crawley, Australia; Electronic and Computer Engineering, The University of Western Australia (UWA), Crawley, Australia; School of Computer Science and Software Engineering, The University of Western Australia (UWA), Crawley, Australia; School of Computer Science and Software Engineering, The University of Western Australia (UWA), Crawley, Australia",IEEE Signal Processing Letters,"10 Sep 2014","2015","22","2","202","206","One of the fastest acceleration techniques for bilateral image filtering is the real time O(1) quantization method proposed by Yang 2009, which first computes some Principal Bilateral Filtered Image Components (PBFICs) and then applies linear interpolation to estimate the filtered output images. There is a trade-off between accuracy and efficiency in selecting the number of PBFICs: the more PBFICs are used, the higher the accuracy, and the higher the computational cost. A question arises: how many PBFICs are required to achieve a certain level of accuracy? In this letter, we address this question by investigating the properties of bilateral filtering and deriving the linear interpolation error bounds when only a subset of PBFICs is used. The provided theoretical analysis indicates that the necessary number of PBFICs for user-provided precision depends on the range kernel and, for typical Gaussian range kernels, a small percentage (typically less than 4%) of the PBFICs are enough for good approximations.","1558-2361","","10.1109/LSP.2014.2353694","Western Australia Office of Science Applied Research Program ARP Shark Hazard Mitigation; ","https://ieeexplore.ieee.org/stamp/stamp.jsp?arnumber=6892949","Bilateral filtering;linear interpolation;quantitative error analysis","Kernel;Interpolation;Accuracy;Error analysis;Real-time systems;Image processing","","3","","15","IEEE","5 Sep 2014","","","IEEE","IEEE Journals"
"Blind Image Quality Assessment Using the Joint Statistics of Generalized Local Binary Pattern","M. Zhang; C. Muramatsu; X. Zhou; T. Hara; H. Fujita","Department of intelligent image information, Gifu University, Gifu-shi, Japan; Department of intelligent image information, Gifu University, Gifu-shi, Japan; Department of intelligent image information, Gifu University, Gifu-shi, Japan; Department of intelligent image information, Gifu University, Gifu-shi, Japan; Department of intelligent image information, Gifu University, Gifu-shi, Japan",IEEE Signal Processing Letters,"10 Sep 2014","2015","22","2","207","210","Multimedia, including audio, image, and video, etc., is a ubiquitous part of modern life. Quality evaluation, both objective and subjective, is of fundamental importance for various multimedia applications. In this letter, a novel quality-aware feature is proposed for blind/no-reference (NR) image quality assessment (IQA). The new quality-aware feature is generated from the proposed joint generalized local binary pattern (GLBP) statistics. In this method, using the Laplacian of Gaussian (LOG) filters, the images are first decomposed into multi-scale subband images. Then, the subband images are encoded with the proposed GLBP operator and the quality-aware features are formed from the joint GLBP histograms from the encoding maps of each subband image. Finally, using support vector regression (SVR), the quality-aware features are mapped to the image's subjective quality score for NR-IQA. The experimental results for two representative databases show that the proposed method is strongly correlated to subjective quality evaluations and competitive to the state-of-the-art NR-IQA methods.","1558-2361","","10.1109/LSP.2014.2326399","","https://ieeexplore.ieee.org/stamp/stamp.jsp?arnumber=6819796","Generalized local binary pattern;image quality assessment;no reference;support vector regression","Histograms;Image quality;Joints;Databases;Signal processing algorithms;Image coding;Multimedia communication","","88","","19","IEEE","22 May 2014","","","IEEE","IEEE Journals"
"Content Adaptive Image Detail Enhancement","F. Kou; W. Chen; Z. Li; C. Wen","School of Automation Science and Electrical Engineering Beihang University, Beijing, China; School of Automation Science and Electrical Engineering Beihang University, Beijing, China; Signal Processing Department, Institute for Infocomm Research, Singapore; School of Electrical and Electronic Engineering, Nanyang Technological University, Singapore",IEEE Signal Processing Letters,"11 Sep 2014","2015","22","2","211","215","Detail enhancement is required by many problems in the fields of image processing and computational photography. Existing detail enhancement algorithms first decompose a source image into a base layer and a detail layer via an edge-preserving smoothing algorithm, and then amplify the detail layer to produce a detail-enhanced image. In this letter, we propose a new L0 norm based detail enhancement algorithm which generates the detail-enhanced image directly. The proposed algorithm preserves sharp edges better than an existing L0 norm based algorithm. Experimental results show that the proposed algorithm reduces color distortion in the detail-enhanced image, especially around sharp edges.","1558-2361","","10.1109/LSP.2014.2353774","China Scholarship Council(grant numbers:201406020019); National Natural Science Foundation of China(grant numbers:61175108); ","https://ieeexplore.ieee.org/stamp/stamp.jsp?arnumber=6892974","Detail enhancement;edge preserving;gradient field;image smoothing;${L_0}$  norm","Signal processing algorithms;Image edge detection;Optimization;Smoothing methods;Algorithm design and analysis;Educational institutions;Measurement","","49","","22","IEEE","5 Sep 2014","","","IEEE","IEEE Journals"
"Joint Preprocesser-Based Detector for Cooperative Networks with Limited Hardware Processing Capability","A. Abuzaid; Q. Z. Ahmed; M. -S. Alouini","Computer, Electrical, and Mathematical Science and Engineering (CEMSE) Division, King Abdullah University of Science and Technology(KAUST), Thuwal, Makkah Province, Saudi Arabia; KAUST Strategic Research Initiative (SRI) in Uncertainty Quantification in Computationl Science and Engineering, Thuwal, Makkah Province, Saudi Arabia; KAUST Strategic Research Initiative (SRI) in Uncertainty Quantification in Computationl Science and Engineering, Thuwal, Makkah Province, Saudi Arabia",IEEE Signal Processing Letters,"11 Sep 2014","2015","22","2","216","219","In this letter, a joint detector for cooperative communication networks is proposed when the destination has limited hardware processing capability. The transmitter sends its symbols with the help of L relays. As the destination has limited hardware, only U out of L signals are processed and the energy of the remaining relays is lost. To solve this problem, a joint preprocessing based detector is proposed. This joint preprocessor based detector operate on the principles of minimizing the symbol error rate (SER). For a realistic assessment, pilot symbol aided channel estimation is incorporated for this proposed detector. From our simulations, it can be observed that our proposed detector achieves the same SER performance as that of the maximum likelihood (ML) detector with all participating relays. Additionally, our detector outperforms selection combining (SC), channel shortening (CS) scheme and reduced-rank techniques when using the same U. Our proposed scheme has low computational complexity.","1558-2361","","10.1109/LSP.2014.2349273","","https://ieeexplore.ieee.org/stamp/stamp.jsp?arnumber=6879437","Cooperative communications;MSER criteria;preprocessing matrix","Detectors;Relays;Complexity theory;Channel estimation;Joints;Hardware;Bit error rate","","2","","11","IEEE","18 Aug 2014","","","IEEE","IEEE Journals"
"Multi-Focus Image Fusion Based on Spatial Frequency in Discrete Cosine Transform Domain","L. Cao; L. Jin; H. Tao; G. Li; Z. Zhuang; Y. Zhang.","University of Chinese Academy of Sciences, Beijing, China; Chinese Academy of Sciences, Fine Mechanics and Physics, Changchun, China; Chinese Academy of Sciences, Fine Mechanics and Physics, Changchun, China; Chinese Academy of Sciences, Fine Mechanics and Physics, Changchun, China; University of Chinese Academy of Sciences, Beijing, China; University of Chinese Academy of Sciences, Beijing, China",IEEE Signal Processing Letters,"12 Sep 2014","2015","22","2","220","224","Multi-focus image fusion in wireless visual sensor networks (WVSN) is a process of fusing two or more images to obtain a new one which contains a more accurate description of the scene than any of the individual source images. In this letter, we propose an efficient algorithm to fuse multi-focus images or videos using discrete cosine transform (DCT) based standards in WVSN. The spatial frequencies of the corresponding blocks from source images are calculated as the contrast criteria, and the blocks with the larger spatial frequencies compose the DCT presentation of the output image. Experiments on plenty of pairs of multi-focus images coded in Joint Photographic Experts Group (JPEG) standard are conducted to evaluate the fusion performance. The results show that our fusion method improves the quality of the output image visually and outperforms the previous DCT based techniques and the state-of-art methods in terms of the objective evaluation.","1558-2361","","10.1109/LSP.2014.2354534","","https://ieeexplore.ieee.org/stamp/stamp.jsp?arnumber=6891156","Discrete cosine transform;image fusion;multi-focus;spatial frequency","Discrete cosine transforms;Image fusion;Discrete wavelet transforms;Standards;Transform coding;Frequency-domain analysis;Visualization","","131","","20","OAPA","4 Sep 2014","","","IEEE","IEEE Journals"
"Confidence Measure Using Composite Features for Eye Detection in a Face Recognition System","S. -I. Choi; Y. Lee; C. Kim","Department of Applied Computer Engineering, Dankook University, Yongin-si, Gyeonggi-do, Korea; Department of Computer Science and Engineering, Dankook University, Yongin-si, Gyeonggi-do, Korea; Korea Institute of Industrial Technology, Cheonan, Korea",IEEE Signal Processing Letters,"15 Sep 2014","2015","22","2","225","228","We propose a new confidence measure to evaluate the eye detection results and combine two different eye detectors. The confidence for the results of eye detection is measured by the distances from the test sample and the positive samples, where the distance is calculated in the composite feature space. By using the proposed confidence measure, we construct a hybrid detector by combining two different detectors, which are complementary to each other. The experimental results show that the proposed detector provides more accurate eye detection results and consequently results in better face recognition rates compared to when using an individual eye detector.","1558-2361","","10.1109/LSP.2014.2335198","","https://ieeexplore.ieee.org/stamp/stamp.jsp?arnumber=6851183","Biased discriminant analysis;composite feature;confidence measure;eye detection;face recognition","Detectors;Feature extraction;Face;Face recognition;Databases;Vectors;Educational institutions","","5","","26","IEEE","9 Jul 2014","","","IEEE","IEEE Journals"
"NMF-based Target Source Separation Using Deep Neural Network","T. G. Kang; K. Kwon; J. W. Shin; N. S. Kim","Department of Electrical and Computer Engineering, Seoul National University, Seoul, Korea; Department of Electrical and Computer Engineering, Seoul National University, Seoul, Korea; School of Information and Communications, Gwangju Institute of Science and Technology, Gwangju, Korea; Department of Electrical and Computer Engineering, Seoul National University, Seoul, Korea",IEEE Signal Processing Letters,"15 Sep 2014","2015","22","2","229","233","Non-negative matrix factorization (NMF) is one of the most well-known techniques that are applied to separate a desired source from mixture data. In the NMF framework, a collection of data is factorized into a basis matrix and an encoding matrix. The basis matrix for mixture data is usually constructed by augmenting the basis matrices for independent sources. However, target source separation with the concatenated basis matrix turns out to be problematic if there exists some overlap between the subspaces that the bases for the individual sources span. In this letter, we propose a novel approach to improve encoding vector estimation for target signal extraction. Estimating encoding vectors from the mixture data is viewed as a regression problem and a deep neural network (DNN) is used to learn the mapping between the mixture data and the corresponding encoding vectors. To demonstrate the performance of the proposed algorithm, experiments were conducted in the speech enhancement task. The experimental results show that the proposed algorithm outperforms the conventional encoding vector estimation scheme.","1558-2361","","10.1109/LSP.2014.2354456","Ministry of Science ICT and Future Planning(grant numbers:NIPA-2013-H0301-13-4005); National Research Foundation of Korea(grant numbers:2012R1A2A2A01045874); ","https://ieeexplore.ieee.org/stamp/stamp.jsp?arnumber=6892992","Deep neural network;dictionary learning;non-negative matrix factorization;speech enhancement;target source separation","Vectors;Speech;Encoding;Noise;Speech enhancement;Source separation;Signal processing algorithms","","64","","26","IEEE","5 Sep 2014","","","IEEE","IEEE Journals"
"Predictive Quantization on the Stiefel Manifold","S. Schwarz; M. Rupp","Institute of Telecommunications, Vienna University of Technology, Vienna, Austria; Institute of Telecommunications, Vienna University of Technology, Vienna, Austria",IEEE Signal Processing Letters,"17 Sep 2014","2015","22","2","234","238","In this letter, we consider time-varying complex-valued n × m matrices H[k] (m ≤ n) and propose a predictive quantizer for the eigenvectors of the Gramian H[k]H[k]H, which operates on the associated compact Stiefel manifold. The proposed quantizer exploits the temporal correlation of the source signal to provide high-fidelity representations with significantly reduced quantization codebook size compared to memoryless schemes. We apply the quantizer to channel state information quantization for limited feedback based multi-user MIMO, employing regularized block-diagonalization precoding. We demonstrate significant rate gains compared to block-diagonalization precoding using Grassmannian predictive feedback.","1558-2361","","10.1109/LSP.2014.2354258","","https://ieeexplore.ieee.org/stamp/stamp.jsp?arnumber=6891198","Adaptive quantization;Grassmann manifold;limited feedback;multi-user MIMO;Stiefel manifold","Manifolds;Quantization (signal);MIMO;Signal processing algorithms;Transmitters;Receiving antennas;Signal to noise ratio","","20","","41","IEEE","4 Sep 2014","","","IEEE","IEEE Journals"
"Selecting the Number of Principal Components with SURE","M. O. Ulfarsson; V. Solo","Department of Electrical and Computer Engineering, University of Iceland, Reykjavik, Iceland; School of Electrical Engineering, University of New South Wales, Sydney, NSW, Australia",IEEE Signal Processing Letters,"17 Sep 2014","2015","22","2","239","243","Principal component analysis (PCA) is one of the most widely used methods in multivariate signal processing. An important problem is to select the number of principal components (PCs). In this paper we develop an automatic method for selecting the number of PCs based on Stein's unbiased risk estimator (SURE). In simulations the new method outperforms state of the art cross-validation methods.","1558-2361","","10.1109/LSP.2014.2337276","","https://ieeexplore.ieee.org/stamp/stamp.jsp?arnumber=6851153","Cross-validation;Principal Component Analysis (PCA);Stein’s Unbiased Risk Estimator (SURE)","Principal component analysis;Signal to noise ratio;Eigenvalues and eigenfunctions;Loading;Vectors;TV","","22","","28","IEEE","9 Jul 2014","","","IEEE","IEEE Journals"
"Subcategory Clustering with Latent Feature Alignment and Filtering for Object Detection","Z. Ruan; G. Wang; J. -H. Xue; X. Lin","Department of Electronic Engineering, Tsinghua University, Beijing, China; Department of Electronic Engineering, Tsinghua University, Beijing, China; Department of Statistical Science, University College London, London, UK; Department of Electronic Engineering, Tsinghua University, Beijing, China",IEEE Signal Processing Letters,"19 Sep 2014","2015","22","2","244","248","For objects with large appearance variations, it has been proved that their detection performance can be effectively improved by clustering positive training instances into subcategories and learning multi-component models for the subcategories. However, it is not trivial to generate subcategories of high quality, due to the difficulty in measuring the similarity between positive instances. In this letter we propose a new weakly supervised clustering method to achieve better sub-categorization. Our method provides a more precise measurement of the similarity by aligning the positive instances through latent variables and filtering the aligned features. As a better alternative to the initialization step of the latent-SVM algorithm for the learning of the multi-component models, our method can lead to a superior performance gain for object detection. We demonstrate this on various real-world datasets.","1558-2361","","10.1109/LSP.2014.2349940","National Natural Science Foundation of China(grant numbers:61132007,61271390); ","https://ieeexplore.ieee.org/stamp/stamp.jsp?arnumber=6880756","Latent-SVM;multi-component models;object detection;subcategory clustering","Clustering algorithms;Signal processing algorithms;Feature extraction;Clutter;Object detection;Support vector machines;Optimization","","6","","18","IEEE","20 Aug 2014","","","IEEE","IEEE Journals"
"Analytical Evaluation of VCO-ADC Quantization Noise Spectrum Using Pulse Frequency Modulation","L. Hernandez; E. Gutierrez","Electronic Technology Department, Carlos III University, Madrid, Spain; Electronic Technology Department, Carlos III University, Madrid, Spain",IEEE Signal Processing Letters,"19 Sep 2014","2015","22","2","249","253","Oversampled ADCs based on voltage-controlled oscillators have been analyzed using statistical models inherited from sigma-delta modulation. This letter shows that the discrete Fourier transform of a VCO-ADC output sequence can be calculated analytically for single tone inputs. The calculation is based on the transformation of the VCO output into a pulse frequency modulated signal that can be represented by a trigonometric series. Knowledge of the VCO-ADC output spectrum allows accurate evaluation of the SNDR dependence with the VCO oscillation frequency and gain constant. The SNDR predictions of the proposed model have been compared to behavioral simulations displaying only a deviation of 0.7 dB.","1558-2361","","10.1109/LSP.2014.2357071","","https://ieeexplore.ieee.org/stamp/stamp.jsp?arnumber=6895304","Data conversion;sigma-delta modulation;time encoding;voltage-controlled oscillators","Frequency modulation;Voltage-controlled oscillators;Quantization (signal);Sigma-delta modulation;Noise;Discrete Fourier transforms","","25","","13","OAPA","11 Sep 2014","","","IEEE","IEEE Journals"
"The Largest Dynamic Range of a Generalized Chinese Remainder Theorem for Two Integers","W. Wang; X. Li; X. -G. Xia; W. Wang","College of Information Engineering, Tarim University, Alar, Xinjiang, P. R. China; MOE Key Lab for Intelligent Networks and Network Security, Xi'an Jiaotong University, Xi'an, Shaanxi, P. R. China; Department of Electrical and Computer Engineering, University of Delaware, Newark, DE, USA; MOE Key Lab for Intelligent Networks and Network Security, Xi'an Jiaotong University, Xi'an, Shaanxi, P. R. China",IEEE Signal Processing Letters,"19 Sep 2014","2015","22","2","254","258","In this letter we determine the largest dynamic range within which any two nonnegative integers can be uniquely determined from their residues modulo a set of moduli. We also propose an efficient determination algorithm that extends a recent known result.","1558-2361","","10.1109/LSP.2014.2322200","Research Fund for the Doctoral Programs of Higher Education of China(grant numbers:20130201110014); Air Force Office of Science Research(grant numbers:FA9550-12-1-0055); ","https://ieeexplore.ieee.org/stamp/stamp.jsp?arnumber=6810782","Chinese remainder theorem;dynamic range;frequency determination from undersampled waveforms;residue sets","Dynamic range;Signal processing algorithms;Heuristic algorithms;Nickel;Educational institutions;Discrete Fourier transforms;Imaging","","18","","16","IEEE","6 May 2014","","","IEEE","IEEE Journals"
"[Blank page]","",,IEEE Signal Processing Letters,"13 Feb 2015","2015","22","2","B259","B260","This page or pages intentionally left blank.","1558-2361","","10.1109/LSP.2015.2401931","","https://ieeexplore.ieee.org/stamp/stamp.jsp?arnumber=7042386","","","","","","","IEEE","13 Feb 2015","","","IEEE","IEEE Journals"
"IEEE Signal Processing Letters information for authors","",,IEEE Signal Processing Letters,"13 Feb 2015","2015","22","2","261","261","Provides instructions and guidelines to prospective authors who wish to submit manuscripts.","1558-2361","","10.1109/LSP.2015.2402354","","https://ieeexplore.ieee.org/stamp/stamp.jsp?arnumber=7042383","","","","","","","IEEE","13 Feb 2015","","","IEEE","IEEE Journals"
"IEEE Signal Processing Letters EDICS","",,IEEE Signal Processing Letters,"13 Feb 2015","2015","22","2","262","262","Presents the EDICS (Editors' information classification scheme) subject categories for this issue of the publication.","1558-2361","","10.1109/LSP.2015.2402353","","https://ieeexplore.ieee.org/stamp/stamp.jsp?arnumber=7042246","","","","","","","IEEE","13 Feb 2015","","","IEEE","IEEE Journals"
"Special issue on Stochastic Simulation and Optimisation in Signal Processing","",,IEEE Signal Processing Letters,"13 Feb 2015","2015","22","2","263","263","Describes the above-named upcoming special issue or section. May include topics to be covered or calls for papers.","1558-2361","","10.1109/LSP.2015.2402358","","https://ieeexplore.ieee.org/stamp/stamp.jsp?arnumber=7042374","","","","","","","IEEE","13 Feb 2015","","","IEEE","IEEE Journals"
"Special Issue on Signal Processing for Millimeter Wave Wireless Communications","",,IEEE Signal Processing Letters,"13 Feb 2015","2015","22","2","264","264","Describes the above-named upcoming special issue or section. May include topics to be covered or calls for papers.","1558-2361","","10.1109/LSP.2015.2402357","","https://ieeexplore.ieee.org/stamp/stamp.jsp?arnumber=7042250","","","","","","","IEEE","13 Feb 2015","","","IEEE","IEEE Journals"
"IEEE Signal Processing Society Information","",,IEEE Signal Processing Letters,"13 Feb 2015","2015","22","2","C3","C3","Provides a listing of current committee members and society officers.","1558-2361","","10.1109/LSP.2015.2402452","","https://ieeexplore.ieee.org/stamp/stamp.jsp?arnumber=7042244","","","","","","","IEEE","13 Feb 2015","","","IEEE","IEEE Journals"
"Blank page","",,IEEE Signal Processing Letters,"9 Mar 2015","2015","22","2","C4","C4","This page or pages intentionally left blank.","1558-2361","","10.1109/LSP.2015.2411553","","https://ieeexplore.ieee.org/stamp/stamp.jsp?arnumber=7056615","","","","","","","IEEE","9 Mar 2015","","","IEEE","IEEE Journals"
