"A Tunable W-ABORT-Like Detector with Improved Detection vs Rejection Capabilities Trade-Off","A. Coluccia; G. Ricci","Dipartimento di Ingegneria dell’Innovazione, University of Salento, Lecce, Italy; Dipartimento di Ingegneria dell’Innovazione, University of Salento, Lecce, Italy",IEEE Signal Processing Letters,"20 Nov 2014","2015","22","6","713","717","Adaptive radar detection of point-like targets in presence of disturbance with unknown spectral properties is addressed. By relaxing the assumptions of the W-ABORT, a tunable detector with improved detection vs rejection trade-off is proposed. To this aim, the presence of a fictitious signal under the null hypothesis is modeled probabilistically, so that an additional degree of freedom is introduced in the statistic of the detector. The resulting parametric GLRT shows a range of possible behaviors, from Kelly's detector to the plain W-ABORT. Monte Carlo simulations reveal that an improved compromise can be obtained. Simple closed-form approximations are also given with near-optimal performance, so that the ultimate computational complexity remains comparable to that of the W-ABORT.","1558-2361","","10.1109/LSP.2014.2364395","","https://ieeexplore.ieee.org/stamp/stamp.jsp?arnumber=6933897","ABORT;adaptive radar detection;GLRT;rejection capabilities","Detectors;Approximation methods;Covariance matrices;Signal to noise ratio;Radar detection","","15","","10","IEEE","22 Oct 2014","","","IEEE","IEEE Journals"
"Fast Computation of Discrete Optimal FIR Estimates in White Gaussian Noise","S. Zhao; Y. S. Shmaliy; F. Liu","Ministry of Education, Jiangnan University, Wuxi, P.R. China; Department of Electronics Engineering, Universidad de Guanajuato1, Salamanca, Mexico; Ministry of Education, Jiangnan University, Wuxi, P.R. China",IEEE Signal Processing Letters,"14 Nov 2014","2015","22","6","718","722","We propose a fast iterative algorithm for optimal finite impulse response (OFIR) filtering of linear discrete time-invariant state-space models in white Gaussian noise. The OFIR filter is known to have the BIBO stability and better robustness against the Kalman filter (KF). The iterative OFIR algorithm is KF-like; that is, its estimate appears much faster than in the batch OFIR filter. A dramatic reduction of computation time is demonstrated in the full-horizon iterative OFIR algorithm which operates as fast as KF. We also notice a considerable reduction of the computational resources allowed by iterations.","1558-2361","","10.1109/LSP.2014.2368777","","https://ieeexplore.ieee.org/stamp/stamp.jsp?arnumber=6949609","Iterative algorithm;optimal FIR filtering;state space;white Gaussian noise","Finite impulse response filters;Signal processing algorithms;Iterative algorithms;Computational modeling;State-space methods;Kalman filters;Gaussian noise","","52","","20","IEEE","7 Nov 2014","","","IEEE","IEEE Journals"
"Robust AN-Aided Secure Transmission Scheme in MISO Channels with Simultaneous Wireless Information and Power Transfer","M. Tian; X. Huang; Q. Zhang; J. Qin","School of Information Science and Technology, Sun Yat-Sen University, Guangzhou, China; School of Information Science and Technology, Sun Yat-Sen University, Guangzhou, China; School of Information Science and Technology, Sun Yat-Sen University, Guangzhou, China; School of Information Science and Technology, Sun Yat-Sen University, Guangzhou, China",IEEE Signal Processing Letters,"14 Nov 2014","2015","22","6","723","727","In this letter, considering the simultaneous wireless information and power transfer scheme, we study the robust artificial noise (AN)-aided secure transmission design in multiple-input-single-output channels where the channel uncertainties are modeled by worst-case model. Our objective is to maximize the worst-case secrecy rate with respect to both the worst-case channel uncertainties and the worst-case eavesdropper among multiple eavesdroppers, under the transmit power constraint and the worst-case energy harvesting constraint. The optimal solution to the problem can be found by two-dimensional (2-D) search. Since the 2-D search algorithm has high computational complexity, we propose to neglect the correlation of the channel uncertainties from the transmitter to the information-decoding receiver and reformulate the problem as a sequence of convex semidefinite programming (SDP) which is solved efficiently by SDP based one-dimensional line search method. It is shown through computer simulations that the proposed robust AN-aided secure transmission schemes have significant performance gain over the non-robust AN-aided secure transmission scheme and the robust secure transmission scheme without the aid of AN.","1558-2361","","10.1109/LSP.2014.2368695","National Natural Science Foundation of China(grant numbers:61173148,61202498,61472458); ","https://ieeexplore.ieee.org/stamp/stamp.jsp?arnumber=6949663","Artificial noise (AN);energy harvesting (EH);secure transmission;simultaneous wireless information and power transfer (SWIPT);worst-case model","Receivers;Uncertainty;Robustness;Transmitters;Communication system security;Wireless communication;Search problems","","60","","21","IEEE","7 Nov 2014","","","IEEE","IEEE Journals"
"A Zoned Image Patch Permutation Descriptor","T. Tian; I. Sethi; D. Ming; N. Patel","School of Automation, Huazhong University of Science and Technology, Wuhan, Hubei, China; Department of Computer Science and Engineering, Oakland University, Rochester, MI, US; School of Automation, Huazhong University of Science and Technology, Wuhan, Hubei, China; Department of Computer Science and Engineering, Oakland University, Rochester, MI, US",IEEE Signal Processing Letters,"14 Nov 2014","2015","22","6","728","732","Image representation through local descriptors is a research hotspot in computer vision. In this letter, we propose a novel local image descriptor based on intensity permutation and zone division. The oFAST detector is first employed to detect keypoints with orientations, and then steered patterns are applied to sample rotation-invariant points within the local keypoint patch. In the step of local patch description, intensity permutation and zone division are implemented to construct our descriptor, with the advantages of inherent robustness and invariance to monotonic brightness changes. Our proposed algorithm performed well in the experiments on benchmark dataset for descriptor evaluation.","1558-2361","","10.1109/LSP.2014.2352172","","https://ieeexplore.ieee.org/stamp/stamp.jsp?arnumber=6883123","Intensity permutation;local image descriptor;zone division","Detectors;Robustness;Signal processing algorithms;Educational institutions;Vectors;Brightness;Indexes","","1","","17","IEEE","26 Aug 2014","","","IEEE","IEEE Journals"
"Robust Pilot Detection Techniques for Channel Estimation and Symbol Detection in OFDM Systems","H. Zhang; H. -C. Wu","School of Electrical Engineering and Computer Science, Louisiana State University, Baton Rouge, LA, USA; School of Electrical Engineering and Computer Science, Louisiana State University, Baton Rouge, LA, USA",IEEE Signal Processing Letters,"20 Nov 2014","2015","22","6","733","737","In this letter, we propose new frequency-domain pilot-multiplexing techniques (FDPMTs) for the channel estimation and equalization in orthogonal frequency-division multiplexing (OFDM) systems. A robust and effective pilot insertion and detection scheme is devised thereby. These pilot positions are optimally selected to minimize the distortion of the transmitted time-domain signal caused by the subcarrier-removal at the corresponding pilot positions. Besides, three different blind pilot-detection techniques are designed at the receiver without any a priori knowledge of the pilot positions, and the distorted data symbols can thus be iteratively reconstructed. Rigorous theoretical analysis and Monte Carlo simulation results both demonstrate that our proposed new OFDM system using dynamical pilot positions is more robust than the conventional OFDM system using the fixed pilot positions over multipath fading channels.","1558-2361","","10.1109/LSP.2014.2364924","","https://ieeexplore.ieee.org/stamp/stamp.jsp?arnumber=6934965","Blind detection;channel estimation;Jarqur–Bera statistics;orthogonal frequency-division multiplexing (OFDM);pilot insertion/detection","OFDM;Vectors;Frequency-domain analysis;Receivers;Distortion;Transmitters;Robustness","","11","2","12","IEEE","23 Oct 2014","","","IEEE","IEEE Journals"
"Receive Antenna Selection for Underlay Cognitive Radio with Instantaneous Interference Constraint","M. Hanif; H. -C. Yang; M. -S. Alouini","Department of Electrical and Computer Engineering, University of Victoria (UVic), Victoria, BC, Canada; Department of Electrical and Computer Engineering, University of Victoria (UVic), Victoria, BC, Canada; Computer, Electrical, and Mathematical Science and Engineering (CEMSE) Division, King Abdullah University of Science and Technology (KAUST), Thuwal, Makkah Province, Saudi Arabia",IEEE Signal Processing Letters,"20 Nov 2014","2015","22","6","738","742","Receive antenna selection is a low complexity scheme to reap diversity benefits. We analyze the performance of a receive antenna selection scheme in spectrum sharing systems where the antenna that results in highest signal-to-interference plus noise ratio at the secondary receiver is selected to improve the performance of secondary transmission. Exact and asymptotic behaviours of the received SINR are derived for both general and interference limited scenarios over general fading environment. These results are then applied to the outage and average bit error rate analysis when the secondary transmitter changes the transmit power in finite discrete levels to satisfy the instantaneous interference constraint at the primary receiver.","1558-2361","","10.1109/LSP.2014.2363163","","https://ieeexplore.ieee.org/stamp/stamp.jsp?arnumber=6924725","Cognitive radio;interference;performance analysis;selection combining","Interference;Signal to noise ratio;Receiving antennas;Transmitting antennas;Fading","","25","","12","IEEE","15 Oct 2014","","","IEEE","IEEE Journals"
"A Bayesian Framework for Intent Detection and Stimulation Selection in SSVEP BCIs","M. Higger; M. Akcakaya; H. Nezamfar; G. LaMountain; U. Orhan; D. Erdogmus","Cognitive Systems Laboratory, ECE Department, Northeastern University, Boston, MA, USA; ECE Department of University of Pittsburgh, Pittsburgh, PA, USA; Cognitive Systems Laboratory, ECE Department, Northeastern University, Boston, MA, USA; Cognitive Systems Laboratory, ECE Department, Northeastern University, Boston, MA, USA; Cognitive Systems Laboratory, ECE Department, Northeastern University, Boston, MA, USA; Cognitive Systems Laboratory, ECE Department, Northeastern University, Boston, MA, USA",IEEE Signal Processing Letters,"20 Nov 2014","2015","22","6","743","747","Currently, many Brain Computer Interfaces (BCI) classifiers output point estimates of user intent which make it difficult to incorporate context prior information or assign a principled confidence measurement to a decision. We propose a Bayesian framework to extend current Steady State Visually Evoked Potential (SSVEP) classifiers to a maximum a posteriori (MAP) classifiers by using a Kernel Density Estimate (KDE) to learn the distribution of features conditioned on stimulation class. To demonstrate our framework we extend Canonical Correlation Analysis (CCA) and Power Spectral Density (PSD) style methods. Traditionally, in either example, the class is estimated as the class associated with the maximum feature. Our framework increases performance by relaxing the assumption that a stimulation class's sample often maximizes its class-associated feature. Further, by leveraging the KDE, we present a method which estimates the performance of a classifier under different stimulation frequency sets. Using this, we optimize the selection of stimulation frequencies from those present in a training set.","1558-2361","","10.1109/LSP.2014.2368952","Division of Information and Intelligent Systems(grant numbers:1118061,1149570); Division of Behavioral and Cognitive Sciences(grant numbers:1027724); National Institutes of Health(grant numbers:5R01DC009834); SBE Office of Multidisciplinary Activities(grant numbers:0835976); Division of Computer and Network Systems(grant numbers:1136027); ","https://ieeexplore.ieee.org/stamp/stamp.jsp?arnumber=6951348","Brain Computer Interfaces;CCA;EDICS: BIO-BCI;information Transfer Rate;kernel Density Estimation;SAS-STAT;SSVEP","Harmonic analysis;Frequency estimation;Electroencephalography;Accuracy;Correlation;Power system harmonics;Vectors","","11","","28","IEEE","10 Nov 2014","","","IEEE","IEEE Journals"
"High-Precision, Permanently Stable, Modulated Hopping Discrete Fourier Transform","Q. Wang; X. Yan; K. Qin","School of aeronautics and astronautics, University of Electronic Science and Technology of China, Chengdu, China; School of aeronautics and astronautics, University of Electronic Science and Technology of China, Chengdu, China; School of aeronautics and astronautics, University of Electronic Science and Technology of China, Chengdu, China",IEEE Signal Processing Letters,"20 Nov 2014","2015","22","6","748","751","A new modulated hopping Discrete Fourier Transform (mHDFT) algorithm which is characterized by its merits of high accuracy and constant stability is presented. The proposed algorithm, which is based on the circular frequency shift property of DFT, directly moves the k-th DFT bin to the position of k = 0, and computes the DFT by incorporating the successive DFT outputs with arbitrary time hop L. Compared to previous works, since the pole of mHDFT precisely settles on the unit circle in the Z-plane, the accumulated errors and potential instabilities, which are caused by the quantization of the twiddle factor, are always eliminated without increasing much computational effort. The numerical simulation results verify the effectiveness and superiority of the proposed algorithm.","1558-2361","","10.1109/LSP.2014.2369518","Ministry of Education of the Peoples Republic of China(grant numbers:20130185110023,ZYGX2012J146); ","https://ieeexplore.ieee.org/stamp/stamp.jsp?arnumber=6953142","Hopping discrete Fourier transforms (HDFT);modulated hopping discrete Fourier transforms (mHDFT);sliding discrete Fourier transforms (SDFT)","Discrete Fourier transforms;Signal processing algorithms;Indexes;Educational institutions;Algorithm design and analysis;Accuracy;Numerical stability","","21","","12","IEEE","11 Nov 2014","","","IEEE","IEEE Journals"
"Non-Coherent Unambiguous Tracking Method for Cosine-BOC Signals Based on an S-Curve Shaping Technique","F. Shen; G. Xu; Q. Li","College of Automation, Harbin Engineering University, Harbin, China; College of Automation, Harbin Engineering University, Harbin, China; Electrical Engineering and Telecommunication (EE’ &'t), University of New South Wales (UNSW), New South Wales, Sydney, NSW, Australia",IEEE Signal Processing Letters,"20 Nov 2014","2015","22","6","752","756","A new non-coherent unambiguous tracking method for Cosine-phased Binary Offset Carrier (cosine-BOC) modulated signals based on an S-curve shaping technique is proposed in this letter. This method employs two linearly-combined codes to replace the commonly used multi-correlator structure. An asymmetrical S-curve without any false lock points is generated in the receiver, which is the product of the cross-correlation function between the received cosine-BOC signal and the local linearly-combined code and the cross-correlation function between the received cosine-BOC signal and another local linearly-combined code. Simulation results show that the proposed method has outstanding multipath mitigation performance while maintaining a sufficiently large operating range of the S-curve with both positive and negative delays.","1558-2361","","10.1109/LSP.2014.2368951","Fundamental Research Funds for the Central Universities(grant numbers:HEUCFX41310); National Natural Science Foundation of China(grant numbers:61102107,61374208); ","https://ieeexplore.ieee.org/stamp/stamp.jsp?arnumber=6951421","Cosine-BOC signals;linearly-combined code;multipath mitigation;s-curve shaping;unambiguous tracking","Receivers;Global Positioning System;Correlation;Educational institutions;Delays;Modulation;Correlators","","17","","12","IEEE","10 Nov 2014","","","IEEE","IEEE Journals"
"Estimating Effective Connectivity from fMRI Data Using Factor-based Subspace Autoregressive Models","C. -M. Ting; A. -K. Seghouane; S. -H. Salleh; A. M. Noor","Center for Biomedical Engineering (CBE), Universiti Teknologi Malaysia (UTM), Skudai, Johor, Malaysia; Dept. of Electrical and Electronic Eng., Univ. of Melbourne, Canberra, Parkville, Australia; Center for Biomedical Engineering (CBE), Universiti Teknologi Malaysia (UTM), Skudai, Johor, Malaysia; Center for Biomedical Engineering (CBE), Universiti Teknologi Malaysia (UTM), Skudai, Johor, Malaysia",IEEE Signal Processing Letters,"20 Nov 2014","2015","22","6","757","761","We consider the problem of identifying large-scale effective connectivity of brain networks from fMRI data. Standard vector autoregressive (VAR) models fail to estimate reliably networks with large number of nodes. We propose a new method based on factor modeling for reliable and efficient high-dimensional VAR analysis of large networks. We develop a subspace VAR (SVAR) model from a factor model (FM), where observations are driven by a lower-dimensional subspace of common latent factors with an AR dynamics. We consider two variants of principal components (PC) methods that provide consistent estimates for the FM hence the implied SVAR model, even of large dimensions. Information criterion is used to select the optimal subspace dimension. We established asymptotic normality and convergence rates for the estimated SVAR coefficients matrix. Evaluation on simulated resting-state fMRI shows that the SVAR models are more robust and produce better connectivity estimates than the classical model for a moderately-large network analysis. Results on real data by varying the subspace dimensions identify strong connections in the default mode network and reveal hierarchical connectivity of resting-state networks with distinct functional relevance.","1558-2361","","10.1109/LSP.2014.2365634","Universiti Teknologi Malaysia(grant numbers:GUP Tier 1 Q.J130000.254); ","https://ieeexplore.ieee.org/stamp/stamp.jsp?arnumber=6939665","Brain effective connectivity;factor model;fMRI;vector autoregressive model","Brain modeling;Reactive power;Load modeling;Estimation;Frequency modulation;Vectors;Reliability","","22","","33","IEEE","29 Oct 2014","","","IEEE","IEEE Journals"
"Improved Variational Denoising of Flow Fields with Application to Phase-Contrast MRI Data","E. Bostan; S. Lefkimmiatis; O. Vardoulis; N. Stergiopulos; M. Unser","Biomedical Imaging Group, École polytechnique fédérale de Lausanne (EPFL), Lausanne, Switzerland; Department of Mathematics, University of California, Los Angeles, CA, USA; École polytechnique fédérale de Lausanne (EPFL) de Lausanne (EPFL), Institute of Bioengineering, Lausanne, Switzerland; École polytechnique fédérale de Lausanne (EPFL) de Lausanne (EPFL), Institute of Bioengineering, Lausanne, Switzerland; Biomedical Imaging Group, École polytechnique fédérale de Lausanne (EPFL), Lausanne, Switzerland",IEEE Signal Processing Letters,"20 Nov 2014","2015","22","6","762","766","We propose a new variational framework for the problem of reconstructing flow fields from noisy measurements. The formalism is based on regularizers penalizing the singular values of the Jacobian of the field. Specifically, we rely on the nuclear norm. Our method is invariant with respect to fundamental transformations and can be efficiently solved. We conduct numerical experiments on several phantom data and report improved performance compared to existing vectorial extensions of total variation and curl-divergence regularizations. Finally, we apply our reconstruction method to an experimentally-acquired phase-contrast MRI recording for enhancing the data visualization.","1558-2361","","10.1109/LSP.2014.2369212","European Research Council(grant numbers:ERC-2010-AdG 267439-FUN-SP); Swiss National Science Foundation(grant numbers:P300P2_151325); ","https://ieeexplore.ieee.org/stamp/stamp.jsp?arnumber=6951417","4D MRI;denoising;flow fields;flow MRI;Jacobian;PCMRI;phase-constrast MRI;regularization;Schatten norms;vector fields;vectorial total variation","TV;Vectors;Jacobian matrices;Noise reduction;Magnetic resonance imaging;Signal processing algorithms","","11","","23","IEEE","10 Nov 2014","","","IEEE","IEEE Journals"
"Image Feature Matching via Progressive Vector Field Consensus","J. Ma; Y. Ma; J. Zhao; J. Tian","Electronic Information School, Wuhan University, Wuhan, Hubei, P. R. China; Electronic Information School, Wuhan University, Wuhan, Hubei, P. R. China; School of Automation, Huazhong University of Science and Technology, Wuhan, Hubei, P. R. China; School of Automation, Huazhong University of Science and Technology, Wuhan, Hubei, P. R. China",IEEE Signal Processing Letters,"20 Nov 2014","2015","22","6","767","771","In this letter, we propose a simple yet effective approach, named Progressive Vector Field Consensus (PVFC), for addressing the problem of finding more true feature correspondences between images. The key idea is to progressively perform feature matching based on Vector Field Consensus, and hence greatly boost the number of true matches as well as avoid false matches. More specifically, it uses matching results on a small putative correspondence set with high inlier ratio to guide the matching on a large putative correspondence set which probably covers the whole true correspondences. We model the transformation between images in a reproducing kernel Hilbert space, and a sparse approximation is applied to the transformation to avoid high computational complexity. Our results quantitatively show that our PVFC outperforms state-of-the-art methods, both in accuracy and in efficiency. Moreover, the progressive framework is general and can be applied to other cases for robust estimation.","1558-2361","","10.1109/LSP.2014.2358625","National Natural Science Foundation of China(grant numbers:61273279,61275098,61363049); ","https://ieeexplore.ieee.org/stamp/stamp.jsp?arnumber=6901205","Feature matching;outlier;progressive","Vectors;Feature extraction;Kernel;Robustness;Educational institutions;Parametric statistics;Hilbert space","","36","","19","IEEE","17 Sep 2014","","","IEEE","IEEE Journals"
"Reduced-Complexity Super-Resolution DOA Estimation with Unknown Number of Sources","V. V. Reddy; M. Mubeen; B. P. Ng","School of Electrical and Electronic Engineering, Nanyang Technological University, Singapore; School of Electrical and Electronic Engineering, Nanyang Technological University, Singapore; School of Electrical and Electronic Engineering, Nanyang Technological University, Singapore",IEEE Signal Processing Letters,"20 Nov 2014","2015","22","6","772","776","When the number of sources is inaccurately estimated, it is well-known that the conventional subspace-based super-resolution direction-of-arrival (DOA) estimation techniques provide inconsistent spatial spectrum, and hence the DOA estimates. In this work, we present a novel technique which provides resolution capability comparable with that of the super-resolution techniques. While the working principle of the proposed technique is similar to that of the minimum-norm algorithm, the algorithm is insensitive to the estimated model-order. Simulation studies show that the proposed technique is advantageous over the use of subspace-based techniques with the number of sources estimated by well-known model order estimation techniques.","1558-2361","","10.1109/LSP.2014.2368987","","https://ieeexplore.ieee.org/stamp/stamp.jsp?arnumber=6951402","Minimum-norm algorithm;model order estimation;super-resolution DOA estimation","Signal processing algorithms;Estimation;Manganese;Vectors;Direction-of-arrival estimation;Signal to noise ratio;Algorithm design and analysis","","40","","15","IEEE","10 Nov 2014","","","IEEE","IEEE Journals"
"On the Expected Likelihood Approach for Assessment of Regularization Covariance Matrix","Y. I. Abramovich; O. Besson","WR Systems, Ltd., Fairfax, VA, USA; Department Electronics Optronics Signal, University of Toulouse, ISAE-Supaero, Toulouse, France",IEEE Signal Processing Letters,"20 Nov 2014","2015","22","6","777","781","Regularization, which consists in shrinkage of the sample covariance matrix to a target matrix, is a commonly used and effective technique in low sample support covariance matrix estimation. Usually, a target matrix is chosen and optimization of the shrinkage factor is carried out, based on some relevant metric. In this letter, we rather address the choice of the target matrix. More precisely, we aim at evaluating, from observation of the data matrix, whether a given target matrix is a good regularizer. Towards this end, the expected likelihood (EL) approach is investigated. At a first step, we re-interpret the regularized covariance matrix estimate as the minimum mean-square error estimate in a Bayesian model where the target matrix serves as a prior. The likelihood function of the data is then derived, and the EL principle is subsequently applied. Over-sampled and under-sampled scenarios are considered.","1558-2361","","10.1109/LSP.2014.2369232","","https://ieeexplore.ieee.org/stamp/stamp.jsp?arnumber=6951419","Covariance matrix estimation;expected likelihood;regularization","Covariance matrices;Bayes methods;Signal to noise ratio;Estimation;Mean square error methods;Loading","","18","1","29","IEEE","10 Nov 2014","","","IEEE","IEEE Journals"
