"Document Title",Authors,"Author Affiliations","Publication Title",Date Added To Xplore,"Publication Year","Volume","Issue","Start Page","End Page","Abstract","ISSN",ISBNs,"DOI",Funding Information,PDF Link,"Author Keywords","IEEE Terms","Mesh_Terms",Article Citation Count,Patent Citation Count,"Reference Count","License",Online Date,Issue Date,"Meeting Date","Publisher",Document Identifier
"[Front cover]","",,IEEE Signal Processing Letters,"13 Feb 2015","2015","22","2","C1","C1","Presents the front cover for this issue of the publication.","1558-2361","","10.1109/LSP.2015.2402071","","https://ieeexplore.ieee.org/stamp/stamp.jsp?arnumber=7042381","","","","","","","IEEE","13 Feb 2015","","","IEEE","IEEE Journals"
"IEEE Signal Processing Letters publication information","",,IEEE Signal Processing Letters,"13 Feb 2015","2015","22","2","C2","C2","Provides a listing of current staff, committee members and society officers.","1558-2361","","10.1109/LSP.2015.2402132","","https://ieeexplore.ieee.org/stamp/stamp.jsp?arnumber=7042388","","","","","","","IEEE","13 Feb 2015","","","IEEE","IEEE Journals"
"Table of Contents","",,IEEE Signal Processing Letters,"20 Nov 2014","2015","22","2","127","128","Presents the table of contents for this issue of the periodical.","1558-2361","","10.1109/LSP.2014.2361706","","https://ieeexplore.ieee.org/stamp/stamp.jsp?arnumber=6960145","","","","","","","IEEE","20 Nov 2014","","","IEEE","IEEE Journals"
"Table of Contents","",,IEEE Signal Processing Letters,"20 Nov 2014","2015","22","2","129","130","Presents the table of contents for this issue of the periodical.","1558-2361","","10.1109/LSP.2014.2361707","","https://ieeexplore.ieee.org/stamp/stamp.jsp?arnumber=6960137","","","","","","","IEEE","20 Nov 2014","","","IEEE","IEEE Journals"
"Stereo Matching with Optimal Local Adaptive Radiometric Compensation","L. Xu; O. C. Au; W. Sun; L. Fang; F. Zou; J. Li","Dept of Electronic and Computer Engineering, Hong Kong University, Hong Kong; Dept of Electronic and Computer Engineering, Hong Kong University, Hong Kong; Dept of Electronic and Computer Engineering, Hong Kong University, Hong Kong; Dept of Electronic Engineering and Information Science, University of Science and Technology of China, Hefei, China; Dept of Electronic and Computer Engineering, Hong Kong University, Hong Kong; Dept of Electronic and Computer Engineering, Hong Kong University, Hong Kong",IEEE Signal Processing Letters,"27 Aug 2014","2015","22","2","131","135","A common assumption in stereo matching is that the corresponding pixels in stereo images have similar pixel values. Unfortunately, such an assumption may not be true due to radiometric variations in different views, leading to severely degraded matching results. In this letter, we propose a radiometrically invariant stereo matching algorithm called Optimal Local Adaptive Radiometric Compensation (LARAC). In LARAC, we approximate the spatially varying Pixel Value Correspondence Function (PVCF) between a corresponding pixel pair as a locally consistent polynomial within an optimal local adaptive window. The optimal polynomial coefficients are obtained for each candidate disparity value and are used to compute the matching cost. Meanwhile, a self-correction property is achieved by the proposed LARAC, leading to reduced matching errors for the outlier pixels. Experimental results suggest that the proposed LARAC outperforms other state-of-the-art stereo matching algorithms.","1558-2361","","10.1109/LSP.2014.2350028","","https://ieeexplore.ieee.org/stamp/stamp.jsp?arnumber=6880804","Radiometric variation;stereo matching","Radiometry;Lighting;Stereo vision;Signal processing algorithms;Cameras;Polynomials;Educational institutions","","8","","26","IEEE","20 Aug 2014","","","IEEE","IEEE Journals"
"A Suboptimal Scheme for Multi-User Scheduling in Gaussian Broadcast Channels","A. Zafar; M. Shaqfeh; M. -S. Alouini; H. Alnuweiri","Electrical Engineering Program, King Abdullah University of Science and Technology (KAUST), Thuwal, Makkah Province, Saudi Arabia; Department of Electrical and Computer Engineering, Texas A&M University at Qatar, Doha, Qatar; Electrical Engineering Program, King Abdullah University of Science and Technology (KAUST), Thuwal, Makkah Province, Saudi Arabia; Department of Electrical and Computer Engineering, Texas A&M University at Qatar, Doha, Qatar",IEEE Signal Processing Letters,"28 Aug 2014","2015","22","2","136","140","This work proposes a suboptimal multi-user scheduling scheme for Gaussian broadcast channels which improves upon the classical single user selection, while considerably reducing complexity as compared to the optimal superposition coding with successful interference cancellation. The proposed scheme combines the two users with the maximum weighted instantaneous rate using superposition coding. The instantaneous rate and power allocation are derived in closed-form, while the long term rate of each user is derived in integral form for all channel distributions. Numerical results are then provided to characterize the prospected gains of the proposed scheme.","1558-2361","","10.1109/LSP.2014.2350776","","https://ieeexplore.ieee.org/stamp/stamp.jsp?arnumber=6880786","Block-fading;broadcast channels;multi-user diversity;resource allocation;superposition coding","Resource management;Silicon carbide;Complexity theory;Encoding;Bandwidth;Interference cancellation;Wireless communication","","3","","12","IEEE","20 Aug 2014","","","IEEE","IEEE Journals"
"Convex 1-D Total Variation Denoising with Non-convex Regularization","I. W. Selesnick; A. Parekh; İ. Bayram","Department of Electrical and Computer Engineering, New York University, Brooklyn, NY; Department of Electrical and Computer Engineering, New York University, Brooklyn, NY; Istanbul Technical University, Istanbul, Turkey",IEEE Signal Processing Letters,"29 Aug 2014","2015","22","2","141","144","Total variation (TV) denoising is an effective noise suppression method when the derivative of the underlying signal is known to be sparse. TV denoising is defined in terms of a convex optimization problem involving a quadratic data fidelity term and a convex regularization term. A non-convex regularizer can promote sparsity more strongly, but generally leads to a non-convex optimization problem with non-optimal local minima. This letter proposes the use of a non-convex regularizer constrained so that the total objective function to be minimized maintains its convexity. Conditions for a non-convex regularizer are given that ensure the total TV denoising objective function is convex. An efficient algorithm is given for the resulting problem.","1558-2361","","10.1109/LSP.2014.2349356","Division of Computing and Communication Foundations(grant numbers:CCF-1018020); ","https://ieeexplore.ieee.org/stamp/stamp.jsp?arnumber=6880761","Convex optimization;non-convex regularization;sparse optimization;total variation denoising","Noise reduction;TV;Convergence;Convex functions;Signal processing algorithms;Noise;Linear programming","","106","1","22","IEEE","20 Aug 2014","","","IEEE","IEEE Journals"
"Detecting Co-Salient Objects in Large Image Sets","S. Du; S. Chen","University of Chinese Academy of Sciences, Beijing, China; Chinese Academy of Sciences, Shenzhen Institutes of Advanced Technology, Guangdong, China",IEEE Signal Processing Letters,"1 Sep 2014","2015","22","2","145","148","Co-salient object detection has attracted much more attention recently as it is useful for many problems in vision computing. However, most of existing methods emphasize detecting the common salient objects in a small group of images and the objects of interest in those images have clear borders with respect to the backgrounds. In this work, we propose a novel co-saliency detection method, which aims at discovering the common objects in a large and diverse image set composed of hundreds of images. First, we search a group of similar images for each image in the set. Our method is based on the overlapped groups. We handle each group with an unsupervised random forest to extract the rough contours of the common objects. Then a contrast-based measure is utilized to produce the saliency map for an individual image. For each image in the set, we collect all the maps from the groups that contain the image and fuse them together as the inter-saliency map for the image. The final co-saliency map is computed by combining the inter-saliency map with the single saliency map of this image. Experimental evaluation on an established large dataset demonstrates that our approach attains superior results and outperforms the state-of-the-art methods.","1558-2361","","10.1109/LSP.2014.2347333","","https://ieeexplore.ieee.org/stamp/stamp.jsp?arnumber=6880789","Co-salient object;random forest","Vegetation;Image color analysis;Object detection;Fuses;Materials;Abstracts;Indexes","","11","","22","IEEE","20 Aug 2014","","","IEEE","IEEE Journals"
"Prediction of Synchrostate Transitions in EEG Signals Using Markov Chain Models","W. Jamal; S. Das; I. -A. Oprescu; K. Maharatna","School of Electronics and Computer Science, University of Southampton, Southampton, United Kingdom; School of Electronics and Computer Science, University of Southampton, Southampton, United Kingdom; School of Electronics and Computer Science, University of Southampton, Southampton, United Kingdom; School of Electronics and Computer Science, University of Southampton, Southampton, United Kingdom",IEEE Signal Processing Letters,"4 Sep 2014","2015","22","2","149","152","This letter proposes a stochastic model using the concept of Markov chains for the inter-state transitions of the millisecond order quasi-stable phase synchronized patterns or synchrostates, found in multi-channel Electroencephalogram (EEG) signals. First and second order transition probability matrices are estimated for Markov chain modelling from 100 trials of 128-channel EEG signals during two different face perception tasks. Prediction accuracies with such finite Markov chain models for synchrostate transition are also compared, under a data-partitioning based cross-validation scheme.","1558-2361","","10.1109/LSP.2014.2352251","FP7 EU: MICHELANGELO project; ","https://ieeexplore.ieee.org/stamp/stamp.jsp?arnumber=6891178","EEG;Markov chain;prediction;synchrostate","Markov processes;Brain models;Electroencephalography;Face;Switches;Hidden Markov models","","8","","20","IEEE","4 Sep 2014","","","IEEE","IEEE Journals"
"Effects of FDMA/TDMA Orthogonality on the Gaussian Pulse Train MIMO Ambiguity Function","B. Shtarkalev; B. Mulgrew","Institute for Digital Communications, The University of Edinburgh, Edinburgh, U. K.; Institute for Digital Communications, The University of Edinburgh, Edinburgh, U. K.",IEEE Signal Processing Letters,"5 Sep 2014","2015","22","2","153","157","As multiple-input multiple-output (MIMO) radar gains popularity, more efficient and better-performing detection algorithms are developed to exploit the benefits of having more transmitters and receivers. Many of these algorithms are based on the assumption that the multiple waveforms used for target scanning are orthogonal to each other in fast time. It has been shown that this assumption can limit the practical detector performance due to the reduction of the area that is clear of sidelobes in the MIMO radar ambiguity function. In this work it is shown that using the same waveform with a different carrier frequency and/or delay across different transmitters ensures relative waveform orthogonality while alleviating the negative effects on the ambiguity function. This is demonstrated in a practical scenario where the probing waveforms consist of Gaussian pulse trains (GPTs) separated in frequency. An approximate theoretical model of the ambiguity is proposed and it is shown that the effects of cross-ambiguity in the MIMO system are negligible compared to the waveform autoambiguities.","1558-2361","","10.1109/LSP.2014.2351256","Engineering and Physical Sciences Research Council(grant numbers:EP/J015180/1); ","https://ieeexplore.ieee.org/stamp/stamp.jsp?arnumber=6882135","Ambiguity function;Gaussian approximation;Gaussian pulse waveforms;MIMO radar","Time-frequency analysis;MIMO;MIMO radar;Approximation methods;Kernel;Frequency division multiaccess","","6","","13","IEEE","22 Aug 2014","","","IEEE","IEEE Journals"
"Turbo Compressed Sensing with Partial DFT Sensing Matrix","J. Ma; X. Yuan; L. Ping","Department of Electronic Engineering, City University of Hong Kong, Hong Kong, SAR, China; School of Information Science and Technology, ShanghaiTech University, Shanghai, China; Department of Electronic Engineering, City University of Hong Kong, Hong Kong, SAR, China",IEEE Signal Processing Letters,"8 Sep 2014","2015","22","2","158","161","In this letter, we propose a turbo compressed sensing algorithm with partial discrete Fourier transform (DFT) sensing matrices. Interestingly, the state evolution of the proposed algorithm is shown to be consistent with that derived using the replica method. Numerical results demonstrate that the proposed algorithm outperforms the well-known approximate message passing (AMP) algorithm when a partial DFT sensing matrix is involved.","1558-2361","","10.1109/LSP.2014.2351822","","https://ieeexplore.ieee.org/stamp/stamp.jsp?arnumber=6883198","Approximate message passing (AMP);compressed sensing;partial DFT matrix;replica method;state evolution","Signal processing algorithms;Discrete Fourier transforms;Sensors;Standards;Compressed sensing;Approximation algorithms;Message passing","","138","","11","IEEE","26 Aug 2014","","","IEEE","IEEE Journals"
"Performance of ML Range Estimator in Radio Interferometric Positioning Systems","Y. Zhang; W. Qi; G. Li; S. Zhang","PLA University of Science and Technology, Nanjing, Jiangsu, China; PLA University of Science and Technology, Nanjing, Jiangsu, China; PLA University of Science and Technology, Nanjing, Jiangsu, China; PLA University of Science and Technology, Nanjing, Jiangsu, China",IEEE Signal Processing Letters,"8 Sep 2014","2015","22","2","162","166","The radio interferometric positioning system (RIPS) is a novel positioning solution used in wireless sensor networks. This letter explores the ranging accuracy of RIPS in two configurations. In the linear step-frequency configuration, we derive the mean squared error (MSE) of the maximum likelihood (ML) estimator. In the random step-frequency configuration, we introduce average MSE to characterize the performance of the ML estimator. The simulation results fit well with theoretical analysis.","1558-2361","","10.1109/LSP.2014.2352270","National Natural Science Foundation of China(grant numbers:61273047,61301159); ","https://ieeexplore.ieee.org/stamp/stamp.jsp?arnumber=6894150","Average ambiguity function;average MSE;maximum likelihood estimator;method of interval error;outlier probability;radio interferometric positioning system","Maximum likelihood estimation;Distance measurement;Signal to noise ratio;Radio interferometry;Frequency estimation;Accuracy;Approximation methods","","10","","19","IEEE","8 Sep 2014","","","IEEE","IEEE Journals"
"On False Alarm Rate of Matched Filter Under Distribution Mismatch","O. Besson","ISAE, University of Toulouse, Toulouse, France",IEEE Signal Processing Letters,"8 Sep 2014","2015","22","2","167","171","The generalized likelihood ratio test (GLRT) is a very widely used technique for detecting signals of interest amongst noise, when some of the parameters describing the signal (and possibly the noise) are unknown. The threshold of such a test is set from a desired probability of false alarm Pfa and hence this threshold depends on the statistical assumptions made about noise. In practice however, the noise statistics are seldom known and it becomes crucial to characterize Pfa under a mismatched distribution. In this letter, we address this problem in the case of a simple binary composite hypothesis testing problem (matched filter) when the threshold is designed under a Gaussian assumption while the noise actually follows an elliptically contoured distribution. We also consider the inverse situation. Generic expressions for the assumed and actual Pfa are derived and illustrated on the particular case of Student distributions for which simple, closed-form expressions are obtained. The latter show that the GLRT based on Gaussian assumption is not robust while that based on Student assumption is.","1558-2361","","10.1109/LSP.2014.2352362","","https://ieeexplore.ieee.org/stamp/stamp.jsp?arnumber=6892991","Distribution mismatch;elliptically contoured distributions;generalized likelihood ratio test;probability of false alarm","Robustness;Noise;Distributed databases;Probability density function;Probability;Testing;Closed-form solutions","","3","","10","IEEE","5 Sep 2014","","","IEEE","IEEE Journals"
"A Low Complexity Interest Point Detector","J. Chen; L. -Y. Duan; F. Gao; J. Cai; A. C. Kot; T. Huang","Institute of Digital Media, Peking University, Beijing, China; Institute of Digital Media, Peking University, Beijing, China; Institute of Digital Media, Peking University, Beijing, China; School of Computer Engineering, Nanyang Technological University, Singapore; School of Electrical and Electronic Engineering, Nanyang Technological University, Singapore; Institute of Digital Media, Peking University, Beijing, China",IEEE Signal Processing Letters,"9 Sep 2014","2015","22","2","172","176","Interest point detection is a fundamental approach to feature extraction in computer vision tasks. To handle the scale invariance, interest points usually work on the scale-space representation of an image. In this letter, we propose a novel block-wise scale-space representation to significantly reduce the computational complexity of an interest point detector. Laplacian of Gaussian (LoG) filtering is applied to implement the block-wise scale-space representation. Extensive comparison experiments have shown the block-wise scale-space representation enables the efficient and effective implementation of an interest point detector in terms of memory and time complexity reduction, as well as promising performance in visual search.","1558-2361","","10.1109/LSP.2014.2354237","National Natural Science Foundation of China(grant numbers:61271311,61121002,61390515,61210005); ","https://ieeexplore.ieee.org/stamp/stamp.jsp?arnumber=6891221","Block-wise scale-space representation;interest point detector;Laplacian of Gaussian;scale-space","Complexity theory;Detectors;Laplace equations;Feature extraction;Visualization;Educational institutions;Convolution","","10","1","22","IEEE","4 Sep 2014","","","IEEE","IEEE Journals"
"Clutter Removal in Sub-Nyquist Radar","Y. C. Eldar; R. Levi; A. Cohen","Dept. of Electrical Engineering,, Technion - Israel Institute of Technology, Haifa, Israel; Dept. of Electrical Engineering,, Technion - Israel Institute of Technology, Haifa, Israel; Dept. of Electrical Engineering,, Technion - Israel Institute of Technology, Haifa, Israel",IEEE Signal Processing Letters,"9 Sep 2014","2015","22","2","177","181","Recently, a new approach to sub-Nyquist sampling and processing in pulse-Doppler radar was introduced, based on the Xampling approach to reduced-rate sampling combined with Doppler focusing performed on the low-rate samples. This method imposes no restrictions on the transmitter, reduces both the sampling and processing rates and exhibits linear signal-to-noise ratio improvement with the number of pulses. Here we extend previous work on sub-Nyquist pulse-Doppler radar by incorporating a clutter removal algorithm operating on the sub-Nyquist samples, allowing to reject clutter modeled as a colored Gaussian random process. In particular, we show how to adapt standard clutter rejection techniques to work directly on the sub-Nyquist samples, allowing to preserve high detection rates even in the presence of strong clutter, while avoiding the need to first interpolate the samples to the Nyquist grid.","1558-2361","","10.1109/LSP.2014.2351827","","https://ieeexplore.ieee.org/stamp/stamp.jsp?arnumber=6883164","Clutter rejection;pulse-Doppler radar;sub-Nyquist sampling","Clutter;Doppler effect;Radar clutter;Sparse matrices;Doppler radar;Radar signal processing","","14","","13","IEEE","26 Aug 2014","","","IEEE","IEEE Journals"
"Change Detection with Compressive Measurements","G. K. Atia","Department of Electrical Engineering and Computer Science, University of Central Florida, Orlando, Florida, United States",IEEE Signal Processing Letters,"9 Sep 2014","2015","22","2","182","186","Quickest change point detection is concerned with the detection of statistical change(s) in sequences while minimizing the detection delay subject to false alarm constraints. In this letter, the problem of change point detection is studied when the decision maker only has access to compressive measurements. First, an expression for the average detection delay of Shiryaev’s procedure with compressive measurements is derived in the asymptotic regime where the probability of false alarm goes to zero. Second, the dependence of the delay on the compression ratio and the signal to noise ratio is explicitly quantified. The ratio of delays with and without compression is studied under various sensing matrix constructions, including Gaussian ensembles and random projections. For a target delay ratio, a sufficient condition on the number of measurements required to meet this objective with prespecified probability is derived.","1558-2361","","10.1109/LSP.2014.2352116","Division of Computing and Communication Foundations(grant numbers:CCF-1320547); ","https://ieeexplore.ieee.org/stamp/stamp.jsp?arnumber=6883184","Compressive measurements;concentration inequalities;quickest change detection","Delays;Signal to noise ratio;Sensors;Materials;Monitoring;Bayes methods;Random variables","","11","","30","IEEE","26 Aug 2014","","","IEEE","IEEE Journals"
"Inverse Beamforming for Radio Tomography","R. K. Martin","Department of Electrical & Computer Engineering, The Air Force Institute of Technology (AFIT), OH",IEEE Signal Processing Letters,"9 Sep 2014","2015","22","2","187","191","Radio tomography is a method for imaging a small scene by measuring the attenuation by objects of all links in a dense wireless sensor network. Multipath reduces the amount of attenuation a user induces on the links, corrupting the image. This paper introduces a beamforming method that does not induce latency in the image frame rate yet allows beamforming using transmit and receive weights on every link. Simulations demonstrate that the beamformer can successfully mitigate multipath, restoring the image to a nearly multipath-free quality.","1558-2361","","10.1109/LSP.2014.2353216","","https://ieeexplore.ieee.org/stamp/stamp.jsp?arnumber=6891227","Inverse beamforming;MIMO;radio tomography;received signal strength","Array signal processing;Receiving antennas;Arrays;Transmitting antennas;Attenuation;Tomography","","2","","15","USGov","4 Sep 2014","","","IEEE","IEEE Journals"
"Joint Object Segmentation and Depth Upsampling","W. Huang; X. Gong; M. Y. Yang","Department of Information Science and Electronic Engineering, Zhejiang University, Hangzhou, Zhejiang, P. R. China; Faculty of the Department of Information Science and Electronic Engineering, Zhejiang University, Hangzhou, Zhejiang, P. R. China; Faculty of the Institute for Information processing (TNT), Leibniz University, Hanover, Germany",IEEE Signal Processing Letters,"10 Sep 2014","2015","22","2","192","196","With the advent of powerful ranging and visual sensors, nowadays, it is convenient to collect sparse 3-D point clouds and aligned high-resolution images. Benefitted from such convenience, this letter proposes a joint method to perform both depth assisted object-level image segmentation and image guided depth upsampling. To this end, we formulate these two tasks together as a bi-task labeling problem, defined in a Markov random field. An alternating direction method (ADM) is adopted for the joint inference, solving each sub-problem alternatively. More specifically, the sub-problem of image segmentation is solved by Graph Cuts, which attains discrete object labels efficiently. Depth upsampling is addressed via solving a linear system that recovers continuous depth values. By this joint scheme, robust object segmentation results and high-quality dense depth maps are achieved. The proposed method is applied to the challenging KITTI vision benchmark suite, as well as the Leuven dataset for validation. Comparative experiments show that our method outperforms stand-alone approaches.","1558-2361","","10.1109/LSP.2014.2352715","","https://ieeexplore.ieee.org/stamp/stamp.jsp?arnumber=6891185","Depth upsampling;joint optimization;object-level image segmentation","Image segmentation;Joints;Three-dimensional displays;Labeling;Distance measurement;Visualization;Sensors","","13","2","22","IEEE","4 Sep 2014","","","IEEE","IEEE Journals"
