"Distributed Sequential Estimation in Asynchronous Wireless Sensor Networks","O. Hlinka; F. Hlawatsch; P. M. Djurić","RobArt GmbH, Linz, Austria; Institute of Telecommunications, Vienna University of Technology, Vienna, Austria; Department of Electrical and Computer Engineering, Stony Brook University, Stony Brook, NY, USA",IEEE Signal Processing Letters,"7 Jul 2015","2015","22","11","1965","1969","We propose a distributed sequential estimation scheme for wireless sensor networks with asynchronous measurements. Our scheme combines the prediction and update steps of a Bayesian filter (for time alignment and recursive state estimation) with a fusion rule (for intersensor fusion using local communication). We also propose a reduced-complexity implementation using particle filtering and Gaussian mixture approximations, and an estimator of the delays resulting from processing and communication. Simulations for a target tracking problem demonstrate the good performance of our scheme.","1558-2361","","10.1109/LSP.2015.2448601","","https://ieeexplore.ieee.org/stamp/stamp.jsp?arnumber=7131459","Asynchronous measurements;data fusion;distributed particle filter;distributed state estimation;target tracking;wireless sensor network","Estimation;Sensor fusion;Approximation methods;Delays;Atmospheric measurements;Particle measurements","","24","","20","IEEE","23 Jun 2015","","","IEEE","IEEE Journals"
"Variational Inference-based Joint Interference Mitigation and OFDM Equalization Under High Mobility","J. Zhou; J. Qin; Y. -C. Wu","School of Information Science and Technology, Sun Yat-Sen University, Guangzhou, China; School of Information Science and Technology, Sun Yat-Sen University, Guangzhou, China; Department of Electrical and Electronic Engineering, The University of Hong Kong, Hong Kong",IEEE Signal Processing Letters,"7 Jul 2015","2015","22","11","1970","1974","In OFDM-based spectrum sharing networks, due to inefficient coordination or imperfect spectrum sensing, the signals from femtocells or secondary users appear as interference in a subset of subcarriers of the primary systems. Together with the inter-carrier interference (ICI) introduced by high mobility, equalizing one subcarrier now depends not only on whether interference exists, but also the neighboring subcarrier data. In this letter, we propose a novel approach to iteratively learn the statistics of noise plus interference across different subcarriers, and refine the soft data estimates of each subcarrier based on the variational inference. Simulation results show that the proposed method avoids the error floor effect, which is exhibited by existing algorithms without considering interference mitigation, and performs close to the ideal case with perfect ICI cancelation and knowledge of noise plus interference powers for optimal maximum a posteriori probability (MAP) equalizer.","1558-2361","","10.1109/LSP.2015.2449658","Natural Science Foundation of Guangdong Province(grant numbers:2014A030310374,2014A030311032,2014A030313111); National Natural Science Foundation of China(grant numbers:61173148,61202498,61472458); ","https://ieeexplore.ieee.org/stamp/stamp.jsp?arnumber=7132716","High mobility;interference mitigation;orthogonal frequency division multiplexing (OFDM);variational inference","Interference;OFDM;Noise;Signal processing algorithms;Joints;Frequency-domain analysis;Equalizers","","5","","25","IEEE","24 Jun 2015","","","IEEE","IEEE Journals"
"Low PMEPR OFDM Radar Waveform Design Using the Iterative Least Squares Algorithm","T. Huang; T. Zhao","Aviation Key Laboratory of Science and Technology on AISSS, Wuxi, China; Aviation Key Laboratory of Science and Technology on AISSS, Wuxi, China",IEEE Signal Processing Letters,"7 Jul 2015","2015","22","11","1975","1979","This letter considers waveform design of orthogonal frequency division multiplexing (OFDM) signal for radar applications, and aims at mitigating the envelope fluctuation in OFDM. A novel method is proposed to reduce the peak-to-mean envelope power ratio (PMEPR), which is commonly used to evaluate the fluctuation. The proposed method is based on the tone reservation approach, in which some bits or subcarriers of OFDM are allocated for decreasing PMEPR. We introduce the coefficient of variation of envelopes (CVE) as the cost function for waveform optimization, and develop an iterative least squares algorithm. Minimizing CVE leads to distinct PMEPR reduction, and it is guaranteed that the cost function monotonically decreases by applying the iterative algorithm. Simulations demonstrate that the envelope is significantly smoothed by the proposed method.","1558-2361","","10.1109/LSP.2015.2449305","","https://ieeexplore.ieee.org/stamp/stamp.jsp?arnumber=7132704","","Peak to average power ratio;Signal processing algorithms;Nonlinear distortion;Radar applications","","30","","17","IEEE","24 Jun 2015","","","IEEE","IEEE Journals"
"Regularization Paths for Re-Weighted Nuclear Norm Minimization","N. Blomberg; C. R. Rojas; B. Wahlberg","Department of Automatic Control, KTH–Royal Institute of Technology, Stockholm, Sweden; Department of Automatic Control, KTH–Royal Institute of Technology, Stockholm, Sweden; Department of Automatic Control, KTH–Royal Institute of Technology, Stockholm, Sweden",IEEE Signal Processing Letters,"7 Jul 2015","2015","22","11","1980","1984","We consider a class of weighted nuclear norm optimization problems with important applications in signal processing, system identification, and model order reduction. The nuclear norm is commonly used as a convex heuristic for matrix rank constraints. Our objective is to minimize a quadratic cost subject to a nuclear norm constraint on a linear function of the decision variables, where the trade-off between the fit and the constraint is governed by a regularization parameter. The main contribution is an algorithm to determine the so-called approximate regularization path, which is the optimal solution up to a given error tolerance as a function of the regularization parameter. The advantage is that we only have to solve the optimization problem for a fixed number of values of the regularization parameter, with guaranteed error tolerance. The algorithm is exemplified on a weighted Hankel matrix model order reduction problem.","1558-2361","","10.1109/LSP.2015.2450505","","https://ieeexplore.ieee.org/stamp/stamp.jsp?arnumber=7138597","Re-weighted hankel matrix nuclear norm minimization;regularization path;weighted ${H_2}$ model reduction","Approximation error;Optimization;Upper bound;Minimization;Approximation algorithms;Signal processing algorithms","","1","","20","IEEE","29 Jun 2015","","","IEEE","IEEE Journals"
"Full-Reference Stereo Image Quality Assessment Using Natural Stereo Scene Statistics","S. Khan Md; B. Appina; S. S. Channappayya","Department of Electrical Engineering, Indian Institute of Technology Hyderabad, Yeddumailaram, India; Department of Electrical Engineering, Indian Institute of Technology Hyderabad, Yeddumailaram, India; Department of Electrical Engineering, Indian Institute of Technology Hyderabad, Yeddumailaram, India",IEEE Signal Processing Letters,"6 Jul 2015","2015","22","11","1985","1989","Empirical studies of the joint statistics of luminance and disparity images (or wavelet coefficients) of natural stereoscopic scenes have resulted in two important findings: the marginal statistics are modelled well by the generalized Gaussian distribution (GGD) and there exists significant correlation between them. Inspired by these findings, we propose a full-reference image quality assessment algorithm dubbed STeReoscopic Image Quality Evaluator (STRIQE). We show that the parameters of the GGD fits of luminance wavelet coefficients along with correlation values form excellent features. Importantly, we demonstrate that the use of disparity information (via correlation) results in a consistent improvement in the performance of the algorithm. The performance of our algorithm is evaluated over popular datasets and shown to be competitive with the state-of-the-art full-reference algorithms. The efficacy of the algorithm is further highlighted by its near-linear relation with subjective scores, low root mean squared error (RMSE), and consistently good performance over both symmetric and asymmetric distortions.","1558-2361","","10.1109/LSP.2015.2449878","","https://ieeexplore.ieee.org/stamp/stamp.jsp?arnumber=7134734","Full-reference image quality assessment;natural scene statistics;stereoscopic images","Signal processing algorithms;Distortion;Correlation;Image quality;Stereo image processing;Algorithm design and analysis;Indexes","","57","","24","IEEE","25 Jun 2015","","","IEEE","IEEE Journals"
"Quaddirectional 2D-Recurrent Neural Networks For Image Labeling","B. Shuai; Z. Zuo; G. Wang","School of Electrical and Electronic Engineering, Nanyang Technological University, Singapore; School of Electrical and Electronic Engineering, Nanyang Technological University, Singapore; School of Electrical and Electronic Engineering, Nanyang Technological University, Singapore",IEEE Signal Processing Letters,"9 Jul 2015","2015","22","11","1990","1994","We adopt Convolutional Neural Networks (CNN) to learn discriminative features for local patch classification. We further introduce quaddirectional 2D Recurrent Neural Networks to model the long range dependencies among pixels. Our quaddirectional 2D-RNN is able to embed the global image context into the compact local representation, which significantly enhance their discriminative power. Our experiments demonstrate that the integration of CNN and quaddirectional 2D-RNN achieves very promising results which are comparable to state-of-the-art on real-world image labeling benchmarks.","1558-2361","","10.1109/LSP.2015.2441781","","https://ieeexplore.ieee.org/stamp/stamp.jsp?arnumber=7118156","Convolutional neural networks;image labeling;quaddirectional 2D-RNN;recurrent neural networks","Labeling;Convolution;Recurrent neural networks;Context;Feature extraction;Hidden Markov models","","24","","35","IEEE","4 Jun 2015","","","IEEE","IEEE Journals"
"Pattern-Coupled Sparse Bayesian Learning for Inverse Synthetic Aperture Radar Imaging","H. Duan; L. Zhang; J. Fang; L. Huang; H. Li","School of Electronic Engineering, University of Electronic Science and Technology of China, Chengdu, China; National Key Laboratory of Science and Technology on Communications, University of Electronic Science and Technology of China, Chengdu, China; National Key Laboratory of Science and Technology on Communications, University of Electronic Science and Technology of China, Chengdu, China; Department of Electronic and Information Engineering, Shenzhen University, Shenzhen, China; Department of Electrical and Computer Engineering, Stevens Institute of Technology, Hoboken, NJ, USA",IEEE Signal Processing Letters,"9 Jul 2015","2015","22","11","1995","1999","We propose a pattern-coupled sparse Bayesian learning method for inverse synthetic aperture radar (ISAR) imaging by exploiting a block-sparse structure inherent in ISAR target images. A two-dimensional pattern-coupled hierarchical Gaussian prior is proposed to model the pattern dependencies among neighboring scatterers on the target scene. An expectation-maximization (EM) algorithm is developed to infer the maximum a posterior (MAP) estimate of the hyperparameters, along with the posterior distribution of the sparse signal. Numerical results are provided to illustrate the effectiveness of the proposed algorithm.","1558-2361","","10.1109/LSP.2015.2452412","","https://ieeexplore.ieee.org/stamp/stamp.jsp?arnumber=7147823","Block-sparse structure;expectation-maximization (EM);ISAR;pattern-coupled sparse bayesian learning","Bayes methods;Imaging;Signal processing algorithms;Radar imaging;Electronic mail;Scattering;Covariance matrices","","81","","14","IEEE","2 Jul 2015","","","IEEE","IEEE Journals"
"Domain Mismatch Compensation for Speaker Recognition Using a Library of Whiteners","E. Singer; D. A. Reynolds","MIT Lincoln Laboratory, Lexington, MA, USA; MIT Lincoln Laboratory, Lexington, MA, USA",IEEE Signal Processing Letters,"9 Jul 2015","2015","22","11","2000","2003","The development of the i-vector framework for generating low dimensional representations of speech utterances has led to considerable improvements in speaker recognition performance. Although these gains have been achieved in periodic National Institute of Standards and Technology (NIST) evaluations, the problem of domain mismatch, where the system development data and the application data are collected from different sources, remains a challenging one. The impact of domain mismatch was a focus of the Johns Hopkins University (JHU) 2013 speaker recognition workshop, where a domain adaptation challenge (DAC13) corpus was created to address this problem. This paper proposes an approach to domain mismatch compensation for applications where in-domain development data is assumed to be unavailable. The method is based on a generalization of data whitening used in association with i-vector length normalization and utilizes a library of whitening transforms trained at system development time using strictly out-of-domain data. The approach is evaluated on the 2013 domain adaptation challenge task and is shown to compare favorably to in-domain conventional whitening and to nuisance attribute projection (NAP) inter-dataset variability compensation.","1558-2361","","10.1109/LSP.2015.2451591","","https://ieeexplore.ieee.org/stamp/stamp.jsp?arnumber=7145413","Channel compensation;domain mismatch;i-vectors;whitening","Speaker recognition;Covariance matrices;Libraries;Speech;NIST;Conferences;Computational modeling","","14","","20","IEEE","1 Jul 2015","","","IEEE","IEEE Journals"
"A Higher Order Subspace Algorithm for Multichannel Speech Enhancement","R. Tong; G. Bao; Z. Ye","National Engineering Laboratory for Speech and Language Information Processing, Hefei, China; National Engineering Laboratory for Speech and Language Information Processing, Hefei, China; National Engineering Laboratory for Speech and Language Information Processing, Hefei, China",IEEE Signal Processing Letters,"9 Jul 2015","2015","22","11","2004","2008","In this letter, we propose a tensor factorization approach for multichannel speech enhancement, which is very successful even when the noise level is high. Specifically, we extend the well-known subspace approach to arbitrary orders and present the higher order subspace approach for multichannel speech enhancement. Unlike previous algorithms, the proposed approach constructs a third order tensor from the noisy data and then applies a tensor operation to reduce the noise. Through this it preserves the original data structure and makes full use of the spatial and temporal correlations in the multichannel data. The proposed approach adopts an iterative and step-wise procedure which usually converges in a few iterations. At each step a subspace filter sharing the same form with the conventional subspace approach is updated. Experiments show that it has achieved considerable performance on white Gaussian noise in terms of segmental signal-to-noise ratio improvement. Rapid convergence of the proposed approach is also reported.","1558-2361","","10.1109/LSP.2015.2453205","","https://ieeexplore.ieee.org/stamp/stamp.jsp?arnumber=7151775","Approach;babble noise;convergence;filter;Gaussian;subspace;tensor factorization","Tensile stress;Noise;Speech;Distortion;Signal processing algorithms;Speech enhancement;Noise measurement","","16","","23","IEEE","7 Jul 2015","","","IEEE","IEEE Journals"
"Generalized Total Variation: Tying the Knots","I. W. Selesnick","Department of Electrical and Computer Engineering, New York University, Brooklyn, NY, USA",IEEE Signal Processing Letters,"9 Jul 2015","2015","22","11","2009","2013","This letter formulates a convex generalized total variation functional for the estimation of discontinuous piecewise linear signals from corrupted data. The method is based on (1) promoting pairwise group sparsity of the second derivative signal and (2) decoupling the principle knot parameters so they can be separately weighted. The proposed method refines the recent approach by Ongie and Jacob.","1558-2361","","10.1109/LSP.2015.2449297","","https://ieeexplore.ieee.org/stamp/stamp.jsp?arnumber=7132720","Denoising;sparse optimization;total variation","TV;Noise reduction;Jacobian matrices;Noise measurement;Estimation;Signal processing algorithms;Polynomials","","18","","35","IEEE","24 Jun 2015","","","IEEE","IEEE Journals"
"A Stochastic CRB for Non-unitary Beam-space Transformations and its Application to Optimal Steering Angle Design","S. Choi; J. Chun; I. Paek; J. Jang","Department of Electrical Engineering, Korea Advanced Institute of Science and Technology, Daejeon, Korea; Department of Electrical Engineering, Korea Advanced Institute of Science and Technology, Daejeon, Korea; Department of PGM Center, Samsung Thales Co., Ltd., Yongin, Korea; Agency for Defense Development, Daejeon, Korea",IEEE Signal Processing Letters,"10 Jul 2015","2015","22","11","2014","2018","Many of modern radar systems employ antenna arrays with thousands of anetnnas. These antennas are usually grouped into a few subarrays or beams through the process of beamspace transformation, to estimate the angle of a target. In this letter, we consider a simple but pragmatic beamspace transformation that only allows beam steering, and present a technique of finding optimal steering angles that minimize the Cramér-Rao bound (CRB) for angle estimation. The CRB and mean squared error (MSE) of the angle estimate using the resulting optimal steering angles are compared with those using the widely used DFT-based beam steering.","1558-2361","","10.1109/LSP.2015.2453152","","https://ieeexplore.ieee.org/stamp/stamp.jsp?arnumber=7150543","Beamspace transformation;correlated noise;cramér-rao bound;DFT beams;subarray formation","Antenna arrays;Noise measurement;Noise;Beam steering;Estimation;Discrete Fourier transforms;Radar antennas","","3","","12","IEEE","6 Jul 2015","","","IEEE","IEEE Journals"
"Blind Low Complexity Time-Of-Arrival Estimation Algorithm for UWB Signals","E. Arias-de-Reyna; J. J. Murillo-Fuentes; R. Boloix-Tortosa","Department of Signal Theory and Communications, University of Seville, Seville, Spain; Department of Signal Theory and Communications, University of Seville, Seville, Spain; Department of Signal Theory and Communications, University of Seville, Seville, Spain",IEEE Signal Processing Letters,"10 Jul 2015","2015","22","11","2019","2023","This letter presents a novel time-of-arrival (TOA) blind estimation technique for ultra wideband energy detection receivers with reduced complexity. The proposed method is blind in the sense that it does not exploit any information about channel or noise power. This new approach is based on a set of approximations of the exact likelihood function (ELF) of the observed energy. Even though these approximations achieve an important reduction of complexity, the shape of the new approximated function is accurate enough compared to the ELF. Application of a threshold to the differential of the approximated log-likelihood function completes the procedure. Simulations show that the performance of the proposed method in terms of the cumulative distribution function of the estimation error approaches that of a method based on the ELF and a genie-aided algorithm with perfect knowledge of the optimal threshold.","1558-2361","","10.1109/LSP.2015.2450999","European Union; Junta de Andalucía(grant numbers:TIC-155); Spanish Government Ministerio de Educacion y Ciencia(grant numbers:TEC2012-38800-C03-02); ","https://ieeexplore.ieee.org/stamp/stamp.jsp?arnumber=7140768","Localization;ranging;time-of-arrival;UWB","Noise;Time of arrival estimation;Estimation;Approximation methods;Ground penetrating radar;Geophysical measurement techniques","","9","","14","IEEE","30 Jun 2015","","","IEEE","IEEE Journals"
"Fast Signal Separation of 2-D Sparse Mixture via Approximate Message-Passing","J. Kang; H. Jung; K. Kim","Department of Information and Communication, Gwangju Institute of Science and Technology, Gwangju, Republic of Korea; Department of Information and Communication, Gwangju Institute of Science and Technology, Gwangju, Republic of Korea; Department of Information and Communication, Gwangju Institute of Science and Technology, Gwangju, Republic of Korea",IEEE Signal Processing Letters,"10 Jul 2015","2015","22","11","2024","2028","Approximate message-passing (AMP) method is a simple and efficient framework for the linear inverse problems. In this letter, we propose a faster AMP to solve the ${L_1}$-Split-Analysis for the 2-D sparsity separation, which is referred to as MixAMP. We develop the MixAMP based on the factor graphical modeling and the min-sum message-passing. Then, we examine MixAMP for two types of the sparsity separation: separation of the direct-and-group sparsity, and that of the direct-and-finite-difference sparsity. This case study shows that the MixAMP method offers computational advantages over the conventional first-order method, TFOCS.","1558-2361","","10.1109/LSP.2015.2454003","","https://ieeexplore.ieee.org/stamp/stamp.jsp?arnumber=7152869","2-D Compressed sensing;approximate message-passing (AMP);${L_1}$-split-analysis;sparse signal separation","Source separation;Indexes;Sea measurements;Inverse problems;Signal processing algorithms;Approximation methods;Computational modeling","","2","","16","IEEE","8 Jul 2015","","","IEEE","IEEE Journals"
"Diffusion Sign Subband Adaptive Filtering Algorithm for Distributed Estimation","J. Ni","School of Electronic and Information Engineering, Soochow University, Suzhou, China",IEEE Signal Processing Letters,"15 Jul 2015","2015","22","11","2029","2033","The diffusion subband adaptive filtering algorithm has faster convergence rate than the diffusion least mean square algorithm. In the case where the measurement noise includes impulsive interferences, however, this algorithm may suffer from bad convergence performance. This letter proposes a diffusion sign subband adaptive filtering algorithm, which is derived based on the method of minimization of the l1-norm of the intermediate subband a posteriori error vector subject to a constraint on the intermediate estimate of the unknown vector at each agent in the network. Simulation results demonstrate that the proposed algorithm is robust against impulsive interferences.","1558-2361","","10.1109/LSP.2015.2454055","Natural Science Foundation of Jiangsu Province(grant numbers:BK20131164); National Natural Science Foundation of China(grant numbers:61101217,61471251); ","https://ieeexplore.ieee.org/stamp/stamp.jsp?arnumber=7152841","Adaptive networks;distributed estimation;${\ell _1}$-norm minimization;subband adaptive filtering","Signal processing algorithms;Estimation;Computational complexity;Adaptive systems;Decision support systems;Convergence;Least squares approximations","","41","","52","IEEE","8 Jul 2015","","","IEEE","IEEE Journals"
"Dictionary Learning Level Set","R. Sarkar; S. Mukherjee; S. T. Acton","Department of ECE, University of Virginia, Charlottesville, VA; Department of ECE, University of Virginia, Charlottesville, VA; Department of ECE, University of Virginia, Charlottesville, VA",IEEE Signal Processing Letters,"20 Jul 2015","2015","22","11","2034","2038","We propose a novel region based segmentation technique using dictionary learning. In a previous work we have developed a method which uses a set of pre-specified Legendre basis functions to perform region based segmentation of an object in presence of heterogeneous illumination. We hypothesize that in problems where a set of training images for the object is available for analysis (such as depth image sequence of blood vessels via ultrasound imaging), segmentation accuracy can be significantly improved by learning the basis functions instead of specifying them implicitly. The salient idea of this letter is to compute the optimal set of functions to model the region intensities. Our solution to this problem involves the integration of a level set segmentation methodology with the dictionary learning framework. This provides an elegant solution to deal with intensity inhomogeneities prevalent in many imaging applications such as ultrasound and fluorescence microscopy. The proposed algorithm, Dictionary Learning Level Set (DL2S) is used to segment ultrasound images of blood vessels captured using low cost, portable ultrasound devices employed in a phlebotomy application. Qualitative and quantitative results obtained from this dataset suggest efficacy of D2LS with an associated improvement in the average Dice index of 12% over the relevant competitors.","1558-2361","","10.1109/LSP.2015.2454991","Army Research Office(grant numbers:W911NF-14-1-0385); Directorate for Biological Sciences(grant numbers:1062433); ","https://ieeexplore.ieee.org/stamp/stamp.jsp?arnumber=7154449","Active contour;dictionary learning;level set;segmentation;ultrasound","Image segmentation;Dictionaries;Ultrasonic imaging;Signal processing algorithms;Level set;Lighting;Imaging","","13","","26","IEEE","10 Jul 2015","","","IEEE","IEEE Journals"
