"Joint Power and Admission Control Based on Channel Distribution Information: A Novel Two-Timescale Approach","Q. Chen; D. Kang; Y. He; T. -H. Chang; Y. -F. Liu","School of Mathematical Sciences, Peking University, Beijing, China; State Key Laboratory of Scientific and Engineering Computing, Institute of Computational Mathematics and Scientific/Engineering Computing, Academy of Mathematics and Systems Science, Chinese Academy of Sciences, Beijing, China; School of Mathematical Sciences, Peking University, Beijing, China; Shenzhen Research Institute of Big Data, Shenzhen, China; State Key Laboratory of Scientific and Engineering Computing, Institute of Computational Mathematics and Scientific/Engineering Computing, Academy of Mathematics and Systems Science, Chinese Academy of Sciences, Beijing, China",IEEE Signal Processing Letters,"20 Jan 2017","2017","24","2","196","200","In this letter, we consider the joint power and admission control (JPAC) problem by assuming that only the channel distribution information (CDI) is available. Under this assumption, we formulate a new chance (probabilistic) constrained JPAC problem, where the signal to interference plus noise ratio (SINR) outage probability of the supported links is enforced to be not greater than a prespecified tolerance. To efficiently deal with the chance SINR constraint, we employ the sample approximation method to convert them into finitely many linear constraints. Then, we propose a convex approximation based deflation algorithm for solving the sample approximation JPAC problem. Compared to the existing works, this letter proposes a novel two-timescale JPAC approach, where admission control is performed by the proposed deflation algorithm based on the CDI in a large timescale and transmission power is adapted instantly with fast fadings in a small timescale. The effectiveness of the proposed algorithm is illustrated by simulations.","1558-2361","","10.1109/LSP.2017.2651047","National Natural Science Foundation of China(grant numbers:11671419,11631013,11331012,11571221); National Natural Science Foundation of China(grant numbers:61571385); ","https://ieeexplore.ieee.org/stamp/stamp.jsp?arnumber=7812602","Admission control;SINR constraint;power control;sample approximation;two-timescale approach","Interference;Signal to noise ratio;Approximation algorithms;Signal processing algorithms;Admission control;Fading channels;Transmitters","","7","","30","IEEE","10 Jan 2017","","","IEEE","IEEE Journals"
"Stability Proof of Iterative Interference Cancellation for OFDM Signals With Blanking Nonlinearity in Impulsive Noise Channels","M. Mostafa","Institute of Communications and Navigation, German Aerospace Center DLR, Weßling, Germany",IEEE Signal Processing Letters,"23 Jan 2017","2017","24","2","201","205","Blanking nonlinearity is a widely applied technique for suppressing impulsive noise. However, for orthogonal frequency-division multiplexing signals, the blanking nonlinearity induces intercarrier interference, which must be removed in order to fully exploit the advantage of the blanking nonlinearity and to avoid performance degradation. For this purpose, interference cancellation techniques are attracting a considerable attention. Particularly, the nonlinear iterative ones show a good complexity-performance behavior. Nevertheless, one of the most important features of nonlinear iterative methods in the context of interference cancellation often remains disregarded: The stability. In this correspondence, we prove the asymptotical stability in the sense of Lyapunov of a nonlinear iterative interference cancellation technique for OFDM signals with blanking nonlinearity in impulsive noise channels. This is achieved by reformulating the considered technique as a multithreshold recurrent neural network and by taking advantage of the extensive research on the Lyapunov stability of recurrent neural networks. We show that the considered nonlinear iterative interference cancellation technique either reaches a fixed point or a limit cycle of length two. The obtained results can be utilized to find an upper bound on the required number of iterations to settle on a fixed point.","1558-2361","","10.1109/LSP.2017.2650867","","https://ieeexplore.ieee.org/stamp/stamp.jsp?arnumber=7812622","Blanking nonlinearity (BN);Lyapunov functions;orthogonal frequency-division multiplexing (OFDM);recurrent neural networks (RNN)","OFDM;Asymptotic stability;Recurrent neural networks;Interference cancellation;Blanking;Stability analysis","","5","","24","IEEE","10 Jan 2017","","","IEEE","IEEE Journals"
"A Novel Noise Jamming Detection Algorithm for Radar Applications","D. Orlando","Università degli Studi Niccolò Cusano, Roma, Italy",IEEE Signal Processing Letters,"23 Jan 2017","2017","24","2","206","210","In this letter, we devise and assess a new algorithm to detect a platform equipped with self-screening jamming systems. The latter illuminates the victim radar by means of noise-like signals leading to an increase of the constant false alarm rate threshold (at the detection stage) and a reduction of radar sensitivity. The problem is formulated in terms of a binary hypothesis test exploiting the rank-one modification of the interference covariance matrix introduced by the jammer and the generalized likelihood ratio test is derived. Performance analysis is conducted on simulated data and is aimed at highlighting the effectiveness of this new approach.","1558-2361","","10.1109/LSP.2016.2645793","","https://ieeexplore.ieee.org/stamp/stamp.jsp?arnumber=7801030","Constant false alarm rate;electronic counter-countermeasure (ECCM);electronic countermeasure;generalized likelihood ratio test (GLRT);noise-like jamming","Jamming;Radar;Electronic countermeasures;Radar antennas;Covariance matrices;Eigenvalues and eigenfunctions;Optimization","","60","","28","IEEE","28 Dec 2016","","","IEEE","IEEE Journals"
"Construction of Binary Sensing Matrices Using Extremal Set Theory","R. R. Naidu; C. R. Murthy","Department of Electrical Communication Engineering, Indian Institute of Science, Bangalore, India; Department of Electrical Communication Engineering, Indian Institute of Science, Bangalore, India",IEEE Signal Processing Letters,"24 Jan 2017","2017","24","2","211","215","The construction of binary sensing matrices is one of the active directions in the emerging field of compressed sensing (CS). Due to their sparse structure and competitive performance, they provide multiplier-less and faster dimensionality reduction in applications such as data compression. This letter attempts to relate the notion of extremal set theory to the construction of good CS matrices. In particular, we show that extremal set theory is useful for constructing binary sensing matrices and bounding their maximum column size (i.e., number of columns). We also prove the existence of binary sensing matrices whose column size meets the upper bound. Simulation results show that the constructed matrices outperform Gaussian and Bernoulli random matrices, as well as other deterministic binary and bipolar constructions from the literature.","1558-2361","","10.1109/LSP.2016.2638426","Postdoctoral Fellowship(grant numbers:2/40(63)/2015/R&D-II/4270); National Board for Higher Mathematics, Government of India; ","https://ieeexplore.ieee.org/stamp/stamp.jsp?arnumber=7779000","Binary sensing matrices;compressed sensing (CS);extremal set theory;restricted isometry property (RIP)","Sensors;Sparse matrices;Coherence;Set theory;Compressed sensing;Upper bound;Simulation","","12","","23","IEEE","9 Dec 2016","","","IEEE","IEEE Journals"
"Total Variation Denoising Via the Moreau Envelope","I. Selesnick","Tandon School of Engineering, New York University, NY, USA",IEEE Signal Processing Letters,"24 Jan 2017","2017","24","2","216","220","Total variation denoising is a nonlinear filtering method well suited for the estimation of piecewise-constant signals observed in additive white Gaussian noise. The method is defined by the minimization of a particular nondifferentiable convex cost function. This letter describes a generalization of this cost function that can yield more accurate estimation of piecewise constant signals. The new cost function involves a nonconvex penalty (regularizer) designed to maintain the convexity of the cost function. The new penalty is based on the Moreau envelope. The proposed total variation denoising method can be implemented using forward-backward splitting.","1558-2361","","10.1109/LSP.2017.2647948","NSF(grant numbers:1525398); ONR(grant numbers:N00014-15-1-2314); ","https://ieeexplore.ieee.org/stamp/stamp.jsp?arnumber=7807310","Convex;denoising;sparse;total variation (TV)","Noise reduction;TV;Cost function;Convex functions;Standards;Signal processing algorithms;Estimation","","104","","53","IEEE","5 Jan 2017","","","IEEE","IEEE Journals"
"Interpolation of Head-Related Transfer Functions Using Manifold Learning","F. Grijalva; L. C. Martini; D. Florencio; S. Goldenstein","School of Electrical and Computer Engineering, University of Campinas, Campinas, Brazil; School of Electrical and Computer Engineering, University of Campinas, Campinas, Brazil; Microsoft Research, Redmond, WA, USA; Institute of Computing, University of Campinas, Campinas, Brazil",IEEE Signal Processing Letters,"25 Jan 2017","2017","24","2","221","225","We propose a new head-related transfer function (HRTF) interpolation method using Isomap, a nonlinear dimensionality reduction technique. First, we construct a single manifold for all subjects across both azimuth and elevation angles through the construction of an intersubject graph (ISG) that includes important prior knowledge of the HRTFs such as correlations across individuals, directions, and ears. Then, for a new direction, we predict its corresponding low-dimensional HRTF by interpolating over same subject low-dimensional measured HRTFs. Finally, we use a local neighborhood mapping in the manifold to reconstruct the high-dimensional HRTF from measured HRTFs of all subjects. We show that a single manifold representation obtained through the ISG is a powerful way to allow measured HRTFs from different subjects to contribute for reconstructing the HRTFs for new directions. Moreover, our results suggest that a small number of spatial measurements capture most of acoustical properties of HRTFs. Finally, our approach outperforms other linear and nonlinear dimensionality reduction techniques such as principal component analysis, locally linear embedding, and Laplacian eigenmaps.","1558-2361","","10.1109/LSP.2017.2648794","São Paulo Research Foundation (FAPESP)(grant numbers:2012/50468-6,2013/21349-1,2014/14630-9); National Counsel of Technological and Scientific Development (CNPq)(grant numbers:308882/2013-0,454082/2014-2); CAPES; Unicamp's IRB(grant numbers:15641313.7.0000.5404); ","https://ieeexplore.ieee.org/stamp/stamp.jsp?arnumber=7807250","Head-related transfer function (HRTF) interpolation;manifold learning;spatial audio;virtual auditory displays","Manifolds;Interpolation;Ear;Azimuth;Principal component analysis;Databases;Measurement","","20","","52","IEEE","5 Jan 2017","","","IEEE","IEEE Journals"
"Robust Time-Delay Estimation for Acoustic Indoor Localization in Reverberant Environments","J. Choi; J. Kim; N. S. Kim","Department of Electrical and Computer Engineering and the Institute of New Media and Communications, Seoul National University, Seoul, South Korea; Department of Electrical and Computer Engineering and the Institute of New Media and Communications, Seoul National University, Seoul, South Korea; Department of Electrical and Computer Engineering and the Institute of New Media and Communications, Seoul National University, Seoul, South Korea",IEEE Signal Processing Letters,"25 Jan 2017","2017","24","2","226","230","In this letter, we propose a robust approach to time-delay estimation for acoustic indoor localization. Particularly, we focus on the acoustic indoor localization that works in real environments, which have been seldom addressed in previous studies. In the actual environments, it is difficult to estimate the correct time delays for localization due to multipath signals caused by acoustic reverberation. The proposed algorithm minimizes the effect of multipaths and determines the target position based on a novel reliability measure. Experiments conducted in both actual room and simulated environments showed good performance of the proposed technique.","1558-2361","","10.1109/LSP.2016.2642178","National Research Foundation of Korea; Korea government (MEST)(grant numbers:NRF-2015R1A2A1A15054343); MSIP; ITRC (Information Technology Research Center)(grant numbers:IITP-2016-H8501-16-1016); IITP (Institute for Information and Communications Technology Promotion); ","https://ieeexplore.ieee.org/stamp/stamp.jsp?arnumber=7792134","Acoustic indoor localization (AIL);time-delay estimation (TDE);time difference of arrival (TDOA);time of arrival (TOA)","Receivers;Reverberation;Delay effects;Signal processing algorithms;Estimation;Microphones","","27","","15","IEEE","20 Dec 2016","","","IEEE","IEEE Journals"
"Recovering Latent Signals From a Mixture of Measurements Using a Gaussian Process Prior","F. Tobar; G. Rios; T. Valdivia; P. Guerrero","Center for Mathematical Modeling, Universidad de Chile, Santiago, Chile; Center for Mathematical Modeling, Universidad de Chile, Santiago, Chile; Center for Mathematical Modeling, Universidad de Chile, Santiago, Chile; Computer Science Department and the Advanced Mining Technology Center, Universidad de Chile, Santiago, Chile",IEEE Signal Processing Letters,"26 Jan 2017","2017","24","2","231","235","In sensing applications, sensors cannot always measure the latent quantity of interest at the required resolution, sometimes they can only acquire a blurred version of it due the sensor's transfer function. To recover latent signals when only noisy mixed measurements of the signal are available, we propose the Gaussian process mixture of measurements (GPMM), which models the latent signal as a Gaussian process (GP) and allows us to perform Bayesian inference on such signal conditional to a set of noisy mixture of measurements. We describe how to train GPMM, that is, to find the hyperparameters of the GP and the mixing weights, and how to perform inference on the latent signal under GPMM; additionally, we identify the solution to the underdetermined linear system resulting from a sensing application as a particular case of GPMM. The proposed model is validated in the recovery of three signals: A smooth synthetic signal, a real-world heart-rate time series and a step function, where GPMM outperformed the standard GP in terms of estimation error, uncertainty representation, and recovery of the spectral content of the latent signal.","1558-2361","","10.1109/LSP.2016.2637312","CONICYT(grant numbers:PAI-82140061); Basal-CMM; FONDECYT(grant numbers:3130729); CONICYT-PCHA Doctorado Nacional(grant numbers:2016-21161789); ","https://ieeexplore.ieee.org/stamp/stamp.jsp?arnumber=7776817","Bayesian inference;convolution process;Gaussian process (GP);sensing applications;underdetermined linear systems","Noise measurement;Weight measurement;Extraterrestrial measurements;Robot sensing systems;Linear systems;Gaussian processes","","4","","19","IEEE","7 Dec 2016","","","IEEE","IEEE Journals"
"MIMO Beamforming for Secure and Energy-Efficient Wireless Communication","N. T. Nghia; H. D. Tuan; T. Q. Duong; H. V. Poor","Faculty of Engineering and Information Technology, University of Technology, Sydney, NSW, Australia; Faculty of Engineering and Information Technology, University of Technology, Sydney, NSW, Australia; School of Electronics, Electrical Engineering and Computer Science, Queen's University Belfast, Belfast, United Kingdom; Department of Electrical Engineering, Princeton University, Princeton, NJ, USA",IEEE Signal Processing Letters,"26 Jan 2017","2017","24","2","236","239","Considering a multiple-user multiple-input multiple-output channel with an eavesdropper, this letter develops a beamformer design to optimize the energy efficiency in terms of secrecy bits per Joule under secrecy quality-of-service constraints. This is a very difficult design problem with no available exact solution techniques. A path-following procedure, which iteratively improves its feasible points by using a simple quadratic program of moderate dimension, is proposed. Under any fixed computational tolerance, the procedure terminates after finitely many iterations, yielding at least a locally optimal solution. Simulation results show the superior performance of the obtained algorithm over other existing methods.","1558-2361","","10.1109/LSP.2017.2647982","Australian Research Councils Discovery Projects(grant numbers:DP130104617); U.K. Royal Academy of Engineering Research Fellowship(grant numbers:RF1415/14/22); U.S. National Science Foundation(grant numbers:CMMI-1435778,ECCS-1647198); ","https://ieeexplore.ieee.org/stamp/stamp.jsp?arnumber=7807263","Energy efficiency (EE);multipleinput multiple-output (MIMO) beamforming;secure communication","Throughput;Optimization;Transmitters;Quality of service;MIMO;Interference;Array signal processing","","22","","19","Crown","5 Jan 2017","","","IEEE","IEEE Journals"
"Precoding for Robust Decentralized Estimation in Coherent-MAC-Based Wireless Sensor Networks","N. K. D. Venkategowda; B. B. Narayana; A. K. Jagannatham","Department of Electrical Engineering, Indian Institute of Technology Kanpur, Kanpur, India; Department of Electrical Engineering, Indian Institute of Technology Kanpur, Kanpur, India; Department of Electrical Engineering, Indian Institute of Technology Kanpur, Kanpur, India",IEEE Signal Processing Letters,"30 Jan 2017","2017","24","2","240","244","This letter proposes novel precoding techniques for robust decentralized parameter estimation with only imperfect channel state information (CSI) in a coherent multiple access channel based wireless sensor network. For scalar parameter estimation, the proposed technique minimizes the worst case estimation error arising due to the channel uncertainties while ensuring the maximum gain at each receive antenna. For vector parameter estimation, since the general noisy measurement case is intractable, a robust precoder is developed for noiseless sensor measurements that eliminates the need for postprocessing at the fusion center while simultaneously minimizing the worst case estimation error. Simulation results show that the proposed techniques have a superior performance in comparison to imperfect CSI agnostic estimation techniques.","1558-2361","","10.1109/LSP.2017.2647984","","https://ieeexplore.ieee.org/stamp/stamp.jsp?arnumber=7807319","Channel uncertainty;decentralized estimation;parameter estimation;robust precoding","Uncertainty;Channel estimation;Estimation;Precoding;Robustness;Parameter estimation;Wireless sensor networks","","20","","28","IEEE","5 Jan 2017","","","IEEE","IEEE Journals"
"SPL EDICS","",,IEEE Signal Processing Letters,"22 Feb 2017","2017","24","2","245","245","Presents the EDICS (Editors' information classification scheme) subject categories for this issue of the publication.","1558-2361","","10.1109/LSP.2017.2662440","","https://ieeexplore.ieee.org/stamp/stamp.jsp?arnumber=7862356","","","","","","","IEEE","22 Feb 2017","","","IEEE","IEEE Journals"
"IEEE Signal Processing Letters information for authors","",,IEEE Signal Processing Letters,"22 Feb 2017","2017","24","2","246","247","These instructions give guidelines for preparing papers for this publication. Presents information for authors publishing in this journal.","1558-2361","","10.1109/LSP.2017.2662441","","https://ieeexplore.ieee.org/stamp/stamp.jsp?arnumber=7862355","","","","","","","IEEE","22 Feb 2017","","","IEEE","IEEE Journals"
"Introducing IEEE Collabratec","",,IEEE Signal Processing Letters,"22 Feb 2017","2017","24","2","248","248","Advertisement, IEEE. IEEE Collabratec is a new, integrated online community where IEEE members, researchers, authors, and technology professionals with similar fields of interest can network and collaborate, as well as create and manage content. Featuring a suite of powerful online networking and collaboration tools, IEEE Collabratec allows you to connect according to geographic location, technical interests, or career pursuits. You can also create and share a professional identity that showcases key accomplishments and participate in groups focused around mutual interests, actively learning from and contributing to knowledgeable communities. All in one place! Learn about IEEE Collabratec at ieeecollabratec.org.","1558-2361","","10.1109/LSP.2017.2670069","","https://ieeexplore.ieee.org/stamp/stamp.jsp?arnumber=7862342","","","","","","","IEEE","22 Feb 2017","","","IEEE","IEEE Journals"
"IEEE Signal Processing Society Board of Governors","",,IEEE Signal Processing Letters,"22 Feb 2017","2017","24","2","C3","C3","Presents a listing of the Board of Governors for this issue of the publication.","1558-2361","","10.1109/LSP.2017.2662438","","https://ieeexplore.ieee.org/stamp/stamp.jsp?arnumber=7862334","","","","","","","IEEE","22 Feb 2017","","","IEEE","IEEE Journals"
"Blank page","",,IEEE Signal Processing Letters,"22 Feb 2017","2017","24","2","C4","C4","This page was intentionally left blank.","1558-2361","","10.1109/LSP.2017.2662439","","https://ieeexplore.ieee.org/stamp/stamp.jsp?arnumber=7862336","","","","","","","IEEE","22 Feb 2017","","","IEEE","IEEE Journals"
