"Document Title",Authors,"Author Affiliations","Publication Title",Date Added To Xplore,"Publication Year","Volume","Issue","Start Page","End Page","Abstract","ISSN",ISBNs,"DOI",Funding Information,PDF Link,"Author Keywords","IEEE Terms","Mesh_Terms",Article Citation Count,Patent Citation Count,"Reference Count","License",Online Date,Issue Date,"Meeting Date","Publisher",Document Identifier
"Front Cover","",,IEEE Signal Processing Letters,"21 Aug 2017","2017","24","8","C1","C1","Presents the front cover for this issue of the publication.","1558-2361","","10.1109/LSP.2017.2716078","","https://ieeexplore.ieee.org/stamp/stamp.jsp?arnumber=8013877","","","","1","","","IEEE","21 Aug 2017","","","IEEE","IEEE Journals"
"IEEE Signal Processing Society Editorial Board","",,IEEE Signal Processing Letters,"21 Aug 2017","2017","24","8","C2","C2","Presents a listing of the editorial board, board of governors, current staff, committee members, and/or society editors for this issue of the publication.","1558-2361","","10.1109/LSP.2017.2716079","","https://ieeexplore.ieee.org/stamp/stamp.jsp?arnumber=8013897","","","","","","","IEEE","21 Aug 2017","","","IEEE","IEEE Journals"
"Table of Contents","",,IEEE Signal Processing Letters,"20 Jul 2017","2017","24","8","1099","1100","Presents a listing of institutional institutions relevant for this issue of the publication.","1558-2361","","10.1109/LSP.2017.2716058","","https://ieeexplore.ieee.org/stamp/stamp.jsp?arnumber=7987111","","","","","","","IEEE","20 Jul 2017","","","IEEE","IEEE Journals"
"Table of Contents [EDICS]","",,IEEE Signal Processing Letters,"20 Jul 2017","2017","24","8","1101","1102","Presents a listing of institutional institutions relevant for this issue of the publication.","1558-2361","","10.1109/LSP.2017.2716059","","https://ieeexplore.ieee.org/stamp/stamp.jsp?arnumber=7987112","","","","","","","IEEE","20 Jul 2017","","","IEEE","IEEE Journals"
"Restricted Boltzmann Machine-Based Voice Conversion for Nonparallel Corpus","K. -S. Lee","Department of Electronic Engineering, Konkuk University, Seoul, Korea",IEEE Signal Processing Letters,"19 Jun 2017","2017","24","8","1103","1107","A large amount of parallel training corpus is necessary for robust, high-quality voice conversion. However, such parallel data may not always be available. This letter presents a new voice conversion method that needs no parallel speech corpus, and adopts a restricted Boltzmann machine (RBM) to represent the distribution of the spectral features derived from a target speaker. A linear transformation was employed to convert the spectral and delta features. A conversion function was obtained by maximizing the conditional probability density function with respect to the target RBM. A feasibility test was carried out on the OGI VOICES corpus. Results from the subjective listening tests and the objective results both showed that the proposed method outperforms the conventional GMM-based method.","1558-2361","","10.1109/LSP.2017.2713412","Konkuk University in 2015; ","https://ieeexplore.ieee.org/stamp/stamp.jsp?arnumber=7944592","Linear transformation;restricted Boltzmann machine (RBM);voice conversion (VC)","Speech;Training;Matrix converters;Covariance matrices;Probability density function;Feature extraction;Training data","","4","","19","IEEE","8 Jun 2017","","","IEEE","IEEE Journals"
"Primal-Dual Plug-and-Play Image Restoration","S. Ono","Laboratory for Institute of Innovative Research, Tokyo Institute of Technology, Yokohama, Japan",IEEE Signal Processing Letters,"19 Jun 2017","2017","24","8","1108","1112","We propose a new plug-and-play image restoration method based on primal-dual splitting. Existing plug-and-play image restoration methods interpret any off-the-shelf Gaussian denoiser as one step of the so-called alternating direction method of multipliers (ADMM). This makes it possible to exploit the power of such a highly-customized Gaussian denoising method for general image restoration tasks in a plug-and-play fashion. However, the ADMM-based plug-and-play approach (ADMMPnP) has several limitations: 1) it often requires a problem-specific iterative method in solving a subproblem, which results in a computationally expensive inner loop; and 2) it is specialized to handle the formulation of a regularization (plug-and-play) term plus a data-fidelity term, so that it does not allow to impose hard constraints useful for image restoration. Our approach resolves these issues by leveraging the nature of primal-dual splitting, yielding a very flexible plug-and-play image restoration method. Experimental results demonstrate that the proposed method is much more efficient than ADMMPnP with an inner loop, whereas it keeps the same efficiency as ADMMPnP in the case where the subproblem of ADMMPnP can be solved efficiently.","1558-2361","","10.1109/LSP.2017.2710233","JSPS(grant numbers:15H06197); JST-PRESTO; ","https://ieeexplore.ieee.org/stamp/stamp.jsp?arnumber=7936537","Image restoration;plug-and-play approach;primal-dual splitting (PDS)","Image restoration;Noise reduction;Signal processing algorithms;Convex functions;Noise measurement;Iterative methods;Optimization","","128","","43","IEEE","31 May 2017","","","IEEE","IEEE Journals"
"Secrecy Sum Rate Optimization for Downlink MIMO Nonorthogonal Multiple Access Systems","M. Tian; Q. Zhang; S. Zhao; Q. Li; J. Qin","School of Electronics and Information Technology, Sun Yat-sen University, Guangzhou, China; School of Electronics and Information Technology, Sun Yat-sen University, Guangzhou, China; School of Mechanical and Electrical Engineering, Guangzhou University, Guangzhou, China; School of Data and Computer Science, Sun Yat-sen University, Guangzhou, China; School of Electronics and Information Technology, Sun Yat-sen University, Guangzhou, China",IEEE Signal Processing Letters,"19 Jun 2017","2017","24","8","1113","1117","Nonorthogonal multiple access (NOMA) is expected to be a promising technique for future wireless networks. In this letter, we investigate the secrecy sum rate optimization problem for a downlink multiple-input-multiple-output NOMA system that consists of a base station, multiple legitimate users, and an eavesdropper. Our objective is to maximize achievable secrecy sum rate subject to successful successive interference cancellation constraints and transmit power constraint. The formulated optimization problem is nonconvex. Motivated by the relationship between mutual information rate and minimum mean square error, we propose to transform the secrecy sum rate optimization problem into a biconvex problem. The biconvex problem is solved by alternating optimization method where in each iteration, we solve a second-order cone programming. Simulation results demonstrate that our proposed NOMA scheme outperforms conventional orthogonal multiple access scheme.","1558-2361","","10.1109/LSP.2017.2711022","National Natural Science Foundation of China(grant numbers:61672549,61472458); Guangdong Natural Science Foundation(grant numbers:2014A030311032,2014A030313111,2014A030310374); Guangzhou Science and Technology Program(grant numbers:201607010098); Guangzhou Education Bureau Science and Technology Project(grant numbers:1201630400); ","https://ieeexplore.ieee.org/stamp/stamp.jsp?arnumber=7937906","Multiple-input-multiple-output (MIMO);nonorthogonal multiple access (NOMA);secrecy sum rate","Optimization;NOMA;Base stations;MIMO;Silicon carbide;Downlink;Mutual information","","65","","17","IEEE","1 Jun 2017","","","IEEE","IEEE Journals"
"Bias-Variance Tradeoff of Graph Laplacian Regularizer","P. -Y. Chen; S. Liu","AI Foudations, IBM Thomas J. Watson Research Center, Yorktown Heights, NY, USA; Department of Electrical Engineering and Computer Science, University of Michigan, Ann Arbor, MI, USA",IEEE Signal Processing Letters,"19 Jun 2017","2017","24","8","1118","1122","This letter presents a bias-variance tradeoff of graph Laplacian regularizer, which is widely used in graph signal processing and semisupervised learning tasks. The scaling law of the optimal regularization parameter is specified in terms of the spectral graph properties and a novel signal-to-noise ratio parameter, which suggests that selecting a mediocre regularization parameter is often suboptimal. The analysis is applied to three applications, including random, band-limited, and multiple-sampled graph signals. Experiments on synthetic and real-world graphs demonstrate near-optimal performance of the established analysis.","1558-2361","","10.1109/LSP.2017.2712141","","https://ieeexplore.ieee.org/stamp/stamp.jsp?arnumber=7938677","Graph signal processing;mean squared error (MSE) analysis;scaling law;spectral graph theory","Laplace equations;Signal to noise ratio;Eigenvalues and eigenfunctions;Reactive power;Semisupervised learning;Symmetric matrices","","15","","26","IEEE","5 Jun 2017","","","IEEE","IEEE Journals"
"Generalizing Skew Jensen Divergences and Bregman Divergences With Comparative Convexity","F. Nielsen; R. Nock","École Polytechnique, Sony Computer Science Laboratories, Inc., Tokyo, Japan; Data61, University of Sydney, Camperdown NSW, Australia",IEEE Signal Processing Letters,"19 Jun 2017","2017","24","8","1123","1127","Comparative convexity is a generalization of ordinary convexity based on abstract means instead of arithmetic means. We introduce the generalized skew Jensen divergences and their corresponding Bregman divergences with respect to comparative convexity. To illustrate those novel families of divergences, we consider the convexity induced by quasi-arithmetic means, and report explicit formula for the corresponding Bregman divergences. In particular, we show that those new Bregman divergences are equivalent to conformal ordinary Bregman divergences on monotone embeddings, and further state related results.","1558-2361","","10.1109/LSP.2017.2712195","","https://ieeexplore.ieee.org/stamp/stamp.jsp?arnumber=7938742","Bregman divergence (BD);conformal divergence;convexity;quasi-arithmetic weighted mean;regular mean;skew Jensen divergence (JD)","Indexes;Convex functions;Harmonic analysis;Taylor series;Radio frequency;Generators;Q measurement","","12","","27","IEEE","5 Jun 2017","","","IEEE","IEEE Journals"
"Pitch-Normalized Acoustic Features for Robust Children's Speech Recognition","S. Shahnawazuddin; R. Sinha; G. Pradhan","Department of Electronics and Communication Engineering, National Institute of Technology Patna, Patna, India; Department of Electronics and Electrical Engineering, Indian Institute of Technology Guwahati, Guwahati, India; Department of Electronics and Communication Engineering, National Institute of Technology Patna, Patna, India",IEEE Signal Processing Letters,"19 Jun 2017","2017","24","8","1128","1132","In this letter, the effectiveness of recently reported SMAC (Spectral Moment time-frequency distribution Augmented by low-order Cepstral) features has been evaluated for robust automatic speech recognition (ASR). The SMAC features consist of normalized first central spectral moments appended with low-order cepstral coefficients. These features have been designed for achieving robustness to both additive noise and the pitch variations. We have explored the SMAC features in severe pitch mismatch ASR task, i.e., decoding of children's speech on adults' speech trained ASR system. In those tasks, the SMAC features are still observed to be sensitive to pitch variations. Toward addressing the same, a simple spectral smoothening approach employing adaptive-cepstral truncation is explored prior to the computation of spectral moments. With the proposed modification, the SMAC features are noted to achieve enhanced pitch robustness without affecting their noise immunity. Furthermore, the effectiveness of the proposed features is explored in three dominant acoustic modeling paradigms and varying data conditions. In all the cases, the proposed features are observed to significantly outperform the existing ones.","1558-2361","","10.1109/LSP.2017.2705085","","https://ieeexplore.ieee.org/stamp/stamp.jsp?arnumber=7930421","Automatic speech recognition (ASR);deep neural network (DNN);pitch-adaptive features;spectral smoothening;subspace Gaussian mixture model (SGMM)","Speech;Robustness;Mel frequency cepstral coefficient;Hidden Markov models;Additive noise","","20","","40","IEEE","17 May 2017","","","IEEE","IEEE Journals"
"Robust Pitch Extraction Method for the HMM-Based Speech Synthesis System","M. K. Reddy; K. S. Rao","Department of Computer Science and Engineering, Indian Institute of Technology, Kharagpur, India; Department of Computer Science and Engineering, Indian Institute of Technology, Kharagpur, India",IEEE Signal Processing Letters,"19 Jun 2017","2017","24","8","1133","1137","This letter proposes an efficient method for extracting pitch from speech signals for the hidden Markov model (HMM)-based speech synthesis system (HTS). In the proposed method, voicing detection and pitch estimation is performed using the mean signal obtained from continuous wavelet transform coefficients. The proposed pitch extraction method is integrated in the HMM-based speech synthesis system. The Performance of the proposed method is evaluated on CMU Arctic and Keele databases. Both objective and subjective evaluation results show that the quality of speech synthesized with the proposed pitch estimation method is much better compared with HMM-based speech synthesis systems developed using the state-of-the-art pitch extraction methods, namely, robust algorithm for pitch tracking and speech transformation and representation using adaptive interpolation of weighted spectrum employed in the HTS.","1558-2361","","10.1109/LSP.2017.2712646","","https://ieeexplore.ieee.org/stamp/stamp.jsp?arnumber=7940005","Continuous wavelet transform (CWT);hidden Markov models (HMMs);pitch estimation;speech synthesis","Speech;Continuous wavelet transforms;Estimation;High-temperature superconductors;Databases;Hidden Markov models","","30","","16","IEEE","6 Jun 2017","","","IEEE","IEEE Journals"
"A Statistically Robust Approach to Acoustic Impulse Response Shaping","L. Krishnan; T. Betlehem; P. D. Teal","School of Engineering and Computer Science, Victoria University of Wellington, Wellington, New Zealand; Samsung Electronics, Suwon, South Korea; School of Engineering and Computer Science, Victoria University of Wellington, Wellington, New Zealand",IEEE Signal Processing Letters,"19 Jun 2017","2017","24","8","1138","1142","Acoustic impulse response shaping is a prefiltering technique to reduce the perceptible effects of room reverberation. The room impulse responses to be shaped must first be measured, and these measurements can contain errors. Furthermore, room responses vary with changes in temperature and humidity and also with changes in measurement position. This letter presents a method for enhancing the robustness of the shaping procedure so that the effects of these errors and changes are minimized. The method uses a stochastic model of the channel variations to explicitly limit the probability of large deviations from the desired performance. The method is evaluated on realistic channel perturbations and the resulting shaped responses are shown to comply with the robustness specification.","1558-2361","","10.1109/LSP.2017.2713418","","https://ieeexplore.ieee.org/stamp/stamp.jsp?arnumber=7944615","Acoustic impulse response shaping;crosstalk;cumulative density function (CDF);direct response;probability density function (PDF);statistical robustness","Reverberation;Robustness;Microphones;Loudspeakers;Optimization;Temperature measurement;Probability","","1","","21","IEEE","8 Jun 2017","","","IEEE","IEEE Journals"
"Discovering Class-Specific Spatial Layouts for Scene Recognition","C. Weng; H. Wang; J. Yuan; X. Jiang","Nanyang Technological University, Singapore; Nanyang Technological University, Chongqing University, Chongqing Shi, China; Nanyang Technological University, Singapore; Nanyang Technological University, Singapore",IEEE Signal Processing Letters,"27 Jun 2017","2017","24","8","1143","1147","Scene image is a spatial composition of objects and background contexts and finding discriminative spatial layouts is critical for scene recognition. In this letter, we propose an ℓ1-regularized max-margin formulation to discover class-specific spatial layouts by jointly learning the image classifier and the class-specific spatial layouts for scene recognition. Unlike previous methods that classify images into different categories either without considering the spatial layouts explicitly or only using class generic spatial layout, our proposed method can discover a sparse combination of class-specific spatial layouts for different scenes and boost the recognition performance. Experiments on scene-15, landuse-21, and MIT indoor-67 datasets validate the advantages of our proposed algorithm.","1558-2361","","10.1109/LSP.2016.2641020","Singapore Ministry of Education Academic Research Fund(grant numbers:MOE2015-T2-2-114,RG27/14); National Natural Science Foundation of China(grant numbers:61602069); Chongqing Research Program of Basic Research and Frontier Technology(grant numbers:cstc2016jcyjA0468); ","https://ieeexplore.ieee.org/stamp/stamp.jsp?arnumber=7786827","Discovering class-specific spatial layouts;scene recognition","Layout;Training;Image recognition;Support vector machines;Feature extraction;Visualization;Buildings","","13","","37","IEEE","16 Dec 2016","","","IEEE","IEEE Journals"
"On the SNR Variability in Noisy Compressed Sensing","A. Lavrenko; F. Römer; G. D. Galdo; R. Thomä","Institute for Information Technology, Technische Universität Ilmenau, Ilmenau, Germany; Institute for Information Technology, Technische Universität Ilmenau, Ilmenau, Germany; Institute for Information Technology, Fraunhofer Institute of Integrated Circuits (IIS), Ilmenau, Germany; Institute for Information Technology, Fraunhofer Institute of Integrated Circuits (IIS), Ilmenau, Germany",IEEE Signal Processing Letters,"21 Jun 2017","2017","24","8","1148","1152","Compressed sensing (CS) is a sampling paradigm that allows us to simultaneously measure and compress signals that are sparse or compressible in some domain. The choice of a sensing matrix that carries out the measurement has a defining impact on the system performance and it is often advocated to draw its elements randomly. It has been noted that in the presence of input (signal) noise, the application of the sensing matrix causes signal-to-noise ratio (SNR) degradation due to the noise folding effect. In fact, it might also result in the variations of the output SNR in compressive measurements over the support of the input signal, potentially resulting in unexpected nonuniform system performance. In this letter, we study the impact of a distribution from which the elements of a sensing matrix are drawn on the spread of the output SNR. We derive analytic expressions for several common types of sensing matrices and show that the SNR spread grows with the decrease of the number of measurements. This makes its negative effect especially pronounced for high compression rates that are often of interest in CS.","1558-2361","","10.1109/LSP.2017.2689243","Deutsche Forschungsgemeinschaft Project CLASS; Carl-Zeiss Foundation; ","https://ieeexplore.ieee.org/stamp/stamp.jsp?arnumber=7888934","Noise folding;noisy compressed sensing (CS);sensing matrix;signal-to-noise ratio (SNR) variability;sparse signals","Signal to noise ratio;Sensors;Noise measurement;Sparse matrices;Power measurement;Compressed sensing;Probability distribution","","13","","20","EU","29 Mar 2017","","","IEEE","IEEE Journals"
"Design of Unimodular Sequences With Good Autocorrelation and Good Complementary Autocorrelation Properties","I. A. Arriaga-Trejo; A. G. Orozco-Lugo; J. Flores-Troncoso","CONACYT - Autonomous University of Zacatecas, Zacatecas, C. P., Mexico; Research Center for Advanced Studies, Instituto Politécnico Nacional, Col. Zacatenco, C. P., Mexico; Autonomous University of Zacatecas, Zacatecas, C. P., Mexico",IEEE Signal Processing Letters,"21 Jun 2017","2017","24","8","1153","1157","Complex sequences with constant magnitude in the time domain and good aperiodic autocorrelation properties are of fundamental interest due to its applications. Their design typically involves the minimization of a nonlinear function that strives to make equal to zero the correlation coefficients in a region of interest. In this letter, the design of unimodular sequences whose aperiodic autocorrelation and aperiodic complementary autocorrelation vanish for a given set of lags is proposed. The sequences are obtained by minimizing a generalized weighted integrated sidelobe level that depends on their complete second-order characterization. Numerical results show that the proposed sequences are ideally suited to identify strictly linear as well as widely linear systems.","1558-2361","","10.1109/LSP.2017.2696950","Consejo Nacional de Ciencia y Tecnología(grant numbers:3066); ","https://ieeexplore.ieee.org/stamp/stamp.jsp?arnumber=7907238","Complementary correlation;correlation;unimodular sequences","Correlation;Minimization;Linear programming;Channel estimation;Signal processing algorithms;Linear systems;Indexes","","20","","19","IEEE","24 Apr 2017","","","IEEE","IEEE Journals"
"Synchrony-Based Feature Extraction for Robust Automatic Speech Recognition","F. de-la-Calle-Silos; R. M. Stern","Department of Signal Theory and Communications, Universidad Carlos III de Madrid, Madrid, Spain; Department of Electrical and Computer Engineering and the Language Technologies Institute, Carnegie Mellon University, Pittsburgh, PA, USA",IEEE Signal Processing Letters,"22 Jun 2017","2017","24","8","1158","1162","This letter discusses the application of models of temporal patterns of auditory-nerve firings to enhance robustness of automatic speech recognition systems. Most conventional feature extraction schemes (such as mel-frequency cepstral coefficients and perceptual linear processing coefficients) are based on short-time energy in each frequency band, and the temporal patterns of auditory-nerve activity are discarded. We compare the impact on speech recognition accuracy of several types of feature extraction schemes based on the putative synchrony of auditory-nerve activity, including feature extraction based on a modified version of the generalized synchrony detector proposed by Seneff, and a modified version of the averaged localized synchrony response proposed by Young and Sachs. It was found that the use of features based on auditory-nerve synchrony can indeed improve speech recognition accuracy in the presence of additive noise based on experiments using multiple standard speech databases. Recognition accuracy obtained using the synchrony-based features is further increased if some form of noise removal is applied to the signal before the synchrony measure is estimated. Signal processing for noise removal based on the noise suppression that is a part of PNCC feature extraction is more effective toward this end than conventional spectral subtraction.","1558-2361","","10.1109/LSP.2017.2714192","Airbus Defense and Space Grant; Spanish Government-CICYT Project(grant numbers:TEC2014-53390-P); ","https://ieeexplore.ieee.org/stamp/stamp.jsp?arnumber=7945498","Auditory modeling;auditory synchrony;feature extraction;physiological modeling;robust speech recognition","Feature extraction;Mel frequency cepstral coefficient;Speech recognition;Speech;Robustness;Frequency synchronization;Databases","","11","","25","IEEE","9 Jun 2017","","","IEEE","IEEE Journals"
"Missing Information Reconstruction for Single Remote Sensing Images Using Structure-Preserving Global Optimization","Q. Cheng; H. Shen; L. Zhang; Z. Peng","School of Urban Design, Wuhan University, Wuhan, China; School of Resource and Environmental Science, Wuhan University, Wuhan, China; State Key Laboratory of Information Engineering in Surveying, Wuhan University, Wuhan, China; School of Urban Design, Wuhan University, Wuhan, China",IEEE Signal Processing Letters,"22 Jun 2017","2017","24","8","1163","1167","Filling missing information or removing special objects is often required in the applications of high spatial resolution images. A novel single-image reconstruction method is presented in this letter to solve this task, without the use of any complementary data. First, the spatial pattern of the image is obtained by the statistics of similar patch offsets in the known regions, which provide reliable information for reconstructing the image. The missing regions are then filled by combining a series of shifted pixels via global optimization. The proposed method was tested on a cloudy image for cloud removal and on a public image for military object concealment. The experimental results show that the proposed method can produce visually convincing and coherent reconstructed images, and the accuracy of the reconstruction is better than the existing noncomplementation methods.","1558-2361","","10.1109/LSP.2017.2703092","National Natural Science Foundation of China(grant numbers:41601357,41422108); Natural Science Foundation of Hubei Province(grant numbers:2016CFB333); ","https://ieeexplore.ieee.org/stamp/stamp.jsp?arnumber=7924312","Global optimization;high spatial resolution;image reconstruction;missing information;single image","Image reconstruction;Remote sensing;Optimization;Brightness;Coherence;Spatial resolution;Interpolation","","16","","13","IEEE","10 May 2017","","","IEEE","IEEE Journals"
