"Robust Plant Cell Tracking in Noisy Image Sequences Using Optimal CRF Graph Matching","M. Liu; Y. Wei; W. Qian; H. Zhang","College of Electrical and Information Engineering, Hunan University, Chang Sha, China; College of Electrical and Information Engineering, Hunan University, Chang Sha, China; College of Electrical and Information Engineering, Hunan University, Chang Sha, China; Department of Industrial Engineering and Operations Research, Columbia University, New York, NY, USA",IEEE Signal Processing Letters,"22 Jun 2017","2017","24","8","1168","1172","In time-lapse live-imaging datasets of developing multicellular tissues, automated tracking of cells is required for high-throughput spatiotemporal quantitative measurements of a range of cell behaviors. This letter proposes a conditional random field (CRF) graph matching method to track plant cells in noisy images by exploiting the tight spatial topology of neighboring cells in a multicellular field as contextual information. The CRF potential of cells dynamically changes during the cell correspondence growing process, because the cells that have been matched already are not included in the calculation of the second-order potential. Therefore, the proposed CRF-based tracker tends to reduce tracking errors, while the previous local graph matching method tends to accumulate errors during the cell correspondence growing process. The CRF graph matching method greatly improves the tracking accuracy in noisy images and enhances the tracking stability because it always matches the most reliable cell pairs with the least CRF potential in the neighboring system. Compared with the previous method, the experimental results show that the proposed method can improve the tracking accuracy rate by 10% in noisy image sequences.","1558-2361","","10.1109/LSP.2017.2704292","National Natural Science Foundation of China(grant numbers:61301254); Hunan Provincial Natural Science Foundation of China(grant numbers:14JJ3069); ","https://ieeexplore.ieee.org/stamp/stamp.jsp?arnumber=7927705","Cell tracking;conditional random field;local graph matching;noisy images","Noise measurement;Image segmentation;Tracking;Pipelines;Shape;Image edge detection;Labeling","","11","","24","IEEE","15 May 2017","","","IEEE","IEEE Journals"
"Magnetic Resonant Beamforming for Secured Wireless Power Transfer","H. Sun; H. Lin; F. Zhu; F. Gao","Tsinghua National Laboratory for Information Science and Technology, Beijing, China; Department of Electrical and Information Systems, Graduate School of Engineering, Osaka Prefecture University, Osaka, Japan; High-Tech Institute of Xi’an, Xi’an, China; Tsinghua National Laboratory for Information Science and Technology, Beijing, China",IEEE Signal Processing Letters,"22 Jun 2017","2017","24","8","1173","1177","Magnetic resonance coupling (MRC) has been utilized in wireless power transfer (WPT) to achieve mid-range contactless power supply. However, unintended users might also draw power from the transmission devices. In this letter, an MRC-WPT system with multiple power transmitters, one intended power receiver, and one unintended power receiver is investigated. We formulate a power security problem by limiting the unintended receiving power and, at the same time, maximizing the power of the intended user. Such an optimization problem is in general nonconvex. Nevertheless, a global optimal solution can be efficiently achieved with the aid of semidefinite relaxation approach. Simulation results are provided to demonstrate the effectiveness of the proposed algorithm.","1558-2361","","10.1109/LSP.2017.2703105","National Natural Science Foundation of China(grant numbers:61422109,61531011); JSPS(grant numbers:17K06435); ","https://ieeexplore.ieee.org/stamp/stamp.jsp?arnumber=7924347","Beamforming;magnetic resonance coupling;power security;semidefinite problem;wireless power transfer","Magnetic resonance;Couplings;Optimization;RLC circuits;Array signal processing;Wireless power transfer;Security","","19","","18","IEEE","10 May 2017","","","IEEE","IEEE Journals"
"MMSE-Directed Linear Image Interpolation Based on Nonlocal Geometric Similarity","S. Zhu; Z. He; S. Liu; B. Zeng","School of Electronic Engineering, University of Electronic Science and Technology of China, Chengdu, China; School of Electronic Engineering, University of Electronic Science and Technology of China, Chengdu, China; School of Electronic Engineering, University of Electronic Science and Technology of China, Chengdu, China; School of Electronic Engineering, University of Electronic Science and Technology of China, Chengdu, China",IEEE Signal Processing Letters,"22 Jun 2017","2017","24","8","1178","1182","In this letter, we propose a minimum mean square error (MMSE) directed linear interpolation to compose the high-resolution image from a single low-resolution image. We build up our interpolation model by using some similar image patches selected according to the nonlocal geometric similarity. First, we use a two-stage search scheme to collect the matched patches inside the whole image. Second, a similarity scaling factor is used in the second search to refine the collected patches so as to help find a robust solution to the MMSE-directed interpolation. Third, our MMSE-directed interpolation is regularized by the involved reference patches to make the solved interpolation coefficients more reliable. Experimental results show that our proposed method outperforms the state-of-the-art MMSE-directed linear interpolation schemes and works competitively with the state-of-the-art learning-based ones.","1558-2361","","10.1109/LSP.2017.2711609","National Natural Science Foundation of China(grant numbers:61672134,61502079,61370148); Fundamental Research Funds for Central Universities of China(grant numbers:ZYGX2016J038); Science and Technology Support Program of Sichuan Province(grant numbers:2016GZ0124); ","https://ieeexplore.ieee.org/stamp/stamp.jsp?arnumber=7938697","Image interpolation;minimum mean square error (MMSE);nonlocal geometric similarity","Interpolation;Image edge detection;Complexity theory;Image resolution;Reliability;Estimation;Mathematical model","","8","","18","IEEE","5 Jun 2017","","","IEEE","IEEE Journals"
"Structure-Based Subspace Method for Multichannel Blind System Identification","Q. Mayyala; K. Abed-Meraim; A. Zerguine","Department of Electrical and Electronic Engineering, King Fahd University of Petroleum & Minerals, Dhahran, Saudi Arabia; PRISME Lab, University of Orléans, Orléans, France; Department of Electrical and Electronic Engineering, King Fahd University of Petroleum & Minerals, Dhahran, Saudi Arabia",IEEE Signal Processing Letters,"22 Jun 2017","2017","24","8","1183","1187","In this work, a novel subspace-based method for blind identification of multichannel finite impulse response systems is presented. Here, we exploit directly the block Toeplitz channel's structure in the signal's linear model to build a quadratic cost function, whose minimization leads to the desired channel estimation up to a scalar factor. This method can be extended to estimate any predefined linear structure, e.g., Hankel, that is usually encountered in linear systems. Simulation findings are provided to highlight the appealing advantages of the new structure-based subspace method over the standard subspace method in certain adverse identification scenarios.","1558-2361","","10.1109/LSP.2017.2715418","Deanship of Scientific Research at KFUPM(grant numbers:RG1414); ","https://ieeexplore.ieee.org/stamp/stamp.jsp?arnumber=7948733","Blind system identification;subspace method;Toeplitz structure","Channel estimation;Cost function;Covariance matrices;Finite impulse response filters;Minimization;Linear systems;Standards","","22","","16","IEEE","14 Jun 2017","","","IEEE","IEEE Journals"
"View-Invariant Gait Recognition Through Genetic Template Segmentation","E. R. H. P. Isaac; S. Elias; S. Rajagopalan; K. S. Easwarakumar","Department of Computer Science and Engineering, Anna University, Chennai, India; School of Electronics Engineering, VIT University, Chennai, India; Department of Physiology and Biomedical Engineering, Mayo Clinic, Rochester, MN, USA; Department of Computer Science and Engineering, Anna University, Chennai, India",IEEE Signal Processing Letters,"23 Jun 2017","2017","24","8","1188","1192","Template-based model-free approach provides by far the most successful solution to the gait recognition problem in literature. Recent work discusses how isolating the head and leg portion of the template increase the performance of a gait recognition system making it robust against covariates like clothing and carrying conditions. However, most involve a manual definition of the boundaries. The method we propose, the genetic template segmentation, employs the genetic algorithm to automate the boundary selection process. This method was tested on the gait energy image (GEI), gait entropy image, and active energy image templates. GEI seems to exhibit the best result when segmented with our approach. Experimental results depict that our approach significantly outperforms the existing implementations of view-invariant gait recognition.","1558-2361","","10.1109/LSP.2017.2715179","","https://ieeexplore.ieee.org/stamp/stamp.jsp?arnumber=7948755","Biometrics;gait recognition;genetic algorithms (GAs);linear discriminant analysis (LDA)","Gait recognition;Genetic algorithms;Feature extraction;Clothing;Legged locomotion;Biological cells;Genetics","","28","","37","IEEE","14 Jun 2017","","","IEEE","IEEE Journals"
"Robust Superdirective Frequency-Invariant Beamforming for Circular Sensor Arrays","Y. Wang; Y. Yang; Z. He; Y. Ma; B. Li","School of Mechanical Engineering, Xi'an Jiaotong University, Xi'an, China; School of Marine Science and Technology, Northwestern Polytechnical University, Xi'an, China; School of Marine Science and Technology, Northwestern Polytechnical University, Xi'an, China; School of Marine Science and Technology, Northwestern Polytechnical University, Xi'an, China; School of Mechanical Engineering, Xi'an Jiaotong University, Xi'an, China",IEEE Signal Processing Letters,"27 Jun 2017","2017","24","8","1193","1197","This letter proposes a robust superdirective frequency-invariant beamforming method for circular sensor arrays. First, the beampattern is accurately transformed into an equivalent form using the property of circular arrays, and the expressions of directivity factor and white noise gain are correspondingly modified. Second, a closed-form weighting vector is accurately derived based on the minimum mean square error approximation to a desired superdirective beampattern that is expressed in a general form. When the number of elements is sufficiently large, the weighting vector can be further simplified, and the white noise gain is also modified to a concise form that is found to be an increasing function of the number of elements in the low-frequency range. Simulations and experimental results show that this method can provide a robust superdirective frequency-invariant beampattern over a wide frequency band given a suitable number of elements, and it can be readily applied to process broadband signals in practice using small circular sensor arrays.","1558-2361","","10.1109/LSP.2017.2712151","National Natural Science Foundation of China(grant numbers:11604259,11527809,11574251); China Postdoctoral Science Foundation(grant numbers:2016M592782); ","https://ieeexplore.ieee.org/stamp/stamp.jsp?arnumber=7938686","Circular sensor array;frequency-invariance;robustness;superdirective beamforming","Array signal processing;Sensor arrays;Robustness;Covariance matrices;White noise;Finite element analysis;Mean square error methods","","30","","27","IEEE","5 Jun 2017","","","IEEE","IEEE Journals"
"Exact BER Analysis of Selection Combining for Differential SWIPT Relaying Systems","Y. Lou; Q. -Y. Yu; J. Cheng; H. -L. Zhao","Department of Communication Engineering, Harbin Institute of Technology, Harbin, China; Department of Communication Engineering, Harbin Institute of Technology, Harbin, China; School of Engineering, The University of British Columbia, Kelowna, BC, Canada; Department of Communication Engineering, Harbin Institute of Technology, Harbin, China",IEEE Signal Processing Letters,"27 Jun 2017","2017","24","8","1198","1202","An exact closed-form average bit-error rate expression of a selection combining (SC) scheme is derived for a differential cooperative system employing an amplify-and-forward relay with simultaneous wireless information and power transfer capability. Monte Carlo simulations verify the analytical expressions. In particular, the SC scheme can achieve the same performance as that of a suboptimal maximal ratio combining scheme, and this is achieved with lower implementation complexity and energy consumption for SC.","1558-2361","","10.1109/LSP.2017.2705066","","https://ieeexplore.ieee.org/stamp/stamp.jsp?arnumber=7930441","Amplify-and-forward;differential modulation;energy harvesting;selection combining","Relays;Diversity reception;Nickel;Channel estimation;IP networks;Energy consumption;Diversity methods","","13","","17","IEEE","17 May 2017","","","IEEE","IEEE Journals"
"Joint Inverse Problems for Signal Reconstruction via Dictionary Splitting","E. Sakhaee; A. Entezari","University of Florida, Gainesville, FL, USA; University of Florida, Gainesville, FL, USA",IEEE Signal Processing Letters,"28 Jun 2017","2017","24","8","1203","1207","Sparse signal recovery from limited and/or degraded samples is fundamental to many applications, such as medical imaging, remote sensing, astronomical and seismic imaging. Discrete wavelet transform (DWT) has been commonly used for sparse representation of signals; nevertheless, due to its shift-variant nature, pseudo-Gibbs artifacts are present in the recovered signals. Using the redundant shift-invariant wavelet transform (SWT) is the ideal solution to obtain shift invariance; however, high redundancy factor of SWT limits its application in practical settings. We propose a dictionary splitting approach for sparse recovery from incomplete data, which leverages the ideas of cycle spinning in combination with Bregman splitting. The proposed method significantly improves the conventional signal reconstruction with DWT, offers the advantages of SWT, and overcomes high redundancy factor of SWT. We solve parallel sparse recovery problems with orthogonal dictionaries (DWT and its permuted versions), while we impose consistency between the results by updating the recovered image at each iteration. Our experiments demonstrate that few shifts are sufficient to achieve reconstruction accuracy as high as recovery with SWT, and significantly reduces its computational cost and redundancy factor.","1558-2361","","10.1109/LSP.2017.2701815","National Science Foundation(grant numbers:IIS-1617101); Office of Naval Research(grant numbers:N00014-14-1-0762); UFII graduate fellowship; ","https://ieeexplore.ieee.org/stamp/stamp.jsp?arnumber=7920408","Compressed sensing;cycle spinning;dictionary splitting;MRI;shift-invariant wavelet transform;sparse reconstruction","Discrete wavelet transforms;Spinning;Image reconstruction;Noise reduction;Signal to noise ratio;Redundancy","","4","","19","IEEE","5 May 2017","","","IEEE","IEEE Journals"
"Multi-Level and Multi-Scale Feature Aggregation Using Pretrained Convolutional Neural Networks for Music Auto-Tagging","J. Lee; J. Nam","Graduate School of Culture Technology, Korea Advanced Institute of Science and Technology, Daejeon, South Korea; Graduate School of Culture Technology, Korea Advanced Institute of Science and Technology, Daejeon, South Korea",IEEE Signal Processing Letters,"28 Jun 2017","2017","24","8","1208","1212","Music auto-tagging is often handled in a similar manner to image classification by regarding the two-dimensional audio spectrogram as image data. However, music auto-tagging is distinguished from image classification in that the tags are highly diverse and have different levels of abstraction. Considering this issue, we propose a convolutional neural networks (CNN)-based architecture that embraces multi-level and multi-scaled features. The architecture is trained in three steps. First, we conduct supervised feature learning to capture local audio features using a set of CNNs with different input sizes. Second, we extract audio features from each layer of the pretrained convolutional networks separately and aggregate them altogether giving a long audio clip. Finally, we put them into fully connected networks and make final predictions of the tags. Our experiments show that using the combination of multi-level and multi-scale features is highly effective in music auto-tagging and the proposed method outperforms the previous state-of-the-art methods on the MagnaTagATune dataset and the Million Song Dataset. We further show that the proposed architecture is useful in transfer learning.","1558-2361","","10.1109/LSP.2017.2713830","Korea Advanced Institute of Science and Technology(grant numbers:G04140049); National Research Foundation of Korea(grant numbers:2015R1C1A1A02036962); ","https://ieeexplore.ieee.org/stamp/stamp.jsp?arnumber=7944704","Convolutional neural networks;feature aggregation;music auto-tagging;transfer learning","Feature extraction;Convolution;Neural networks;Predictive models;Spectrogram;Multiple signal classification;Aggregates","","105","3","25","IEEE","8 Jun 2017","","","IEEE","IEEE Journals"
"Toward End-to-End Face Recognition Through Alignment Learning","Y. Zhong; J. Chen; B. Huang","Department of Electronic Engineering, Tsinghua University, Beijing, China; Department of Electronic Engineering, Tsinghua University, Beijing, China; Department of Electronic Engineering, Tsinghua University, Beijing, China",IEEE Signal Processing Letters,"28 Jun 2017","2017","24","8","1213","1217","A common practice in modern face recognition methods is to specifically align the face area based on the prior knowledge of human face structure before recognition feature extraction. The face alignment is usually implemented independently, causing difficulties in the designing of end-to-end face recognition models. We study the possibility of end-to-end face recognition through alignment learning in which neither prior knowledge on facial landmarks nor artificially defined geometric transformations are required. Only human identity clues are used for driving the automatic learning of appropriate geometric transformations for the face recognition task. Trained purely on publicly available datasets, our model achieves a verification accuracy of 99.33% on the LFW dataset, which is on par with state-of-the-art single model methods.","1558-2361","","10.1109/LSP.2017.2715076","National Natural Science Foundation of China(grant numbers:61673234); ","https://ieeexplore.ieee.org/stamp/stamp.jsp?arnumber=7948720","End-to-end (e2e) training;face alignment;face recognition;spatial transformer","Face;Face recognition;Face detection;Feature extraction;Training;Convolution;Two dimensional displays","","52","","39","IEEE","14 Jun 2017","","","IEEE","IEEE Journals"
"Saliency-Guided Just Noticeable Distortion Estimation Using the Normalized Laplacian Pyramid","H. Hadizadeh; A. Rajati; I. V. Bajić","Quchan University of Advanced Technology, Quchan, Iran; Quchan University of Advanced Technology, Quchan, Iran; Simon Fraser University, Burnaby, BC, Canada",IEEE Signal Processing Letters,"28 Jun 2017","2017","24","8","1218","1222","The human visual system (HVS), like any other physical system, has limitations. For instance, it is known that the HVS can only sense the content changes that are larger than the so-called just noticeable distortion (JND) threshold. Also, to reduce the computational load on the brain, the visual attention mechanism is deployed such that regions with higher visual saliency are processed with higher priority than other less-salient regions. It is also known that visual saliency has a modulatory effect on JND thresholds. In this letter, we present a novel pixel-wise JND estimation method that considers the interplay between visual saliency and JND thresholds. In the proposed method, the largest JND thresholds of a given image are found such that the perceptual distance between the image and its JND noise-contaminated version is minimized in a perceptual space defined by the coefficients of the image in a normalized Laplacian pyramid. Experimental results indicate that the proposed method outperforms four of the latest JND models for static images.","1558-2361","","10.1109/LSP.2017.2717946","","https://ieeexplore.ieee.org/stamp/stamp.jsp?arnumber=7954695","Just noticeable distortion (JND);visual saliency","Visualization;Estimation;Computational modeling;Laplace equations;Measurement;Distortion;Brain modeling","","14","","27","IEEE","21 Jun 2017","","","IEEE","IEEE Journals"
"Universal Cooperative Localizer for WSN With Varied Types of Ranging Measurements","S. Wang; F. Luo; L. Zhang","School of Information and Communication Engineering, Beijing University of Posts and Communications, Beijing, China; School of Information and Communication Engineering, Beijing University of Posts and Communications, Beijing, China; School of Information and Communication Engineering, Beijing University of Posts and Communications, Beijing, China",IEEE Signal Processing Letters,"28 Jun 2017","2017","24","8","1223","1227","This letter proposes a universal cooperative localizer (UCL) for wireless sensor network (WSN) with varied types of ranging measurements including time-of-arrival, radio signal strength, angle-of-arrival, and Doppler frequency. By representing the WSN node positions as complex numbers, the localization problem is converted as a generalized linear mixing problem, and then resolved by generalized approximate message passing with the importance sampling mechanism. The computational complexity of UCL is two orders lower than that of the belief propagation localizer. Simulation results validate that UCL outperforms most mainstream localizers, and cooperation significantly enhances the positioning accuracy.","1558-2361","","10.1109/LSP.2017.2711008","National Natural Science Foundation of China(grant numbers:61601048,61601043); ","https://ieeexplore.ieee.org/stamp/stamp.jsp?arnumber=7937863","Approximate message passing;cooperative localization;wireless sensor network","Distance measurement;Wireless sensor networks;Probability density function;Frequency measurement;Doppler effect;Additives;Pollution measurement","","20","","16","IEEE","1 Jun 2017","","","IEEE","IEEE Journals"
"On the Secure Energy Efficiency of TAS/MRC With Relaying and Jamming Strategies","J. Farhat; G. Brante; R. D. Souza","Federal University of Technology-Paraná, Curitiba, Brazil; Federal University of Technology-Paraná, Curitiba, Brazil; Federal University of Santa Catarina, Florianópolis, Brazil",IEEE Signal Processing Letters,"30 Jun 2017","2017","24","8","1228","1232","In this letter, we investigate the secure energy efficiency (SEE) in a cooperative scenario where all nodes are equipped with multiple antennas. Moreover, we employ secrecy rate and power allocation at Alice and at the relay in order to maximize the SEE, subjected to a constraint in terms of a minimal required secrecy outage probability. Only the channel state information (CSI) with respect to the legitimate nodes is available. Then, we compare the artificial-noise (AN) scheme with CSI-aided decode-and-forward (CSI-DF), which exploits the CSI to choose the best communication path (direct or cooperative). Our results show that CSI-DF outperforms AN in terms of SEE in most scenarios, except when eavesdropper (Eve) is closer to the relay or with the increase of antennas at Eve. Additionally, we also show that the maximization of SEE implies in an optimal number of antennas to be used at each node, which is due to the tradeoff between secure throughput and power consumption.","1558-2361","","10.1109/LSP.2017.2717083","Coordenao de Aperfeioamento de Pessoal de Nvel Superior; Conselho Nacional de Desenvolvimento Cientfico e Tecnolgico; ","https://ieeexplore.ieee.org/stamp/stamp.jsp?arnumber=7953526","Cooperative communication;energy efficiency;MIMO;security","Relays;Signal to noise ratio;Jamming;Security;Receiving antennas;Transmitters","","11","","22","IEEE","19 Jun 2017","","","IEEE","IEEE Journals"
