"Efficient, Accurate, and Rotation-Invariant Iris Code","N. Damer; P. Terhörst; A. Braun; A. Kuijper","Fraunhofer Institute for Computer Graphics Research IGD, Darmstadt, Germany; Department of Physics, Technische Universität Darmstadt, Darmstadt, Germany; Fraunhofer Institute for Computer Graphics Research IGD, Darmstadt, Germany; Mathematical and Applied Visual Computing Group, Technische Universität Darmstadt, Darmstadt, Germany",IEEE Signal Processing Letters,"3 Jul 2017","2017","24","8","1233","1237","The large scale of the recently demanded biometric systems has put a pressure on creating a more efficient, accurate, and private biometric solutions. Iris biometrics is one of the most distinctive and widely used biometric characteristics. High-performing iris representations suffer from the curse of rotation inconsistency. This is usually solved by assuming a range of rotational errors and performing a number of comparisons over this range, which results in a high computational effort and limits indexing and template protection. This work presents a generic and parameter-free transformation of binary iris representation into a rotation-invariant space. The goal is to perform accurate and efficient comparison and enable further indexing and template protection deployment. The proposed approach was tested on a database of 10 000 subjects of the ISYN1 iris database generated by CASIA. Besides providing a compact and rotational-invariant representation, the proposed approach reduced the equal error rate by more than 55% and the computational time by a factor of up to 44 compared to the original representation.","1558-2361","","10.1109/LSP.2017.2719282","German Federal Ministry of Education and Research; Hessen State Ministry for Higher Education; CRISP; ","https://ieeexplore.ieee.org/stamp/stamp.jsp?arnumber=7956157","Biometrics;iris recognition;rotation-invariance","Iris recognition;Feature extraction;Indexing;Sun;Robustness;Iris","","12","","17","IEEE","23 Jun 2017","","","IEEE","IEEE Journals"
"Parameter Estimation of Hybrid Linear Frequency Modulation-Sinusoidal Frequency Modulation Signal","Z. Wang; Y. Wang; L. Xu","Research Institute of Electronic Engineering Technology, Harbin Institute of Technology, Harbin, China; Research Institute of Electronic Engineering Technology, Harbin Institute of Technology, Harbin, China; Research Institute of Electronic Engineering Technology, Harbin Institute of Technology, Harbin, China",IEEE Signal Processing Letters,"30 Jun 2017","2017","24","8","1238","1241","In this letter, a novel method which employs the Radon transform (RT) and inverse Radon transform is proposed to estimate the parameters of the hybrid linear frequency modulation (LFM)-sinusoidal frequency modulation (SFM) signal. By adding a parameter called width, we extend the original RT to a three-parameter transform, which we named as extended Radon transform (ERT). Compared with the original RT, the ERT has shown more capacities, such as estimating the parameters of a strip in a plane. As the time–frequency representations (TFRs) of the hybrid LFM-SFM signal is a strip where there is a sinusoidal pattern embedded, the parameters of the signal are related to the strip; herein, we employ the ERT to estimate several parameters of the signal. With the estimated parameters values, the signal can be dechirped to be a SFM signal, whose parameters can be estimated by some existing methods. As it is based on the TFRs, the proposed method has strong robustness under low signal-to-noise ratios. Numerical results and analysis are provided to demonstrate the effectiveness of the proposed method.","1558-2361","","10.1109/LSP.2017.2715832","National Natural Science Foundation of China(grant numbers:61622107,61471149); State Key Laboratory of Millimeter Waves(grant numbers:K201708); ","https://ieeexplore.ieee.org/stamp/stamp.jsp?arnumber=7949047","Hybrid linear frequency modulation (LFM)-sinusoidal frequency modulation (SFM) signal;parameters estimation;radon transform","Strips;Transforms;Radon;Frequency modulation;Frequency estimation;Estimation","","33","","9","IEEE","15 Jun 2017","","","IEEE","IEEE Journals"
"Weighted Selection Combinings for Differential Decode-and-Forward Cooperative Networks","Y. Lou; Q. -Y. Yu; J. Cheng; H. -L. Zhao","Department of Communication Engineering, Harbin Institute of Technology, Harbin, China; Department of Communication Engineering, Harbin Institute of Technology, Harbin, China; School of Engineering, University of British Columbia, Kelowna, BC, Canada; Department of Communication Engineering, Harbin Institute of Technology, Harbin, China",IEEE Signal Processing Letters,"11 Jul 2017","2017","24","8","1242","1246","Two weighted selection combining (WSC) schemes are proposed for a differential decode-and-forward relaying system in Rayleigh fading channels. Compared to the conventional SC scheme, the decision variable of the relay link is multiplied by a scale factor to combat the error propagation phenomenon. Average bit-error rate (ABER) expressions of the two proposed WSC schemes are derived in closed form and verified by simulation results. For the second WSC scheme, asymptotic ABER expression and diversity order are derived to gain more insight into this scheme. Moreover, it is demonstrated that both WSC schemes can overcome the extra noise amplification induced by the link adaptive relaying scheme. The first WSC scheme is slightly inferior to the second one, which has a higher complexity. Both proposed WSC schemes outperform the conventional SC scheme.","1558-2361","","10.1109/LSP.2017.2720594","","https://ieeexplore.ieee.org/stamp/stamp.jsp?arnumber=7961284","Bit-error rate;decode-and-forward;differential modulation;selection combining","Relays;Diversity reception;Fading channels;Signal to noise ratio;Degradation;Optimized production technology;Cooperative systems","","1","","24","IEEE","28 Jun 2017","","","IEEE","IEEE Journals"
"Image Enhancement by S-Shaped Curves Using Successive Approximation for Preserving Brightness","D. Tohl; J. S. Jimmy Li","School of Computer Science, Engineering and Mathematics, Flinders University, Adelaide, S.A., Australia; School of Computer Science, Engineering and Mathematics, Flinders University, Adelaide, S.A., Australia",IEEE Signal Processing Letters,"11 Jul 2017","2017","24","8","1247","1251","For image contrast enhancement, an S-shaped transfer function has been developed to better match the human vision system with an associated median brightness subtraction and addition method to preserve the median brightness of an image. However, this median brightness preservation method will cause clipping of the dynamic range of images resulting in a loss of contrast. Moreover, preserving the mean or median image brightness will sometimes produce a different result without a consistent preference. In this letter, we have developed a method to preserve either the mean or median image brightness by shifting the intersection point of S-shaped curves along the y = x line by successive approximation. To improve computational efficiency, two newly derived equations have been proposed to reduce the number of optimum control parameters from four to two for solving the S-shaped curves. In addition, our proposed method can alter the image brightness without causing clipping at either ends of the intensity range. Our proposed brightness preservation method can also be applied to a video sequence to change its brightness without causing any flickering. It has been shown that our proposed method can produce visually pleasing enhanced images and videos.","1558-2361","","10.1109/LSP.2017.2718018","","https://ieeexplore.ieee.org/stamp/stamp.jsp?arnumber=7954739","Brightness preservation;image and video enhancement;S-shaped curve;successive approximation","Brightness;Image color analysis;Benchmark testing;Signal processing algorithms;Histograms;Adaptive equalizers;Dynamic range","","11","","22","IEEE","21 Jun 2017","","","IEEE","IEEE Journals"
"Deep CNN-Based Super-Resolution Using External and Internal Examples","J. Y. Cheong; I. K. Park","Department of Information and Communication Engineering, Inha University, Incheon, South Korea; Department of Information and Communication Engineering, Inha University, Incheon, South Korea",IEEE Signal Processing Letters,"12 Jul 2017","2017","24","8","1252","1256","The external example-driven single image super-resolution (SISR) method that uses a deep convolutional neural network (CNN) has exhibited superior performance as compared to previously developed SISR methods. However, the advantages of jointly using external and internal examples on a deep CNN framework have not been sufficiently investigated. In this letter, we present a novel method for single image super-resolution by exploiting a complementary relation between external and internal example-based SISR methods. The proposed deep CNN model consists of two subnetworks, a global residual network and a self-residual network, to utilize the advantages of both external and internal examples. In contrast with conventional joint SISR methods, the proposed method is the first deep CNN-based SISR method that does not require a retraining process, which tends to be inefficient. The proposed method outperformed existing methods in both quantitative and qualitative evaluations.","1558-2361","","10.1109/LSP.2017.2721104","National Research Foundation of Korea; Korea Government (MSIP)(grant numbers:NRF-2016R1A2B4014731); ","https://ieeexplore.ieee.org/stamp/stamp.jsp?arnumber=7961250","Deep convolutional neural network (CNN);external example;internal example;single image super-resolution (SISR)","Image restoration;Training;Image resolution;Signal resolution;Image edge detection;Neural networks;Signal processing algorithms","","37","","29","IEEE","28 Jun 2017","","","IEEE","IEEE Journals"
"A Study of the Allan Variance for Constant-Mean Nonstationary Processes","H. Xu; S. Guerrier; R. Molinari; Y. Zhang","Geneva School of Economics and Management, University of Geneva, Geneva, Switzerland; Department of Statistics, Pennsylvania State University, State College, PA, USA; Department of Statistics & Applied Probability, University of California, Santa Barbara, CA, USA; Department of Statistics, Pennsylvania State University, State College, PA, USA",IEEE Signal Processing Letters,"12 Jul 2017","2017","24","8","1257","1260","The Allan variance (AV) is a widely used quantity in areas focusing on error measurement as well as in the general analysis of variance for autocorrelated processes in domains such as engineering and, more specifically, metrology. The form of this quantity is widely used to detect noise patterns and indications of stability within signals. However, the properties of this quantity are not known for commonly occurring processes whose covariance structure is nonstationary and, in these cases, an erroneous interpretation of the AV could lead to misleading conclusions. This letter generalizes the theoretical form of the AV to some nonstationary processes while at the same time being valid also for weakly stationary processes. Some simulation examples show how this new form can help to understand the processes for which the AV is able to distinguish these from the stationary cases and hence allow for a better interpretation of this quantity in applied cases.","1558-2361","","10.1109/LSP.2017.2722222","","https://ieeexplore.ieee.org/stamp/stamp.jsp?arnumber=7964734","Bias-instability;Haar wavelet variance;heteroscedasticity;longitudinal studies;metrology;sensor calibration","Covariance matrices;Measurement uncertainty;Uncertainty;Biological system modeling;Autoregressive processes;Mathematical model;White noise","","8","","8","IEEE","30 Jun 2017","","","IEEE","IEEE Journals"
"SPL EDICS","",,IEEE Signal Processing Letters,"21 Aug 2017","2017","24","8","1261","1261","Presents the EDICS (Editors' information classification scheme) subject categories for this issue of the publication.","1558-2361","","10.1109/LSP.2017.2716080","","https://ieeexplore.ieee.org/stamp/stamp.jsp?arnumber=8013899","","","","","","","IEEE","21 Aug 2017","","","IEEE","IEEE Journals"
"IEEE Signal Processing Letters information for authors","",,IEEE Signal Processing Letters,"21 Aug 2017","2017","24","8","1262","1263","These instructions give guidelines for preparing papers for this publication. Presents information for authors publishing in this journal.","1558-2361","","10.1109/LSP.2017.2716060","","https://ieeexplore.ieee.org/stamp/stamp.jsp?arnumber=8013891","","","","","","","IEEE","21 Aug 2017","","","IEEE","IEEE Journals"
"Information-Theoretic Methods in Data Acquisition, Analysis, and Processing","",,IEEE Signal Processing Letters,"21 Aug 2017","2017","24","8","1264","1264","Prospective authors are requested to submit new, unpublished manuscripts for inclusion in the upcoming event described in this call for papers.","1558-2361","","10.1109/LSP.2017.2740587","","https://ieeexplore.ieee.org/stamp/stamp.jsp?arnumber=8013898","","","","","","","IEEE","21 Aug 2017","","","IEEE","IEEE Journals"
"Special Issue on Signal and Information Processing for Critical Infrastructures","",,IEEE Signal Processing Letters,"21 Aug 2017","2017","24","8","1265","1265","Prospective authors are requested to submit new, unpublished manuscripts for inclusion in the upcoming event described in this call for papers.","1558-2361","","10.1109/LSP.2017.2740588","","https://ieeexplore.ieee.org/stamp/stamp.jsp?arnumber=8013886","","","","","","","IEEE","21 Aug 2017","","","IEEE","IEEE Journals"
"Introducing IEEE Collabratec","",,IEEE Signal Processing Letters,"21 Aug 2017","2017","24","8","1266","1266","Advertisement, IEEE. IEEE Collabratec is a new, integrated online community where IEEE members, researchers, authors, and technology professionals with similar fields of interest can network and collaborate, as well as create and manage content. Featuring a suite of powerful online networking and collaboration tools, IEEE Collabratec allows you to connect according to geographic location, technical interests, or career pursuits. You can also create and share a professional identity that showcases key accomplishments and participate in groups focused around mutual interests, actively learning from and contributing to knowledgeable communities. All in one place! Learn about IEEE Collabratec at ieeecollabratec.org.","1558-2361","","10.1109/LSP.2017.2740600","","https://ieeexplore.ieee.org/stamp/stamp.jsp?arnumber=8013880","","","","","","","IEEE","21 Aug 2017","","","IEEE","IEEE Journals"
"IEEE Signal Processing Society Board of Governors","",,IEEE Signal Processing Letters,"21 Aug 2017","2017","24","8","C3","C3","Presents a listing of the IEEE SPS society Board of Governors.","1558-2361","","10.1109/LSP.2017.2716061","","https://ieeexplore.ieee.org/stamp/stamp.jsp?arnumber=8013882","","","","","","","IEEE","21 Aug 2017","","","IEEE","IEEE Journals"
"Blank page","",,IEEE Signal Processing Letters,"21 Aug 2017","2017","24","8","C4","C4","This page or pages intentionally left blank.","1558-2361","","10.1109/LSP.2017.2716081","","https://ieeexplore.ieee.org/stamp/stamp.jsp?arnumber=8013890","","","","","","","IEEE","21 Aug 2017","","","IEEE","IEEE Journals"
